Account,Coin,Execution Price,Size Tokens,Size USD,Side,Timestamp IST,Start Position,Direction,Closed PnL,Transaction Hash,Order ID,Crossed,Fee,Trade ID,Timestamp,time_parsed,date,sentiment,value,hour
0xbee1707d6b44d4d52bfe19e41f8a828645437aab,HYPE,15.912,31.42,499.96,sell,26-03-2025 12:11,13940.4,close long,5.963516,0xf326c05140a2586d31fa04204a770c0202f700a58ab98a3c95eb46a6f7ca1d7a,81861226298,True,0.149986,1020000000000000.0,1740000000000.0,,,,,
0xbee1707d6b44d4d52bfe19e41f8a828645437aab,@107,18.1,4.0,72.4,sell,13-12-2024 15:48,27447.09605,sell,1.654459,0x4a12f48886b1bbb189ac04191f97e2015700ba800148da90466c7a05656d1ac0,55085941659,False,0.0,848000000000000.0,1730000000000.0,,,,,
0x47add9a56df66b524d5e2c1993a43cde53b6ed85,FTT,2.35,133.9,314.67,sell,18-02-2025 20:15,-1164.1,open short,0.0,0x481280df1f019e61c828041e001eae01cd008c739ee12cc72883b34767a3feab,73036942785,False,0.030207,567000000000000.0,1740000000000.0,,,,,
0x23e7a7f8d14b550961925fbfdaa92f5d195ba5bd,@107,13.9,344.67,4790.91,buy,28-03-2025 11:21,4066.821644,buy,0.0,0x6740f56e173891f85eb904206afdf6020105006991cb2c7ece0070a8a6dc9dbc,82248117253,True,0.12063446,847000000000000.0,1740000000000.0,,,,,
0xbee1707d6b44d4d52bfe19e41f8a828645437aab,@107,23.066,15.61,360.06,buy,19-02-2025 10:22,1971.547324,buy,0.0,0x9d6931b60fc4c782cc74041e09c867012a0005b8ccbe34b1e969263181b62972,73332733809,True,0.00546349,206000000000000.0,1740000000000.0,,,,,
0xbee1707d6b44d4d52bfe19e41f8a828645437aab,HYPE,20.798,96.16,1999.94,sell,27-02-2025 11:11,-8739.12,open short,0.0,0x38858f6974206cc91d98041e8cc1f00203920010fef5696418b6eab71f0e0975,75430343709,True,0.59998,320000000000000.0,1740000000000.0,,,,,
0xbee1707d6b44d4d52bfe19e41f8a828645437aab,HYPE,15.753,31.74,500.0,buy,26-03-2025 18:54,3056.32,open long,0.0,0x75548e64e6ce31040b4504204f1af70202180083e4ead7d8bba9ad7cfc5c1b11,81912169795,True,0.15,17800000000000.0,1740000000000.0,,,,,
0x8477e447846c758f5a675856001ea72298fd9cb5,LDO,1.6921,131.1,221.83,sell,08-01-2025 21:39,0.0,open short,0.0,0x9536c29feed0647426f9041af8ef4501bb0062a3e503ee62dc69f50a05978552,61494482346,True,0.077642,371000000000000.0,1740000000000.0,2025-08-01 21:39:00,2025-08-01,,,21.0
0x8477e447846c758f5a675856001ea72298fd9cb5,POPCAT,0.363,1039.0,377.16,buy,23-04-2025 15:37,-126624.0,close short,-31.005838,0x4f258aee14ed6ecf1559042216e51902015100b7217198cac2a21d0950d548fe,88265288772,False,0.037715,548000000000000.0,1750000000000.0,,,,,
0xbee1707d6b44d4d52bfe19e41f8a828645437aab,HYPE,11.806,127.05,1499.95,sell,04-04-2025 14:37,12041.71,close long,-37.55598,0x209d293a0d82418c7f730420e123bc0202c800ce4e90220d5a7d7d962a7ea56e,83852633853,True,0.449985,680000000000000.0,1740000000000.0,2025-04-04 14:37:00,2025-04-04,Fear,28.0,14.0
0xbd5fead7180a9c139fa51a103cb6a2ce86ddb5c3,OP,1.1759,939.4,1104.64,sell,24-02-2025 03:24,-17090.5,open short,0.0,0xa453a59f60131cfbb106041e560523012a001ed18bbed820c6a3ab49de60cbea,74313469272,True,0.386624,301000000000000.0,1740000000000.0,,,,,
0xbee1707d6b44d4d52bfe19e41f8a828645437aab,HYPE,19.7,11.91,234.63,sell,25-02-2025 22:14,-455.15,open short,0.0,0x0000000000000000000000000000000000000000000000000000000000000000,74903056057,False,0.023462,671000000000000.0,1740000000000.0,,,,,
0xbee1707d6b44d4d52bfe19e41f8a828645437aab,HYPE,20.79,222.92,4634.51,sell,27-02-2025 11:10,-6874.32,open short,0.0,0x4374baa12f4464348e83041e8cbfc801ca002c2f0e86f04ddaf9f13da70b73a9,75397544836,False,0.231725,819000000000000.0,1740000000000.0,,,,,
0xbee1707d6b44d4d52bfe19e41f8a828645437aab,HYPE,12.65,15.81,200.0,buy,13-03-2025 11:15,398.34,open long,0.0,0x3acf3c15ff8c51e9a6f7041f7403f30201d7008d852faf45958908f15c723392,79527796561,True,0.059998,167000000000000.0,1740000000000.0,,,,,
0x3f9a0aadc7f04a7c9d75dc1b5a6ddd6e36486cf6,ADA,0.38643,1849.0,714.51,sell,07-11-2024 22:01,33384.0,close long,22.933147,0xbc2c4d5feb2fc49ccc440416392f2201fa00c2810a35c3fd7768c59d941eb7f3,45249857899,False,0.07145,1050000000000000.0,1730000000000.0,2024-07-11 22:01:00,2024-07-11,Fear,29.0,22.0
0xa0feb3725a9335f49874d7cd8eaad6be45b27416,HYPE,25.922,40.76,1056.58,sell,20-12-2024 18:29,2967.41,close long,47.147092,0x23348b60078da8817d5e0419b0d0dd01c3004a6da2e381c75f55da5e7af8b813,56796599619,False,0.052829,432000000000000.0,1730000000000.0,,,,,
0xbee1707d6b44d4d52bfe19e41f8a828645437aab,HYPE,13.096,152.73,2000.15,sell,18-03-2025 10:41,2136.92,close long,12.920958,0x06fa194e3281d14acc9f041fc5ea2a0133002f9381a27ea4a2f0e82b11e5415b,80481735771,True,0.600045,648000000000000.0,1740000000000.0,,,,,
0x75f7eeb85dc639d5e99c78f95393aa9a5f1170d4,MAVIA,0.3216,5230.3,1682.06,buy,17-03-2025 08:08,-78845.6,close short,68.203112,0x7a212bceac15fa1cf606041fb3bb14016900c4f2aab8d9952779247586884403,80267602510,True,0.565173,906000000000000.0,1740000000000.0,,,,,
0xbee1707d6b44d4d52bfe19e41f8a828645437aab,HYPE,16.88,59.24,999.97,buy,24-03-2025 10:39,-4067.07,close short,-2.13264,0x6d52a5111a39ba509c25042028585d01810071c590b4c9267059363ef4b9966f,81480977924,True,0.299991,258000000000000.0,1740000000000.0,,,,,
0x75f7eeb85dc639d5e99c78f95393aa9a5f1170d4,FARTCOIN,0.65865,2480.0,1633.45,sell,05-02-2025 20:34,28724.7,close long,1.116,0x12058e098dee7d9b75bf041d30d8d80201b00095e42f112fcfd44a42b569a1f2,69842113592,False,0.156811,396000000000000.0,1740000000000.0,2025-05-02 20:34:00,2025-05-02,Greed,67.0,20.0
0xbaaaf6571ab7d571043ff1e313a9609a10637864,HYPE,19.962,472.36,9429.25,sell,26-02-2025 01:42,98373.55,close long,60.084192,0xa4ed5a04fec7219fb5a8041e75a7ed02013b01014e79d446fc5e34f9bfba45c4,74784409720,False,0.452603,360000000000000.0,1740000000000.0,,,,,
0xbee1707d6b44d4d52bfe19e41f8a828645437aab,@107,25.2,0.46,11.59,sell,19-12-2024 11:09,31522.1241,sell,0.05486,0x0000000000000000000000000000000000000000000000000000000000000000,56528932822,False,0.000579,371000000000000.0,1730000000000.0,,,,,
0xb1231a4a2dd02f2276fa3c5e2a2f3436e6bfed23,ETH,2338.5,0.62,1449.87,buy,06-02-2024 20:54,19.7352,open long,0.0,0xe268845d228bc6af034a04077f93db01a100bae8fd6c62704c81c45b8d761d0c,8953225254,False,-0.028997,453000000000000.0,1710000000000.0,2024-06-02 20:54:00,2024-06-02,Greed,73.0,20.0
0xbee1707d6b44d4d52bfe19e41f8a828645437aab,HYPE,24.1,0.85,20.48,sell,30-01-2025 01:57,-225.28,open short,0.0,0xe509c04d2a5df23379e2041cc39dbb02026d0086d79dd5509eb98e669b8483aa,67209182054,False,0.002048,474000000000000.0,1740000000000.0,,,,,
0xb899e522b5715391ae1d4f137653e7906c5e2115,BTC,75096.0,0.28087,21092.21,buy,09-04-2025 06:50,5.30277,open long,0.0,0xa216d5dcc70989eb53ae04212ddf170207f90071bceccf2db9e4fe624cd9c891,85134369805,True,6.327664,581000000000000.0,1740000000000.0,2025-09-04 06:50:00,2025-09-04,,,6.0
0x28736f43f1e871e6aa8b1148d38d4994275d72c4,TRUMP,20.449,4.8,98.16,buy,18-01-2025 16:48,-35.2,close short,0.291312,0xda8008c52f26847c898c041bc1ddd7010c0026e5146be783e665c2e0db15c5b0,63991110669,False,0.009815,718000000000000.0,1740000000000.0,,,,,
0xbee1707d6b44d4d52bfe19e41f8a828645437aab,@107,16.639,4.78,79.53,sell,24-03-2025 09:26,576.8472333,sell,5.302292,0x230e646ea94762765c920420278168016a002f68ab5921c99a2e69122212e6d9,81470570211,True,0.02386,897000000000000.0,1740000000000.0,,,,,
0xbaaaf6571ab7d571043ff1e313a9609a10637864,HYPE,12.882,138.95,1789.95,sell,14-03-2025 09:54,21919.19,close long,14.853755,0x0000000000000000000000000000000000000000000000000000000000000000,79743319146,False,0.0,62300000000000.0,1740000000000.0,,,,,
0x75f7eeb85dc639d5e99c78f95393aa9a5f1170d4,ZEREBRO,0.45026,1124.0,506.09,buy,07-01-2025 21:49,-38359.0,close short,20.324168,0x692fd702efcbf0b1ad0e041ae449fb02015500b23371332db57921b1b9803d38,61211813081,False,0.048584,1090000000000000.0,1740000000000.0,2025-07-01 21:49:00,2025-07-01,,,21.0
0xbee1707d6b44d4d52bfe19e41f8a828645437aab,@107,27.98,2.05,57.36,sell,20-12-2024 20:48,31069.81113,sell,4.565658,0x0000000000000000000000000000000000000000000000000000000000000000,57104169413,False,0.002867,460000000000000.0,1730000000000.0,,,,,
0x8170715b3b381dffb7062c0298972d4727a0a63b,MELANIA,0.496,1378.0,683.49,sell,11-04-2025 07:57,-1092985.5,open short,0.0,0x2a1c9b940d735475b03e04214f99ce02042f00d55749c0a077b7cf9f3092fd92,85661894891,False,0.065614,796000000000000.0,1740000000000.0,2025-11-04 07:57:00,2025-11-04,,,7.0
0x39cef799f8b69da1995852eea189df24eb5cae3c,MELANIA,0.72177,684.6,494.12,sell,17-03-2025 07:46,-71371.7,open short,0.0,0x12f5c6afa5c430fec8fb041fb37c7001a900fb6b3dc02b11344edd48adcb28a9,80265051214,False,0.049412,1050000000000000.0,1740000000000.0,,,,,
0xbaaaf6571ab7d571043ff1e313a9609a10637864,HYPE,14.2,8.33,118.29,sell,12-03-2025 01:40,9837.09,close long,7.637777,0xaa7c79b0f75e28249ccc041f5c9e3602016600ec2831a0bdcc22fbf297a5d274,79160457263,False,0.0,915000000000000.0,1740000000000.0,2025-12-03 01:40:00,2025-12-03,,,1.0
0xb1231a4a2dd02f2276fa3c5e2a2f3436e6bfed23,ETH,2242.4,1.4356,3219.19,sell,08-01-2024 02:24,-3.0218,open short,0.0,0x8c2c87c8144622c75ab404070a7460016e001d44e4fd067119a2ae05f132d88d,6450963755,True,0.804797,78800000000000.0,1700000000000.0,2024-08-01 02:24:00,2024-08-01,Neutral,52.0,2.0
0xbaaaf6571ab7d571043ff1e313a9609a10637864,HYPE,13.05,89.91,1173.33,buy,11-03-2025 06:20,211841.22,open long,0.0,0xe24494d4750d82f68eab041f4f3ebf014e00194a8a2d684b38171f5090f0579a,78766167752,False,0.0,935000000000000.0,1740000000000.0,2025-11-03 06:20:00,2025-11-03,,,6.0
0x72c6a4624e1dffa724e6d00d64ceae698af892a0,HYPE,17.62,113.69,2003.22,buy,04-03-2025 02:12,-22096.3,close short,769.283385,0x2044015cd60e2cca7c36041ed97ef30201b300530971fc7dff5a0db4cf34bce0,76776659372,False,0.192308,1110000000000000.0,1740000000000.0,2025-04-03 02:12:00,2025-04-03,Fear,25.0,2.0
0x72743ae2822edd658c0c50608fd7c5c501b2afbd,ETH,1454.9,0.35,509.21,sell,09-04-2025 17:30,946.0081,close long,12.2255,0xbefb51f1b00b187b02970421353e080202ca0000f75480b2e5c0c48e6fa8c8a4,85278836101,False,0.050921,307000000000000.0,1740000000000.0,2025-09-04 17:30:00,2025-09-04,,,17.0
0xbee1707d6b44d4d52bfe19e41f8a828645437aab,HYPE,14.573,3.0,43.72,buy,16-03-2025 04:43,-805.81,close short,0.681,0x44437856adb5a5ed5542041fa105760130005e6d0e1f21699d2b39b207725e63,80056511126,True,0.013115,317000000000000.0,1740000000000.0,,,,,
0xbee1707d6b44d4d52bfe19e41f8a828645437aab,HYPE,14.569,75.0,1092.67,buy,19-03-2025 15:30,-1148.89,close short,-7.1475,0x03c44238ed3b8fb724a9041fd998fe018900b69be506baef6166d234f821d886,80695833647,True,0.327802,615000000000000.0,1740000000000.0,,,,,
0xb1231a4a2dd02f2276fa3c5e2a2f3436e6bfed23,ILV,91.869,16.4,1506.65,buy,21-12-2023 09:40,210.82,open long,0.0,0x9f50ffe364b4ee2d9f940406b2b2c9010a00dfed859b0ddf457c4e4840db3835,5075918658,True,0.376662,770000000000000.0,1700000000000.0,,,,,
0xbaaaf6571ab7d571043ff1e313a9609a10637864,HYPE,23.966,48.96,1173.38,sell,20-02-2025 01:29,24667.35,close long,68.039712,0xe95d0633a19d8ecbe576041e1423420201e300c408cc278f05acc4a61c9f0d5c,73482924452,True,0.394253,742000000000000.0,1740000000000.0,,,,,
0xae5eacaf9c6b9111fd53034a602c192a04e082ed,AIXBT,0.08687,94020.0,8167.52,sell,12-04-2025 20:07,94020.0,close long,386.23416,0xdccb756e0d44199b1eae0421681a120205870049e634ccabfcc25703a483f421,86040314167,True,2.744285,870000000000000.0,1740000000000.0,2025-12-04 20:07:00,2025-12-04,,,20.0
0xb1231a4a2dd02f2276fa3c5e2a2f3436e6bfed23,ETH,2384.4,13.2951,31700.84,sell,31-01-2024 03:12,-28.6371,open short,0.0,0xf46918ac6335e5ce19240407655bc801ee00c3fc364b76a002d6b8c7eb96f9ea,8479867143,True,7.925209,790000000000000.0,1710000000000.0,,,,,
0x75f7eeb85dc639d5e99c78f95393aa9a5f1170d4,ONDO,0.93226,3901.0,3636.75,buy,27-03-2024 22:24,-5779.0,close short,-22.07966,0x6c01cf9fed6c4c2e86ba0408384d5502033e0102e7406f24b5e30cd7ba1f1c77,15748491839,False,0.349127,28600000000000.0,1710000000000.0,,,,,
0xbee1707d6b44d4d52bfe19e41f8a828645437aab,@107,17.98,55.28,993.93,sell,12-12-2024 12:55,9355.767731,sell,177.793007,0x84a23415c96fa83f8799041908427c01a9000f02bac619e0d0b710cb3c85d81d,54855236273,False,0.0,508000000000000.0,1730000000000.0,2024-12-12 12:55:00,2024-12-12,Extreme Greed,83.0,12.0
0xbee1707d6b44d4d52bfe19e41f8a828645437aab,HYPE,12.6,1.01,12.73,sell,03-04-2025 10:13,13614.04,close long,-0.012322,0x667c0098a7cf4856c2e20420cd794302033e0080fe111701a5b7bdcd2d4986bd,83560982631,False,0.000636,635000000000000.0,1740000000000.0,2025-03-04 10:13:00,2025-03-04,Extreme Fear,15.0,10.0
0x75f7eeb85dc639d5e99c78f95393aa9a5f1170d4,JELLY,0.009779,72452.0,708.51,sell,10-02-2025 07:46,4031278.0,close long,4.274668,0xc70c47d313e80cbba020041d7916f402013f00351a0a6b9db118ddaebcd6860c,71095750320,False,0.068016,715000000000000.0,1740000000000.0,2025-10-02 07:46:00,2025-10-02,,,7.0
0x513b8629fe877bb581bf244e326a047b249c4ff1,BTC,87800.0,0.007,614.6,sell,21-04-2025 19:50,47.33188,close long,2.933,0xad4bd4a63485ac6b144c0421f929690202f600361d3339ebe4f7c516d0abbac5,87788597919,False,0.0,631000000000000.0,1750000000000.0,,,,,
0xa0feb3725a9335f49874d7cd8eaad6be45b27416,BTC,97749.0,0.00015,14.66,sell,10-02-2025 19:15,0.59074,close long,0.095175,0x03320657bf1e2b3000e8041d80e2f90202d900d2faabf8016033e5026dc9fa59,71232689525,False,0.000733,180000000000000.0,1740000000000.0,2025-10-02 19:15:00,2025-10-02,,,19.0
0xb1231a4a2dd02f2276fa3c5e2a2f3436e6bfed23,BTC,42391.0,1.05872,44880.2,buy,05-02-2024 08:01,-1.05872,close short,-53.99472,0x7e25461db43129f6acf30407799e44010b00dce7e7380d3a73b8aa9701ff1c98,8846058687,True,11.220049,691000000000000.0,1710000000000.0,2024-05-02 08:01:00,2024-05-02,Fear,43.0,8.0
0xbee1707d6b44d4d52bfe19e41f8a828645437aab,HYPE,14.94,471.39,7042.57,sell,11-04-2025 09:00,-730.73,open short,0.0,0xf523d851255b51b3e6470421504ffc0163000cb6be0924595495e4c48efa4467,85741924187,True,2.464898,950000000000000.0,1740000000000.0,2025-11-04 09:00:00,2025-11-04,,,9.0
0x8477e447846c758f5a675856001ea72298fd9cb5,ZRO,5.055,49.4,249.72,buy,21-07-2024 01:54,-25099.2,close short,-8.01515,0xdb67cc708c04221cd01d040dd251530133004c7930d4561b3572091281fd0d0b,30548067727,False,0.024971,147000000000000.0,1720000000000.0,,,,,
0x8477e447846c758f5a675856001ea72298fd9cb5,kBONK,0.03715,9207.0,342.04,buy,23-05-2024 17:31,-961864.0,close short,0.073656,0x8f299160023ee29aa6540409ba1dc901380000d76014d379955e8a87c2b98024,23559154109,False,0.034204,793000000000000.0,1720000000000.0,,,,,
0x75f7eeb85dc639d5e99c78f95393aa9a5f1170d4,GRIFFAIN,0.22457,2227.0,500.12,sell,31-01-2025 05:00,152533.0,close long,15.52219,0x5d71e4d8a6fc390ac3b8041cd5c4bf015e00a8e7649db07e04a7e8e641833037,67854953268,True,0.168039,398000000000000.0,1740000000000.0,,,,,
0x8477e447846c758f5a675856001ea72298fd9cb5,ZRO,4.969,50.2,249.44,sell,21-07-2024 00:03,-22227.1,open short,0.0,0x160cb0f09e9db27255fc040dd12ed4013900f305cb6b1ff5a5347eb0022ecb3c,30546144986,True,0.087305,1090000000000000.0,1720000000000.0,,,,,
0xbaaaf6571ab7d571043ff1e313a9609a10637864,HYPE,12.652,39.51,499.88,buy,29-03-2025 15:08,67149.69,open long,0.0,0xb2b136b71b3d56c60d3b04207e23fb0201e1002a4076c0f0d362071e9d78340b,82476212852,True,0.174958,869000000000000.0,1740000000000.0,,,,,
0xa0feb3725a9335f49874d7cd8eaad6be45b27416,ONDO,1.3347,277.0,369.71,buy,09-02-2025 14:49,8530.0,open long,0.0,0xcf431004498790efc575041d6da608017c0098ba95decd600cf33883565a810b,70816395251,False,0.018485,678000000000000.0,1740000000000.0,2025-09-02 14:49:00,2025-09-02,,,14.0
0xbaaaf6571ab7d571043ff1e313a9609a10637864,HYPE,22.517,4.0,90.07,buy,24-02-2025 08:34,23833.66,open long,0.0,0x0000000000000000000000000000000000000000000000000000000000000000,73505718963,False,0.008645,749000000000000.0,1740000000000.0,,,,,
0x75f7eeb85dc639d5e99c78f95393aa9a5f1170d4,kPEPE,0.005788,254988.0,1475.87,sell,12-04-2024 22:58,254989.0,close long,-26.518752,0xb0ca875dd62a7bfbbab504087330c00203e10021fbb5160a97baf9c3a1a758f3,17696000815,False,0.141683,558000000000000.0,1710000000000.0,2024-12-04 22:58:00,2024-12-04,Extreme Greed,78.0,22.0
0xbaaaf6571ab7d571043ff1e313a9609a10637864,HYPE,17.9,2.0,35.8,buy,25-02-2025 13:05,284332.28,open long,0.0,0x0a6ed8ec20b677d591f0041e6d075d02082f00e0a0cebbff7f66116cc6cfc62c,74729318964,False,0.001718,132000000000000.0,1740000000000.0,,,,,
0xb899e522b5715391ae1d4f137653e7906c5e2115,BTC,87476.0,0.19465,17027.2,sell,25-03-2025 19:37,0.0,open short,0.0,0x7cca537dc324724c98e104203f105702026900f6bf7c1b44c2435d162f3741f3,81732226874,True,4.2568,995000000000000.0,1740000000000.0,,,,,
0x28736f43f1e871e6aa8b1148d38d4994275d72c4,PENDLE,3.7074,54.0,200.2,sell,15-02-2025 12:07,945.0,close long,17.934156,0xa701dae70d5d0665ea97041dca8a940201b90007491343b118f1fa592f55414f,72454928846,True,0.070069,52100000000000.0,1740000000000.0,,,,,
0xbee1707d6b44d4d52bfe19e41f8a828645437aab,@107,28.187,49.96,1408.22,buy,17-12-2024 12:46,37770.66102,buy,0.0,0x31982fc964e7c48ebf5104196fdbb4017100889a150d90f778b6a2caa9f7619e,55954234261,True,0.01498797,358000000000000.0,1730000000000.0,,,,,
0x75f7eeb85dc639d5e99c78f95393aa9a5f1170d4,BTC,52114.0,0.00021,10.94,buy,19-02-2024 21:23,0.0,open long,0.0,0x27741b058345f66ec1b40407b102840114004c5a364c393ac8888e122a53b220,10159333827,True,0.002625,430000000000000.0,1710000000000.0,,,,,
0xbaaaf6571ab7d571043ff1e313a9609a10637864,HYPE,11.502,867.42,9977.06,sell,04-04-2025 00:19,12004.78,close long,2.949228,0xe8b026c476b1e532ce010420d74ad901de0000165b7787b8dda5de5b51804123,83722278991,False,0.498853,851000000000000.0,1740000000000.0,2025-04-04 00:19:00,2025-04-04,Fear,28.0,0.0
0xbee1707d6b44d4d52bfe19e41f8a828645437aab,HYPE,20.737,0.95,19.7,buy,27-02-2025 12:33,-15480.46,close short,0.001995,0x4c9d2d74c3dc72e70412041e8db6df02015200e71fc3cc3ddb7d44f82686b851,75444027222,True,0.00591,69800000000000.0,1740000000000.0,,,,,
0xbee1707d6b44d4d52bfe19e41f8a828645437aab,@107,19.617,12.5,245.21,sell,28-02-2025 17:12,767.232943,sell,6.517937,0x90a365ab64ef90c36602041ea1a1520203a60010f53656c770ad45e67c4af17f,75827788642,True,0.073563,8810000000000.0,1740000000000.0,,,,,
0x28736f43f1e871e6aa8b1148d38d4994275d72c4,PURR/USDC,0.1921,57.0,10.95,buy,25-01-2025 12:22,77331.43792,buy,0.0,0xcdd45e2c29257f0cc9a8041c6c713c01530023aaa0ddc24c529ceb9b60d0825a,66411285046,True,0.01994,489000000000000.0,1740000000000.0,,,,,
0xa0feb3725a9335f49874d7cd8eaad6be45b27416,@107,18.545,12.05,223.47,buy,23-04-2025 19:23,5876.887226,buy,0.0,0xe649f3d9a8f5322d8d870422197a770202ce00564d04c7a414e94b53b6b7f1f9,88163006226,False,0.00120496,341000000000000.0,1750000000000.0,,,,,
0x28736f43f1e871e6aa8b1148d38d4994275d72c4,ETH,2444.0,1.5,3666.0,sell,02-03-2025 22:09,5.5,close long,426.72,0xa5a9d51529c32f0a4b4a041ec616b402067a000c9e73a7729ea14005e6c67a92,75626737239,False,0.3666,275000000000000.0,1740000000000.0,2025-02-03 22:09:00,2025-02-03,Fear,44.0,22.0
0xbee1707d6b44d4d52bfe19e41f8a828645437aab,HYPE,14.957,12.57,188.01,buy,26-03-2025 19:24,795.22,open long,0.0,0x18d3768b1f4fe90807d604204f747402021f0048e5b42cebcbd998deb5f90f1f,81919039370,True,0.056402,1040000000000000.0,1740000000000.0,,,,,
0x4acb90e786d897ecffb614dc822eb231b4ffb9f4,ZORA,0.0194,102385.0,1986.27,buy,23-04-2025 19:49,-1132349.0,close short,176.92128,0xa26cab778c37336ea476042219c741020390008e737f9d077eb81fad361b2e1c,88325566693,False,0.099313,138000000000000.0,1750000000000.0,,,,,
0xb1231a4a2dd02f2276fa3c5e2a2f3436e6bfed23,BTC,67362.0,0.11428,7698.13,buy,29-07-2024 23:35,0.66395,open long,0.0,0xa234cde3813ed3e86180040e55b71e018a00fd1b023e8fce4348cc7d2b92df41,31574649640,True,2.694345,773000000000000.0,1720000000000.0,,,,,
0x75f7eeb85dc639d5e99c78f95393aa9a5f1170d4,IP,1.869,8.0,14.95,buy,13-02-2025 19:06,-3662.4,close short,0.2448,0x1e89bf5638c9bfdfd239041daefe0c02039c009e3fc789ab0369b5f01156a6cf,72013056010,False,0.001435,1080000000000000.0,1740000000000.0,,,,,
0xbee1707d6b44d4d52bfe19e41f8a828645437aab,HYPE,25.775,0.45,11.6,sell,13-02-2025 05:23,-1585.15,open short,0.0,0x0000000000000000000000000000000000000000000000000000000000000000,71878775000,False,0.001159,956000000000000.0,1740000000000.0,,,,,
0x28736f43f1e871e6aa8b1148d38d4994275d72c4,HYPE,19.514,75.0,1463.55,buy,28-02-2025 17:28,375.0,open long,0.0,0x84f7b2e6bcbc2ab14262041ea1d0a00201840070a9c4b6ea73e8366711160cdd,75831027829,True,0.512242,581000000000000.0,1740000000000.0,,,,,
0xbee1707d6b44d4d52bfe19e41f8a828645437aab,HYPE,16.474,30.35,499.99,buy,13-04-2025 07:24,-9837.27,close short,5.62082,0x489621166168ce01e01a04216fc104020294004f2bc996fed64ca536af98823a,86139806071,True,0.174995,166000000000000.0,1740000000000.0,,,,,
0xb1231a4a2dd02f2276fa3c5e2a2f3436e6bfed23,HYPE,16.053,11.8,189.43,buy,06-03-2025 19:41,3476.85,open long,0.0,0x9069f3cf7b31d61af27c041f05eef202022500cf3fc4fc19c414a5ee9a10c2f1,77662999037,True,0.066298,360000000000000.0,1740000000000.0,2025-06-03 19:41:00,2025-06-03,,,19.0
0x271b280974205ca63b716753467d5a371de622ab,PAXG,3085.5,0.955,2946.65,buy,09-04-2025 23:29,-157.709,close short,3.23936,0xd3d5f3aaf82060f9f34a04213956e2020139002e48a76736f7fc06b891e5d0bc,85379430895,False,0.282878,400000000000000.0,1740000000000.0,2025-09-04 23:29:00,2025-09-04,,,23.0
0x75f7eeb85dc639d5e99c78f95393aa9a5f1170d4,FTM,1.0039,2177.0,2185.49,buy,19-03-2024 21:00,-87381.0,close short,79.575881,0xb6847fed3c1630357fb104081acc8502033100fab67a6805dafd4e7c0e8ae3f1,14513028466,False,0.209807,341000000000000.0,1710000000000.0,,,,,
0x47add9a56df66b524d5e2c1993a43cde53b6ed85,RENDER,10.952,35.4,387.7,sell,05-12-2024 08:59,-366.3,open short,0.0,0x21682312b3b8cf5ff8b50418736ecb020187006d78bcf0c81d07c2b3827d3759,52807291770,True,0.130267,285000000000000.0,1730000000000.0,2024-05-12 08:59:00,2024-05-12,Greed,56.0,8.0
0xb899e522b5715391ae1d4f137653e7906c5e2115,BTC,83448.0,0.00599,499.85,sell,12-03-2025 07:13,-19.41695,open short,0.0,0xa41fd61332fd96bfe5c2041f6074ed0201d40067459fd46f1f19199cb1ae798b,79211580341,True,0.124963,823000000000000.0,1740000000000.0,2025-12-03 07:13:00,2025-12-03,,,7.0
0xbee1707d6b44d4d52bfe19e41f8a828645437aab,@107,22.721,67.82,1540.94,sell,29-01-2025 09:57,670.8257095,sell,37.705456,0xfa9e88eb5351d17030c5041cb8de3b018600bef377863959058640d360914a5b,67389547849,True,0.539328,678000000000000.0,1740000000000.0,,,,,
0xa0feb3725a9335f49874d7cd8eaad6be45b27416,BTC,98756.0,0.0264,2607.16,buy,04-02-2025 10:46,1.28244,open long,0.0,0x4b8e32918b74041fe7d7041d1a2bdd00007cd1163073690368d5d8a9d53e248d,69270506786,False,0.260715,836000000000000.0,1740000000000.0,2025-04-02 10:46:00,2025-04-02,Fear,44.0,10.0
0x8477e447846c758f5a675856001ea72298fd9cb5,HYPE,23.119,40.0,924.76,sell,03-01-2025 16:30,77.6,close long,17.124,0xeddfb5cafe9c17101f6c041a8c7d8101a700cc9b96daa547f0f7ef81bc105288,60397805402,True,0.323666,1020000000000000.0,1740000000000.0,2025-03-01 16:30:00,2025-03-01,Extreme Fear,20.0,16.0
0xbee1707d6b44d4d52bfe19e41f8a828645437aab,HYPE,24.653,8.11,199.94,sell,22-02-2025 19:27,-489.41,open short,0.0,0xf23429d268c8704ccc72041e409e6f01cd0073eb400bc402c19cd0015a4b4164,74103114807,True,0.069977,640000000000000.0,1740000000000.0,,,,,
0xbee1707d6b44d4d52bfe19e41f8a828645437aab,HYPE,14.197,36.99,525.15,buy,10-03-2025 20:34,21245.57,open long,0.0,0xcf23658fc65f33e69f6b041f487c9402010800782cb044fa05303120df8fae16,78718261663,True,0.157544,908000000000000.0,1740000000000.0,2025-10-03 20:34:00,2025-10-03,,,20.0
0xbaaaf6571ab7d571043ff1e313a9609a10637864,HYPE,13.8,114.4,1578.72,buy,10-03-2025 23:02,13521.82,open long,0.0,0x4ffd254ccfee9663ef40041f4a330c0201e7004518bb5f90c41ba2ec796614f8,78760997451,False,0.0,833000000000000.0,1740000000000.0,2025-10-03 23:02:00,2025-10-03,,,23.0
0xbee1707d6b44d4d52bfe19e41f8a828645437aab,@107,26.421,76.78,2028.6,sell,18-02-2025 12:03,210.471881,sell,-18.14532,0x03c43a6084528168f9cd041dfa89870202f6000c3fe97bf186852915a1921ed3,73083140211,True,0.710011,136000000000000.0,1740000000000.0,,,,,
0x28736f43f1e871e6aa8b1148d38d4994275d72c4,TRUMP,47.08,1.5,70.62,buy,19-01-2025 13:57,-16.9,close short,0.71952,0x391236a3902ac131a3ea041bd3de490202230078fe035b6d8b5251a3f7d665ff,64270439440,True,0.024717,919000000000000.0,1740000000000.0,,,,,
0xbee1707d6b44d4d52bfe19e41f8a828645437aab,HYPE,18.027,33.17,597.96,buy,19-04-2025 16:29,-21627.82,close short,-3.927328,0x9169189b6166b909b8c20421d72c28013f003444acf4d5dd64f860abf5529784,87468753030,True,0.179386,45900000000000.0,1750000000000.0,,,,,
0xa0feb3725a9335f49874d7cd8eaad6be45b27416,HYPE,24.111,116.22,2802.18,buy,19-12-2024 04:33,3130.82,open long,0.0,0x3b3be193b405a0e21911041991dfbe0195004815dd5ea8183bfb057443ff8ace,56414437838,False,0.140109,548000000000000.0,1730000000000.0,,,,,
0x75f7eeb85dc639d5e99c78f95393aa9a5f1170d4,S,0.45262,495.0,224.05,sell,03-02-2025 21:05,24533.0,close long,9.40995,0x6321aae4b84260bc3f23041d10e7a60205840027754bcd3b04a37c95cb54d6c6,69065706783,False,0.021507,904000000000000.0,1740000000000.0,2025-03-02 21:05:00,2025-03-02,Fear,26.0,21.0
0x28736f43f1e871e6aa8b1148d38d4994275d72c4,BNB,639.9,0.052,33.27,sell,18-03-2025 15:48,-4.948,open short,0.0,0xd97b4b2f2b9f52df9fb2041fc9651d0207380048188acbe6fe290d94f9130194,80521909665,True,0.011646,231000000000000.0,1740000000000.0,,,,,
0x28736f43f1e871e6aa8b1148d38d4994275d72c4,CRV,0.51586,484.5,249.93,sell,04-04-2025 10:34,9844.2,close long,8.721,0xdd01c111a71a1aa910ed0420de58ca02059200965d587b3f239339201adcc25e,83815854113,True,0.087476,1050000000000000.0,1740000000000.0,2025-04-04 10:34:00,2025-04-04,Fear,28.0,10.0
0xb1231a4a2dd02f2276fa3c5e2a2f3436e6bfed23,HYPE,15.536,102.98,1599.9,sell,09-03-2025 10:31,6905.11,close long,35.394226,0xa78574d55ff2eaf1990b041f30f2fd01670047aca2341437c4f31bc300b29077,78316461494,True,0.559964,435000000000000.0,1740000000000.0,2025-09-03 10:31:00,2025-09-03,,,10.0
0x513b8629fe877bb581bf244e326a047b249c4ff1,BTC,85184.0,0.00015,12.78,buy,20-04-2025 05:49,0.00015,open long,0.0,0xcae2698b8b99cc38f0090421dffd7c0201d40064bffaa744520a7d3575b0b299,87541945403,True,0.002938,375000000000000.0,1750000000000.0,,,,,
0x513b8629fe877bb581bf244e326a047b249c4ff1,SOL,149.51,171.96,25709.74,sell,29-04-2025 22:06,32805.15,close long,312.692064,0x55428e7275e7434235f404227cba110203f100b24b37616ff270ce7bfe24134c,89799124579,True,5.91324,191000000000000.0,1750000000000.0,,,,,
0x72c6a4624e1dffa724e6d00d64ceae698af892a0,HYPE,20.61,427.78,8816.55,sell,14-12-2024 16:34,-8679.02,open short,0.0,0x05f1cb5ef133ac27a6b2041935139a0193003e05dcad71cb3fd7fcad391a894d,55376583964,False,0.846387,559000000000000.0,1730000000000.0,,,,,
0x8170715b3b381dffb7062c0298972d4727a0a63b,MELANIA,0.73,684.7,499.83,sell,19-03-2025 13:14,-601127.4,open short,0.0,0x680abd13bc24e97e4ab7041fd8117901e100d6fd871a144e1a987a62754f1e2b,80545110957,False,0.047983,200000000000000.0,1740000000000.0,,,,,
0x4acb90e786d897ecffb614dc822eb231b4ffb9f4,SUI,3.82,130.9,500.04,buy,20-12-2024 14:15,124765.8,open long,0.0,0x735a3508424ca6f4443e0419ae703a0201cd0055e6fcc6bed63a77fe4bf82537,56944586323,False,0.050003,511000000000000.0,1730000000000.0,,,,,
0xbee1707d6b44d4d52bfe19e41f8a828645437aab,HYPE,12.631,39.58,499.93,buy,13-03-2025 12:33,495.33,open long,0.0,0xb20b8cae0551195a82be041f74ebcf0201a700fd6debf5088b2a2186f7a72930,79539204914,True,0.14998,752000000000000.0,1740000000000.0,,,,,
0x23e7a7f8d14b550961925fbfdaa92f5d195ba5bd,@107,18.173,3.33,60.52,sell,26-04-2025 06:34,433.6053247,sell,-3.011312,0x5061f47871b4e83255170422418a8e0201240014fbb349c638031ba1102a53d3,88978562183,True,0.018154,354000000000000.0,1750000000000.0,,,,,
0x28736f43f1e871e6aa8b1148d38d4994275d72c4,kPEPE,0.018464,2707.0,49.98,sell,27-11-2024 20:03,19827.0,close long,0.590126,0x55269764cf1fbb4887230417d806b90201b2005233c7c4a4719fd068b4bbda9c,50827029653,True,0.017493,11900000000000.0,1730000000000.0,,,,,
0xa0feb3725a9335f49874d7cd8eaad6be45b27416,HYPE,23.978,7.8,187.03,buy,20-02-2025 02:38,346.1,open long,0.0,0x83faf83fba90f8c55aa1041e14ebdf02027a007bee872167f5fc9a63d916f38a,73490330167,False,0.009351,331000000000000.0,1740000000000.0,,,,,
0x8170715b3b381dffb7062c0298972d4727a0a63b,MELANIA,0.735,125.0,91.88,sell,19-03-2025 14:49,-623061.6,open short,0.0,0x6fdb7e6d3ac5245286bd041fd92540018100fa30703b6dbc59bc438827d08ef7,80545153674,False,0.008819,514000000000000.0,1740000000000.0,,,,,
0xbaaaf6571ab7d571043ff1e313a9609a10637864,HYPE,12.808,43.66,559.2,sell,14-03-2025 09:41,103789.7,close long,1.436414,0x6b58df5baf62d4a697d6041f839540020200007a6b653c03ea9094f6166c758c,79743319110,False,0.0,724000000000000.0,1740000000000.0,,,,,
0x8477e447846c758f5a675856001ea72298fd9cb5,ETH,3933.9,0.2824,1110.93,buy,23-05-2024 18:02,-4.6472,close short,1.73676,0x2d847a407a044ab0389a0409ba8c43016f003428cacb04f5e4782de43ee1417a,23563509429,False,0.111093,630000000000000.0,1720000000000.0,,,,,
0xbee1707d6b44d4d52bfe19e41f8a828645437aab,@107,29.0,5.99,173.71,buy,24-12-2024 19:10,86.59805257,buy,0.0,0xd934a5e92b7623245ffd0419eacaa702016100649f50da45cb029a3eb88da5ac,58318532789,True,0.00149748,575000000000000.0,1740000000000.0,,,,,
0x47add9a56df66b524d5e2c1993a43cde53b6ed85,AAVE,337.83,1.12,378.37,sell,18-01-2025 07:43,4.69,close long,57.586144,0x23142824157bb66af5c6041bb9f7ff01cc002222be64a2017f8e6be8230d9b21,63859549198,True,0.127131,165000000000000.0,1740000000000.0,,,,,
0x8477e447846c758f5a675856001ea72298fd9cb5,WLD,5.113,97.7,499.54,sell,31-05-2024 00:24,0.0,open short,0.0,0x79dfaa11fc66ca07cb4c040a4b5dde011400166409a1e2419117922817d1a3a7,24456692697,True,0.174839,693000000000000.0,1720000000000.0,,,,,
0x75f7eeb85dc639d5e99c78f95393aa9a5f1170d4,ZEREBRO,0.45026,858.0,386.32,buy,07-01-2025 21:49,-48830.0,close short,15.514356,0x5ea3adaa65f78c16bf8d041ae449de0202010081d5075af5a4ebe68391273c3b,61211813081,False,0.037086,609000000000000.0,1740000000000.0,2025-07-01 21:49:00,2025-07-01,,,21.0
0xb899e522b5715391ae1d4f137653e7906c5e2115,SOL,145.62,0.1,14.56,sell,06-03-2025 20:07,5752.98,close long,0.03925,0x1067a69cd79651019199041f063ba1020353009f6e653e15c717b8fe2bdedbdb,77669759525,False,0.000698,366000000000000.0,1740000000000.0,2025-06-03 20:07:00,2025-06-03,,,20.0
0x39cef799f8b69da1995852eea189df24eb5cae3c,TRUMP,12.186,74.9,912.73,sell,23-03-2025 21:26,-11.1,open short,0.0,0x6ce6c7557c1ab3d6dbc204201f4d33019c0011f3fb7dbb2012e48bb1942fa247,81395107044,False,0.091273,1070000000000000.0,1740000000000.0,,,,,
0x92f17e8d81a944691c10e753af1b1baae1a2cd0d,FARTCOIN,0.65513,875.1,573.3,buy,02-02-2025 05:02,111026.3,open long,0.0,0x187a08d0f721db172ef5041cf6112202025b00fe6494dad91ff13e39a87e3b44,68340840169,True,0.200656,130000000000000.0,1740000000000.0,2025-02-02 05:02:00,2025-02-02,Greed,60.0,5.0
0x8477e447846c758f5a675856001ea72298fd9cb5,POPCAT,0.344,364.0,125.22,buy,23-04-2025 12:38,-133171.0,close short,-7.34006,0x78c167b3559602b388cf042214dc3c0201ba0076c7954b5cc7b0503feb2ba392,88224263957,False,0.012521,1070000000000000.0,1750000000000.0,,,,,
0x75f7eeb85dc639d5e99c78f95393aa9a5f1170d4,OP,2.8705,100.0,287.05,sell,05-04-2024 15:05,13712.4,close long,2.94,0xfe582ceddf6cde74be6c0408585ad401a900fa59e69162719b468da8649a3502,16800596835,False,0.027556,348000000000000.0,1710000000000.0,2024-05-04 15:05:00,2024-05-04,Greed,67.0,15.0
0xbaaaf6571ab7d571043ff1e313a9609a10637864,HYPE,20.244,196.61,3980.17,buy,25-02-2025 05:23,232911.84,open long,0.0,0x31994f6fa728792c9ecc041e67d0370201de0131d3b220a49a201c4082bd2cf0,74597839919,True,1.337337,798000000000000.0,1740000000000.0,,,,,
0x75f7eeb85dc639d5e99c78f95393aa9a5f1170d4,JELLY,0.01489,33543.0,499.46,sell,07-02-2025 22:52,2098332.0,close long,6.775686,0x40a6d61e7a9d5a100ec9041d52e56302036a00edd5dad359fc344a27cdc91e43,70527156558,True,0.167816,46600000000000.0,1740000000000.0,2025-07-02 22:52:00,2025-07-02,,,22.0
0x39cef799f8b69da1995852eea189df24eb5cae3c,FARTCOIN,0.69994,5397.1,3777.65,sell,10-04-2025 23:02,-20555.0,open short,0.0,0x5a030fc1740b9895c59204214985e202023400881e4708a3c77a19c049835ce1,85648403706,False,0.188882,754000000000000.0,1740000000000.0,2025-10-04 23:02:00,2025-10-04,,,23.0
0xa0feb3725a9335f49874d7cd8eaad6be45b27416,BTC,96892.0,0.00015,14.53,buy,13-02-2025 00:06,0.02445,open long,0.0,0x8f52d3408137368ac53f041da2d73702021c004a2addbc57631a75f91a8f409c,71822145294,False,0.000726,308000000000000.0,1740000000000.0,,,,,
0xa0feb3725a9335f49874d7cd8eaad6be45b27416,VINE,0.14872,4019.0,597.71,buy,04-02-2025 07:20,16288.0,open long,0.0,0x09bae732695735a85948041d17dbca0201e20008642e29f2c6be8ce969bcea7d,69247965190,False,0.05977,529000000000000.0,1740000000000.0,2025-04-02 07:20:00,2025-04-02,Fear,44.0,7.0
0x8170715b3b381dffb7062c0298972d4727a0a63b,MELANIA,0.52,658.2,342.26,buy,23-04-2025 22:05,-1045520.9,close short,23.649126,0x9388deda36eea506680c04221b517e02011200fba0a68e0a4f2d45315e609de5,88368093091,False,0.032856,948000000000000.0,1750000000000.0,,,,,
0x39cef799f8b69da1995852eea189df24eb5cae3c,XRP,2.0722,8.0,16.58,buy,09-04-2025 23:28,-37322.0,close short,-1.344592,0xb89a13b026180f04b88004213953b30206c00011a4d328d10fc4b95be5a987fe,85381575634,False,0.000828,166000000000000.0,1740000000000.0,2025-09-04 23:28:00,2025-09-04,,,23.0
0xbaaaf6571ab7d571043ff1e313a9609a10637864,HYPE,11.507,43.03,495.15,sell,03-04-2025 22:35,44294.14,close long,0.361452,0xe772c18d9de08aa659410420d613ca019400ede7e7e588b23476c93dda5f003f,83713441439,True,0.148543,985000000000000.0,1740000000000.0,2025-03-04 22:35:00,2025-03-04,Extreme Fear,15.0,22.0
0xb899e522b5715391ae1d4f137653e7906c5e2115,SOL,127.94,54.71,6999.6,buy,09-03-2025 22:22,3335.84,open long,0.0,0x42cb179187e2aa471f47041f3914c70204c400739ea10a5f65fc284ff6dffce9,78423983764,True,1.749899,549000000000000.0,1740000000000.0,2025-09-03 22:22:00,2025-09-03,,,22.0
0xbee1707d6b44d4d52bfe19e41f8a828645437aab,HYPE,14.593,131.05,1912.41,buy,20-03-2025 15:50,9529.49,open long,0.0,0x9d05f2846e1b5dee6ea6041fea6c5302030800692ea74558446e22661334238e,80914341129,True,0.573723,257000000000000.0,1740000000000.0,,,,,
0xbaaaf6571ab7d571043ff1e313a9609a10637864,HYPE,13.217,2.0,26.43,buy,11-03-2025 06:04,148611.29,open long,0.0,0xb63f9511fd5ba9909290041f4f12070204d100e3bd6c594982b9dac2f95450d2,78808032399,False,0.0,1110000000000000.0,1740000000000.0,2025-11-03 06:04:00,2025-11-03,,,6.0
0x39cef799f8b69da1995852eea189df24eb5cae3c,TAO,264.75,2.021,535.06,sell,12-03-2025 00:13,-140.206,open short,0.0,0x19e6afe8d1a71d082e1c041f5b98350202b5002eb306a5d457c10884e5a2a6e8,79139589857,False,0.053505,392000000000000.0,1740000000000.0,2025-12-03 00:13:00,2025-12-03,,,0.0
0x513b8629fe877bb581bf244e326a047b249c4ff1,BTC,85514.0,0.23387,19999.16,buy,13-04-2025 04:03,27.43752,open long,0.0,0xf4cc710f389fb8a5f0c504216d7ff70202df0016109ad0f61678b35a1853efaf,86111984800,True,4.999789,1090000000000000.0,1740000000000.0,,,,,
0x75f7eeb85dc639d5e99c78f95393aa9a5f1170d4,FTM,1.0462,141.0,147.51,buy,21-03-2024 00:11,-12804.0,close short,6.4578,0x6e44d1c79bc7aa1ae01204081ecd6501e7001627f0ecd3b0eb3d5ccd5af5346b,14757193467,False,0.01416,957000000000000.0,1710000000000.0,,,,,
0x8477e447846c758f5a675856001ea72298fd9cb5,W,0.63056,665.5,419.64,sell,27-05-2024 19:12,-68031.4,open short,0.0,0xab1bb3fa7fac16f443d6040a0b34ff011500a243351238320ca770b62c0132a4,24027005813,True,0.146873,1070000000000000.0,1720000000000.0,,,,,
0x23e7a7f8d14b550961925fbfdaa92f5d195ba5bd,TAO,345.0,8.696,3000.12,buy,24-04-2025 00:45,-118.061,close short,15.157128,0x9b93905980418c6cdef804221d23cb0201e200802a1a66cd80aa3766c05ddf26,88401452203,False,0.300012,171000000000000.0,1750000000000.0,,,,,
0xbaaaf6571ab7d571043ff1e313a9609a10637864,HYPE,12.52,79.88,1000.1,sell,03-04-2025 07:23,86232.35,close long,1.589612,0xa5bdc10c13ec12a5a4300420cb85de019e00da9dd80e1ce7b696d70283ac8479,83515748199,False,0.050004,745000000000000.0,1740000000000.0,2025-03-04 07:23:00,2025-03-04,Extreme Fear,15.0,7.0
0x47add9a56df66b524d5e2c1993a43cde53b6ed85,@107,11.619,21.52,250.04,buy,05-12-2024 04:28,960.8068324,buy,0.0,0x4eb62615013f98e68e3204186f8cb70151000b9f63a96e24dec2ede710ea6fae,52722262755,True,0.00723065,1090000000000000.0,1730000000000.0,2024-05-12 04:28:00,2024-05-12,Greed,56.0,4.0
0xae5eacaf9c6b9111fd53034a602c192a04e082ed,@107,9.0421,268.15,2424.64,sell,03-12-2024 15:22,1934.218602,sell,325.738252,0x125ea070e5b6af24d28e04184f784a02018f001d1acb12d38da77f72a68ac0db,52209955900,True,0.848623,221000000000000.0,1730000000000.0,2024-03-12 15:22:00,2024-03-12,Extreme Greed,81.0,15.0
0xa0feb3725a9335f49874d7cd8eaad6be45b27416,BTC,97749.0,0.013,1270.74,sell,10-02-2025 19:15,0.57519,close long,8.2485,0xf515fd126151e74c9396041d80e2fa020335006f8590dbcc549a5f14713b6160,71232689525,False,0.063536,908000000000000.0,1740000000000.0,2025-10-02 19:15:00,2025-10-02,,,19.0
0x513b8629fe877bb581bf244e326a047b249c4ff1,SOL,146.91,6.81,1000.46,buy,29-04-2025 02:16,30835.91,open long,0.0,0xcfdf6c777e75f4665b5104226f51fd017a00b285f2f6312fd7b094de09b3b795,89618961145,True,0.230105,361000000000000.0,1750000000000.0,,,,,
0x75f7eeb85dc639d5e99c78f95393aa9a5f1170d4,TAO,632.24,5.366,3392.6,sell,10-12-2024 02:51,0.0,open short,0.0,0x83f3c7c94716a034a8f10418d611650201e7004ac8d6edc91be46ce1bf515697,54028094442,False,0.325688,1070000000000000.0,1730000000000.0,2024-10-12 02:51:00,2024-10-12,Neutral,49.0,2.0
0x513b8629fe877bb581bf244e326a047b249c4ff1,BTC,85681.0,0.04961,4250.63,sell,13-04-2025 03:53,2.05076,close long,6.890829,0x0101e46948a1e5d5d04504216d61e501f400bda7706c7769eed1f16bda71cfd9,86110673100,True,1.062658,963000000000000.0,1740000000000.0,,,,,
0xb1231a4a2dd02f2276fa3c5e2a2f3436e6bfed23,HYPE,15.577,12.83,199.85,buy,07-03-2025 00:00,5021.48,open long,0.0,0x10a4cf0273b5e00e29c9041f08e73f01d600e640f8104ae5084e22a881aed8fc,77726746772,True,0.069948,415000000000000.0,1740000000000.0,2025-07-03 00:00:00,2025-07-03,,,0.0
0xa0feb3725a9335f49874d7cd8eaad6be45b27416,@107,18.951,124.98,2368.5,buy,23-04-2025 07:55,2967.417603,buy,0.0,0x3563b2c4342b33bcf6460422119d8602017e007d0576bb7ed94cbd302f5c79f8,88178210238,False,0.01249796,903000000000000.0,1750000000000.0,,,,,
0xbee1707d6b44d4d52bfe19e41f8a828645437aab,HYPE,13.7,658.32,9018.98,sell,02-04-2025 17:13,703.9,close long,457.20324,0x9ea21f760e4024738bef0420c1a72001e00088b239e9b7ac1f2b06cdbdc64f0b,83312585334,False,0.450949,679000000000000.0,1740000000000.0,2025-02-04 17:13:00,2025-02-04,Greed,72.0,17.0
0xb1231a4a2dd02f2276fa3c5e2a2f3436e6bfed23,HYPE,25.652,79.28,2033.69,sell,14-02-2025 02:19,-21633.16,open short,0.0,0xd5efafc63a0864c23dba041db3e84c015300687a6b9d78abf5472e9dc7b2e42a,72106248615,True,0.610107,367000000000000.0,1740000000000.0,,,,,
0x8170715b3b381dffb7062c0298972d4727a0a63b,MELANIA,0.4702,786.9,370.0,buy,23-04-2025 21:55,-2127633.0,close short,67.460937,0x8d71c730275cbf879c0804221b34a50205f600587406cabde1fe36473f6b92ca,88365036466,False,0.03552,403000000000000.0,1750000000000.0,,,,,
0x28736f43f1e871e6aa8b1148d38d4994275d72c4,PURR/USDC,0.50866,27.0,13.73,buy,18-12-2024 00:51,21627.67591,buy,0.0,0x7d3dc8e95a9c335cfa5704197a2b26020106002178253f34dbe6e862e5ac1e5a,56086554337,True,0.00944,475000000000000.0,1730000000000.0,,,,,
0xbaaaf6571ab7d571043ff1e313a9609a10637864,HYPE,20.13,720.49,14503.46,buy,25-02-2025 05:23,195682.26,open long,0.0,0x6f4be57de2be09477f80041e67d0250204b10130ea1b8dd8a2bcccf0bf6f2121,74597832189,True,4.873163,1070000000000000.0,1740000000000.0,,,,,
0xa0feb3725a9335f49874d7cd8eaad6be45b27416,@107,18.746,12.84,240.7,sell,30-04-2025 17:48,4583.008473,sell,2.911511,0xafad97bb36cf9ea8f47a042289f45e01970102951f5e082a241d0137508d2303,89960785858,True,0.084244,824000000000000.0,1750000000000.0,,,,,
0x513b8629fe877bb581bf244e326a047b249c4ff1,BTC,85300.0,0.018,1535.4,sell,15-04-2025 09:08,0.36547,close long,9.9036,0xcb4cb45d541b6d38ada90421919ce002037d00851a8526e3d0cc17c9bbd7135e,86618342363,False,0.0,668000000000000.0,1740000000000.0,,,,,
0xbee1707d6b44d4d52bfe19e41f8a828645437aab,@107,30.7,651.46,19999.82,sell,20-12-2024 21:26,32569.7642,sell,2240.731422,0x0000000000000000000000000000000000000000000000000000000000000000,57114869301,False,0.999991,1020000000000000.0,1730000000000.0,,,,,
0x8170715b3b381dffb7062c0298972d4727a0a63b,MELANIA,0.4,2095.7,838.28,sell,22-04-2025 20:35,-2091127.0,open short,0.0,0x1f9a41b68b46bd28a316042209e4ae01c9003f0bbe2494eb8952cb720c165bab,87664221563,False,0.080474,139000000000000.0,1750000000000.0,,,,,
0xbee1707d6b44d4d52bfe19e41f8a828645437aab,HYPE,14.308,34.97,500.35,sell,10-03-2025 20:37,21295.39,close long,0.41964,0x56f8c53854b9fa0bc72f041f4884010204e300c341d25bb8403858a1b8eedf17,78719356065,True,0.150105,616000000000000.0,1740000000000.0,2025-10-03 20:37:00,2025-10-03,,,20.0
0x39cef799f8b69da1995852eea189df24eb5cae3c,XRP,1.8636,3653.0,6807.73,sell,07-04-2025 20:05,108778.0,close long,-112.1471,0xf0de86ab46fee19eb827042115eec10208cf00c11a6acb897934740052a63282,84685119949,False,0.680773,54900000000000.0,1740000000000.0,2025-07-04 20:05:00,2025-07-04,,,20.0
0x513b8629fe877bb581bf244e326a047b249c4ff1,BTC,83186.0,0.00015,12.48,sell,12-04-2025 04:58,-1.79934,open short,0.0,0x6b313e029807198fba0f04215de94801ac001092edd85e7c214059795735b0c6,85920946401,True,0.003743,1110000000000000.0,1740000000000.0,2025-12-04 04:58:00,2025-12-04,,,4.0
0x28736f43f1e871e6aa8b1148d38d4994275d72c4,SOL,237.11,5.0,1185.55,buy,20-11-2024 21:00,50.0,open long,0.0,0x01802cb3653b8374b37704174705ea01e400c0d0e1ce5f8d9df1148136256c0a,48764371210,True,0.414942,497000000000000.0,1730000000000.0,,,,,
0xb1231a4a2dd02f2276fa3c5e2a2f3436e6bfed23,ETH,3252.1,0.615,2000.04,sell,26-07-2024 08:38,76.4134,close long,19.82145,0x0dd499f6d6535edc6a90040e20315c01f100e81704a30fe7b98f7c6dd335df27,31210408819,True,0.700014,618000000000000.0,1720000000000.0,,,,,
0xbaaaf6571ab7d571043ff1e313a9609a10637864,HYPE,17.035,357.97,6098.02,buy,04-03-2025 07:05,94876.66,open long,0.0,0xd7d3ad9aaad03453e0b3041edcde0b0207cf0005c7b293ce77f3c8fed05110f4,75775902052,False,0.292704,1030000000000000.0,1740000000000.0,2025-04-03 07:05:00,2025-04-03,Fear,25.0,7.0
0x8477e447846c758f5a675856001ea72298fd9cb5,ZEREBRO,0.029313,11123.0,326.05,buy,22-04-2025 22:09,-33702.0,close short,2.89198,0x05c54c1a06d2482a3cc704220af98201ed0018a38730c017544dbf83865d4871,88063977568,True,0.114116,930000000000000.0,1750000000000.0,,,,,
0xa0feb3725a9335f49874d7cd8eaad6be45b27416,HYPE,32.379,51.26,1659.75,buy,21-12-2024 14:52,439.42,open long,0.0,0x8dfdba25d85be5be80720419bd3b4a02034e006f995d178362b7201e04bac60c,57286738126,False,0.082987,885000000000000.0,1730000000000.0,,,,,
0xa0feb3725a9335f49874d7cd8eaad6be45b27416,HYPE,26.505,7.98,211.51,sell,16-02-2025 17:15,-377.93,open short,0.0,0x689ee76134d95c8d1b7a041dddc5940132007b26927a54c75535047fe8f37b67,72669980331,False,0.010575,727000000000000.0,1740000000000.0,,,,,
0x47add9a56df66b524d5e2c1993a43cde53b6ed85,VVV,6.0979,60.16,366.85,sell,06-02-2025 04:48,-60.28,open short,0.0,0xda9e90e4f680b05eb4bf041d36722802012f000615f8ee15c9571de0514dcf2c,69969840714,True,0.123261,474000000000000.0,1740000000000.0,2025-06-02 04:48:00,2025-06-02,,,4.0
0xbee1707d6b44d4d52bfe19e41f8a828645437aab,@107,26.6,573.82,15263.61,buy,16-12-2024 15:49,37483.17684,buy,0.0,0x65e1a4ad41c6feaf4c7104195de59301a300c6a4806242b325bd02e7394d51a9,55758878298,False,0.02869097,665000000000000.0,1730000000000.0,,,,,
0x8477e447846c758f5a675856001ea72298fd9cb5,AVAX,17.051,14.93,254.57,buy,07-04-2025 23:32,-14.93,close short,0.952534,0x57e81f66d73466baa30c0421184b140203f20088801236bc24b33f07430d2247,84760589512,True,0.0891,960000000000000.0,1740000000000.0,2025-07-04 23:32:00,2025-07-04,,,23.0
0xa0feb3725a9335f49874d7cd8eaad6be45b27416,TAO,458.74,1.274,584.43,sell,21-02-2025 03:01,14.612,close long,4.665388,0x106ec798efff0c318d7b041e256a540201cb007b8893b3b23efe0d554e2810ba,73718784593,False,0.029221,126000000000000.0,1740000000000.0,,,,,
0x28736f43f1e871e6aa8b1148d38d4994275d72c4,HBAR,0.30005,166.0,49.81,sell,05-12-2024 14:45,-3863.0,open short,0.0,0xea2aac7c42437828d79404187868f5018a004e7665f3d4ecb7f9a1b8274aeb5a,52886707882,True,0.017432,27400000000000.0,1730000000000.0,2024-05-12 14:45:00,2024-05-12,Greed,56.0,14.0
0xb1231a4a2dd02f2276fa3c5e2a2f3436e6bfed23,BTC,43050.0,0.07965,3428.93,buy,31-01-2024 04:56,1.37202,open long,0.0,0x674eb9bb8a7dbb04a0a2040765a4f4020194002fa7c821cb83ad1f44ed316414,8483910488,False,-0.068578,508000000000000.0,1710000000000.0,,,,,
0xbee1707d6b44d4d52bfe19e41f8a828645437aab,HYPE,13.424,14.89,199.88,sell,26-03-2025 20:39,-254.78,open short,0.0,0xae8f6b4e3d9490895d1404205056a801bd00f1071994d3fc8f55d8025931ef01,81936429388,True,0.059965,123000000000000.0,1740000000000.0,,,,,
0xb1231a4a2dd02f2276fa3c5e2a2f3436e6bfed23,BTC,43501.0,0.00026,11.31,buy,31-01-2024 02:40,0.51125,open long,0.0,0xfe05cb5b9dd68317c62e0407654552013700cc92ec076192e1ce53cc976956d1,8478339424,True,0.002827,1060000000000000.0,1710000000000.0,,,,,
0x75f7eeb85dc639d5e99c78f95393aa9a5f1170d4,GRIFFAIN,0.22411,480.0,107.57,sell,31-01-2025 05:01,87085.0,close long,3.1248,0xa6e202279e649cc62940041cd5c5b401ae00c568d0257d6992baf76005e90d9d,67854991589,False,0.010326,547000000000000.0,1740000000000.0,,,,,
0xb1231a4a2dd02f2276fa3c5e2a2f3436e6bfed23,ETH,3399.0,21.7043,73772.92,buy,24-06-2024 08:25,43.6025,open long,0.0,0xb59380467f4545a3939b040c3044bd0202690039bc471900949d21fd6f9471b3,27078695265,False,7.377291,1050000000000000.0,1720000000000.0,,,,,
0x75f7eeb85dc639d5e99c78f95393aa9a5f1170d4,BLUR,0.76916,4530.0,3484.29,sell,26-02-2024 22:59,4530.0,close long,113.0688,0xd7c01042078ecee174c90407cb237e02022a004d7c4ccec2159bc45c91cca3e0,10993734705,False,-0.069685,726000000000000.0,1710000000000.0,,,,,
0xa0feb3725a9335f49874d7cd8eaad6be45b27416,BTC,97182.0,0.01129,1097.18,buy,21-02-2025 23:09,1.33092,open long,0.0,0xb1697aaa173c2be60916041e330cac010800fe35f71a1ac4d66350036d68f8be,73910451057,False,0.054859,292000000000000.0,1740000000000.0,,,,,
0xb899e522b5715391ae1d4f137653e7906c5e2115,SOL,148.26,448.98,66565.77,sell,06-03-2025 08:21,-3933.42,open short,0.0,0xe7bcc34c37853d45fd0e041efe257001e800fb3c4c8ec386d2ce9628e911a7d8,77540763926,True,19.170942,108000000000000.0,1740000000000.0,2025-06-03 08:21:00,2025-06-03,,,8.0
0x4f93fead39b70a1824f981a54d4e55b278e9f760,BTC,82645.0,0.01132,935.54,buy,01-04-2025 02:20,0.50247,open long,0.0,0xb41ed917913d63eb74440420a6fb4b01680031c92cd47496d3441bf390755d2b,83009309161,True,0.327439,1050000000000000.0,1740000000000.0,2025-01-04 02:20:00,2025-01-04,Greed,73.0,2.0
0x8477e447846c758f5a675856001ea72298fd9cb5,AI16Z,0.24504,909.5,222.86,sell,25-04-2025 13:37,-1003.8,open short,0.0,0x927bd0c5b7e3ed1b2df9042235f5db0201140003b9d96b8a1b079637eb3109bc,88781346249,True,0.078002,956000000000000.0,1750000000000.0,,,,,
0xb1231a4a2dd02f2276fa3c5e2a2f3436e6bfed23,HYPE,23.811,21.0,500.03,buy,06-02-2025 21:19,-4794.4,close short,52.9305,0x277ebc75f3588e5c775f041d419ac9020202006c524bdfa6cfc1f04ee484543f,70177940119,True,0.17501,526000000000000.0,1740000000000.0,2025-06-02 21:19:00,2025-06-02,,,21.0
0x430f09841d65beb3f27765503d0f850b8bce7713,LAYER,1.2059,1610.0,1941.5,sell,12-02-2025 06:15,47927.0,close long,180.7547,0x9ec3481c511375c8bc5f041d982f3f02029a0095ebc822ff2964066c31400fc3,71611999083,True,0.679524,517000000000000.0,1740000000000.0,2025-12-02 06:15:00,2025-12-02,,,6.0
0xbee1707d6b44d4d52bfe19e41f8a828645437aab,@107,25.2,0.62,15.62,sell,19-12-2024 11:10,28810.8341,sell,0.073942,0x0000000000000000000000000000000000000000000000000000000000000000,56529020159,False,0.000781,601000000000000.0,1730000000000.0,,,,,
0xb1231a4a2dd02f2276fa3c5e2a2f3436e6bfed23,HYPE,14.266,350.99,5007.22,sell,11-03-2025 22:54,3428.67,close long,-9.722423,0x9186b93a9ed63e16f160041f5aa9810202300034e8bef8e8618e6067263b7bb8,79117673494,True,1.752528,740000000000000.0,1740000000000.0,2025-11-03 22:54:00,2025-11-03,,,22.0
0xb1231a4a2dd02f2276fa3c5e2a2f3436e6bfed23,SOL,147.34,1.8,265.21,buy,01-05-2025 04:30,-1044.55,close short,168.64866,0x5657aa1e9a41a45f657f0422914e9f01fa009ad36cf8d634f9dd03628af5cf83,90088205810,True,0.092824,85100000000000.0,1750000000000.0,2025-01-05 04:30:00,2025-01-05,Greed,72.0,4.0
0x75f7eeb85dc639d5e99c78f95393aa9a5f1170d4,INJ,35.16,2.8,98.45,sell,20-02-2024 21:01,410.8,close long,6.4792,0x03c0c03799752306953f0407b4b0ed02026a0025fd960c4e96aa3e8de12d5656,10276542893,False,-0.001968,51600000000000.0,1710000000000.0,,,,,
0xb1231a4a2dd02f2276fa3c5e2a2f3436e6bfed23,HYPE,15.253,131.13,2000.13,buy,09-03-2025 03:51,3693.11,open long,0.0,0x19df35445f72338bba9e041f2c6baa013100dc94a94e0def473282985ed8a0e9,78273672349,True,0.700044,329000000000000.0,1740000000000.0,2025-09-03 03:51:00,2025-09-03,,,3.0
0xbaaaf6571ab7d571043ff1e313a9609a10637864,HYPE,15.809,506.12,8001.25,sell,07-03-2025 20:46,1629.26,close long,191.009688,0x411fb8ba8b2cb654a17e041f171a0c02022e0028a4151874c695ddd025d1a242,77964432896,True,2.000312,11200000000000.0,1740000000000.0,2025-07-03 20:46:00,2025-07-03,,,20.0
0x4acb90e786d897ecffb614dc822eb231b4ffb9f4,HYPE,17.761,28.16,500.15,buy,04-03-2025 02:09,4962.96,open long,0.0,0xec6ee50570ba25646502041ed9763002040b001eb6e82824953415d330541911,76788135854,True,0.175052,362000000000000.0,1740000000000.0,2025-04-03 02:09:00,2025-04-03,Fear,25.0,2.0
0x39cef799f8b69da1995852eea189df24eb5cae3c,ETH,1769.7,1.6137,2855.76,sell,03-04-2025 18:59,-317.6689,open short,0.0,0x6dc00c96a2fb360f24c30420d38d4d0202530046ede8c9458b5464d7c86d3a6b,83660205277,False,0.285576,543000000000000.0,1740000000000.0,2025-03-04 18:59:00,2025-03-04,Extreme Fear,15.0,18.0
0xb1231a4a2dd02f2276fa3c5e2a2f3436e6bfed23,@4,3.1988,32.0,102.36,sell,18-09-2024 04:18,294.21926,sell,-12.813781,0x1c6dd336ad216e92ae7e04121837a9011000a22789b249d682bdd3f88afeeec2,38203280838,True,0.035826,588000000000000.0,1730000000000.0,,,,,
0xb1231a4a2dd02f2276fa3c5e2a2f3436e6bfed23,PURR/USDC,0.28695,347.0,99.57,sell,06-01-2025 07:00,27940.87303,sell,2.901125,0xf96928c58680bf86097f041ac2a33f01ad00713ee98d075fc9183b8a6b73f5f1,60879837241,True,0.03485,137000000000000.0,1740000000000.0,2025-06-01 07:00:00,2025-06-01,,,7.0
0x28736f43f1e871e6aa8b1148d38d4994275d72c4,@107,27.314,3.66,99.97,sell,18-12-2024 16:26,1119.463194,sell,61.666821,0xc792e2205e90b7b2d3190419878268018700bd5fa10c9bb04097fd2e0d2a54f7,56240247210,True,0.034989,811000000000000.0,1730000000000.0,,,,,
0xa0feb3725a9335f49874d7cd8eaad6be45b27416,VINE,0.13632,828.0,112.87,buy,06-02-2025 21:31,124504.0,open long,0.0,0xf081332b8cd60ade9632041d41bdba0204ca001bc7191e544985f2cfd0dff7be,69731537225,False,0.011287,600000000000000.0,1740000000000.0,2025-06-02 21:31:00,2025-06-02,,,21.0
0xb899e522b5715391ae1d4f137653e7906c5e2115,BTC,74843.0,2.04223,152846.62,sell,09-04-2025 07:00,2.04223,close long,288.771322,0x4f5cb575426785ec92c504212dfbc90206fa0083f17c662c1e643c29e9957e9c,85138102165,True,45.853985,459000000000000.0,1740000000000.0,2025-09-04 07:00:00,2025-09-04,,,7.0
0xbd5fead7180a9c139fa51a103cb6a2ce86ddb5c3,BTC,82400.0,0.0122,1005.28,sell,10-04-2025 07:39,35.84894,close long,38.84724,0xcfafaf5f75c5dedc35d904213efaf002036400c962f839aa15544e7d091b3870,85473737896,False,0.050264,452000000000000.0,1740000000000.0,2025-10-04 07:39:00,2025-10-04,,,7.0
0xbee1707d6b44d4d52bfe19e41f8a828645437aab,HYPE,18.355,23.7,435.01,sell,28-04-2025 14:25,-2316.15,open short,0.0,0x4d1faeed0c636df9fbdb0422672b0601e400ce4bf12e26b2728a2b271a3281e6,89482513525,True,0.130504,305000000000000.0,1750000000000.0,,,,,
0xa0feb3725a9335f49874d7cd8eaad6be45b27416,HYPE,24.766,92.79,2298.04,sell,20-02-2025 15:47,251.76,close long,25.758504,0x668cbbc6f4545c9a6bb2041e1db90202019f0003d002f20b470e1f6d17913863,73603189843,False,0.114901,25800000000000.0,1740000000000.0,,,,,
0xa0feb3725a9335f49874d7cd8eaad6be45b27416,BTC,97749.0,0.00013,12.71,sell,10-02-2025 19:15,0.37186,close long,0.082485,0x2ced3a5f46ca97e5a5dc041d80e3230201ae003bfd91410e52ba35bc75dab1d7,71232689525,False,0.000635,647000000000000.0,1740000000000.0,2025-10-02 19:15:00,2025-10-02,,,19.0
0x513b8629fe877bb581bf244e326a047b249c4ff1,SOL,134.41,17.86,2400.56,sell,18-04-2025 15:39,2472.08,close long,42.08709,0x36983d10620f3792b8bf0421c6afba0201e5001286250fe371b0ae451f0dbd8f,87324084209,True,0.552129,11500000000000.0,1740000000000.0,,,,,
0xb1231a4a2dd02f2276fa3c5e2a2f3436e6bfed23,HYPE,24.463,20.44,500.02,buy,06-02-2025 19:46,-9496.92,close short,38.19214,0xdc0a2d7c1b544341b4eb041d408f5f02024800687df6498f5f1a602befea63a1,70144105230,True,0.175008,162000000000000.0,1740000000000.0,2025-06-02 19:46:00,2025-06-02,,,19.0
0xbee1707d6b44d4d52bfe19e41f8a828645437aab,HYPE,16.352,0.82,13.41,sell,04-03-2025 16:18,8073.84,close long,0.162688,0x6a213a72acd3dcd34dfa041ee31a2902034800efe894aadc1a45638b73322c02,77002358970,True,0.004022,606000000000000.0,1740000000000.0,2025-04-03 16:18:00,2025-04-03,Fear,25.0,16.0
0xbaaaf6571ab7d571043ff1e313a9609a10637864,HYPE,22.626,21.93,496.19,buy,24-02-2025 07:03,4763.83,open long,0.0,0x971996e1527eb0a6c04d041e587f1401730052d8d4fd795a57c0eb189432bd4c,73505718927,False,0.047633,581000000000000.0,1740000000000.0,,,,,
0x8170715b3b381dffb7062c0298972d4727a0a63b,TRUMP,8.8,2371.1,20865.68,sell,22-04-2025 19:39,-83479.8,open short,0.0,0x13300fd3bdd3b5e2d69c042209413702037a0062a9ed3a9e8a0111677a34f55b,87558463693,False,2.003105,891000000000000.0,1750000000000.0,,,,,
0xb899e522b5715391ae1d4f137653e7906c5e2115,BTC,82799.0,0.14076,11654.79,sell,09-04-2025 23:57,7.11375,close long,24.942672,0x1924aef77412a43ff573042139a82502036c008c95d43510c83bf7aa1bef6b67,85393220712,True,3.496436,743000000000000.0,1740000000000.0,2025-09-04 23:57:00,2025-09-04,,,23.0
0x8477e447846c758f5a675856001ea72298fd9cb5,POPCAT,0.24941,4777.0,1191.43,buy,13-04-2025 21:21,-37971.0,close short,51.505614,0x04f5ffe6e391ff1916c804217927ad0205bc00e53e05a118386377b5ff98bb83,86251238498,True,0.417001,1110000000000000.0,1740000000000.0,,,,,
0x28736f43f1e871e6aa8b1148d38d4994275d72c4,@107,24.702,4.0,98.81,sell,16-12-2024 10:46,1291.704226,sell,75.018746,0x9394710de2f62edaa1cd0419599208018800cdbb2211e23b80616b89152e8ade,55713803431,True,0.034582,778000000000000.0,1730000000000.0,,,,,
0x28736f43f1e871e6aa8b1148d38d4994275d72c4,PURR/USDC,0.5735,93.0,53.34,buy,17-12-2024 16:55,18122.37759,buy,0.0,0xe4bde8b8f4efc05da158041973698f020122000e8f6a2e07ba911ed837c741ef,55990964045,True,0.03254,259000000000000.0,1730000000000.0,,,,,
0xbaaaf6571ab7d571043ff1e313a9609a10637864,HYPE,11.719,1025.64,12019.48,buy,03-04-2025 15:24,38537.19,open long,0.0,0xcfd867b61c307f92a3fa0420d10b5c0202ab010181f775a1ffb3494f0fc5256e,83555405449,False,0.600973,739000000000000.0,1740000000000.0,2025-03-04 15:24:00,2025-03-04,Extreme Fear,15.0,15.0
0xbd5fead7180a9c139fa51a103cb6a2ce86ddb5c3,BTC,85350.0,0.00464,396.02,sell,16-04-2025 23:00,11.00067,close long,15.025248,0xffa853549197b634aae20421ab406402054b0096ca44bca9aad05cc9eac52fff,86990092271,False,0.019801,920000000000000.0,1740000000000.0,,,,,
0x8477e447846c758f5a675856001ea72298fd9cb5,VIRTUAL,4.871,205.2,999.53,sell,02-01-2025 15:18,0.0,open short,0.0,0xd8fd28abe07bb18b7753041a76b7e80186001210514822ac048af345bc3088cd,60186630783,True,0.349835,965000000000000.0,1740000000000.0,2025-02-01 15:18:00,2025-02-01,Greed,68.0,15.0
0xbee1707d6b44d4d52bfe19e41f8a828645437aab,HYPE,24.371,20.51,499.85,sell,28-01-2025 12:51,-168.0,open short,0.0,0xd23614bea40a9e580ad3041caa90b002015d000ac1062097a2f64b567dbf5f4f,67154599425,True,0.174947,769000000000000.0,1740000000000.0,,,,,
0x28736f43f1e871e6aa8b1148d38d4994275d72c4,@107,7.9379,12.59,99.94,buy,30-11-2024 23:37,4349.570436,buy,0.0,0xef5f5b9f8d4d243b473d0418184d8701bb00b789625957abe0d2e39461b2700c,51527955135,True,0.00440645,738000000000000.0,1730000000000.0,,,,,
0x23e7a7f8d14b550961925fbfdaa92f5d195ba5bd,TAO,357.0,3.65,1303.05,sell,25-04-2025 02:12,160.018,close long,-9.9207,0xce885db1bf7ed0da502804222e73d90201810017c44bf907bcb747cfaae327a2,88675423567,False,0.130305,713000000000000.0,1750000000000.0,,,,,
0xb1231a4a2dd02f2276fa3c5e2a2f3436e6bfed23,HYPE,27.632,9.42,260.29,sell,30-01-2025 20:32,-18661.93,open short,0.0,0xd3c6dbfc918a01afae26041cd0126501bd004401a8b432f9722e62eb8b331b6d,67770373821,True,0.091102,721000000000000.0,1740000000000.0,,,,,
0x39cef799f8b69da1995852eea189df24eb5cae3c,ETH,3352.4,0.5996,2010.1,buy,12-11-2024 05:40,2.5,open long,0.0,0x816ba9759f25a91f9c4c041692d6eb01b2007892008ca2f621a3c38edc0c4276,46274656834,True,0.703534,428000000000000.0,1730000000000.0,2024-12-11 05:40:00,2024-12-11,Greed,74.0,5.0
0xbee1707d6b44d4d52bfe19e41f8a828645437aab,@107,13.82,8.2,113.32,buy,10-12-2024 14:47,36296.95843,buy,0.0,0x8bc53fec0b158d8a9b560418e064e502019b00b29c6d1f926f3343855979f6c2,54239701357,True,0.00205,86300000000000.0,1730000000000.0,2024-10-12 14:47:00,2024-10-12,Neutral,49.0,14.0
0x271b280974205ca63b716753467d5a371de622ab,SOL,150.6,199.2,29999.52,sell,23-04-2025 21:20,-4653.84,open short,0.0,0xfc64fc97153d314f239e04221acf9d02013900a17b5774a17a9b9d17758fe200,88354609284,True,7.49988,271000000000000.0,1750000000000.0,,,,,
0xbee1707d6b44d4d52bfe19e41f8a828645437aab,HYPE,14.114,28.56,403.1,sell,21-03-2025 19:53,10047.32,close long,2.38476,0x0fba0fed9efa53c0e61b041ffdadad0202ac008e7ac73c4cfac3cd6d628fb8a1,81121317943,True,0.120928,713000000000000.0,1740000000000.0,,,,,
0x72743ae2822edd658c0c50608fd7c5c501b2afbd,KAITO,0.745,3322.0,2474.89,buy,20-04-2025 16:17,-3322.0,close short,-22.370348,0x44744c3bc7ca5e95765a0421e6ed8601d80034797b55b422bf0fdf6413b446c7,87606872120,False,0.247489,870000000000000.0,1750000000000.0,,,,,
0x8477e447846c758f5a675856001ea72298fd9cb5,POPCAT,0.32744,305.0,99.87,buy,24-04-2025 07:01,-43914.0,close short,5.07947,0x7fb55a3b2d612500f26f0422215cbc02015b004e2519ba25ebf390bf1995a1a9,88460457375,True,0.034954,558000000000000.0,1750000000000.0,,,,,
0x4acb90e786d897ecffb614dc822eb231b4ffb9f4,SUI,2.2767,219.6,499.96,sell,31-03-2025 19:38,53919.6,close long,11.208384,0x7e730897f950c3a1b0f60420a2490c020208000a372c09c6a2cfc6282387a99c,82936469561,True,0.174987,832000000000000.0,1740000000000.0,,,,,
0xbee1707d6b44d4d52bfe19e41f8a828645437aab,HYPE,16.619,1.09,18.11,sell,24-03-2025 18:27,-865.82,open short,0.0,0x5a0dc9848725668b6e1c04202da8bd0201c200c4f8d1fdf1967cb3e3f5e52990,81534796652,True,0.005434,235000000000000.0,1740000000000.0,,,,,
0x28736f43f1e871e6aa8b1148d38d4994275d72c4,HYPE,29.287,1.54,45.1,buy,23-12-2024 02:08,-14.05,close short,4.409944,0x29cf9a9ee48a157710bb0419d24ec70201f3002b90ba3f6cf800587e0a2725e2,57821833114,True,0.015785,966000000000000.0,1730000000000.0,,,,,
0xbee1707d6b44d4d52bfe19e41f8a828645437aab,@107,25.42,60.86,1547.06,sell,19-12-2024 13:19,8558.570211,sell,13.917508,0x02de0b53c40ec0991f8e04199961c7017a00a2f8f381a3116eb050aaa14fa9dd,56547574604,False,0.077353,588000000000000.0,1730000000000.0,,,,,
0xb1231a4a2dd02f2276fa3c5e2a2f3436e6bfed23,HYPE,24.676,80.11,1976.79,buy,04-02-2025 06:32,-1003.82,close short,44.637292,0x85d5e1da560bac4a7870041d174c410201860019bc561bb4a872bb58aa686de2,69236632611,True,0.691878,80300000000000.0,1740000000000.0,2025-04-02 06:32:00,2025-04-02,Fear,44.0,6.0
0xaf40fdc468c30116bd3307bcbf4a451a7ebf1deb,BTC,82901.0,0.12061,9998.69,buy,16-03-2025 18:41,0.50221,open long,0.0,0xaeb507aa2a946387a555041faa876d01f60027c41605fc16cb00144a531fa5aa,80152049207,False,0.999868,360000000000000.0,1740000000000.0,,,,,
0x8477e447846c758f5a675856001ea72298fd9cb5,HYPE,19.652,43.18,848.57,buy,11-01-2025 15:11,369.34,open long,0.0,0x7efc57ad56b9c23405da041b31948101bb0063ba40318b93c9255db1eaa55d5b,62259130380,True,0.297,994000000000000.0,1740000000000.0,2025-11-01 15:11:00,2025-11-01,,,15.0
0xb1231a4a2dd02f2276fa3c5e2a2f3436e6bfed23,ETH,2341.4,0.1068,250.06,sell,06-02-2024 21:02,21.379,close long,-0.301176,0x99413f979ff0903d375c04077f98f70199002c26b2640eb2d290f15e47d0fca7,8953795819,True,0.062515,1010000000000000.0,1710000000000.0,2024-06-02 21:02:00,2024-06-02,Greed,73.0,21.0
0x28736f43f1e871e6aa8b1148d38d4994275d72c4,ETH,3152.3,0.14,441.32,sell,18-11-2024 21:27,3.8905,close long,-0.049,0xa2d7a837720ce6e93a5d04171e004d02015300b6838001bbbe7d7005cca27af5,48298613428,True,0.154462,1030000000000000.0,1730000000000.0,,,,,
0x8477e447846c758f5a675856001ea72298fd9cb5,AAVE,140.51,7.08,994.81,sell,21-08-2024 12:36,-57.66,open short,0.0,0x734f5790601ce5795889040fe858ba013200f62026420768af8ace7c055c0bc1,34937084038,True,0.348183,403000000000000.0,1720000000000.0,,,,,
0xa0feb3725a9335f49874d7cd8eaad6be45b27416,HYPE,26.029,14.5,377.42,buy,17-02-2025 00:36,794.05,open long,0.0,0x05aee832ad744646b9c6041de29f4801b2001fea44ecc90e7d7d77a984e1a15a,72720364270,False,0.018871,857000000000000.0,1740000000000.0,,,,,
0xbaaaf6571ab7d571043ff1e313a9609a10637864,HYPE,11.445,43.21,494.54,buy,06-04-2025 15:53,17379.96,open long,0.0,0x861d9b559b4942cabb98042102abd40180001149c39d71370045f1157fa5d8ad,84227820216,True,0.148361,438000000000000.0,1740000000000.0,2025-06-04 15:53:00,2025-06-04,,,15.0
0x8170715b3b381dffb7062c0298972d4727a0a63b,HYPE,27.226,1.23,33.49,sell,15-02-2025 01:40,1314.91,close long,0.278472,0x0000000000000000000000000000000000000000000000000000000000000000,72357808937,False,0.003214,839000000000000.0,1740000000000.0,,,,,
0x75f7eeb85dc639d5e99c78f95393aa9a5f1170d4,MAVIA,0.3936,12560.0,4943.62,buy,26-03-2025 20:47,-58338.4,close short,18.84,0xf402b6a19bbfab40cd4e0420506f500202d600a9b0ae39b74c529c22ac2004de,81938014723,False,0.474586,240000000000000.0,1740000000000.0,,,,,
0xbee1707d6b44d4d52bfe19e41f8a828645437aab,@107,26.692,10.0,266.92,buy,20-12-2024 20:34,37706.54403,buy,0.0,0xdb488e42a3532c286a290419b212840201cd0029f53de85c18998286bb27c12f,57099751521,True,0.003,16100000000000.0,1730000000000.0,,,,,
0xa0feb3725a9335f49874d7cd8eaad6be45b27416,HYPE,26.127,38.27,999.88,sell,04-02-2025 19:33,133.77,close long,17.321002,0x5e10df08ac65194e9798041d201e10017e001fb7659d55070bf03989d80c1276,69451774029,True,0.349958,459000000000000.0,1740000000000.0,2025-04-02 19:33:00,2025-04-02,Fear,44.0,19.0
0xb1231a4a2dd02f2276fa3c5e2a2f3436e6bfed23,HYPE,23.794,10.0,237.94,buy,22-02-2025 01:12,-18125.97,close short,9.134,0x5b7b1cba5f5013e50a76041e34778b0201960032a0ea16460d4d6a99bed78839,73956931714,True,0.083279,911000000000000.0,1740000000000.0,,,,,
0xb899e522b5715391ae1d4f137653e7906c5e2115,SOL,128.83,309.41,39861.29,buy,09-03-2025 22:09,5457.16,open long,0.0,0xa9cedd80e539a840ca16041f38ec3e020441006ec077a42686922edd2c698bc5,78420066966,True,9.965322,192000000000000.0,1740000000000.0,2025-09-03 22:09:00,2025-09-03,,,22.0
0x271b280974205ca63b716753467d5a371de622ab,SOL,149.34,3.34,498.8,buy,24-04-2025 00:54,-422.47,close short,4.675666,0xbbe2fac6b9b3b0166ef804221d3f84020134002f28236e90e0112e5c2de7ea0a,88403601449,True,0.124698,733000000000000.0,1750000000000.0,,,,,
0x4f93fead39b70a1824f981a54d4e55b278e9f760,BTC,63498.0,0.04409,2799.63,sell,07-10-2024 11:40,-4.23471,open short,0.0,0x1853ee90bf5701b63ae50413a82b660177007398d4d46c1d38ae2d792dd8ddb0,40828504271,True,0.979869,662000000000000.0,1730000000000.0,2024-07-10 11:40:00,2024-07-10,Fear,28.0,11.0
0x8170715b3b381dffb7062c0298972d4727a0a63b,MELANIA,0.409,52633.0,21526.9,sell,17-04-2025 11:00,-1703662.9,open short,0.0,0x8f8cc1def3619e394e250421b3550d02019700170a87bea9ef9bd3499a210c03,87105011076,False,2.066581,95600000000000.0,1740000000000.0,,,,,
0x47add9a56df66b524d5e2c1993a43cde53b6ed85,TRX,0.385,6493.0,2499.8,buy,04-12-2024 10:18,-16066.0,close short,101.264828,0x2df6700e05dbeaa99c7b04185fe45200006b66d8aa3718efc532b871226bb493,52468398367,False,0.23998,159000000000000.0,1730000000000.0,2024-04-12 10:18:00,2024-04-12,Extreme Greed,79.0,10.0
0xa0feb3725a9335f49874d7cd8eaad6be45b27416,HYPE,27.315,0.15,4.1,buy,15-02-2025 00:08,1.05,open long,0.0,0xa78e3abff8fbfc57dc54041dc292d50201bc007b2904a7cbc851e194cd534b55,72340551772,True,0.001229,109000000000000.0,1740000000000.0,,,,,
0xbee1707d6b44d4d52bfe19e41f8a828645437aab,@107,23.289,5.0,116.45,sell,19-02-2025 12:24,4497.338802,sell,1.600488,0x4c084231dd238512de31041e0b2a0c020144004df924c687acdbfc888e8fddd4,73349913719,True,0.040755,919000000000000.0,1740000000000.0,,,,,
0xbee1707d6b44d4d52bfe19e41f8a828645437aab,HYPE,20.855,1.0,20.86,sell,28-02-2025 05:02,-1401.9,open short,0.0,0x5d22252bf0981550e3c2041e993fb7015e00d0695ab0d023bee6692bafc43aa0,75628681971,True,0.006256,1040000000000000.0,1740000000000.0,,,,,
0xb1231a4a2dd02f2276fa3c5e2a2f3436e6bfed23,DOGE,0.25339,286.0,72.47,buy,21-02-2025 11:04,-323624.0,close short,1.54297,0x1c87017883e084d866ae041e2acf770201f600b83ea1042d83e1348e7ca6b258,73785508048,True,0.025364,1030000000000000.0,1740000000000.0,,,,,
0x72c6a4624e1dffa724e6d00d64ceae698af892a0,ADA,0.6245,7842.0,4897.33,sell,20-04-2025 13:44,7842.0,close long,-835.173,0xb791f3d3086efe3913dd0421e5397a019600611b7aa135e004447086373e2485,87589740713,False,0.470142,683000000000000.0,1750000000000.0,,,,,
0xbaaaf6571ab7d571043ff1e313a9609a10637864,HYPE,16.046,50.0,802.3,sell,07-03-2025 20:39,89734.91,close long,30.72,0xa67acabfc24d0cb5d05b041f1704590204f000525423d8cded7ec70825f7b658,77962266892,True,0.200575,56100000000000.0,1740000000000.0,2025-07-03 20:39:00,2025-07-03,,,20.0
0xbee1707d6b44d4d52bfe19e41f8a828645437aab,@107,25.22,2.86,72.13,sell,19-12-2024 11:12,25576.8941,sell,0.398286,0x0000000000000000000000000000000000000000000000000000000000000000,56529334243,False,0.003606,751000000000000.0,1730000000000.0,,,,,
0xbee1707d6b44d4d52bfe19e41f8a828645437aab,HYPE,14.957,249.83,3736.71,buy,07-03-2025 06:17,10210.84,open long,0.0,0xcaa365ad9c36f68ff74f041f0d27e302037c00dad7015015c89b3db69c6ade78,77798689302,True,1.121012,112000000000000.0,1740000000000.0,2025-07-03 06:17:00,2025-07-03,,,6.0
0x2c229d22b100a7beb69122eed721cee9b24011dd,TRUMP,16.367,95.0,1554.87,buy,13-02-2025 11:54,15878.7,open long,0.0,0x340887342ecb216d30d9041daa263f020374009db83989d960eb57ea5f3593e3,71939448387,True,0.544202,423000000000000.0,1740000000000.0,,,,,
0x47add9a56df66b524d5e2c1993a43cde53b6ed85,FARTCOIN,0.95,78.7,74.77,sell,14-01-2025 02:03,-6838.3,open short,0.0,0x35acd7abb3af2597f882041b63bd9602013c005f6d6bad1e7a048d42e1897466,62792874324,False,0.007176,318000000000000.0,1740000000000.0,,,,,
0x271b280974205ca63b716753467d5a371de622ab,SOL,138.57,279.69,38756.64,sell,20-04-2025 01:10,-8587.27,open short,0.0,0x127e777a883ef05b27ff0421dcf4d401da00a31c1abe8b6815dc919ea911176d,87519240533,False,1.860318,1050000000000000.0,1750000000000.0,,,,,
0x23e7a7f8d14b550961925fbfdaa92f5d195ba5bd,@107,17.172,34.32,589.34,sell,18-04-2025 04:48,3809.827728,sell,2.287633,0xadd6f8f12625bdefa9e90421bf60e50202d200954d911aea8a3a6a1f72ee5ebe,87248956685,True,0.20627,902000000000000.0,1740000000000.0,,,,,
0x8477e447846c758f5a675856001ea72298fd9cb5,TAO,553.85,0.4,221.54,sell,03-01-2025 23:50,0.0,open short,0.0,0x739bcc1cd5c0ede85daa041a92d21b02014a007dbc4a0a50dc7d273e57869912,60482955220,True,0.077539,1080000000000000.0,1740000000000.0,2025-03-01 23:50:00,2025-03-01,Extreme Fear,20.0,23.0
0x8477e447846c758f5a675856001ea72298fd9cb5,BTC,92973.0,0.00015,13.95,sell,23-04-2025 04:37,-1.70655,open short,0.0,0x3a77381d2f2e5c69c13004220f5c8b0201040046f625bce9bcb5967476fca024,88130556238,True,0.004881,156000000000000.0,1750000000000.0,,,,,
0xbee1707d6b44d4d52bfe19e41f8a828645437aab,HYPE,20.697,16.91,349.99,buy,27-02-2025 12:34,-12610.28,close short,0.711911,0x93c25d8069c05a17c63d041e8dba620201d5003fa202181daafa0f5485b6fa33,75444239690,True,0.104995,437000000000000.0,1740000000000.0,,,,,
0x23e7a7f8d14b550961925fbfdaa92f5d195ba5bd,HYPE,17.043,18.23,310.69,sell,18-04-2025 04:05,-525.0,open short,0.0,0xb3316ebfb93b6c848f920421bee51a020151004c76b1ecaeec7249eec139f6a6,87245123763,True,0.108742,916000000000000.0,1740000000000.0,,,,,
0x430f09841d65beb3f27765503d0f850b8bce7713,LAYER,2.4584,72.0,177.0,sell,26-04-2025 00:19,-95393.0,open short,0.0,0x9d79fb65b2e317a8ec4404223d50010203140087e499097de3cd4654b7dbcbe2,88924198848,False,0.0177,247000000000000.0,1750000000000.0,,,,,
0xbaaaf6571ab7d571043ff1e313a9609a10637864,HYPE,19.357,11.0,212.93,buy,25-02-2025 07:24,240849.41,open long,0.0,0xe5c26daf21dfebabe968041e692aff0201e400205dfdc74697d9e52f159fa7cd,74607648912,False,0.01022,1070000000000000.0,1740000000000.0,,,,,
0x47add9a56df66b524d5e2c1993a43cde53b6ed85,LINK,16.604,45.1,748.84,buy,03-02-2025 07:37,152.0,open long,0.0,0xf8daae9e3ec8c3729092041d07d9e00205b7009b1489b223fcab4e68a96707b3,68785721469,True,0.25161,604000000000000.0,1740000000000.0,2025-03-02 07:37:00,2025-03-02,Fear,26.0,7.0
0x8381e6d82f1affd39a336e143e081ef7620a3b7f,@107,24.586,2.0,49.17,buy,06-02-2025 20:30,1458.482593,buy,0.0,0x4521a6ebc587b56b1969041d410ded02029600b87cb95dfb83b5c385f16fddb3,70158371020,True,0.00059997,367000000000000.0,1740000000000.0,2025-06-02 20:30:00,2025-06-02,,,20.0
0xb899e522b5715391ae1d4f137653e7906c5e2115,BTC,76608.0,0.02035,1558.97,buy,07-04-2025 19:19,3.41667,open long,0.0,0x12982b5515d1ea9193440421156ac102035c00dbd797d24ecb29affe99834797,84658170176,True,0.467691,470000000000000.0,1740000000000.0,2025-07-04 19:19:00,2025-07-04,,,19.0
0xbaaaf6571ab7d571043ff1e313a9609a10637864,HYPE,16.17,494.65,7998.49,sell,07-03-2025 20:39,143515.83,close long,365.24956,0xa67acabfc24d0cb5d05b041f1704590204f000525423d8cded7ec70825f7b658,77962266892,True,1.999622,398000000000000.0,1740000000000.0,2025-07-03 20:39:00,2025-07-03,,,20.0
0x7f4f299f74eec87806a830e3caa9afa5f2b9db8f,ETH,1478.2,1.0,1478.2,buy,09-04-2025 19:14,-93.8323,close short,2.5,0xcc7d8426a636bc854ceb0421366c27020582000faf49be0ec4f6e689a8abe022,85305663820,False,0.14782,873000000000000.0,1740000000000.0,2025-09-04 19:14:00,2025-09-04,,,19.0
0x083384f897ee0f19899168e3b1bec365f52a9012,SOL,272.96,29.83,8142.4,sell,19-01-2025 14:26,-2676.67,open short,0.0,0xa56364134be8860cc39e041bd4499902027000c150394156d968cd3eae690a3b,64281140135,False,0.814239,1050000000000000.0,1740000000000.0,,,,,
0x2c229d22b100a7beb69122eed721cee9b24011dd,TRUMP,16.675,67.0,1117.23,sell,13-02-2025 13:27,368.7,close long,23.76959,0xce452ad914bb3a2b78b1041dab357c0201f90098ac40d68ce23d8bf984da01c0,71956270081,True,0.391028,278000000000000.0,1740000000000.0,,,,,
0xb899e522b5715391ae1d4f137653e7906c5e2115,SOL,136.74,2.0,273.48,sell,07-03-2025 06:32,8958.81,close long,0.216,0x903d57ee826fd011bdeb041f0d552e0203040050a31483fb391ee56e3ccad00a,77804115883,True,0.078762,686000000000000.0,1740000000000.0,2025-07-03 06:32:00,2025-07-03,,,6.0
0x4f93fead39b70a1824f981a54d4e55b278e9f760,ETH,3265.7,4.932,16106.43,sell,27-07-2024 02:54,23.1711,close long,128.52792,0xa82a7215c47630af2ca8040e2b747c012a0009e70f710c60e7b71967d13eb2b2,31287882862,True,5.637251,711000000000000.0,1720000000000.0,,,,,
0x430f09841d65beb3f27765503d0f850b8bce7713,LAYER,1.0608,7214.0,7652.61,buy,12-02-2025 06:01,79140.0,open long,0.0,0x0f233adda3f163903afe041d98089001fd00a3db01cfba04024674f89bddc011,71609183554,True,2.678413,728000000000000.0,1740000000000.0,2025-12-02 06:01:00,2025-12-02,,,6.0
0x4acb90e786d897ecffb614dc822eb231b4ffb9f4,HYPE,17.446,9.59,167.31,buy,25-02-2025 15:43,3397.25,open long,0.0,0x0370d364b11b608786b7041e6ed47a02074000facba0279ff064702c437d0754,74778150195,True,0.058557,894000000000000.0,1740000000000.0,,,,,
0xbee1707d6b44d4d52bfe19e41f8a828645437aab,HYPE,22.0,0.58,12.76,sell,24-02-2025 18:51,12255.25,close long,0.043442,0x9ab695bc38dbb1100b17041e60941d0201cc003647e5e5cf70cffb5511d43f99,74457223148,False,0.001276,1100000000000000.0,1740000000000.0,,,,,
0x39cef799f8b69da1995852eea189df24eb5cae3c,MELANIA,0.67689,151.9,102.82,sell,18-03-2025 00:11,-1342.0,open short,0.0,0xf9aa68ab5f8b99a49f8f041fbec3ce0205c8001d89dccc65bae11112936fae49,80402399709,False,0.010281,254000000000000.0,1740000000000.0,,,,,
0x39cef799f8b69da1995852eea189df24eb5cae3c,XRP,1.8894,292.0,551.7,buy,07-04-2025 20:26,-55346.0,close short,3.1828,0xa723c384196b3903582c042116298702063c00ba7f48ebc03596a2f376736d97,84694560326,False,0.05517,733000000000000.0,1740000000000.0,2025-07-04 20:26:00,2025-07-04,,,20.0
0x4f93fead39b70a1824f981a54d4e55b278e9f760,BTC,97074.0,0.07217,7005.83,buy,03-01-2025 03:35,0.48824,open long,0.0,0xb24e12ed3787cc426226041a8155c5010800335378805dd20366229023eb2b84,60306776417,True,2.101749,553000000000000.0,1740000000000.0,2025-03-01 03:35:00,2025-03-01,Extreme Fear,20.0,3.0
0xa0feb3725a9335f49874d7cd8eaad6be45b27416,VINE,0.15512,106.0,16.44,sell,06-02-2025 07:57,147645.0,close long,0.584484,0x72626b07d27b637027a3041d3896b10202f101042c57a81c89e3939972cc473a,70010979748,False,0.001644,627000000000000.0,1740000000000.0,2025-06-02 07:57:00,2025-06-02,,,7.0
0x8170715b3b381dffb7062c0298972d4727a0a63b,MELANIA,0.58,434.0,251.72,sell,04-04-2025 23:10,-677185.4,open short,0.0,0x8f33dba7aa33065ead550420e70ddb02034500e4f100ec2c78e4c18b8214749b,83936259912,False,0.024165,1050000000000000.0,1740000000000.0,2025-04-04 23:10:00,2025-04-04,Fear,28.0,23.0
0xbee1707d6b44d4d52bfe19e41f8a828645437aab,@107,17.48,348.26,6087.58,sell,12-12-2024 11:30,24720.86011,sell,1235.789491,0x0000000000000000000000000000000000000000000000000000000000000000,54841564661,False,0.0,607000000000000.0,1730000000000.0,2024-12-12 11:30:00,2024-12-12,Extreme Greed,83.0,11.0
0x8477e447846c758f5a675856001ea72298fd9cb5,SUI,3.689,206.0,759.93,sell,25-04-2025 15:05,-19132.3,open short,0.0,0x557afc21a464a32599b2042236f58a0204e800461fd63b2992b449b251ad268a,88797767451,True,0.265976,610000000000000.0,1750000000000.0,,,,,
0x8477e447846c758f5a675856001ea72298fd9cb5,BRETT,0.12044,1842.0,221.85,sell,09-01-2025 03:12,0.0,open short,0.0,0x576a05f01cc640ffc89c041afdbb88020185009844c5468522ef634248f484b0,61590182927,True,0.077647,607000000000000.0,1740000000000.0,2025-09-01 03:12:00,2025-09-01,,,3.0
0x8381e6d82f1affd39a336e143e081ef7620a3b7f,@107,24.028,39.63,952.23,buy,18-02-2025 20:39,1716.005868,buy,0.0,0x4fc2a3f0fd36d632cf6e041e0065930201d7003de18c9efe72d0812f0a962871,73181692578,True,0.01188896,118000000000000.0,1740000000000.0,,,,,
0xbd5fead7180a9c139fa51a103cb6a2ce86ddb5c3,ETH,2278.7,2.9,6608.23,buy,28-02-2025 03:25,-63.817,close short,1382.778,0xbcf41eb9ab1e4cb952ff041e9822dc020188008f652a9e60c3478feb4285af49,75615345364,True,2.31288,1060000000000000.0,1740000000000.0,,,,,
0xbaaaf6571ab7d571043ff1e313a9609a10637864,HYPE,11.18,44.68,499.52,buy,06-04-2025 18:58,50635.48,open long,0.0,0x0000000000000000000000000000000000000000000000000000000000000000,84245935204,False,0.024976,637000000000000.0,1740000000000.0,2025-06-04 18:58:00,2025-06-04,,,18.0
0x47add9a56df66b524d5e2c1993a43cde53b6ed85,LINK,17.5,1.1,19.25,buy,24-02-2025 01:43,136.8,open long,0.0,0x0000000000000000000000000000000000000000000000000000000000000000,74303322101,False,0.001848,273000000000000.0,1740000000000.0,,,,,
0x28736f43f1e871e6aa8b1148d38d4994275d72c4,GRIFFAIN,0.54932,91.0,49.99,buy,22-01-2025 15:15,-469.0,close short,2.089997,0x14ea8d7d790f213857d1041c1e31cb02019f000358c34bf7eea9c7d890c45053,65565025373,True,0.017495,672000000000000.0,1740000000000.0,,,,,
0x28736f43f1e871e6aa8b1148d38d4994275d72c4,PENDLE,3.8727,64.0,247.85,sell,26-01-2025 20:36,910.0,close long,4.958784,0x9b3abc47f30d2e414628041c8f7e67020112005a39cc9a904fc2b1e88c961387,66659995965,True,0.086748,18100000000000.0,1740000000000.0,,,,,
0x8477e447846c758f5a675856001ea72298fd9cb5,POPCAT,1.659,281.0,466.18,buy,31-10-2024 12:07,-281.0,close short,31.8935,0xfa656179e82a7002f8fc04159eac0101e3009c813697c1ade39f5f997d092830,44057161167,True,0.163162,450000000000000.0,1730000000000.0,,,,,
0x513b8629fe877bb581bf244e326a047b249c4ff1,BTC,83166.0,2.50424,208267.62,sell,12-04-2025 04:58,-11.34258,open short,0.0,0x6b313e029807198fba0f04215de94801ac001092edd85e7c214059795735b0c6,85920946401,True,62.480287,823000000000000.0,1740000000000.0,2025-12-04 04:58:00,2025-12-04,,,4.0
0x8477e447846c758f5a675856001ea72298fd9cb5,BTC,91125.0,0.00109,99.33,buy,23-04-2025 02:03,-1.8405,close short,-0.671222,0x0000000000000000000000000000000000000000000000000000000000000000,88098412217,False,0.009932,453000000000000.0,1750000000000.0,,,,,
0x7f4f299f74eec87806a830e3caa9afa5f2b9db8f,ETH,1533.0,0.36,551.88,sell,11-04-2025 07:02,30.5677,close long,6.606,0x751e8ad919106e8df12004214ef7b302056600233e190a851e1825dc551bcf3f,85634834151,False,0.055188,270000000000000.0,1740000000000.0,2025-11-04 07:02:00,2025-11-04,,,7.0
0x28736f43f1e871e6aa8b1148d38d4994275d72c4,@107,23.985,2.29,54.93,sell,15-12-2024 22:46,1373.503501,sell,42.132413,0x45847a94a6bba30d594f04194f2fee012b00e018d84bf15b21d776bdeed479b3,55607599453,True,0.019223,1090000000000000.0,1730000000000.0,,,,,
0xa0feb3725a9335f49874d7cd8eaad6be45b27416,ONDO,1.3374,65.0,86.93,buy,09-02-2025 04:15,4481.0,open long,0.0,0x9ffad61e275d6986cbcd041d66a3e401da00cd2785d84fbbf992f51ed62fd588,70822158300,False,0.008693,177000000000000.0,1740000000000.0,2025-09-02 04:15:00,2025-09-02,,,4.0
0x8477e447846c758f5a675856001ea72298fd9cb5,W,0.71832,914.7,657.05,sell,07-06-2024 18:30,-17819.0,open short,0.0,0x9dce11a95a92f886d2ff040ae60c8a0133004367adcb5fb149eb7739f8c55275,25243749623,True,0.229966,867000000000000.0,1720000000000.0,2024-07-06 18:30:00,2024-07-06,Fear,26.0,18.0
0x513b8629fe877bb581bf244e326a047b249c4ff1,BTC,94642.0,0.10566,9999.87,buy,26-04-2025 05:11,68.08814,open long,0.0,0xf7ff25309355a297ff1804224099eb0201f700105e1fe96b2f282a718023328a,88964304053,True,2.29997,565000000000000.0,1750000000000.0,,,,,
0x23e7a7f8d14b550961925fbfdaa92f5d195ba5bd,TAO,357.0,7.0,2499.0,sell,25-04-2025 02:12,64.494,close long,-19.026,0x7598760d21fa6fb08a3804222e74bc01f900f4c5cb6cfd966703ffcdb56b4fc8,88675423567,False,0.2499,334000000000000.0,1750000000000.0,,,,,
0xbee1707d6b44d4d52bfe19e41f8a828645437aab,@107,31.3,271.57,8500.14,sell,21-12-2024 07:50,25860.08296,sell,628.253634,0x7d8831c093dc5b4509380419b8ea26019a00f82b97c305490a87da12cb02330b,57136834324,False,0.425007,314000000000000.0,1730000000000.0,,,,,
0x28736f43f1e871e6aa8b1148d38d4994275d72c4,DOGE,0.41524,4075.0,1692.1,buy,25-11-2024 21:29,3202.0,open long,0.0,0x493fe8ee0077c8936b7b0417afb5bd020105009d14cd019f1fc48740dcd297a4,50194472516,True,0.592236,995000000000000.0,1730000000000.0,,,,,
0x513b8629fe877bb581bf244e326a047b249c4ff1,SOL,146.25,123.83,18110.14,buy,30-04-2025 18:05,31483.88,open long,0.0,0xa8d280f266db6659edae04228a261002017b0094d2f7a8e63c14429497ac5956,89964513329,True,4.165331,1020000000000000.0,1750000000000.0,,,,,
0xa0feb3725a9335f49874d7cd8eaad6be45b27416,HYPE,24.69,293.75,7252.69,sell,16-12-2024 09:15,694.75,close long,216.84625,0xcbe7726a785b5554bc5504195843580201f9006b1b897fb7d57d3f74c88a43d5,55697776170,False,0.362634,1110000000000000.0,1730000000000.0,,,,,
0xbaaaf6571ab7d571043ff1e313a9609a10637864,HYPE,13.606,255.82,3480.69,buy,10-03-2025 23:06,31339.05,open long,0.0,0x3f7a1a49c804b353ef90041f4a405802066e003c609a34f0d4758ea061cb10f0,78285868828,False,0.0,893000000000000.0,1740000000000.0,2025-10-03 23:06:00,2025-10-03,,,23.0
0xa0feb3725a9335f49874d7cd8eaad6be45b27416,BTC,97644.0,0.00015,14.65,buy,13-02-2025 02:47,0.01331,open long,0.0,0x5558df41025c861bc501041da46e4a02015800c96acb09d0f6c2550c2eb91a1a,71851719271,False,0.000732,968000000000000.0,1740000000000.0,,,,,
0xa0feb3725a9335f49874d7cd8eaad6be45b27416,HYPE,26.638,1.94,51.68,sell,16-12-2024 22:36,475.46,close long,0.388776,0x0000000000000000000000000000000000000000000000000000000000000000,55832408759,False,0.002583,459000000000000.0,1730000000000.0,,,,,
0xbee1707d6b44d4d52bfe19e41f8a828645437aab,HYPE,12.853,11.03,141.77,sell,29-03-2025 18:40,6467.5,close long,2.675878,0xfd88b4ba0643a544b53204208099ef0201d100a16e34c33a7916112c8d0e910b,82511992238,True,0.04253,283000000000000.0,1740000000000.0,,,,,
0xbaaaf6571ab7d571043ff1e313a9609a10637864,HYPE,19.967,24.86,496.38,sell,26-02-2025 01:42,91040.12,close long,3.286492,0x89b1e40536f6226572ef041e75a8980157002039c8ae1d9f455a3be415beef7e,74784409723,False,0.023825,5940000000000.0,1740000000000.0,,,,,
0x8170715b3b381dffb7062c0298972d4727a0a63b,MELANIA,0.51503,6040.1,3110.83,buy,23-04-2025 22:00,-1835319.9,close short,247.04009,0x0bbc8555359b3124438504221b43ad0202d00017c1c6b393b463e499f542cd98,88366588318,True,1.045239,977000000000000.0,1750000000000.0,,,,,
0xbee1707d6b44d4d52bfe19e41f8a828645437aab,HYPE,14.071,39.98,562.56,buy,26-03-2025 19:57,-8489.29,close short,-8.763616,0x52be4079e25b6d6d587a04204fd8da02054600c0e03f96b2fbd5d4de3a201654,81927850528,True,0.168767,1050000000000000.0,1740000000000.0,,,,,
0xbaaaf6571ab7d571043ff1e313a9609a10637864,HYPE,12.871,247.29,3182.87,sell,14-03-2025 08:18,139836.75,close long,23.715111,0xf76cbbe8c389ba41d688041f82a4c90201190062409a113401a7487997d69444,79696873978,False,0.0,575000000000000.0,1740000000000.0,,,,,
0x23e7a7f8d14b550961925fbfdaa92f5d195ba5bd,TAO,363.0,23.211,8425.59,sell,25-04-2025 06:39,-134.413,open short,0.0,0xe9202f0b251581046ff2042231722d0205c50018496b248daf853f02d2715d1a,88711262073,False,0.842559,193000000000000.0,1750000000000.0,,,,,
0xa0feb3725a9335f49874d7cd8eaad6be45b27416,GRIFFAIN,0.062696,13861.0,869.03,sell,03-03-2025 00:32,26259.0,close long,6.23745,0x20f45500a9d19831d4ba041ec7b4f0020453008fb3a1bbd7c5a39c58d0cab8d0,76415273494,False,0.043451,307000000000000.0,1740000000000.0,2025-03-03 00:32:00,2025-03-03,Fear,33.0,0.0
0x47add9a56df66b524d5e2c1993a43cde53b6ed85,@107,29.317,10.6,310.76,sell,23-12-2024 08:56,4044.11947,sell,56.975926,0xa6ba556010e0a5e972350419d666f30201ad0051ac6f32177a3bdfb30476bd36,57920918279,True,0.104415,156000000000000.0,1730000000000.0,,,,,
0x7f4f299f74eec87806a830e3caa9afa5f2b9db8f,ETH,1478.0,0.36,532.08,sell,09-04-2025 05:43,-1.5942,open short,0.0,0xcccdf0c3f9736067b97604212d1c4502050600a8545f4125676e193a24f18bef,85114585006,False,0.053208,1060000000000000.0,1740000000000.0,2025-09-04 05:43:00,2025-09-04,,,5.0
0xbd5fead7180a9c139fa51a103cb6a2ce86ddb5c3,ENA,0.35732,958.0,342.31,sell,07-03-2025 05:56,-399999.0,open short,0.0,0xaf48fb5e9bad10ededd3041f0cec0102048400fae6c041fd93a8f75834afca65,77790164574,True,0.102693,1080000000000000.0,1740000000000.0,2025-07-03 05:56:00,2025-07-03,,,5.0
0x8170715b3b381dffb7062c0298972d4727a0a63b,TRUMP,7.96,106.8,850.13,sell,11-04-2025 06:49,-26453.9,open short,0.0,0x5eefbdb1c64d7e4f599904214ed37601f7003dc24e016914b7f144ea694624a7,85662193135,False,0.081611,163000000000000.0,1740000000000.0,2025-11-04 06:49:00,2025-11-04,,,6.0
0x4f93fead39b70a1824f981a54d4e55b278e9f760,ETH,3373.5,1.4834,5004.25,sell,27-06-2024 13:59,-20.5742,open short,0.0,0xd2f9442df80cc9a78244040c690884011f000888bcb9e0dca8a2b103275f43a2,27671073380,True,1.751487,98500000000000.0,1720000000000.0,,,,,
0xbee1707d6b44d4d52bfe19e41f8a828645437aab,HYPE,14.502,3.0,43.51,sell,10-03-2025 04:47,11850.4,close long,0.2223,0x74549d4ebeb8838e71ef041f3d8cb10201e3005cced48b1428334effe0084b8e,78514892145,True,0.013051,993000000000000.0,1740000000000.0,2025-10-03 04:47:00,2025-10-03,,,4.0
0x72c6a4624e1dffa724e6d00d64ceae698af892a0,HYPE,28.45,2.15,61.17,sell,27-12-2024 18:28,-32027.07,open short,0.0,0x0000000000000000000000000000000000000000000000000000000000000000,59003206370,False,0.005871,34100000000000.0,1740000000000.0,,,,,
0x75f7eeb85dc639d5e99c78f95393aa9a5f1170d4,kBONK,0.033,291416.0,9616.73,sell,05-03-2024 10:20,538116.0,close long,597.985632,0xd46abeba217db6d788990407e65a8702015d00347b90b976bfdb4e91666e94d8,12074391377,False,-0.192334,1060000000000000.0,1710000000000.0,2024-05-03 10:20:00,2024-05-03,Neutral,48.0,10.0
0x430f09841d65beb3f27765503d0f850b8bce7713,ZRO,5.24,115.3,604.17,sell,23-07-2024 06:09,40484.6,close long,216.734022,0x50bdef15c6404d403dd2040df2530f01330071638da91e8a04772fcbb190559f,30774951211,False,0.060417,1090000000000000.0,1720000000000.0,,,,,
0x8477e447846c758f5a675856001ea72298fd9cb5,APE,1.295,607.2,786.32,sell,23-11-2024 19:55,-8712.5,open short,0.0,0x1ab827c5ffafa00bc007041784b4cb01c900f8382b5c025625cbcf8304b98c0b,49545365921,True,0.275213,380000000000000.0,1730000000000.0,,,,,
0xb1231a4a2dd02f2276fa3c5e2a2f3436e6bfed23,INJ,38.0,26.1,991.8,buy,19-03-2024 00:28,78.9,open long,0.0,0x2d4b6f0144716d827326040817ca4d01e300f2b37faa7c0a2fbd888166d5ceb2,13991599007,False,0.09918,960000000000000.0,1710000000000.0,,,,,
0x23e7a7f8d14b550961925fbfdaa92f5d195ba5bd,HYPE,18.515,25.0,462.88,sell,24-04-2025 02:34,7975.0,close long,3.5225,0x11e8ee2bdd2068d9b56004221e60a7020167003b53ca34df0e6be73932bf5a58,88419804235,True,0.162006,815000000000000.0,1750000000000.0,,,,,
0xa0feb3725a9335f49874d7cd8eaad6be45b27416,HYPE,27.637,43.67,1206.91,sell,01-02-2025 21:24,1451.77,close long,43.945121,0x5ac71ada44f86e4b7aea041cf0e27f020134000d527d9406374f26f51a17af3b,68250657161,False,0.12069,374000000000000.0,1740000000000.0,2025-01-02 21:24:00,2025-01-02,Greed,70.0,21.0
0xbee1707d6b44d4d52bfe19e41f8a828645437aab,HYPE,14.034,1.38,19.37,buy,21-03-2025 19:36,5664.76,open long,0.0,0xfe8d914431a275b50170041ffd7a1c02018c00729e9ff08abc0573608bb870b1,81118181799,True,0.00581,839000000000000.0,1740000000000.0,,,,,
0xbee1707d6b44d4d52bfe19e41f8a828645437aab,@107,17.56,178.63,3136.74,sell,12-12-2024 12:13,20297.82773,sell,499.489958,0xfe82d77da7759d219d7f041907a6b202017300304a7d31dbaf6ad7fd219e4c31,54849409254,False,0.0,530000000000000.0,1730000000000.0,2024-12-12 12:13:00,2024-12-12,Extreme Greed,83.0,12.0
0xbaaaf6571ab7d571043ff1e313a9609a10637864,HYPE,12.822,15.19,194.77,sell,14-03-2025 09:45,88509.09,close long,0.712411,0x0cc203d88dfe97d4c97c041f83a03202020e00f0e741ed0027b0ed1104d56f87,79743319117,False,0.0,638000000000000.0,1740000000000.0,,,,,
0xb899e522b5715391ae1d4f137653e7906c5e2115,SOL,144.29,1.54,222.21,sell,07-03-2025 01:44,8779.65,close long,0.300916,0x32be098670300332d38e041f0a138901fa0095969ec36be4a97a2f2a044734aa,77745579233,False,0.010665,731000000000000.0,1740000000000.0,2025-07-03 01:44:00,2025-07-03,,,1.0
0x8477e447846c758f5a675856001ea72298fd9cb5,APE,1.3801,11.4,15.73,sell,03-01-2025 23:02,-2460.3,open short,0.0,0xe2411215662ce97086c5041a92236902018f00b33695a7e7d0e39bf9e0878fba,60475810689,True,0.005506,842000000000000.0,1740000000000.0,2025-03-01 23:02:00,2025-03-01,Extreme Fear,20.0,23.0
0xbd5fead7180a9c139fa51a103cb6a2ce86ddb5c3,ETH,1794.9,14.6212,26243.59,buy,01-05-2025 01:34,-339.4929,close short,-2939.446048,0x3115380ea9539b24a74504228f4dd302011d00e5254aa285a148e6f8716f5c79,90065472038,True,9.185257,191000000000000.0,1750000000000.0,2025-01-05 01:34:00,2025-01-05,Greed,72.0,1.0
0x513b8629fe877bb581bf244e326a047b249c4ff1,BTC,94530.0,0.85261,80597.22,buy,29-04-2025 00:35,10.96316,open long,0.0,0x4adb3b7d683a90a921b104226e2bd002047400d176f44cf159179fd4e4203fed,89603791247,True,18.537361,700000000000000.0,1750000000000.0,,,,,
0x8477e447846c758f5a675856001ea72298fd9cb5,kBONK,0.015675,35406.0,554.99,buy,23-04-2025 19:28,-1599020.0,close short,-11.719386,0x073626523b6066841af60422198b1802037f008f9a1451575f1c9907876d0b06,88284780327,False,0.055498,1100000000000000.0,1750000000000.0,,,,,
0x75f7eeb85dc639d5e99c78f95393aa9a5f1170d4,ZEREBRO,0.035658,5356.0,190.98,sell,23-02-2025 09:37,5356.0,close long,1.837108,0x29ff4d92bdb0856a2f34041e4a1aa00155003b105f894cd51772a59f85655afe,74203999846,False,0.018334,240000000000000.0,1740000000000.0,,,,,
0xbee1707d6b44d4d52bfe19e41f8a828645437aab,HYPE,14.283,35.01,500.05,buy,10-03-2025 20:22,19182.72,open long,0.0,0x63994886320f47eca39d041f4856960203ba0082ac88ec863f24a71dc8deba14,78713556252,True,0.150014,580000000000000.0,1740000000000.0,2025-10-03 20:22:00,2025-10-03,,,20.0
0x8477e447846c758f5a675856001ea72298fd9cb5,kPEPE,0.008516,260736.0,2220.43,sell,22-04-2025 20:36,-11492616.0,open short,0.0,0xf7090a11814d30556fec042209e60c0201ff000a6f7487ff8dd1b2e1d8500ed3,88039603621,True,0.777149,702000000000000.0,1750000000000.0,,,,,
0x8477e447846c758f5a675856001ea72298fd9cb5,AAVE,139.35,1.38,192.3,buy,21-08-2024 13:15,-260.79,close short,0.791568,0x4e0fe6c39838d28a2131040fe8e888018800011dc2e09097e8db9e7138e27fb4,34939567958,True,0.067306,441000000000000.0,1720000000000.0,,,,,
0xa0feb3725a9335f49874d7cd8eaad6be45b27416,BTC,97749.0,0.013,1270.74,sell,10-02-2025 19:15,0.65174,close long,8.2485,0x24d0f298102c8ef8e891041d80e2f702015c00e1d4458285f9cf6269586118c6,71232689525,False,0.063536,1020000000000000.0,1740000000000.0,2025-10-02 19:15:00,2025-10-02,,,19.0
0x8170715b3b381dffb7062c0298972d4727a0a63b,MELANIA,1.5156,329.5,499.39,sell,09-02-2025 09:17,-88191.0,open short,0.0,0xaaa63e1ea273d874161f041d69fb8602028700f83c2fa42b8170107c17468134,70868314222,False,0.047941,609000000000000.0,1740000000000.0,2025-09-02 09:17:00,2025-09-02,,,9.0
0x39cef799f8b69da1995852eea189df24eb5cae3c,ADA,0.62165,1610.0,1000.86,buy,09-04-2025 23:08,-133245.0,close short,-101.85504,0x7b160c37719ff00ef3a40421391aca02029700f97d3d4e19dc5ad4eb8efc93b5,85372307668,False,0.050042,434000000000000.0,1740000000000.0,2025-09-04 23:08:00,2025-09-04,,,23.0
0x083384f897ee0f19899168e3b1bec365f52a9012,SOL,271.0,77.27,20940.17,buy,19-01-2025 14:06,-2873.68,close short,-11.04961,0x68faafbb1b97abf13c60041bd3fe8f0201e0005c787046f520e2aba540585bfa,64273466050,False,2.094017,169000000000000.0,1740000000000.0,,,,,
0x28736f43f1e871e6aa8b1148d38d4994275d72c4,PURR/USDC,0.26899,325.0,87.42,buy,07-01-2025 22:39,44471.74262,buy,0.0,0xbdd408798f8a8a2afb48041ae505f901eb00adfc75a980a150bd14222a96c47b,61222087190,True,0.11374,74300000000000.0,1740000000000.0,2025-07-01 22:39:00,2025-07-01,,,22.0
0x083384f897ee0f19899168e3b1bec365f52a9012,ETH,3346.3,0.3,1003.89,sell,19-01-2025 19:43,-5.942,open short,0.0,0xf56387e0db7c74d190a7041bd8dc4902034900ff6cd1abfe500e5ed424c9bdda,64385173814,False,0.100389,900000000000000.0,1740000000000.0,,,,,
0x75f7eeb85dc639d5e99c78f95393aa9a5f1170d4,WLD,6.586,41.0,270.03,sell,19-02-2024 09:52,2307.1,close long,10.48083,0x05ea9cfe912b62117bcb0407af310e018600adce819f9b9c83bd3acfe553c904,10105946920,False,-0.0054,524000000000000.0,1710000000000.0,,,,,
0xbaaaf6571ab7d571043ff1e313a9609a10637864,HYPE,13.31,1.68,22.36,sell,29-03-2025 04:22,57963.23,close long,0.001848,0x21d1327133f510612e8b042076c36302017000a56fff7c3bf5d13258165e4514,82393596028,False,0.002236,647000000000000.0,1740000000000.0,,,,,
0x47add9a56df66b524d5e2c1993a43cde53b6ed85,SUI,2.7382,183.5,502.46,buy,03-02-2025 07:30,5572.1,open long,0.0,0x3e04542d07603ee834de041d07c94d02013d00b006a4917bdd29ebc6a51725ad,68782714811,True,0.168825,529000000000000.0,1740000000000.0,2025-03-02 07:30:00,2025-03-02,Fear,26.0,7.0
0x23e7a7f8d14b550961925fbfdaa92f5d195ba5bd,PURR/USDC,0.19506,1007.0,196.43,buy,18-01-2025 16:22,1246.56358,buy,0.0,0x8c024861f6fe082c8cb1041bc17bc0020106006229cbc954d11a3e7a722a9ee3,63984745334,True,0.35244,716000000000000.0,1740000000000.0,,,,,
0x513b8629fe877bb581bf244e326a047b249c4ff1,BTC,83272.0,0.013,1082.54,sell,12-04-2025 05:50,-63.37532,open short,0.0,0xc1465588a341830dce0b04215e7d0202012f005a447bc0c373f260bf5a2d386d,85926275185,True,0.270634,695000000000000.0,1740000000000.0,2025-12-04 05:50:00,2025-12-04,,,5.0
0x8477e447846c758f5a675856001ea72298fd9cb5,W,0.71355,921.4,657.46,buy,07-06-2024 18:32,-14731.3,close short,0.36856,0x0cc5eba046ab1413624c040ae61298014e009380c46c48004406142dc1497256,25243976088,True,0.230112,13300000000000.0,1720000000000.0,2024-07-06 18:32:00,2024-07-06,Fear,26.0,18.0
0xa0feb3725a9335f49874d7cd8eaad6be45b27416,HYPE,18.17,5.92,107.57,sell,13-12-2024 22:59,780.42,close long,2.81496,0xb6d6c6953f66da336fb7041925cf4c0201260003a977d939493a21eacdc18db9,55227768712,False,0.005378,256000000000000.0,1730000000000.0,,,,,
0x4f93fead39b70a1824f981a54d4e55b278e9f760,BTC,103311.0,0.05426,5605.65,sell,21-01-2025 05:10,1.44495,close long,30.320488,0x90a71aa887ad3d182529041bf7a8df018200c5b59a4daa8e4b40989d751807eb,65057633123,True,1.401413,266000000000000.0,1740000000000.0,,,,,
0xb1231a4a2dd02f2276fa3c5e2a2f3436e6bfed23,ETH,2323.0,0.75,1742.25,sell,06-02-2024 08:19,25.6143,close long,-2.2425,0x4fe646820448abe807d504077d8b25018400a779f91c42d844a3c29fa36fcaf9,8914886667,True,0.435562,25900000000000.0,1710000000000.0,2024-06-02 08:19:00,2024-06-02,Greed,73.0,8.0
0xa0feb3725a9335f49874d7cd8eaad6be45b27416,HYPE,18.039,1.99,35.9,sell,13-12-2024 22:56,2610.25,close long,0.685555,0x0000000000000000000000000000000000000000000000000000000000000000,55227768692,False,0.001794,224000000000000.0,1730000000000.0,,,,,
0x4f93fead39b70a1824f981a54d4e55b278e9f760,ETH,3383.2,0.2955,999.74,buy,18-07-2024 05:45,9.3389,open long,0.0,0xbc95a526e8f1031308d5040da8a105015a0051e9c26766fb248e62120148a868,30221721936,True,0.349907,995000000000000.0,1720000000000.0,,,,,
0xb1231a4a2dd02f2276fa3c5e2a2f3436e6bfed23,HYPE,24.226,20.63,499.78,sell,30-01-2025 01:59,-1071.51,open short,0.0,0xf7b6448f62cac2dc2557041cc3a44801de00082483f3ca6e6c14774e4a0d375a,67575867547,True,0.174923,943000000000000.0,1740000000000.0,,,,,
0xa0feb3725a9335f49874d7cd8eaad6be45b27416,HYPE,17.999,0.01,0.18,sell,13-12-2024 20:59,0.01,close long,0.004324,0x8c30a314597ea9ad198c041924153a01b70034a7a5b640c8182cf82ae0efc59d,55213337845,True,5.3e-05,897000000000000.0,1730000000000.0,,,,,
0xa0feb3725a9335f49874d7cd8eaad6be45b27416,BTC,99011.0,0.011,1089.12,sell,05-02-2025 01:23,4.74871,close long,-18.6516,0xa9b741c8500a67cdad86041d2410e00205ad005047bbb3b06620f4150115c2a8,69564759626,False,0.108912,884000000000000.0,1740000000000.0,2025-05-02 01:23:00,2025-05-02,Greed,67.0,1.0
0x513b8629fe877bb581bf244e326a047b249c4ff1,SOL,147.06,1.12,164.71,buy,30-04-2025 02:47,19375.89,open long,0.0,0xb61ff9bf5529d5dd3e4d04227fe851020241005c43ac9ca781b2237c2115450d,89838826573,True,0.037882,209000000000000.0,1750000000000.0,,,,,
0x2c229d22b100a7beb69122eed721cee9b24011dd,SOL,176.7,11.32,2000.24,sell,31-10-2024 02:32,84.69,close long,-1.51122,0x6cf1d3dc9855030630da0415963da80172000d5392c2b918decfb5382fee524a,44013871644,True,0.700085,897000000000000.0,1730000000000.0,,,,,
0x8170715b3b381dffb7062c0298972d4727a0a63b,BTC,82386.0,0.012,988.63,buy,03-04-2025 04:38,1.69858,open long,0.0,0x2076f859c6d7277d4c820420c996d202019200a171c2a5bdc9b56d01808b4546,83515132840,False,0.094908,842000000000000.0,1740000000000.0,2025-03-04 04:38:00,2025-03-04,Extreme Fear,15.0,4.0
0x513b8629fe877bb581bf244e326a047b249c4ff1,BTC,84711.0,0.03448,2920.84,buy,16-04-2025 22:06,-7.20753,close short,0.303424,0xc314d8f78109038dc0c00421aaa35e02014f00b0124c9183a3f5222c58d984a3,86979218888,True,0.671792,805000000000000.0,1740000000000.0,,,,,
0x23e7a7f8d14b550961925fbfdaa92f5d195ba5bd,@107,19.7,172.94,3406.92,buy,28-02-2025 02:02,81.11400385,buy,0.0,0x78d70d183677ed3ba4e0041e97295f020157003bb552b444e26175ad478ef0be,75596140396,True,0.06052898,155000000000000.0,1740000000000.0,,,,,
0xbee1707d6b44d4d52bfe19e41f8a828645437aab,@107,20.448,5.0,102.24,buy,27-02-2025 19:04,202.6714249,buy,0.0,0x9d028960ad53a3bda9a7041e923e4701f700c2f2d37511105fc017e23fdda9c5,75505305959,True,0.00149995,161000000000000.0,1740000000000.0,,,,,
0xb1231a4a2dd02f2276fa3c5e2a2f3436e6bfed23,INJ,33.7,295.1,9944.87,sell,05-04-2024 01:04,305.9,close long,298.051,0xdc5cf2a97645dd04b0f70408563e3e0201e5008e29b01b6722905205db603582,16724185149,True,3.480704,1100000000000000.0,1710000000000.0,2024-05-04 01:04:00,2024-05-04,Greed,67.0,1.0
0xbaaaf6571ab7d571043ff1e313a9609a10637864,HYPE,13.177,1.97,25.96,buy,11-03-2025 06:05,153851.61,open long,0.0,0x0000000000000000000000000000000000000000000000000000000000000000,78808032407,False,0.0,668000000000000.0,1740000000000.0,2025-11-03 06:05:00,2025-11-03,,,6.0
0x28736f43f1e871e6aa8b1148d38d4994275d72c4,SOL,242.43,1.0,242.43,sell,18-11-2024 22:53,21.0,close long,1.9516,0x647516c2aae726f42c0204171f3e9e02015c007e668d954704947cf31670dfec,48318952639,True,0.08485,363000000000000.0,1730000000000.0,,,,,
0xbaaaf6571ab7d571043ff1e313a9609a10637864,HYPE,12.531,274.02,3433.74,sell,03-04-2025 08:08,27344.17,close long,8.467218,0xf6909ca34c7e0d8604270420cc0bb8016d00464c578ab384e0e904c76bff5d73,83555980003,True,1.030123,783000000000000.0,1740000000000.0,2025-03-04 08:08:00,2025-03-04,Extreme Fear,15.0,8.0
0xbee1707d6b44d4d52bfe19e41f8a828645437aab,@107,24.7,174.71,4315.34,sell,18-02-2025 19:17,4843.155038,sell,20.136647,0xc9bb6c75c5865ed3d368041dff754b0201d400284870a525a2d6ca591f5fa01f,73126595980,False,0.431533,802000000000000.0,1740000000000.0,,,,,
0x513b8629fe877bb581bf244e326a047b249c4ff1,BTC,94810.0,0.0106,1004.99,sell,29-04-2025 01:09,57.32803,close long,2.88956,0x023113f91d3f3bb95de504226e8eec0203de000260cc9ef1089ee28fac539b7a,89609661670,False,0.0,1030000000000000.0,1750000000000.0,,,,,
0xbee1707d6b44d4d52bfe19e41f8a828645437aab,@107,19.8,1.5,29.7,buy,28-02-2025 01:42,665.0889876,buy,0.0,0x40d1f38a443db7d87041041e96ebbb0205f500d1cb3adda86bf8e287d79b488f,75455392154,False,7.5e-05,115000000000000.0,1740000000000.0,,,,,
0x2c229d22b100a7beb69122eed721cee9b24011dd,AIXBT,0.45808,65281.0,29903.92,buy,10-01-2025 14:25,210956.0,open long,0.0,0xce0e2a30988ddf1a2db8041b1c34210201fc00a10b99f390dab684759b1eb735,62009748582,True,10.466372,144000000000000.0,1740000000000.0,2025-10-01 14:25:00,2025-10-01,,,14.0
0xbee1707d6b44d4d52bfe19e41f8a828645437aab,HYPE,18.874,26.0,490.72,buy,29-04-2025 17:20,-4830.87,close short,2.0098,0xabe0aea648a75cef650e0422797cec016900d0465fd1f197595f3aba573b3efc,89749755332,True,0.147217,603000000000000.0,1750000000000.0,,,,,
0x28736f43f1e871e6aa8b1148d38d4994275d72c4,PENDLE,3.1003,91.0,282.13,buy,05-04-2025 19:20,1685.0,open long,0.0,0x7e37153fa7fd8de28d0c0420f4c1d40202c8004be3dce6c8af8d920ae9ed6457,84121042012,True,0.098744,926000000000000.0,1740000000000.0,2025-05-04 19:20:00,2025-05-04,,,19.0
0xa0feb3725a9335f49874d7cd8eaad6be45b27416,BTC,100640.0,0.33288,33501.04,buy,05-02-2025 01:01,0.23278,open long,0.0,0x1f09dac09c6104d88030041d23d0070202690052f39ef18bbdee6fa8add95386,69556211852,False,3.350104,953000000000000.0,1740000000000.0,2025-05-02 01:01:00,2025-05-02,Greed,67.0,1.0
0x8477e447846c758f5a675856001ea72298fd9cb5,ETH,3381.7,0.2954,998.95,sell,22-11-2024 00:29,-24.8392,open short,0.0,0x336a79ffcbd20e8dde2e04175eec160201ee00f48d62535a8c30f3d9d50b75cf,49091892538,True,0.349633,819000000000000.0,1730000000000.0,,,,,
0x513b8629fe877bb581bf244e326a047b249c4ff1,BTC,93722.0,0.00021,19.68,sell,24-04-2025 01:53,46.15281,close long,0.089313,0x07ec544a491edc4d712e04221debb90201cf000a99607ef7e27506641795fe04,88414305860,True,0.004526,205000000000000.0,1750000000000.0,,,,,
0xbee1707d6b44d4d52bfe19e41f8a828645437aab,HYPE,19.757,6.73,132.96,sell,25-02-2025 21:22,-2212.68,open short,0.0,0xba12392c550f65b0cfec041e72af570201ac00d0bf6e5c48b0fee3aa73207806,74885645740,True,0.046537,562000000000000.0,1740000000000.0,,,,,
0x8477e447846c758f5a675856001ea72298fd9cb5,TNSR,0.47531,607.4,288.7,buy,31-01-2025 18:48,-43195.5,close short,1.111542,0x52e9f98930891294984b041cdf00560201e8002fca8d11f26dc593079623a892,67977157806,True,0.101046,224000000000000.0,1740000000000.0,,,,,
0xb1231a4a2dd02f2276fa3c5e2a2f3436e6bfed23,@107,17.831,136.71,2437.68,sell,12-12-2024 15:59,69272.27,sell,2437.674643,0x6ba29441b1136181e3f204190aea29017900b8c6fd03683f8106ca2625c98364,54883805127,True,0.853186,463000000000000.0,1730000000000.0,2024-12-12 15:59:00,2024-12-12,Extreme Greed,83.0,15.0
0x8477e447846c758f5a675856001ea72298fd9cb5,WLD,1.0325,279.6,288.69,buy,01-05-2025 12:13,-85753.7,close short,-16.69212,0x6d9cdb0fd78454175c140422969312020438007206bb9992242283d26c3242bb,90142215802,False,0.028868,23200000000000.0,1750000000000.0,2025-01-05 12:13:00,2025-01-05,Greed,72.0,12.0
0x75f7eeb85dc639d5e99c78f95393aa9a5f1170d4,JELLY,0.016,100000.0,1600.0,buy,15-03-2025 23:03,-600954.0,close short,-68.0,0xe4902ee7421e888ed7fb041f9d2bbd01eb00a9a130c10be3630f8dc9fdc02622,80024142309,True,0.5376,302000000000000.0,1740000000000.0,,,,,
0xa0feb3725a9335f49874d7cd8eaad6be45b27416,ONDO,1.3852,592.0,820.04,sell,13-02-2025 02:46,15867.0,close long,0.651792,0x2322e07f13dd180ac946041da46cbc00006bd7503a9f8870c8e7907f3b7c1365,71836693519,True,0.246011,1110000000000000.0,1740000000000.0,,,,,
0x8477e447846c758f5a675856001ea72298fd9cb5,kBONK,0.03686,5779.0,213.01,buy,23-05-2024 17:41,-460227.0,close short,1.924407,0x2ff8c674d9c834a8392f0409ba42ac015800a6f86ec97450ae0347be0b8281b4,23560602832,False,0.021301,836000000000000.0,1720000000000.0,,,,,
0xbee1707d6b44d4d52bfe19e41f8a828645437aab,HYPE,11.73,136.4,1599.97,sell,03-04-2025 15:30,14144.11,close long,-105.8464,0x860a435a5314677683050420d11da902036b00126db51a792d93cee90e5a6f36,83615399463,True,0.479991,469000000000000.0,1740000000000.0,2025-03-04 15:30:00,2025-03-04,Extreme Fear,15.0,15.0
0x92f17e8d81a944691c10e753af1b1baae1a2cd0d,FARTCOIN,1.1778,4369.9,5146.87,buy,23-04-2025 03:30,1069450.1,open long,0.0,0x03a8b9ff0b84142fa1b104220e9715020b250036e19e6790c939e7621b393ed8,88114148455,True,1.801403,896000000000000.0,1750000000000.0,,,,,
0xb1231a4a2dd02f2276fa3c5e2a2f3436e6bfed23,HYPE,16.644,47.67,793.42,sell,24-03-2025 12:58,-243.26,open short,0.0,0x1d2d135e7ba4a303e8a2042029eeff01df0044e8f929f9ca811d278edc02fe7f,81497446651,True,0.277696,1070000000000000.0,1740000000000.0,,,,,
0xaf40fdc468c30116bd3307bcbf4a451a7ebf1deb,BTC,86350.0,0.01,863.5,buy,28-03-2025 10:10,0.4136,open long,0.0,0xd0d490d86c27608a7ac304206a28a1020764006f55becd929a3f375d6778fedd,82174735929,False,0.08635,1030000000000000.0,1740000000000.0,,,,,
0xbd5fead7180a9c139fa51a103cb6a2ce86ddb5c3,BTC,85500.0,0.00018,15.39,sell,13-04-2025 06:21,20.48161,close long,0.61803,0x0000000000000000000000000000000000000000000000000000000000000000,86128931560,False,0.000769,524000000000000.0,1740000000000.0,,,,,
0x271b280974205ca63b716753467d5a371de622ab,SOL,147.16,7.69,1131.66,buy,23-04-2025 03:19,-4234.29,close short,-19.347271,0xea8b615241af2e44ca2c04220e77910204aa00742821be90755473ad8b8fc8f4,88110273712,True,0.339498,536000000000000.0,1750000000000.0,,,,,
0xbaaaf6571ab7d571043ff1e313a9609a10637864,HYPE,13.05,10.0,130.5,buy,11-03-2025 06:17,194191.67,open long,0.0,0xef62f92bff96bf2bf436041f4f38da0204e200ffad70fc638bb91d95d87da3a9,78766167752,False,0.0,1090000000000000.0,1740000000000.0,2025-11-03 06:17:00,2025-11-03,,,6.0
0x8477e447846c758f5a675856001ea72298fd9cb5,WLD,2.9059,30.1,87.47,sell,29-11-2024 14:17,-852.3,open short,0.0,0x658c40360817e9d2c7080417fc2d63016400c081cf1a0fd2de6357a03b54a0bc,51248535918,True,0.030613,891000000000000.0,1730000000000.0,,,,,
0xbee1707d6b44d4d52bfe19e41f8a828645437aab,HYPE,20.755,167.64,3479.37,buy,26-02-2025 07:53,-3208.64,close short,-0.92202,0xf4b9c6d6cccc5c3fd358041e79e8cb02016b00cf3810b44c12e1afb655e297e5,75035965984,True,1.04381,37400000000000.0,1740000000000.0,,,,,
0xa0feb3725a9335f49874d7cd8eaad6be45b27416,VINE,0.13827,1820.0,251.65,buy,06-02-2025 17:53,4024.0,open long,0.0,0xed63c2796d090a93c2eb041d3f448a0201fe001774904db205ecbe7807496e55,70116389386,False,0.025165,1100000000000000.0,1740000000000.0,2025-06-02 17:53:00,2025-06-02,,,17.0
0x28736f43f1e871e6aa8b1148d38d4994275d72c4,@107,25.056,0.79,19.79,sell,19-12-2024 02:48,1192.330839,sell,9.63833,0xedbc25d32941312ee0fc0419905cd102019f0024fcf73121f8d4078843a1d556,56397363979,True,0.006927,959000000000000.0,1730000000000.0,,,,,
0x4f93fead39b70a1824f981a54d4e55b278e9f760,BTC,103825.0,0.07943,8246.82,buy,22-01-2025 20:18,0.43228,open long,0.0,0x491bbb9e5201a22e3046041c23e97d0202d300c5772e884ff652cf2315467c2e,65622744814,True,2.061704,1020000000000000.0,1740000000000.0,,,,,
0x4f93fead39b70a1824f981a54d4e55b278e9f760,BTC,104432.0,0.09592,10017.12,buy,22-01-2025 21:09,0.01021,open long,0.0,0xd406010be715d2b65cc6041c24e13901f600a5959ea87c102d1edb4d277444be,65637677725,True,2.504279,746000000000000.0,1740000000000.0,,,,,
0x4acb90e786d897ecffb614dc822eb231b4ffb9f4,SOL,121.36,242.14,29386.11,sell,11-04-2025 19:09,5682.64,close long,2227.542716,0xcebb2077ccaeb569c31604215739350201b2002fbe9edfe9bbdd040ec550c743,85821526343,False,1.469305,435000000000000.0,1740000000000.0,2025-11-04 19:09:00,2025-11-04,,,19.0
0xbee1707d6b44d4d52bfe19e41f8a828645437aab,HYPE,14.02,4.3,60.29,buy,21-03-2025 19:37,8052.88,open long,0.0,0xb65b242b805a2959aedf041ffd7d88019300a8344af695868cbd69450b2af64e,81118115140,False,0.003014,306000000000000.0,1740000000000.0,,,,,
0x2c229d22b100a7beb69122eed721cee9b24011dd,JTO,2.7986,3272.0,9157.02,buy,21-02-2025 10:30,0.0,open long,0.0,0x41fcadf89f24aa868f8f041e2a6d6c0204f700b6ce8fa4cfe2ed2ebd6487f037,73780204703,True,3.204956,719000000000000.0,1740000000000.0,,,,,
0xbee1707d6b44d4d52bfe19e41f8a828645437aab,HYPE,14.288,128.27,1832.72,buy,10-03-2025 20:21,15874.78,open long,0.0,0x1d315d662f6a19e77444041f48552701e000b981f8210653f125ca0bdf4d16c0,78713370725,True,0.549816,326000000000000.0,1740000000000.0,2025-10-03 20:21:00,2025-10-03,,,20.0
0x4acb90e786d897ecffb614dc822eb231b4ffb9f4,BTC,86060.0,0.00056,48.19,sell,15-04-2025 19:09,-3.68869,open short,0.0,0x0000000000000000000000000000000000000000000000000000000000000000,86569212793,False,0.002409,391000000000000.0,1740000000000.0,,,,,
0xbee1707d6b44d4d52bfe19e41f8a828645437aab,@107,18.28,18.74,342.57,sell,12-12-2024 19:01,4391.077971,sell,19.968272,0xad9827cf339e5d0bdb6e04190d85b10201b200999deb1d7480f4fb77ada18ecc,54916530301,False,0.0,418000000000000.0,1730000000000.0,2024-12-12 19:01:00,2024-12-12,Extreme Greed,83.0,19.0
0x3998f134d6aaa2b6a5f723806d00fd2bbbbce891,@107,13.63,1.04,14.18,sell,11-03-2025 07:06,36415.36911,sell,-3.582796,0x0000000000000000000000000000000000000000000000000000000000000000,78902429523,False,0.00136,146000000000000.0,1740000000000.0,2025-11-03 07:06:00,2025-11-03,,,7.0
0xbd5fead7180a9c139fa51a103cb6a2ce86ddb5c3,ENA,0.76,31.0,23.56,sell,31-01-2025 05:30,-285338.0,open short,0.0,0x0000000000000000000000000000000000000000000000000000000000000000,67857640651,False,0.002356,349000000000000.0,1740000000000.0,,,,,
0xbee1707d6b44d4d52bfe19e41f8a828645437aab,HYPE,12.811,39.51,506.16,sell,29-03-2025 14:45,15190.21,close long,5.033574,0x8c433a824fbfb6db7a5704207dde5401a600457426e58defeff83b12562ca35d,82473079766,True,0.151848,91500000000000.0,1740000000000.0,,,,,
0xbee1707d6b44d4d52bfe19e41f8a828645437aab,@107,30.28,4.92,148.98,sell,20-12-2024 21:33,34010.46814,sell,12.189627,0x0000000000000000000000000000000000000000000000000000000000000000,57118029204,False,0.007448,988000000000000.0,1730000000000.0,,,,,
0x8477e447846c758f5a675856001ea72298fd9cb5,FARTCOIN,1.133,25.2,28.55,sell,25-04-2025 01:25,-215.1,open short,0.0,0x1c257d67e7d3bff6ac7a04222ded9501d20090b93e219fe1874e04ed31a77c89,88668984461,True,0.009993,615000000000000.0,1750000000000.0,,,,,
0x23e7a7f8d14b550961925fbfdaa92f5d195ba5bd,@107,18.0,39.16,704.88,buy,27-04-2025 06:52,3813.274652,buy,0.0,0x132b1e57e60a5d9116e1042251e15e0202d4007ce4ba55ec796d69a52bed8cf3,89190558110,False,0.001958,248000000000000.0,1750000000000.0,,,,,
0x513b8629fe877bb581bf244e326a047b249c4ff1,BTC,85300.0,0.00351,299.4,sell,15-04-2025 09:08,16.45785,close long,1.931202,0x9d86f5283511bf7da8590421919c1b019c00862c30288bc8daa5d0465ea0a063,86618342363,False,0.0,674000000000000.0,1740000000000.0,,,,,
0x8477e447846c758f5a675856001ea72298fd9cb5,DOGE,0.41094,1427.0,586.41,sell,12-11-2024 10:48,-42577.0,open short,0.0,0x714fe095a052f0ba5f960416974d1502013200b4651b6ece54ac93df88525bf0,46352559483,True,0.205243,1030000000000000.0,1730000000000.0,2024-12-11 10:48:00,2024-12-11,Greed,74.0,10.0
0x75f7eeb85dc639d5e99c78f95393aa9a5f1170d4,NEAR,7.8145,830.5,6489.94,sell,11-03-2024 19:36,-6638.0,open short,0.0,0x20307f70818d5bfabfca0407fdc22201220097b441ea8b0b9d17b03a3c17216d,13106975712,False,0.311517,563000000000000.0,1710000000000.0,2024-11-03 19:36:00,2024-11-03,Greed,74.0,19.0
0x72743ae2822edd658c0c50608fd7c5c501b2afbd,FARTCOIN,1.154,456.0,526.22,buy,23-04-2025 15:29,4794.7,open long,0.0,0xf45d2ed8f54aff8e45f1042216cef602014a00f3f4a35620a0a544f997a4c128,88264995359,False,0.052622,563000000000000.0,1750000000000.0,,,,,
0xbee1707d6b44d4d52bfe19e41f8a828645437aab,HYPE,13.555,36.88,499.91,buy,02-04-2025 19:31,-480.2,close short,1.194912,0x327c31bb681e127d60240420c3418a020211002f88b1a906f7bff3c1eea1aee0,83381264224,True,0.149972,44700000000000.0,1740000000000.0,2025-02-04 19:31:00,2025-02-04,Greed,72.0,19.0
0xb1231a4a2dd02f2276fa3c5e2a2f3436e6bfed23,HYPE,22.35,5.0,111.75,buy,18-02-2025 23:28,-4355.83,close short,15.508,0xec082f7da5c5f993db54041e0258d6017100179b503799d8970ed5385f5cff4e,73229093861,True,0.039112,677000000000000.0,1740000000000.0,,,,,
0xbee1707d6b44d4d52bfe19e41f8a828645437aab,HYPE,15.933,31.38,499.98,sell,26-03-2025 08:52,9580.62,close long,-3.407868,0x0d40073cf51f5782dec604204836cd019800e6a6770860ed8b5b99f927812ee8,81840321235,True,0.149993,226000000000000.0,1740000000000.0,,,,,
0xbaaaf6571ab7d571043ff1e313a9609a10637864,HYPE,13.25,41.75,553.19,buy,11-03-2025 06:03,128881.72,open long,0.0,0xa2b8fbc50b4a77963ad2041f4f0fbe02030200d8dd4d835b60c922452453d2f1,78766120810,False,0.0,493000000000000.0,1740000000000.0,2025-11-03 06:03:00,2025-11-03,,,6.0
0xb1231a4a2dd02f2276fa3c5e2a2f3436e6bfed23,BTC,41971.0,0.23829,10001.27,sell,29-01-2024 00:25,-0.15193,open short,0.0,0xe7815f70f88291e1ede804075d0bbc01a30085a85233cd0483954a0089eedff0,8323081527,True,2.500317,559000000000000.0,1710000000000.0,,,,,
0x8477e447846c758f5a675856001ea72298fd9cb5,ZRO,4.9527,11.6,57.45,sell,20-07-2024 23:59,-17742.4,open short,0.0,0x6934a4a10927450603b6040dd1245a015300b2d93c6a3fbcd4796cf4ea7e0ac2,30545866237,True,0.020107,1070000000000000.0,1720000000000.0,,,,,
0x8477e447846c758f5a675856001ea72298fd9cb5,FARTCOIN,1.3014,384.8,500.78,buy,03-01-2025 00:31,-1386.4,close short,38.333776,0x4787856b72464239642d041a7eafe00201be00f5b4ccbc4bdb49f6b4ce083a7b,60285960405,True,0.175272,58200000000000.0,1740000000000.0,2025-03-01 00:31:00,2025-03-01,Extreme Fear,20.0,0.0
0x271b280974205ca63b716753467d5a371de622ab,PAXG,3434.3,0.172,590.7,buy,22-04-2025 21:01,-177.209,close short,-12.240036,0xf1bb5e744aef8cb2d20a04220a31030203ae00cf15002c1b4844de1e74625bfb,88047267843,False,0.028352,875000000000000.0,1750000000000.0,,,,,
0x47add9a56df66b524d5e2c1993a43cde53b6ed85,FTT,3.05,8.1,24.7,sell,17-12-2024 05:44,-1675.0,open short,0.0,0xb18248fb40c908eda500041969cf510201a60067f75ad0b68691971da89af73f,55878998244,False,0.002371,951000000000000.0,1730000000000.0,,,,,
0x2c229d22b100a7beb69122eed721cee9b24011dd,AIXBT,0.51919,80.0,41.54,sell,10-01-2025 14:32,43162.0,close long,4.9552,0x5758cd61f7e757fe284c041b1c4f8f01c7005ac9b0d4ab63cd4b884ef60bbb18,62011057623,False,0.004153,732000000000000.0,1740000000000.0,2025-10-01 14:32:00,2025-10-01,,,14.0
0x47add9a56df66b524d5e2c1993a43cde53b6ed85,SUI,4.365,125.8,549.12,sell,03-01-2025 01:42,-573.2,open short,0.0,0x1163b20f413ae31056b0041a7fb90d01a8004a73d38ed5480a91a0761c2718c8,60294494545,True,0.184502,478000000000000.0,1740000000000.0,2025-03-01 01:42:00,2025-03-01,Extreme Fear,20.0,1.0
0xb899e522b5715391ae1d4f137653e7906c5e2115,SOL,142.34,40.0,5693.6,sell,05-03-2025 20:10,995.44,close long,12.616,0x95e83f1eb78aa6f6f021041ef5c0290202950052cc79f7dfb9eb6ec8551273c8,77393558957,True,1.639755,617000000000000.0,1740000000000.0,2025-05-03 20:10:00,2025-05-03,,,20.0
0xa0feb3725a9335f49874d7cd8eaad6be45b27416,HYPE,23.898,0.95,22.7,buy,20-02-2025 02:42,453.81,open long,0.0,0x8a3926486bb91d3579cc041e14f7350151009ac3e219e4e8f580ecec0a0a6d4f,73490330179,False,0.001135,574000000000000.0,1740000000000.0,,,,,
0x28736f43f1e871e6aa8b1148d38d4994275d72c4,@107,4.1637,60.04,249.99,sell,29-11-2024 16:09,5736.689372,sell,240.2685,0xc787442af079b429cf780417fd4ff0017800363d331efc443c9fb75bebbe4a03,51260375896,False,0.024998,859000000000000.0,1730000000000.0,,,,,
0xb899e522b5715391ae1d4f137653e7906c5e2115,SOL,145.01,56.48,8190.16,buy,02-03-2025 20:55,347.32,open long,0.0,0xdda5efe6902bea4a1d1e041ec548f7020494001abfaa38940954174a0979ddb6,76327309137,True,2.751894,807000000000000.0,1740000000000.0,2025-02-03 20:55:00,2025-02-03,Fear,44.0,20.0
0xbaaaf6571ab7d571043ff1e313a9609a10637864,HYPE,19.385,38.67,749.62,buy,25-02-2025 07:22,232127.22,open long,0.0,0x58aff135b4cced95d7b7041e6925ff0202ab008eb5eb6314802cb09ec0178404,74607648926,False,0.03598,692000000000000.0,1740000000000.0,,,,,
0x513b8629fe877bb581bf244e326a047b249c4ff1,BTC,79048.0,0.0064,505.91,buy,10-04-2025 22:36,-18.22541,close short,2.13248,0xcc3c4a5a7ef6fbd2e7c104214937bb0201f8004c9a108f2f5a25e4a1221ad321,85641949320,False,0.048566,633000000000000.0,1740000000000.0,2025-10-04 22:36:00,2025-10-04,,,22.0
0x75f7eeb85dc639d5e99c78f95393aa9a5f1170d4,FET,1.053,4543.0,4783.78,sell,22-02-2024 03:10,15630.0,close long,12.906663,0x7133fd17bd2dd196a4110407b948bf0201ce003a1b716a6fadb4c3a7471f392e,10440750657,False,-0.095675,341000000000000.0,1710000000000.0,,,,,
0xbee1707d6b44d4d52bfe19e41f8a828645437aab,@107,25.41,70.94,1802.59,sell,19-12-2024 13:17,18095.44021,sell,15.51321,0xa08d8c74925f38698ce10419995b5602012a0080aa77d337ae3d813ac716138b,56547227062,False,0.090129,274000000000000.0,1730000000000.0,,,,,
0xbee1707d6b44d4d52bfe19e41f8a828645437aab,@107,25.7,339.73,8731.06,buy,17-02-2025 09:57,0.00640668,buy,0.0,0x205289ef2318a01ec2a1041de8e44101b3007c1c102c03a769d811bfbe9a6ee6,72754811476,False,0.03397299,926000000000000.0,1740000000000.0,,,,,
0x28736f43f1e871e6aa8b1148d38d4994275d72c4,BTC,92130.0,0.0095,875.24,buy,10-01-2025 01:35,0.128,open long,0.0,0xa716b5cd94745ee994c5041b1119400201d200722c6f8ae13934cd70a1658b76,61864939999,True,0.306332,855000000000000.0,1740000000000.0,2025-10-01 01:35:00,2025-10-01,,,1.0
0x513b8629fe877bb581bf244e326a047b249c4ff1,SOL,141.51,112.59,15932.61,sell,21-04-2025 07:24,5905.81,close long,385.541937,0xae16b2f0909d6542483f0421f0db3801ff001db8d21b786e977fb04056026333,87708234336,True,3.6645,158000000000000.0,1750000000000.0,,,,,
0xbee1707d6b44d4d52bfe19e41f8a828645437aab,HYPE,13.004,61.06,794.02,buy,02-04-2025 12:48,532.52,open long,0.0,0x5ef7a29b5bc5c75aee8a0420be983201c500d0639a022707d0aa89e024336849,83312563567,True,0.238207,933000000000000.0,1740000000000.0,2025-02-04 12:48:00,2025-02-04,Greed,72.0,12.0
0xbaaaf6571ab7d571043ff1e313a9609a10637864,HYPE,14.604,75.0,1095.3,sell,12-03-2025 01:02,181675.83,close long,99.0675,0x3655a111928eedee013c041f5c2d5402013c008ea1f39f2a909376e7d5023bc2,79152457130,True,0.273825,644000000000000.0,1740000000000.0,2025-12-03 01:02:00,2025-12-03,,,1.0
0x513b8629fe877bb581bf244e326a047b249c4ff1,BTC,85253.0,2.34577,199983.93,sell,19-04-2025 18:30,73.65745,close long,860.89759,0x224e005eef8b8335bc080421d880b801d200a67e16b4427467a3e116173ca001,87478608767,True,45.996303,541000000000000.0,1750000000000.0,,,,,
0xbee1707d6b44d4d52bfe19e41f8a828645437aab,@107,24.498,112.98,2767.78,sell,18-12-2024 10:14,41422.1888,sell,-93.714016,0xb48958982bddc94768f304198234b301aa009413d282391ece9f935a4e90af95,56184232205,False,0.138389,560000000000000.0,1730000000000.0,,,,,
0x513b8629fe877bb581bf244e326a047b249c4ff1,BTC,85542.0,0.55,47048.1,buy,13-04-2025 02:30,6.44841,open long,0.0,0xd1104751281a4157b54e04216c76b70204e500369ea2f59de5d4cc4148389398,86100390648,True,11.762025,920000000000000.0,1740000000000.0,,,,,
0xb1231a4a2dd02f2276fa3c5e2a2f3436e6bfed23,@85,3.2035,46.06,147.55,buy,17-03-2025 01:02,1738.401351,buy,0.0,0x53286a4ca124e7df5d01041faee6e90201f9003b8be19a2b81049d8680cdb391,80216541072,True,0.0161208,135000000000000.0,1740000000000.0,,,,,
0x23e7a7f8d14b550961925fbfdaa92f5d195ba5bd,@107,19.3,20.0,386.0,buy,01-05-2025 09:13,1326.511865,buy,0.0,0x5652522ff4c566e5f5890422948a4601e80003cc28ecf0373fe4c2139eb5dfe2,90125488396,False,0.001,625000000000000.0,1750000000000.0,2025-01-05 09:13:00,2025-01-05,Greed,72.0,9.0
0xa0feb3725a9335f49874d7cd8eaad6be45b27416,@107,18.629,131.7,2453.44,sell,01-05-2025 01:15,802.7246521,sell,10.950318,0xe4e7862113b57e04e31d04228f167102013b00ec5492639760f59f31e1d49150,90061745542,False,0.245343,634000000000000.0,1750000000000.0,2025-01-05 01:15:00,2025-01-05,Greed,72.0,1.0
0x75f7eeb85dc639d5e99c78f95393aa9a5f1170d4,JELLY,0.12289,26471.0,3253.02,buy,31-01-2025 01:44,-301193.0,close short,33.61817,0xa710c1e52821b77e63f4041cd39afa020172000e87b5218e07b71a86da467a52,67828873433,True,1.093014,1020000000000000.0,1740000000000.0,,,,,
0x8477e447846c758f5a675856001ea72298fd9cb5,ZRO,4.86,60.0,291.6,sell,20-07-2024 23:15,-8309.0,open short,0.0,0xcf1123eebf7bd358019e040dd0b2760154005c9840b31c5eaf0caa0ed2cb2364,30526130527,False,0.02916,534000000000000.0,1720000000000.0,,,,,
0xbaaaf6571ab7d571043ff1e313a9609a10637864,HYPE,10.496,50.02,525.01,sell,07-04-2025 18:06,183.33,close long,15.086032,0xda40985f500a49fae83604211497dc02013100f489cbb01f3688bff98767e821,84631700279,True,0.157502,196000000000000.0,1740000000000.0,2025-07-04 18:06:00,2025-07-04,,,18.0
0xa0feb3725a9335f49874d7cd8eaad6be45b27416,HYPE,25.072,18.65,467.59,buy,21-02-2025 20:21,790.28,open long,0.0,0xa021a889a8abc4d6e8be041e311ca0020217001f0a62361c9f762f064679f35b,73867151433,False,0.023379,611000000000000.0,1740000000000.0,,,,,
0xbaaaf6571ab7d571043ff1e313a9609a10637864,HYPE,17.751,115.36,2047.76,sell,05-03-2025 08:10,140584.87,close long,131.060496,0x0391d319e62be49373f4041eed87270208ee00705347ffd836f7c93b5c4e1d92,77255189086,True,0.511938,1030000000000000.0,1740000000000.0,2025-05-03 08:10:00,2025-05-03,,,8.0
0x083384f897ee0f19899168e3b1bec365f52a9012,ETH,2803.0,0.179,501.74,buy,03-02-2025 04:56,276.1864,open long,0.0,0xe41b2d97b48ba5e4c3f5041d062e3f020315001c0bf3f4fb6559441458282609,68708892571,False,0.025086,617000000000000.0,1740000000000.0,2025-03-02 04:56:00,2025-03-02,Fear,26.0,4.0
0x28736f43f1e871e6aa8b1148d38d4994275d72c4,@107,28.671,25.0,716.77,sell,20-12-2024 21:09,1150.67018,sell,316.376567,0xe31168681e42924036720419b26c5a0201a000a0a6441ad440d0ab24a92e6065,57110994685,True,0.250871,35200000000000.0,1730000000000.0,,,,,
0x8477e447846c758f5a675856001ea72298fd9cb5,BTC,88640.0,0.00015,13.3,sell,22-04-2025 17:21,-0.02494,open short,0.0,0xcdbf39d2731423e7b421042207abed02020600563a09f583cb10951d161f2943,87994808322,True,0.004653,76600000000000.0,1750000000000.0,,,,,
0x271b280974205ca63b716753467d5a371de622ab,BTC,92575.0,0.00569,526.75,sell,23-04-2025 21:15,-14.32117,open short,0.0,0x682fddf27f601c49d06504221abe750201b700d9c86b971bc432061e4adc352c,88352401935,False,0.0,121000000000000.0,1750000000000.0,,,,,
0x513b8629fe877bb581bf244e326a047b249c4ff1,BTC,84687.0,0.11809,10000.69,buy,16-04-2025 22:06,-55.71506,close short,3.873352,0xc314d8f78109038dc0c00421aaa35e02014f00b0124c9183a3f5222c58d984a3,86979218888,True,2.300158,132000000000000.0,1740000000000.0,,,,,
0xbaaaf6571ab7d571043ff1e313a9609a10637864,HYPE,15.198,3.0,45.59,buy,09-03-2025 05:53,584.29,open long,0.0,0x76498839d8c0eca0dee8041f2dcdd50166009867a3372840d2fca53a7fcd1e94,78286646721,True,0.011398,887000000000000.0,1740000000000.0,2025-09-03 05:53:00,2025-09-03,,,5.0
0xb899e522b5715391ae1d4f137653e7906c5e2115,SOL,115.93,5.88,681.67,sell,11-03-2025 00:25,10867.6,close long,-21.292656,0xccb8f6a2c1a31b0bb211041f4b26d902022b0011334a7116ff5df8282cfa0282,78789476627,False,0.0,811000000000000.0,1740000000000.0,2025-11-03 00:25:00,2025-11-03,,,0.0
0xbaaaf6571ab7d571043ff1e313a9609a10637864,HYPE,21.468,2.0,42.94,buy,24-02-2025 13:36,103746.68,open long,0.0,0x9c13f4e8eb48bcdcb52a041e5cf95d0201bd001ddf090ec06dd5501f5860094c,74400900706,False,0.004121,398000000000000.0,1740000000000.0,,,,,
0x4acb90e786d897ecffb614dc822eb231b4ffb9f4,SOL,116.44,9.0,1047.96,buy,11-03-2025 00:24,10424.92,open long,0.0,0x39f53863bddf877bea0a041f4b24f50204c500ec2cc34b1fd5f8a0911424c443,78755701192,False,0.104796,732000000000000.0,1740000000000.0,2025-11-03 00:24:00,2025-11-03,,,0.0
0xb1231a4a2dd02f2276fa3c5e2a2f3436e6bfed23,ETHFI,3.3343,76.1,253.74,sell,25-06-2024 20:50,-14463.6,open short,0.0,0x75dd993fc12426128722040c4e755901d800d7f42934d18f3076e8bc098fc851,27501864698,True,0.088809,712000000000000.0,1720000000000.0,,,,,
0xbee1707d6b44d4d52bfe19e41f8a828645437aab,HYPE,14.867,33.07,491.65,buy,09-03-2025 17:05,2430.82,open long,0.0,0x9e0b19f80557f051b151041f35653002014900005d0b323a4c0104f6a0779d85,78362653354,True,0.147495,199000000000000.0,1740000000000.0,2025-09-03 17:05:00,2025-09-03,,,17.0
0xbee1707d6b44d4d52bfe19e41f8a828645437aab,@107,26.773,10.0,267.73,sell,20-12-2024 20:39,39516.72113,sell,10.201501,0x599edd403ff028f665370419b21d9e01e10019b25b3ee212f4ac0a10d595bf57,57101137231,True,0.080319,156000000000000.0,1730000000000.0,,,,,
0xa0feb3725a9335f49874d7cd8eaad6be45b27416,BTC,96179.0,0.00278,267.38,buy,19-02-2025 23:03,0.07777,open long,0.0,0x0000000000000000000000000000000000000000000000000000000000000000,73454835010,False,0.013368,852000000000000.0,1740000000000.0,,,,,
0xa0feb3725a9335f49874d7cd8eaad6be45b27416,IP,4.0644,77.1,313.37,buy,16-04-2025 07:45,-77.1,close short,2.151861,0x81de497eb74209a74d480421a0e9a5010a00656da55a0fe9a1d5e4811c038d14,86847500633,False,0.031336,1100000000000000.0,1740000000000.0,,,,,
0x8477e447846c758f5a675856001ea72298fd9cb5,kPEPE,0.016353,30571.0,499.93,sell,27-05-2024 01:25,-307170.0,open short,0.0,0x316fe0ae0782b9720b1f0409fc82b9016100089c1ce84bbc71596f7ccbba4d52,23954821547,True,0.174974,755000000000000.0,1720000000000.0,,,,,
0x92f17e8d81a944691c10e753af1b1baae1a2cd0d,@123,39.182,109.09,4274.36,buy,13-12-2024 21:07,11492.67616,buy,0.0,0x12a814020c67f497eae9041924313002016f00501ec85297e87e756405ce135f,55214985104,True,0.03818148,357000000000000.0,1730000000000.0,,,,,
0xbaaaf6571ab7d571043ff1e313a9609a10637864,HYPE,19.351,2.0,38.7,buy,25-02-2025 07:24,243063.23,open long,0.0,0xd8705e68535c7b4abfce041e692c04020120001d9ed6f1b409b12abfa826d615,74607648909,False,0.001857,776000000000000.0,1740000000000.0,,,,,
0x513b8629fe877bb581bf244e326a047b249c4ff1,BTC,93227.0,0.10726,9999.53,buy,25-04-2025 03:15,-103.32117,close short,8.065952,0x8543ffeb4fdab50bfa0304222f29b702012700b5ee6b85c21ed9215e3bc8ba45,88683244072,True,2.299891,275000000000000.0,1750000000000.0,,,,,
0xbee1707d6b44d4d52bfe19e41f8a828645437aab,@107,26.623,19.07,507.7,buy,18-02-2025 11:46,506.3136559,buy,0.0,0x89644ca1e27368eaf859041dfa55be0203c300783d1eaf4716858cc92686fb55,73078388998,True,0.00667449,150000000000000.0,1740000000000.0,,,,,
0x8477e447846c758f5a675856001ea72298fd9cb5,SAND,0.30812,262.0,80.73,sell,26-02-2025 21:50,-1360.0,open short,0.0,0x914354b8777ea9fea241041e8389190204c700d78458a926d140f92579a300c1,75210036168,True,0.028254,113000000000000.0,1740000000000.0,,,,,
0xbee1707d6b44d4d52bfe19e41f8a828645437aab,@107,27.374,3.65,99.92,buy,23-12-2024 16:43,9515.544021,buy,0.0,0xf50e898ace6267f62bc30419dae07d0203e600ee40f3fa96e21a1b5ef61c60f8,58012050313,True,0.00109498,524000000000000.0,1730000000000.0,,,,,
0xbaaaf6571ab7d571043ff1e313a9609a10637864,HYPE,16.114,81.29,1309.91,sell,07-03-2025 20:39,126989.57,close long,55.472296,0xa67acabfc24d0cb5d05b041f1704590204f000525423d8cded7ec70825f7b658,77962266892,True,0.327476,766000000000000.0,1740000000000.0,2025-07-03 20:39:00,2025-07-03,,,20.0
0xa0feb3725a9335f49874d7cd8eaad6be45b27416,IP,4.5241,58.8,266.02,buy,25-02-2025 04:28,3704.3,open long,0.0,0x950bc092f0b4e51322e8041e672f650203d50005d92b70d0a1a82224e83253f7,74580134679,False,0.0133,280000000000000.0,1740000000000.0,,,,,
0xb1231a4a2dd02f2276fa3c5e2a2f3436e6bfed23,BTC,42722.0,0.00702,299.91,sell,06-02-2024 05:36,0.99656,close long,1.44612,0x9761307a43a698dce26304077d1b8802011f0035e10694cefc9238f8c2f3ab4e,8907381210,True,0.074977,1010000000000000.0,1710000000000.0,2024-06-02 05:36:00,2024-06-02,Greed,73.0,5.0
0xb899e522b5715391ae1d4f137653e7906c5e2115,SOL,119.86,60.0,7191.6,buy,11-03-2025 07:57,-4758.93,close short,11.868,0x3e95385012f0824baa80041f50537b01ab004d65e9310c3dccd9278139a06fce,78921258827,True,1.7979,581000000000000.0,1740000000000.0,2025-11-03 07:57:00,2025-11-03,,,7.0
0x430f09841d65beb3f27765503d0f850b8bce7713,ZRO,5.24,3.0,15.72,sell,23-07-2024 03:12,60619.9,close long,5.63922,0xbc110d924fae544ecf5f040df08440011c0089300ad30e0f3ac08118314500bd,30774951211,False,0.001572,986000000000000.0,1720000000000.0,,,,,
0x47add9a56df66b524d5e2c1993a43cde53b6ed85,@107,11.801,43.29,510.87,sell,09-04-2025 07:18,1075.255007,sell,-314.890342,0x1b32c68f3197705df6b604212e31cf0203c1008c99e418614cde651a394e818c,85145259055,True,0.171649,649000000000000.0,1740000000000.0,2025-09-04 07:18:00,2025-09-04,,,7.0
0xb1231a4a2dd02f2276fa3c5e2a2f3436e6bfed23,HYPE,13.664,75.0,1024.8,sell,14-03-2025 18:16,20598.97,close long,48.8175,0x511b30b558dbd9915233041f896c0d0201d400234f644a68191f3bee3be2a21a,79805655511,True,0.35868,521000000000000.0,1740000000000.0,,,,,
0xbee1707d6b44d4d52bfe19e41f8a828645437aab,@107,24.9,10.0,249.0,sell,18-12-2024 10:25,42896.39878,sell,-3.161123,0x908e0d51cdd81b3d76f90419825d8f01a300c6a7a1542ad9f4293930c1f36725,56186885204,False,0.01245,406000000000000.0,1730000000000.0,,,,,
0x8170715b3b381dffb7062c0298972d4727a0a63b,@107,27.5,72.72,1999.8,sell,27-12-2024 16:32,1295.77041,sell,35.631217,0x4ae446bc7db4db99558c041a14486901e30096f7524cdb732db63c44a30084a1,58968784024,False,0.19998,436000000000000.0,1740000000000.0,,,,,
0x72743ae2822edd658c0c50608fd7c5c501b2afbd,SOL,133.6,3.93,525.05,buy,18-04-2025 20:03,-1805.74,close short,-78.869991,0x5328b94d443df8aa1ffe0421c9a82a02076e00fe465fd92d568e2bdd714d2fd3,87333347541,False,0.052504,975000000000000.0,1740000000000.0,,,,,
0xa0feb3725a9335f49874d7cd8eaad6be45b27416,@142,93491.0,0.00989,924.63,buy,28-04-2025 21:30,0.381063229,buy,0.0,0x2b2dc93c127526d438e704226c0cd40201db0040cede589ba08171ee29167ac0,89446887212,False,9.89e-07,684000000000000.0,1750000000000.0,,,,,
0xb1231a4a2dd02f2276fa3c5e2a2f3436e6bfed23,HYPE,25.596,192.98,4939.52,sell,30-01-2025 07:51,-9512.81,open short,0.0,0xb21e7b615be42c256046041cc7953a0202e6005c2dbb0aa05fa1a906be521c5e,67648839685,True,1.72883,460000000000000.0,1740000000000.0,,,,,
0x8477e447846c758f5a675856001ea72298fd9cb5,W,0.74189,525.4,389.79,sell,07-06-2024 20:30,-15936.6,open short,0.0,0xafa08fefa0dd4d065d9e040ae7b478015200972cab813bd1377c57096e011f61,25255090884,True,0.136426,585000000000000.0,1720000000000.0,2024-07-06 20:30:00,2024-07-06,Fear,26.0,20.0
0xa0feb3725a9335f49874d7cd8eaad6be45b27416,ONDO,0.96786,5163.0,4997.06,buy,26-02-2025 00:49,24188.0,open long,0.0,0xbc4231d6ef58332dfc9f041e750b4902038c009c9c8e057ece0eb783da5d5420,74944779977,True,1.499118,787000000000000.0,1740000000000.0,,,,,
0x8170715b3b381dffb7062c0298972d4727a0a63b,TRUMP,12.94,20.7,267.86,buy,23-04-2025 21:50,-62566.3,close short,-97.932114,0xf7e50cd0bc3698dce49a04221b250402076e00d139c045114a9364e3234b33fc,88363364715,True,0.09,753000000000000.0,1750000000000.0,,,,,
0x23e7a7f8d14b550961925fbfdaa92f5d195ba5bd,@107,18.2,79.09,1439.44,sell,26-04-2025 06:25,4367.255325,sell,-69.385496,0x4261ca2ef19f6033dce004224170a901e7007b5337c799842ccab83a0daf79d2,88977157319,False,0.071971,165000000000000.0,1750000000000.0,,,,,
0x75f7eeb85dc639d5e99c78f95393aa9a5f1170d4,kBONK,0.043548,1950.0,84.92,sell,04-03-2024 22:38,1591118.0,close long,0.702,0xbc2d319c9885ffba21680407e499ed0139003afbe47d4b44670670fbf701309b,11991718301,True,0.020379,919000000000000.0,1710000000000.0,2024-04-03 22:38:00,2024-04-03,Greed,71.0,22.0
0x513b8629fe877bb581bf244e326a047b249c4ff1,BTC,84900.0,0.015,1273.5,buy,19-04-2025 22:17,32.68497,open long,0.0,0x2b4f8e73cef17f87864a0421db08c10203f000592275f6599e9ca9ac6b762260,87496676650,False,0.0,358000000000000.0,1750000000000.0,,,,,
0xbee1707d6b44d4d52bfe19e41f8a828645437aab,@107,13.8,1971.25,27203.25,buy,09-12-2024 08:26,50660.0641,buy,0.0,0xa568dca1a623c72e0bda0418c62298015a00ae17e2c3d4bc752fe485c2b5c43d,53725337768,False,0.0,387000000000000.0,1730000000000.0,2024-09-12 08:26:00,2024-09-12,Fear,31.0,8.0
0x23e7a7f8d14b550961925fbfdaa92f5d195ba5bd,TAO,345.0,1.406,485.07,buy,24-04-2025 00:47,-82.156,close short,2.450658,0xf6f81899f36f8e4f519a04221d28e9020436006ae5da359a23e70ccc9533cfd8,88401452203,False,0.048507,503000000000000.0,1750000000000.0,,,,,
0xbaaaf6571ab7d571043ff1e313a9609a10637864,HYPE,13.67,7.32,100.06,buy,27-03-2025 04:38,22577.21,open long,0.0,0x7f48a419f209091231c0042055eb1d02010b002a35bf9e0f3b002269be9a7a59,82006421634,True,0.030019,514000000000000.0,1740000000000.0,,,,,
0x75f7eeb85dc639d5e99c78f95393aa9a5f1170d4,PROMPT,0.25271,834.0,210.76,buy,20-04-2025 06:01,-76924.0,close short,-1.05084,0x1f8a069c94992759c63c0421e01fc1016700249dfef567c1a9c8bc6bf5e49cea,87543273952,True,0.070815,622000000000000.0,1750000000000.0,,,,,
0xbaaaf6571ab7d571043ff1e313a9609a10637864,HYPE,13.692,1.09,14.92,buy,28-03-2025 15:43,16402.96,open long,0.0,0x143750036aa1e721174704206e012c02011c0035de940fd0dbf8525f5e9de248,82287210933,True,0.005223,52700000000000.0,1740000000000.0,,,,,
0x47add9a56df66b524d5e2c1993a43cde53b6ed85,USUAL,0.5756,30.1,17.33,sell,13-01-2025 03:58,-9279.3,open short,0.0,0xefa21ea66ae54f843edf041b5158b20174004fd08b63358cb18951e42ed196f0,62504616279,True,0.00582,969000000000000.0,1740000000000.0,,,,,
0x28736f43f1e871e6aa8b1148d38d4994275d72c4,LINK,23.833,2.0,47.67,buy,05-12-2024 11:40,-16.8,close short,0.978,0xe29c1112e7b36c2953e9041875bef601ca009bed7f0d410783e358e3030bbb0e,52851178051,True,0.016683,423000000000000.0,1730000000000.0,2024-05-12 11:40:00,2024-05-12,Greed,56.0,11.0
0xbaaaf6571ab7d571043ff1e313a9609a10637864,HYPE,13.05,75.72,988.15,buy,29-03-2025 03:26,61218.21,open long,0.0,0xa6d50ad726797f2bfd810420761fe001e200e27c1c25ff28a5c4eb93c08de634,82390971681,False,0.098814,317000000000000.0,1740000000000.0,,,,,
0x39cef799f8b69da1995852eea189df24eb5cae3c,ADA,0.5558,630.0,350.15,sell,09-04-2025 04:16,-13606.0,open short,0.0,0x3093f63ac5f45a0070d404212c1cc002056c00b72b9385338a8445f791036378,85098533539,False,0.017507,962000000000000.0,1740000000000.0,2025-09-04 04:16:00,2025-09-04,,,4.0
0xbee1707d6b44d4d52bfe19e41f8a828645437aab,HYPE,26.979,9.26,249.83,buy,01-02-2025 22:09,-412.54,close short,6.336618,0x00015e9cbcbf96ac17a4041cf163f7020124008c3464e13628fc192a63a42ab6,68258763258,True,0.087438,12200000000000.0,1740000000000.0,2025-01-02 22:09:00,2025-01-02,Greed,70.0,22.0
0xbaaaf6571ab7d571043ff1e313a9609a10637864,HYPE,12.843,37.14,476.99,sell,14-03-2025 09:48,66189.33,close long,2.521806,0xa9302fc2e01aeb2af388041f83a954020281002d7b80c1ff775c49202f80c1b7,79743319127,False,0.0,30700000000000.0,1740000000000.0,,,,,
0xbee1707d6b44d4d52bfe19e41f8a828645437aab,@107,26.781,0.93,24.91,buy,20-12-2024 20:14,35833.99385,buy,0.0,0x30b454822763adfcb5b80419b1ddfe02018200e08ef163842ee8ce978638b295,57093145563,True,0.00027896,153000000000000.0,1730000000000.0,,,,,
0x8477e447846c758f5a675856001ea72298fd9cb5,PENGU,0.009192,12075.0,110.99,sell,03-03-2025 01:13,-38938.0,open short,0.0,0xf7c23a9c3c04f772b7b1041ec82f90020301006fa00d92e4f178d5d4f2622a57,76424935198,True,0.038847,270000000000000.0,1740000000000.0,2025-03-03 01:13:00,2025-03-03,Fear,33.0,1.0
0xbaaaf6571ab7d571043ff1e313a9609a10637864,HYPE,14.656,727.82,10666.93,sell,12-03-2025 01:02,204746.22,close long,999.224078,0x3655a111928eedee013c041f5c2d5402013c008ea1f39f2a909376e7d5023bc2,79152457130,True,2.666732,765000000000000.0,1740000000000.0,2025-12-03 01:02:00,2025-12-03,,,1.0
0x28736f43f1e871e6aa8b1148d38d4994275d72c4,BTC,99745.0,0.05,4987.25,sell,27-01-2025 18:13,0.45001,close long,39.325,0xf25bd700a5390f1f1864041c9df38f02037600e38111ecd912dfb84dd615827c,66916831060,True,1.745537,784000000000000.0,1740000000000.0,,,,,
0xbee1707d6b44d4d52bfe19e41f8a828645437aab,HYPE,11.58,56.24,651.26,sell,04-04-2025 19:43,9693.76,close long,2.480184,0x99bee6d1a4faf5174cc80420e4ae2f02011b00691b9bac142da3e2dd754d8f13,83928769536,True,0.195377,608000000000000.0,1740000000000.0,2025-04-04 19:43:00,2025-04-04,Fear,28.0,19.0
0xbaaaf6571ab7d571043ff1e313a9609a10637864,HYPE,13.232,134.73,1782.75,buy,11-03-2025 06:03,146433.22,open long,0.0,0x2b695f053a22378195a3041f4f11be020945008d99130579001de426939961b8,78808032396,False,0.0,141000000000000.0,1740000000000.0,2025-11-03 06:03:00,2025-11-03,,,6.0
0x083384f897ee0f19899168e3b1bec365f52a9012,ETH,3203.0,1.0,3203.0,sell,11-11-2024 08:40,-139.3619,open short,0.0,0xfa0af8f4ab9a7e34f267041680a8e301a200cf61007dec4b7beab8b4c694c948,45993118565,False,0.3203,568000000000000.0,1730000000000.0,2024-11-11 08:40:00,2024-11-11,Extreme Greed,76.0,8.0
0xb1231a4a2dd02f2276fa3c5e2a2f3436e6bfed23,HYPE,25.536,19.82,506.12,sell,04-02-2025 08:01,-3937.56,open short,0.0,0x9bb5fc9c6106d5a149d0041d18511101870046b0abb50f0fdd89af7dadfb359e,69256550638,True,0.177143,755000000000000.0,1740000000000.0,2025-04-02 08:01:00,2025-04-02,Fear,44.0,8.0
0x8477e447846c758f5a675856001ea72298fd9cb5,HYPE,12.413,3.55,44.07,sell,09-04-2025 13:29,-36.7,open short,0.0,0x093501ac9ffbc7a307c904213275c0020147002d97eb7f032d0c446c1c7e8974,85233812377,True,0.015423,984000000000000.0,1740000000000.0,2025-09-04 13:29:00,2025-09-04,,,13.0
0xb1231a4a2dd02f2276fa3c5e2a2f3436e6bfed23,ETH,2202.2,0.1455,320.42,buy,03-01-2024 20:00,0.0,open long,0.0,0xd933577cbc6134ad7c750406f5f6120144006a150cf0d3e980963a91124eb7fc,6079616500,True,0.080105,88500000000000.0,1700000000000.0,2024-03-01 20:00:00,2024-03-01,Extreme Greed,80.0,20.0
0x271b280974205ca63b716753467d5a371de622ab,BTC,92924.0,0.017,1579.71,sell,23-04-2025 21:53,-2.18515,open short,0.0,0x81e516855cd6df77d23904221b2f6c0202e300fb6544617ed7daf2d4b071eda9,88364448513,False,0.0,849000000000000.0,1750000000000.0,,,,,
0xa0feb3725a9335f49874d7cd8eaad6be45b27416,@107,18.404,15.11,278.08,buy,25-04-2025 21:44,6487.256184,buy,0.0,0x3f9978d647f8f076616504223b8a850201270052db73d2adc12011e2d00809d1,88730843596,False,0.00151097,586000000000000.0,1750000000000.0,,,,,
0x8477e447846c758f5a675856001ea72298fd9cb5,POPCAT,0.337,1646.0,554.7,buy,23-04-2025 06:07,-139430.0,close short,-31.659164,0x28f9ba71067da4b69743042210633a0162005f96d5a3bf1d139fc686bddb57a3,88144779872,False,0.05547,592000000000000.0,1750000000000.0,,,,,
0xbee1707d6b44d4d52bfe19e41f8a828645437aab,@107,25.596,25.0,639.9,sell,18-12-2024 10:40,42606.49217,sell,9.637644,0x50ae5fabac843df40e7a041982938b011f00535ceb52b3cf1643b59babf14a61,56189668777,True,0.191969,692000000000000.0,1730000000000.0,,,,,
0xbee1707d6b44d4d52bfe19e41f8a828645437aab,HYPE,16.326,1.25,20.41,sell,07-03-2025 06:52,-3668.72,open short,0.0,0x92a2a1dc6d886903e8f7041f0d8e1402048800fe621644ca9a7a9c0bbe4723aa,77811044893,True,0.006122,644000000000000.0,1740000000000.0,2025-07-03 06:52:00,2025-07-03,,,6.0
0xbaaaf6571ab7d571043ff1e313a9609a10637864,HYPE,16.087,62.16,999.97,sell,07-03-2025 20:39,62235.89,close long,40.739664,0x00f4bf283210e09cb09f041f17055702026900bab3394dcf73495437996023ea,77962361891,True,0.249991,258000000000000.0,1740000000000.0,2025-07-03 20:39:00,2025-07-03,,,20.0
0x28736f43f1e871e6aa8b1148d38d4994275d72c4,@107,20.977,8.62,180.82,sell,14-12-2024 12:01,1950.007389,sell,133.823255,0x89ba167f1e3f2ad657db0419311ef602010400e78611872a8f72658057a7d82e,55345866526,True,0.063287,326000000000000.0,1730000000000.0,,,,,
0xa0feb3725a9335f49874d7cd8eaad6be45b27416,BTC,97945.0,0.00011,10.77,sell,11-02-2025 16:26,0.10525,close long,0.035112,0x0000000000000000000000000000000000000000000000000000000000000000,71453522825,False,0.000538,386000000000000.0,1740000000000.0,2025-11-02 16:26:00,2025-11-02,,,16.0
0xbaaaf6571ab7d571043ff1e313a9609a10637864,HYPE,14.6,1.37,20.0,sell,12-03-2025 01:02,179610.46,close long,1.804153,0x3655a111928eedee013c041f5c2d5402013c008ea1f39f2a909376e7d5023bc2,79152457130,True,0.005,261000000000000.0,1740000000000.0,2025-12-03 01:02:00,2025-12-03,,,1.0
0x75f7eeb85dc639d5e99c78f95393aa9a5f1170d4,kBONK,0.041174,98168.0,4041.97,sell,04-03-2024 23:38,288021.0,close long,204.483944,0x2d1e930553be1a9add870407e4be6e02038400b8b7f380dfe54adc5e820eeb1d,12001128677,False,-0.080839,408000000000000.0,1710000000000.0,2024-04-03 23:38:00,2024-04-03,Greed,71.0,23.0
0x28736f43f1e871e6aa8b1148d38d4994275d72c4,@107,26.794,10.22,273.83,buy,28-12-2024 04:06,484.4763453,buy,0.0,0xc7b9e5ef0d99a1398967041a1b569d01740098bb1de642f43b733a9a0e877fe8,59106076716,True,0.00357699,308000000000000.0,1740000000000.0,,,,,
0xb1231a4a2dd02f2276fa3c5e2a2f3436e6bfed23,HPOS,0.04075,765.0,31.17,buy,17-02-2024 06:16,17241.0,open long,0.0,0x70746f0c76a0b0cd88ad0407a6f272010600f370f568e1a8e2a4ce7af16c4ea0,9588489089,False,-0.000623,605000000000000.0,1710000000000.0,,,,,
0x513b8629fe877bb581bf244e326a047b249c4ff1,BTC,92938.0,0.64531,59973.82,sell,24-04-2025 23:02,39.54698,close long,29.03895,0x5edcb07c73b385bdae9204222c48760201b90050797e5570b797af975afea5e2,88643113971,True,13.793978,359000000000000.0,1750000000000.0,,,,,
0x4acb90e786d897ecffb614dc822eb231b4ffb9f4,SOL,112.65,183.13,20629.59,buy,06-04-2025 23:03,8317.18,open long,0.0,0x0255b3b2febfc0c4f0ae0421077db501d300aca3add05a262d49571a6a560ce2,84285224524,True,6.188878,625000000000000.0,1740000000000.0,2025-06-04 23:03:00,2025-06-04,,,23.0
0x28736f43f1e871e6aa8b1148d38d4994275d72c4,PURR/USDC,0.20469,89.0,18.22,buy,26-01-2025 00:33,82424.65483,buy,0.0,0xf3a8e4602dd175774ef3041c7a390002017a00e64a28e77c0fce3f2bd98e27eb,66519353244,True,0.03114,394000000000000.0,1740000000000.0,,,,,
0xbd5fead7180a9c139fa51a103cb6a2ce86ddb5c3,ENA,0.909,987.0,897.18,sell,11-12-2024 03:02,-157386.0,open short,0.0,0xe39a56e752f3d8fe52380418eafeb0020113007f5e56e6b01fedc8ee05ad040d,54473254129,False,0.089718,684000000000000.0,1730000000000.0,2024-11-12 03:02:00,2024-11-12,Extreme Greed,80.0,3.0
0xb1231a4a2dd02f2276fa3c5e2a2f3436e6bfed23,ETH,2374.1,1.5717,3731.37,buy,31-01-2024 04:02,12.9016,open long,0.0,0xd89bcd50072d59dcb0c70407657f2a019a008957c19f91db98c166b02bea641c,8481956681,True,0.932843,114000000000000.0,1710000000000.0,,,,,
0x8477e447846c758f5a675856001ea72298fd9cb5,APE,1.7164,45.9,78.78,sell,21-10-2024 16:45,-34097.7,open short,0.0,0xe9c7b5402e20b26822eb0414d17364014700489f7383d700c9b8a6e5c3ceb6ec,42754019460,True,0.027573,1060000000000000.0,1730000000000.0,,,,,
0x3998f134d6aaa2b6a5f723806d00fd2bbbbce891,@107,17.0,6.54,111.18,sell,06-03-2025 07:34,52172.76911,sell,-0.49048,0x63726b6d8be0c4de4165041efd9afa0202c9001953753c7eae10128b4e75873a,77527060339,False,0.010673,169000000000000.0,1740000000000.0,2025-06-03 07:34:00,2025-06-03,,,7.0
0xbee1707d6b44d4d52bfe19e41f8a828645437aab,@107,16.71,71.78,1199.44,sell,18-04-2025 18:42,574.1389845,sell,9.869899,0xf0362129d8a28724a5070421c8bf320203d200c8d3a210dbc06d7aa41964af4b,87343648311,True,0.359833,920000000000000.0,1740000000000.0,,,,,
0x72c6a4624e1dffa724e6d00d64ceae698af892a0,IP,4.38,114.2,500.2,buy,22-02-2025 16:28,438.3,open long,0.0,0xdb71cd92441b54ce8146041e3ea507016b004412e0d5860b436af58218249f27,74074578996,False,0.048018,614000000000000.0,1740000000000.0,,,,,
0x2c229d22b100a7beb69122eed721cee9b24011dd,AIXBT,0.51919,151.0,78.4,sell,10-01-2025 14:32,151.0,close long,9.35294,0x7d636be5e1a74fe8c185041b1c4f9502019f00ba4308576a4e5301d126541f00,62011057623,False,0.007839,469000000000000.0,1740000000000.0,2025-10-01 14:32:00,2025-10-01,,,14.0
0x47add9a56df66b524d5e2c1993a43cde53b6ed85,XRP,2.3993,625.0,1499.56,sell,02-01-2025 07:11,-1344.0,open short,0.0,0x92bd2bef9c15e752795f041a6fb2c801b300b72bf5a72f3e1c851128552669d3,60123404386,True,0.503852,816000000000000.0,1740000000000.0,2025-02-01 07:11:00,2025-02-01,Greed,68.0,7.0
0xbee1707d6b44d4d52bfe19e41f8a828645437aab,HYPE,15.392,104.16,1603.23,sell,16-04-2025 03:19,4625.6,close long,-12.988752,0x6ac4b73eecc25bf514fe04219dea99017800deed3ad27941794b6cec409caf3f,86809401248,True,0.56113,125000000000000.0,1740000000000.0,,,,,
0xbaaaf6571ab7d571043ff1e313a9609a10637864,HYPE,12.97,8.19,106.22,sell,14-03-2025 00:33,160333.92,close long,0.064701,0x0000000000000000000000000000000000000000000000000000000000000000,79676785319,False,0.0,450000000000000.0,1740000000000.0,,,,,
0x2c229d22b100a7beb69122eed721cee9b24011dd,MOODENG,0.53919,462.0,249.11,sell,03-12-2024 22:29,75292.0,close long,3.591126,0xc0df3d5ac40dcb2c1427041855a1b201ff00338020c5a4d3b22887fe1f08a16c,52334063949,True,0.087187,495000000000000.0,1730000000000.0,2024-03-12 22:29:00,2024-03-12,Extreme Greed,81.0,22.0
0xbee1707d6b44d4d52bfe19e41f8a828645437aab,HYPE,15.91,196.43,3125.2,sell,26-03-2025 12:13,10821.22,close long,36.889554,0x943985421b3226d75ada04204a7cd501fe00755edf06be75840b549bf9e0ca2c,81861452719,True,0.93756,1060000000000000.0,1740000000000.0,,,,,
0x8381e6d82f1affd39a336e143e081ef7620a3b7f,@107,24.63,9.25,227.83,buy,11-02-2025 18:46,0.00381239,buy,0.0,0x79f841dae229646522ad041d9084dc020200004921568358c39d537fef2b02b2,71474994698,True,0.00277498,1040000000000000.0,1740000000000.0,2025-11-02 18:46:00,2025-11-02,,,18.0
0xbaaaf6571ab7d571043ff1e313a9609a10637864,HYPE,20.269,26.08,528.62,buy,25-02-2025 03:44,137935.81,open long,0.0,0x0000000000000000000000000000000000000000000000000000000000000000,74479445887,False,0.050746,474000000000000.0,1740000000000.0,,,,,
0xbaaaf6571ab7d571043ff1e313a9609a10637864,HYPE,20.071,24.91,499.97,sell,26-02-2025 01:46,36966.89,close long,5.883742,0xc27e4bb224b27341b499041e75b3ad020346005d60519219f591c96cf2d5dcd6,74960333949,True,0.14399,956000000000000.0,1740000000000.0,,,,,
0xbee1707d6b44d4d52bfe19e41f8a828645437aab,HYPE,11.296,8.85,99.97,buy,04-04-2025 16:39,12368.12,open long,0.0,0x87a623e20d7008110aaf0420e28d2c0201e400ff398b7b827979e1e887a9c7cb,83877559270,True,0.02999,980000000000000.0,1740000000000.0,2025-04-04 16:39:00,2025-04-04,Fear,28.0,16.0
0x8477e447846c758f5a675856001ea72298fd9cb5,kPEPE,0.00887,146821.0,1302.3,buy,23-04-2025 20:37,-4152090.0,close short,-39.935312,0xac83f7cbf1b38dc61d5a04221a51d302013d004f5600f91dd4983175b197470b,88339772788,True,0.455805,1050000000000000.0,1750000000000.0,,,,,
0x8477e447846c758f5a675856001ea72298fd9cb5,POPCAT,0.332,1671.0,554.77,buy,23-04-2025 04:05,-230403.0,close short,-40.47162,0xc122a7693f7ed5f8ecff04220efcf002028a00afe3f3f53e430db04e6d1f741c,88120676112,False,0.055477,392000000000000.0,1750000000000.0,,,,,
0x8477e447846c758f5a675856001ea72298fd9cb5,IO,4.2374,130.9,554.68,sell,12-06-2024 16:41,-3183.3,open short,0.0,0x57185616225d8b2097bd040b481be4012800d11e5d298c95100306ef0e4494e8,25795491797,True,0.194136,972000000000000.0,1720000000000.0,2024-12-06 16:41:00,2024-12-06,Greed,72.0,16.0
0x47add9a56df66b524d5e2c1993a43cde53b6ed85,SUI,2.9086,283.9,825.75,sell,25-02-2025 06:24,2028.1,close long,-14.36534,0x3122b273ab60163ff11c041e687e0401d5005a63d47677643a76b3b9b953493f,74617114373,True,0.277452,774000000000000.0,1740000000000.0,,,,,
0xa0feb3725a9335f49874d7cd8eaad6be45b27416,@142,93891.0,0.00119,111.73,buy,30-04-2025 04:39,0.802054689,buy,0.0,0x0000000000000000000000000000000000000000000000000000000000000000,89844062314,False,1.19e-07,312000000000000.0,1750000000000.0,,,,,
0x8477e447846c758f5a675856001ea72298fd9cb5,ETH,1706.7,2.9272,4995.85,sell,22-04-2025 20:36,-52.2768,open short,0.0,0xe09a966d5eb5e5a0e6ae042209e6ae0203c9001a4344fccd0e9323912f9c8a05,88039686531,True,1.748548,448000000000000.0,1750000000000.0,,,,,
0xa0feb3725a9335f49874d7cd8eaad6be45b27416,@142,94803.0,0.00606,574.51,sell,29-04-2025 01:06,0.246807398,sell,5.585398,0xfb02103fcafebf5a588604226e86880201a200a681cad2654a60a98b63050107,89608954091,False,0.05745,745000000000000.0,1750000000000.0,,,,,
0xb1231a4a2dd02f2276fa3c5e2a2f3436e6bfed23,HYPE,14.477,40.63,588.2,sell,11-03-2025 17:14,32070.02,close long,7.447479,0x5e56833c8507e7bfc7e9041f56b62f0204f700fdab31afd045d5464dd9223b15,79017998320,True,0.20587,237000000000000.0,1740000000000.0,2025-11-03 17:14:00,2025-11-03,,,17.0
0x28736f43f1e871e6aa8b1148d38d4994275d72c4,ARB,0.87235,45.8,39.95,buy,26-11-2024 14:25,-166.7,close short,2.653652,0x75588d972b1a2a21aade0417be617902022100f038eee16e85e6416e8de6f28c,50425291654,True,0.013983,733000000000000.0,1730000000000.0,,,,,
0x92f17e8d81a944691c10e753af1b1baae1a2cd0d,FARTCOIN,0.91398,7879.8,7201.98,buy,29-01-2025 23:48,-19953.9,close short,556.865466,0xaa0ea878a2a1ae7437cf041cc22b2001f200a5ca6d5f870072f31018d0cb162d,67529850218,True,2.520692,376000000000000.0,1740000000000.0,,,,,
0xb1231a4a2dd02f2276fa3c5e2a2f3436e6bfed23,BTC,43460.0,0.00026,11.3,sell,31-01-2024 03:59,-1.15019,open short,0.0,0x08001a72d65b845bab3a0407657d43019a00ef9421f08f8c1f80954ea4f28ec7,8481822619,True,0.002824,547000000000000.0,1710000000000.0,,,,,
0x23e7a7f8d14b550961925fbfdaa92f5d195ba5bd,@107,16.968,244.68,4151.73,buy,18-04-2025 03:36,755.062371,buy,0.0,0x81d5c0aac9516d70f6350421be92f301ed0097397f83f477bab3d615d86a54ea,87242371628,True,0.08563796,641000000000000.0,1740000000000.0,,,,,
0xa0feb3725a9335f49874d7cd8eaad6be45b27416,BTC,96912.0,0.00625,605.7,buy,14-02-2025 06:01,1e-05,open long,0.0,0xe6069eaedbc584140f59041db65f8f02028000d6406b5d5cf82c5da054adfce2,72136781295,False,0.030285,504000000000000.0,1740000000000.0,,,,,
0x47add9a56df66b524d5e2c1993a43cde53b6ed85,FTT,3.39,6.6,22.37,sell,11-12-2024 14:32,-4532.3,open short,0.0,0xbc06b406ae193ba3ea2e0418f4ecf10202c000b3d6ce26ffcc1a9507c1fdc2e5,54611519645,False,0.002147,441000000000000.0,1730000000000.0,2024-11-12 14:32:00,2024-11-12,Extreme Greed,80.0,14.0
0xbee1707d6b44d4d52bfe19e41f8a828645437aab,@107,25.42,1.93,49.06,sell,19-12-2024 13:19,6151.880211,sell,0.441354,0x0000000000000000000000000000000000000000000000000000000000000000,56547653190,False,0.002453,820000000000000.0,1730000000000.0,,,,,
0x72743ae2822edd658c0c50608fd7c5c501b2afbd,@107,17.12,603.35,10329.35,sell,18-04-2025 07:53,13780.99471,sell,57.321273,0x5668931a2fdbd127e3e20421c17d1701c200b05e61eb42a47daa6f9db3d852b3,87271035175,False,1.032935,1050000000000000.0,1740000000000.0,,,,,
0x513b8629fe877bb581bf244e326a047b249c4ff1,BTC,84594.0,0.11821,9999.86,buy,14-04-2025 19:07,62.1594,open long,0.0,0x8f65d85adf8e5394701f042188095c01c2001bc4abf5408820daedfd248074d6,86492926883,True,2.499964,477000000000000.0,1740000000000.0,,,,,
0x4acb90e786d897ecffb614dc822eb231b4ffb9f4,SOL,119.22,1.86,221.75,sell,11-04-2025 16:41,14965.73,close long,13.130484,0x0000000000000000000000000000000000000000000000000000000000000000,85802512181,False,0.011087,506000000000000.0,1740000000000.0,2025-11-04 16:41:00,2025-11-04,,,16.0
0x47add9a56df66b524d5e2c1993a43cde53b6ed85,XRP,2.4134,86.0,207.55,buy,07-12-2024 09:31,-1226.0,close short,2.330944,0x0e8ed25fb73d2696314304189d6f2301bd00ddec5e07d633bd18f62e78e2e994,53381213889,True,0.069737,147000000000000.0,1730000000000.0,2024-07-12 09:31:00,2024-07-12,Fear,25.0,9.0
0xbee1707d6b44d4d52bfe19e41f8a828645437aab,HYPE,10.9,652.33,7110.4,buy,08-04-2025 22:44,3339.52,open long,0.0,0xdc236ca63356c593fdee0421284ba50201a100db89e8379e2c900eea47b71f8b,84806705852,False,0.355519,637000000000000.0,1740000000000.0,2025-08-04 22:44:00,2025-08-04,,,22.0
0xbaaaf6571ab7d571043ff1e313a9609a10637864,HYPE,13.0,16.59,215.67,buy,12-03-2025 15:17,112852.55,open long,0.0,0xaae7bb357fc74957c1a2041f661247019a004b457c7059f14da3401ca524831f,79306752397,False,0.010783,1030000000000000.0,1740000000000.0,2025-12-03 15:17:00,2025-12-03,,,15.0
0x7f4f299f74eec87806a830e3caa9afa5f2b9db8f,ETH,1587.0,0.631,1001.4,sell,11-04-2025 23:09,-35.8895,open short,0.0,0xd8037725158ecab5a1df042159fa9d02028400b9ff1bfd2b64c7ee70f838b4d5,85807303066,False,0.100139,166000000000000.0,1740000000000.0,2025-11-04 23:09:00,2025-11-04,,,23.0
0xbaaaf6571ab7d571043ff1e313a9609a10637864,HYPE,12.818,10.0,128.18,sell,14-03-2025 09:44,93252.13,close long,0.429,0x1826ef993d6a2ac0f950041f839e3a01ae00c889b48652c236b05e6d6dc5baf0,79743319115,False,0.0,33900000000000.0,1740000000000.0,,,,,
0xbee1707d6b44d4d52bfe19e41f8a828645437aab,@107,24.732,30.32,749.87,sell,18-02-2025 19:53,3503.971579,sell,4.592152,0x70fd7eb3140bc34258a5041dffde4a020132009f36b53b606dc3f48553510a67,73169101257,True,0.262455,763000000000000.0,1740000000000.0,,,,,
0x2c229d22b100a7beb69122eed721cee9b24011dd,PNUT,2.1106,10.0,21.11,sell,15-11-2024 21:41,2115.8,close long,2.7084,0x6eed90d5b1332fc3e9300416df9e2f01d500d6cd74420109f7f87f2df65c0dcd,47567168638,False,0.00211,678000000000000.0,1730000000000.0,,,,,
0xbee1707d6b44d4d52bfe19e41f8a828645437aab,HYPE,12.964,7.71,99.95,buy,18-03-2025 12:32,5097.21,open long,0.0,0x772c856034c2ece2cee8041fc72d3101f70082d311dc9bc7890a43585e3fc01b,80496067044,True,0.029985,446000000000000.0,1740000000000.0,,,,,
0xbee1707d6b44d4d52bfe19e41f8a828645437aab,HYPE,20.4,378.21,7715.48,buy,27-02-2025 07:59,-4458.75,close short,79.877952,0x601b8adeb66f87a41201041e8a86770201760066af433efcddd37b13fd6d0e83,75396689700,False,0.385774,740000000000000.0,1740000000000.0,,,,,
0xbee1707d6b44d4d52bfe19e41f8a828645437aab,HYPE,20.349,63.76,1297.45,buy,26-02-2025 05:22,-1131.89,close short,23.030112,0x54861a0e912e127d6865041e782e30012e001a0d3090badb2ccfa688384f6acc,75008675656,True,0.454108,700000000000000.0,1740000000000.0,,,,,
0x28736f43f1e871e6aa8b1148d38d4994275d72c4,kPEPE,0.006743,14841.0,100.07,buy,03-04-2025 18:05,1063926.0,open long,0.0,0xd888f702490f17b15c990420d2eafb020308007a9776530974496f10c399d57f,83644827133,True,0.035025,1070000000000000.0,1740000000000.0,2025-03-04 18:05:00,2025-03-04,Extreme Fear,15.0,18.0
0x6d6a4b953f202f8df5bed40692e7fd865318264a,@107,26.471,16.58,438.89,sell,16-12-2024 13:40,7124.0,sell,345.240537,0x00d0367ce33888c2434d04195c0c8101b1005225114452263245f0cf755e2a3f,55735711821,True,0.153611,534000000000000.0,1730000000000.0,,,,,
0x75f7eeb85dc639d5e99c78f95393aa9a5f1170d4,RUNE,1.5407,95.3,146.83,buy,01-02-2025 19:31,-36750.0,close short,2.03942,0x3c68d53cc246fbd1f6de041cef9da70203300035bfd9e1632a085b2663a9e85d,68231669843,False,0.014094,274000000000000.0,1740000000000.0,2025-01-02 19:31:00,2025-01-02,Greed,70.0,19.0
0xbaaaf6571ab7d571043ff1e313a9609a10637864,HYPE,19.961,10.0,199.61,sell,26-02-2025 01:39,101675.71,close long,1.262,0x9c6fd4d153775b250ffd041e759f5002012500305bc645dbf76849608daeee3e,74784409719,False,0.00958,687000000000000.0,1740000000000.0,,,,,
0xbaaaf6571ab7d571043ff1e313a9609a10637864,HYPE,20.266,0.57,11.55,buy,25-02-2025 03:44,140378.82,open long,0.0,0xa2c2f772e1e77c80608e041e66adca0201a800389e231f1834091797f2bb1ea9,74479445890,False,0.001108,759000000000000.0,1740000000000.0,,,,,
0xa0feb3725a9335f49874d7cd8eaad6be45b27416,@142,93980.0,0.00475,446.4,buy,27-04-2025 10:54,0.154862542,buy,0.0,0x239d0cbe6e1fff751bf104225497dd01b6000cb29a6b478b05907d8a1bbf93b4,89233190791,False,4.75e-07,373000000000000.0,1750000000000.0,,,,,
0xbee1707d6b44d4d52bfe19e41f8a828645437aab,HYPE,15.947,0.63,10.05,sell,26-03-2025 08:52,14225.27,close long,-0.059598,0xbc6aa52f4257f04afa3e04204835b5020202004decf574f78a412f25731f0e4d,81840278308,True,0.003013,1040000000000000.0,1740000000000.0,,,,,
0xa0feb3725a9335f49874d7cd8eaad6be45b27416,@142,93323.0,0.02564,2392.8,buy,24-04-2025 05:58,0.43959604,buy,0.0,0x07467400760d31232f0e042220a64c020376001094f1d8cf920adf3b9509657b,88434032379,False,2.56e-06,866000000000000.0,1750000000000.0,,,,,
0xb1231a4a2dd02f2276fa3c5e2a2f3436e6bfed23,BTC,43541.0,0.68901,30000.18,buy,31-01-2024 03:27,-2.29548,close short,6.683397,0xc9f506c92f16e862421d040765663b020252002fae89966949e670d0702be521,8480540626,True,7.500046,39100000000000.0,1710000000000.0,,,,,
0xbee1707d6b44d4d52bfe19e41f8a828645437aab,HYPE,18.637,101.09,1884.01,sell,29-04-2025 05:33,-4892.02,open short,0.0,0xa5efedf7d0c31b46cac404227184570201b400b09c23b57babf22a9302a9b5e3,89642744509,True,0.565204,1010000000000000.0,1750000000000.0,,,,,
0xbee1707d6b44d4d52bfe19e41f8a828645437aab,@107,25.2,11.53,290.56,sell,19-12-2024 11:08,33066.4141,sell,1.375076,0x0000000000000000000000000000000000000000000000000000000000000000,56528797517,False,0.014527,151000000000000.0,1730000000000.0,,,,,
0xbee1707d6b44d4d52bfe19e41f8a828645437aab,@107,26.885,118.57,3187.75,sell,18-02-2025 11:36,118.589951,sell,181.025776,0xf61de2a6b5045efa6a90041dfa38f602021b006185fe35dba33648e1a8ae6c35,73075291821,True,1.115714,275000000000000.0,1740000000000.0,,,,,
0xbaaaf6571ab7d571043ff1e313a9609a10637864,HYPE,11.707,10.0,117.07,buy,03-04-2025 15:24,45088.9,open long,0.0,0x099a11cb9ed6eaedb7070420d10b7502010300d0421278595806868088635f83,83555405443,False,0.005853,306000000000000.0,1740000000000.0,2025-03-04 15:24:00,2025-03-04,Extreme Fear,15.0,15.0
0xbee1707d6b44d4d52bfe19e41f8a828645437aab,HYPE,16.4,10.0,164.0,buy,04-03-2025 08:49,2797.52,open long,0.0,0x5e850abe6ef7c7cd442b041ede08c70202d500be14c56149df2705ed37a44465,76899018833,True,0.049199,658000000000000.0,1740000000000.0,2025-04-03 08:49:00,2025-04-03,Fear,25.0,8.0
0xbaaaf6571ab7d571043ff1e313a9609a10637864,HYPE,15.9,3.0,47.7,sell,07-03-2025 20:41,1684.04,close long,1.4052,0x1419af9a7ed79be1b95b041f170aea02038200b83f3aa8dbf4e9ecb573028f9f,77962881534,False,0.0,876000000000000.0,1740000000000.0,2025-07-03 20:41:00,2025-07-03,,,20.0
0xbaaaf6571ab7d571043ff1e313a9609a10637864,HYPE,11.891,50.0,594.55,buy,03-04-2025 13:18,3271.68,open long,0.0,0x8012ab9e8e5b865d369a0420cf94eb02024200a9936027dea8c49465692a95e4,83595261949,True,0.178364,333000000000000.0,1740000000000.0,2025-03-04 13:18:00,2025-03-04,Extreme Fear,15.0,13.0
0xbaaaf6571ab7d571043ff1e313a9609a10637864,HYPE,13.688,70.11,959.67,buy,11-03-2025 04:45,8302.89,open long,0.0,0xb5b0591045073ba5dcb3041f4e274e0203230056a9d0e2dabc4ed393260d6b6f,78855434507,True,0.239916,1110000000000000.0,1740000000000.0,2025-11-03 04:45:00,2025-11-03,,,4.0
0xbee1707d6b44d4d52bfe19e41f8a828645437aab,HYPE,12.267,205.02,2514.98,sell,08-04-2025 07:49,3186.93,close long,273.722202,0xe778a5dcb8f6a6d319d904211e069902010b0084f9de6851a97acaa991821ea7,84854187609,True,0.754494,991000000000000.0,1740000000000.0,2025-08-04 07:49:00,2025-08-04,,,7.0
0x513b8629fe877bb581bf244e326a047b249c4ff1,SOL,148.5,1.61,239.09,buy,30-04-2025 02:17,9065.3,open long,0.0,0x439c8fc065a661b2a8f104227f922101ac009b0a66c81af8b17b3181030dde3e,89834608042,True,0.054989,813000000000000.0,1750000000000.0,,,,,
0xa0feb3725a9335f49874d7cd8eaad6be45b27416,HYPE,26.355,9.48,249.85,sell,16-02-2025 23:41,319.72,close long,0.524244,0x147d44d4ccc860595c67041de20015017f00896c75e5d1c1d1f6e35303575984,72721546740,False,0.012492,731000000000000.0,1740000000000.0,,,,,
0xbee1707d6b44d4d52bfe19e41f8a828645437aab,HYPE,20.846,111.39,2322.04,sell,27-02-2025 07:56,-4352.79,open short,0.0,0xc9e2d2db29f2b48a1c48041e8a7fb401a400934a2e472c96f708fb8b7b0bed48,75396171961,True,0.69661,930000000000000.0,1740000000000.0,,,,,
0x28736f43f1e871e6aa8b1148d38d4994275d72c4,TIA,7.9943,6.8,54.36,buy,25-11-2024 20:59,-33.1,close short,-0.982328,0x535a1745ec3a96806cbe0417af482c02015c00a53fb7023cbd79126a56af7b94,50185394300,True,0.019026,419000000000000.0,1730000000000.0,,,,,
0x4acb90e786d897ecffb614dc822eb231b4ffb9f4,BTC,77651.0,0.01291,1002.47,buy,09-04-2025 19:56,4.62218,open long,0.0,0xab4c7a6a251b7970e6b0042136e5510201260071e9b0174e830e223dada81673,85322154902,True,0.300742,41000000000000.0,1740000000000.0,2025-09-04 19:56:00,2025-09-04,,,19.0
0xbee1707d6b44d4d52bfe19e41f8a828645437aab,HYPE,18.824,25.0,470.6,sell,29-04-2025 13:17,-3634.04,open short,0.0,0x15d339ccfa88d614fad1042276be1d0201d100ed4ac7ad9659bbceba37c8cac8,89714390993,True,0.14118,468000000000000.0,1750000000000.0,,,,,
0xa0feb3725a9335f49874d7cd8eaad6be45b27416,HYPE,24.256,41.22,999.83,buy,19-12-2024 06:21,62.07,open long,0.0,0xb08393729218265ae47c0419936c9302011f007b28b05d7a2fb5c18c31cb4ea6,56452174725,True,0.299949,672000000000000.0,1730000000000.0,,,,,
0x23e7a7f8d14b550961925fbfdaa92f5d195ba5bd,HYPE,18.4,0.63,11.59,sell,24-04-2025 03:55,1913.0,close long,0.04725,0x0000000000000000000000000000000000000000000000000000000000000000,88429757565,False,0.001159,963000000000000.0,1750000000000.0,,,,,
0xa0feb3725a9335f49874d7cd8eaad6be45b27416,HYPE,22.8,22.31,508.67,buy,15-12-2024 02:56,21.78,open long,0.0,0xc9ce6428c126ff173a4404193e0f02018800b43d47ceae08cc958c7f2b2df024,55466326284,False,0.025433,934000000000000.0,1730000000000.0,,,,,
0xbee1707d6b44d4d52bfe19e41f8a828645437aab,HYPE,14.688,156.73,2302.05,buy,16-04-2025 13:41,4315.68,open long,0.0,0x15111c29f80c4bbb93270421a4e2e101e60030261184aed54e6d147c8af970e4,86891326879,True,0.805717,10800000000000.0,1740000000000.0,,,,,
0x28736f43f1e871e6aa8b1148d38d4994275d72c4,ETH,3053.3,0.0163,49.77,buy,21-11-2024 00:01,4.0099,open long,0.0,0x34b2b0f5f57cd8b554cd041749a38202011c00e7f4bbc04bdfe23bef057e039a,48808391604,True,0.017419,755000000000000.0,1730000000000.0,,,,,
0x4f93fead39b70a1824f981a54d4e55b278e9f760,BTC,104889.0,0.143,14999.13,sell,21-01-2025 21:38,0.0,open short,0.0,0x33b724dfd66f0385eec3041c0a443102018e00efefe29f4a7208d1cb13a622e5,65352751772,True,3.749781,716000000000000.0,1740000000000.0,,,,,
0x8170715b3b381dffb7062c0298972d4727a0a63b,HYPE,12.025,166.18,1998.31,buy,04-04-2025 23:27,1488.76,open long,0.0,0x9d5f684de84f3ac377450420e741c00201c4008aa389dc2f6db824ddfec1fde9,83996722026,True,0.671433,322000000000000.0,1740000000000.0,2025-04-04 23:27:00,2025-04-04,Fear,28.0,23.0
0x8477e447846c758f5a675856001ea72298fd9cb5,FARTCOIN,0.61664,1620.4,999.2,sell,09-04-2025 22:35,-5894.1,open short,0.0,0x133df410ba8e25849c48042138bd070201a20069897fb49979e67cef3a97c73a,85358371558,True,0.349721,36700000000000.0,1740000000000.0,2025-09-04 22:35:00,2025-09-04,,,22.0
0x6d6a4b953f202f8df5bed40692e7fd865318264a,BTC,82945.0,0.00015,12.44,buy,05-04-2025 23:41,-0.0381,close short,0.0477,0xb7d8fd10982ac844bab90420f7bdee020151002e1c6aa9d1f6d517745734a615,84147865714,True,0.004179,970000000000000.0,1740000000000.0,2025-05-04 23:41:00,2025-05-04,,,23.0
0xbee1707d6b44d4d52bfe19e41f8a828645437aab,HYPE,16.225,357.24,5796.22,sell,25-03-2025 14:41,8111.04,close long,-0.500136,0x53633d222fd4133fa1d504203ba28e0187003b826a04674d98a6c3011af9794b,81688406236,True,1.738865,751000000000000.0,1740000000000.0,,,,,
0xa0feb3725a9335f49874d7cd8eaad6be45b27416,BTC,97612.0,0.00149,145.44,buy,08-02-2025 00:31,0.22411,open long,0.0,0x7360cb130ac85b6cfe6a041d540773020223004f341b4b0b5928917d25543613,70539340434,False,0.014544,1040000000000000.0,1740000000000.0,2025-08-02 00:31:00,2025-08-02,,,0.0
0x513b8629fe877bb581bf244e326a047b249c4ff1,SOL,140.13,107.54,15069.58,buy,21-04-2025 08:17,6049.56,open long,0.0,0x40636656ccb8039808210421f17477020137000eba37ec6e7139d3183da46b15,87717438300,True,3.466003,846000000000000.0,1750000000000.0,,,,,
0x75f7eeb85dc639d5e99c78f95393aa9a5f1170d4,USUAL,0.98354,6443.0,6336.95,sell,19-12-2024 05:16,25234.2,close long,225.76272,0x99595010c072ad476efb0419927d9e020138005370cf0215f1f946714260cdfe,56430817351,False,0.608346,456000000000000.0,1730000000000.0,,,,,
0xbaaaf6571ab7d571043ff1e313a9609a10637864,HYPE,13.661,183.0,2499.96,sell,12-03-2025 15:10,132863.68,close long,108.6105,0xfd761a82b5d5dab7103b041f65fd1101fb00dcf41edd74f9763f1565fe0ff2b8,79305638206,True,0.749988,171000000000000.0,1740000000000.0,2025-12-03 15:10:00,2025-12-03,,,15.0
0xb1231a4a2dd02f2276fa3c5e2a2f3436e6bfed23,HYPE,18.067,0.9,16.26,sell,22-04-2025 03:23,-36737.88,open short,0.0,0x33f54782b38962cc67920421fe4935018f006711d6e027e662525c1316618315,87877462950,True,0.005691,44600000000000.0,1750000000000.0,,,,,
0xbaaaf6571ab7d571043ff1e313a9609a10637864,HYPE,12.939,38.69,500.61,buy,12-03-2025 15:33,124593.54,open long,0.0,0x327c7d559cfe0d982722041f66413001d40080d361f57c5dbfd089f029ecbb29,79306752407,False,0.02503,72700000000000.0,1740000000000.0,2025-12-03 15:33:00,2025-12-03,,,15.0
0xb1231a4a2dd02f2276fa3c5e2a2f3436e6bfed23,@4,3.8561,32.0,123.4,buy,06-08-2024 03:09,586.76,buy,0.0,0x579d60e645c8df6fdf69040ebf9c95015a00fd22d316906eb23b1d6cf159df98,32835457202,True,0.01119,1020000000000000.0,1720000000000.0,2024-06-08 03:09:00,2024-06-08,Greed,72.0,3.0
0xb899e522b5715391ae1d4f137653e7906c5e2115,BTC,83948.0,0.47648,39999.54,buy,16-03-2025 23:56,-5.02018,close short,379.9928,0x2ef2550e22529cd9afcb041fae22a802020b008b3ab6b451b64ecf213f835715,80205912805,True,9.999885,522000000000000.0,1740000000000.0,,,,,
0xbaaaf6571ab7d571043ff1e313a9609a10637864,HYPE,12.504,48.95,612.07,sell,03-04-2025 08:08,4875.57,close long,0.190905,0xf6909ca34c7e0d8604270420cc0bb8016d00464c578ab384e0e904c76bff5d73,83555980003,True,0.183621,325000000000000.0,1740000000000.0,2025-03-04 08:08:00,2025-03-04,Extreme Fear,15.0,8.0
0xbee1707d6b44d4d52bfe19e41f8a828645437aab,HYPE,14.289,1.53,21.86,sell,21-03-2025 03:25,863.31,close long,0.378675,0x1a2148f8401b78c04912041ff275a1014c0000cdb5cc6c831bf1adf0015deecd,81010522105,True,0.006558,981000000000000.0,1740000000000.0,,,,,
0x92f17e8d81a944691c10e753af1b1baae1a2cd0d,FARTCOIN,1.1715,1781.4,2086.91,buy,23-04-2025 03:30,682015.5,open long,0.0,0x6d14aa46ee034404132c04220e96c20204c7001210f851a76abe9ab4d0407b8b,88114093004,True,0.730418,682000000000000.0,1750000000000.0,,,,,
0xbaaaf6571ab7d571043ff1e313a9609a10637864,HYPE,13.293,8.29,110.2,buy,12-03-2025 14:48,60727.32,open long,0.0,0xe52a650a9aa1a325ae9b041f65bbb102018a006ef98e8740bde9bb921fd310d7,79163103790,False,0.005509,440000000000000.0,1740000000000.0,2025-12-03 14:48:00,2025-12-03,,,14.0
0x92f17e8d81a944691c10e753af1b1baae1a2cd0d,@107,21.188,10.0,211.88,buy,15-12-2024 17:35,99115.12784,buy,0.0,0xc1ef5803021ecae15ae104194ab1f6018d0037a90cb3004b3dcc19eef0294604,55565538646,True,0.0035,881000000000000.0,1730000000000.0,,,,,
0xbee1707d6b44d4d52bfe19e41f8a828645437aab,HYPE,16.394,48.42,793.8,buy,17-04-2025 16:05,-5634.9,close short,5.534406,0xaba8eaf9af0b0c4572f00421b6baa501cc006748fe990f2e268f70103c702516,87139171120,True,0.277829,899000000000000.0,1740000000000.0,,,,,
0x513b8629fe877bb581bf244e326a047b249c4ff1,BTC,84713.0,0.00607,514.21,buy,16-04-2025 22:06,-4.36726,close short,0.041276,0xc314d8f78109038dc0c00421aaa35e02014f00b0124c9183a3f5222c58d984a3,86979218888,True,0.118267,823000000000000.0,1740000000000.0,,,,,
0x8477e447846c758f5a675856001ea72298fd9cb5,BTC,98121.0,0.01132,1110.73,sell,21-11-2024 23:30,-0.19288,open short,0.0,0xe658341c0e14da4cdccb04175e10580202040071be716d3fdbf7dbfcbd4a05cf,49079311548,True,0.388755,417000000000000.0,1730000000000.0,,,,,
0x28736f43f1e871e6aa8b1148d38d4994275d72c4,VIRTUAL,3.712,68.6,254.64,sell,29-12-2024 13:35,-203.8,open short,0.0,0x7384dc4ba0a4f717949e041a2fc5790190002b9035fff488ad691cf461dd64f1,59334569670,True,0.089125,54800000000000.0,1740000000000.0,,,,,
0xb1231a4a2dd02f2276fa3c5e2a2f3436e6bfed23,HYPE,23.41,243.35,5696.82,buy,24-02-2025 02:24,-2815.53,close short,317.3284,0xb7b5f9744b9ccd4a581f041e555b82014d0008d7f1884b25b301a69e980fe27e,74309150792,True,1.993888,355000000000000.0,1740000000000.0,,,,,
0x75f7eeb85dc639d5e99c78f95393aa9a5f1170d4,GRIFFAIN,0.22454,967.0,217.13,sell,31-01-2025 05:00,137672.0,close long,6.71098,0x08f4e9a8f57a64776e49041cd5c4d102012b00771bc80f803d7a580a55d8e76d,67854953268,False,0.020844,514000000000000.0,1740000000000.0,,,,,
0xb1231a4a2dd02f2276fa3c5e2a2f3436e6bfed23,BTC,43027.0,0.0003,12.91,buy,02-02-2024 09:46,-0.93069,close short,-0.01374,0xaf6ca93dfe1f1b00918f04076e2f6b02011f007beade49e456cd2eb60607bf3c,8669670658,True,0.003227,682000000000000.0,1710000000000.0,2024-02-02 09:46:00,2024-02-02,Greed,63.0,9.0
0xbee1707d6b44d4d52bfe19e41f8a828645437aab,@107,25.2,45.7,1151.64,sell,19-12-2024 11:09,31169.9941,sell,5.450213,0x7e0d69affdb3d8dcbf9a04199786c301a500a710da67567d480b68b1a436c313,56528950822,False,0.057582,737000000000000.0,1730000000000.0,,,,,
0xbee1707d6b44d4d52bfe19e41f8a828645437aab,@107,26.02,22.5,585.45,buy,26-12-2024 06:51,7365.476428,buy,0.0,0xb3d89635f43d401e6c1d041a002589020193003161178b3bcd1f6e272de8f21d,58657641684,False,0.00112498,76800000000000.0,1740000000000.0,,,,,
0x513b8629fe877bb581bf244e326a047b249c4ff1,BTC,85331.0,0.09975,8511.77,sell,18-04-2025 00:10,37.76123,close long,34.97235,0x326186dc9ef500c5b12d0421bc3be20202bf00616ee03113f29fb353549ca3b2,87215644427,True,1.957706,269000000000000.0,1740000000000.0,,,,,
0xb1231a4a2dd02f2276fa3c5e2a2f3436e6bfed23,HYPE,25.676,9.42,241.87,sell,14-02-2025 02:19,-20592.85,open short,0.0,0xd5efafc63a0864c23dba041db3e84c015300687a6b9d78abf5472e9dc7b2e42a,72106248615,True,0.07256,783000000000000.0,1740000000000.0,,,,,
0xbee1707d6b44d4d52bfe19e41f8a828645437aab,HYPE,26.757,1.24,33.18,sell,15-02-2025 09:16,-197.61,open short,0.0,0xd7033a8823a684604c5b041dc8b26401b0003db0e6c3e74d787c1f426ab66cde,72434869035,True,0.011612,876000000000000.0,1740000000000.0,,,,,
0x28736f43f1e871e6aa8b1148d38d4994275d72c4,PENDLE,2.8358,176.0,499.1,buy,25-02-2025 12:47,2674.0,open long,0.0,0xb614342e5c90e1f86d03041e6cd4ed02031300d495dea2aa33993caeb20d8701,74720829290,True,0.174685,76100000000000.0,1740000000000.0,,,,,
0xbee1707d6b44d4d52bfe19e41f8a828645437aab,HYPE,12.983,76.25,989.95,buy,29-03-2025 10:04,13685.41,open long,0.0,0x652f5c558fe8920ce63404207aad0c01db0004ace0c0d480bf1f8fe17f15cf4f,82436950561,True,0.296986,129000000000000.0,1740000000000.0,,,,,
0xa0feb3725a9335f49874d7cd8eaad6be45b27416,HYPE,21.072,20.47,431.34,buy,25-02-2025 00:45,2661.86,open long,0.0,0x0000000000000000000000000000000000000000000000000000000000000000,74502381401,False,0.021567,609000000000000.0,1740000000000.0,,,,,
0x28736f43f1e871e6aa8b1148d38d4994275d72c4,BTC,94506.0,0.0125,1181.33,sell,12-02-2025 19:15,0.37559,close long,-22.205,0x034331ccabdb678ddd74041d9febf20203d10019a03e6e2460138f9c507f4d43,71742240468,True,0.413463,800000000000000.0,1740000000000.0,2025-12-02 19:15:00,2025-12-02,,,19.0
0xbee1707d6b44d4d52bfe19e41f8a828645437aab,@107,19.133,10.0,191.33,buy,25-02-2025 08:49,3498.626415,buy,0.0,0x73f9586f503bf5a65c9f041e6a23fd02022e007badf7a9a9a5053a5649661391,74656940599,True,0.00349997,656000000000000.0,1740000000000.0,,,,,
0xbee1707d6b44d4d52bfe19e41f8a828645437aab,HYPE,14.452,13.75,198.72,sell,11-03-2025 13:57,-1390.82,open short,0.0,0xc96f422cbc45a7c04bfd041f547407020102000e9b85c2d0baa44495f93eff8c,78986774584,True,0.059614,1110000000000000.0,1740000000000.0,2025-11-03 13:57:00,2025-11-03,,,13.0
0x75f7eeb85dc639d5e99c78f95393aa9a5f1170d4,ZEREBRO,0.14061,3557.0,500.15,buy,20-01-2025 05:44,-5369.0,close short,31.58616,0x06b8f7391e235cdd1bf9041be185b20203b30071f6edddf9bbc9fd4182969db1,64577961105,True,0.168049,1030000000000000.0,1740000000000.0,,,,,
0xbee1707d6b44d4d52bfe19e41f8a828645437aab,@107,25.2,142.05,3579.66,sell,19-12-2024 11:09,30926.5241,sell,16.940978,0x2ba199b44f19d8acff5d04199787000170004b8035b7018ad61e9cd865fc0a57,56528965178,False,0.178983,367000000000000.0,1730000000000.0,,,,,
0x513b8629fe877bb581bf244e326a047b249c4ff1,BTC,85259.0,0.02344,1998.47,sell,19-04-2025 18:30,108.10027,close long,8.74312,0x224e005eef8b8335bc080421d880b801d200a67e16b4427467a3e116173ca001,87478608767,True,0.459648,784000000000000.0,1750000000000.0,,,,,
0xb1231a4a2dd02f2276fa3c5e2a2f3436e6bfed23,HYPE,15.922,18.77,298.86,sell,08-03-2025 20:16,7311.28,close long,4.084352,0x772e3ac8986c1cb05711041f273e700201e5002ed0a8f2f3f033166f79d7aa4b,78216321870,True,0.104599,893000000000000.0,1740000000000.0,2025-08-03 20:16:00,2025-08-03,,,20.0
0x513b8629fe877bb581bf244e326a047b249c4ff1,BTC,92933.0,0.1076,9999.59,sell,24-04-2025 23:02,27.49828,close long,4.304,0x5edcb07c73b385bdae9204222c48760201b90050797e5570b797af975afea5e2,88643113971,True,2.299905,24500000000000.0,1750000000000.0,,,,,
0x28736f43f1e871e6aa8b1148d38d4994275d72c4,XRP,3.1714,78.0,247.37,sell,22-01-2025 15:19,-239.0,open short,0.0,0x76cee058923683fa02b3041c1e453f0201da001480ae70662bd4b6bab495254d,65565635348,True,0.086579,574000000000000.0,1740000000000.0,,,,,
0x083384f897ee0f19899168e3b1bec365f52a9012,ETH,2261.8,0.233,527.0,buy,01-03-2025 08:12,-1296.2433,close short,74.46913,0x85ab0b5e28b45fd7071d041eac029801bf00a6da3af47f9a8aa30e414e36ad75,76019886337,False,0.026349,28800000000000.0,1740000000000.0,2025-01-03 08:12:00,2025-01-03,Greed,74.0,8.0
0x513b8629fe877bb581bf244e326a047b249c4ff1,HYPE,12.886,3.0,38.66,buy,17-03-2025 04:27,0.0,open long,0.0,0x17de713e595445fb5928041fb13a2201e900119f501dfba4939a745acac51a69,80239763359,True,0.012988,998000000000000.0,1740000000000.0,,,,,
0x513b8629fe877bb581bf244e326a047b249c4ff1,BTC,85374.0,0.00015,12.81,sell,18-04-2025 00:10,94.74469,close long,0.05904,0x326186dc9ef500c5b12d0421bc3be20202bf00616ee03113f29fb353549ca3b2,87215644427,True,0.002945,1080000000000000.0,1740000000000.0,,,,,
0xbee1707d6b44d4d52bfe19e41f8a828645437aab,HYPE,14.443,247.28,3571.47,sell,10-03-2025 21:06,1070.0,close long,18.867464,0x9a85696e0e82dd73e840041f48db37020252008ea60b6aadeb60cca96ed09a85,78728954570,True,1.071439,788000000000000.0,1740000000000.0,2025-10-03 21:06:00,2025-10-03,,,21.0
0x28736f43f1e871e6aa8b1148d38d4994275d72c4,DOGE,0.33704,459.0,154.7,sell,30-01-2025 21:24,15606.0,close long,1.570698,0xd8ed74f65c9699e99cfe041cd0ac050201e80033ffb145321c758e4aef078fe9,67783915777,True,0.054145,549000000000000.0,1740000000000.0,,,,,
0xbaaaf6571ab7d571043ff1e313a9609a10637864,HYPE,20.275,49.53,1004.22,buy,25-02-2025 03:43,132071.16,open long,0.0,0xb299cd6ddc06265b3131041e66aafa0203af00e526b2cd0c56bbd6cef5d167ef,74479445881,False,0.096405,122000000000000.0,1740000000000.0,,,,,
0x271b280974205ca63b716753467d5a371de622ab,BTC,82620.0,0.00605,499.85,buy,10-04-2025 05:28,-17.79551,close short,0.23474,0x4db07461443983574bb504213d7b1b01c100f298a37edee65334f0c090dc0c5c,85452914712,True,0.167949,73800000000000.0,1740000000000.0,2025-10-04 05:28:00,2025-10-04,,,5.0
0xa0feb3725a9335f49874d7cd8eaad6be45b27416,@107,17.686,6.29,111.24,buy,26-04-2025 17:12,7282.116692,buy,0.0,0x2d09093e9f799c6182d2042248bcff02085e004def3a614c31a2ec0d26079b34,88730849031,False,0.00062897,722000000000000.0,1750000000000.0,,,,,
0x23e7a7f8d14b550961925fbfdaa92f5d195ba5bd,@107,15.061,25.0,376.52,sell,16-04-2025 10:12,3773.266732,sell,-0.353087,0x563b8fbbd6df990822e90421a28a07014b00f3d777363d7e036faaefcef16525,86864289632,True,0.131783,790000000000000.0,1740000000000.0,,,,,
0x8477e447846c758f5a675856001ea72298fd9cb5,SOL,130.61,3.82,498.93,buy,01-09-2024 16:43,11.4,open long,0.0,0x8da22ed4784e2ac53ce40410c25b1e011b00b26e30b8eba0acb0edf30b03e810,36376738765,True,0.174625,163000000000000.0,1730000000000.0,2024-01-09 16:43:00,2024-01-09,Extreme Greed,76.0,16.0
0x8477e447846c758f5a675856001ea72298fd9cb5,kPEPE,0.008149,120125.0,978.9,sell,22-04-2025 17:04,-4905244.0,open short,0.0,0xe2c29c540b937a5cb7b60422077ac1018200d9e6ac6e60505fe6aa07f4b68bcb,87992531302,True,0.342614,1070000000000000.0,1750000000000.0,,,,,
0xbee1707d6b44d4d52bfe19e41f8a828645437aab,@107,29.4,268.66,7898.6,sell,20-12-2024 21:03,30018.8056,sell,882.725632,0xdf63ae20062ec81522ab0419b25c9e0203a300f9485281ea6308ce0e6692d46b,57109085526,False,0.39493,946000000000000.0,1730000000000.0,,,,,
0xbee1707d6b44d4d52bfe19e41f8a828645437aab,@107,13.97,0.83,11.6,sell,10-12-2024 15:38,32528.78367,sell,0.441802,0x0000000000000000000000000000000000000000000000000000000000000000,54250791283,False,0.0,897000000000000.0,1730000000000.0,2024-10-12 15:38:00,2024-10-12,Neutral,49.0,15.0
0x513b8629fe877bb581bf244e326a047b249c4ff1,BTC,85038.0,0.44,37416.72,sell,16-04-2025 21:42,16.86107,close long,231.924,0x71d72a1d7ab8f7a961a60421aa5b980185009c0bd1efce4fd05a0f38d73d3e51,86974982935,True,8.605845,542000000000000.0,1740000000000.0,,,,,
0xbee1707d6b44d4d52bfe19e41f8a828645437aab,HYPE,24.5,13.79,337.85,buy,21-02-2025 21:02,-5383.68,close short,7.958209,0xeda86db121bfed8fb4a3041e3194080201970095d0f20299869e42b2371d2d29,73797836466,False,0.033785,100000000000000.0,1740000000000.0,,,,,
0xb899e522b5715391ae1d4f137653e7906c5e2115,SOL,137.44,4.0,549.76,buy,09-03-2025 08:13,-2614.48,close short,3.1052,0x538e51f6c258602ed4a3041f2f64bd016a000647636ea40b2e292e26049fbc85,78301942116,True,0.13744,369000000000000.0,1740000000000.0,2025-09-03 08:13:00,2025-09-03,,,8.0
0xbd5fead7180a9c139fa51a103cb6a2ce86ddb5c3,ENA,1.136,14.0,15.9,sell,15-12-2024 07:59,-171215.0,open short,0.0,0x4508f8f9d137a1749b730419426e7401ce00d8b8d4df6fb36cc963723129ff1a,55501359591,False,0.00159,526000000000000.0,1730000000000.0,,,,,
0xb1231a4a2dd02f2276fa3c5e2a2f3436e6bfed23,@107,17.98,3.34,60.05,sell,12-12-2024 16:09,60833.75,sell,60.053167,0x0000000000000000000000000000000000000000000000000000000000000000,54883143825,False,0.006005,1050000000000000.0,1730000000000.0,2024-12-12 16:09:00,2024-12-12,Extreme Greed,83.0,16.0
0xbee1707d6b44d4d52bfe19e41f8a828645437aab,HYPE,12.756,394.79,5035.94,sell,13-03-2025 12:43,767.64,close long,46.743136,0x809da0aeb87629e2663c041f7509740201a9007f0f96be36ca5a5ebc807550ac,79540635007,True,1.510782,16900000000000.0,1740000000000.0,,,,,
0x4acb90e786d897ecffb614dc822eb231b4ffb9f4,SUI,4.2523,1763.7,7499.78,sell,19-12-2024 08:26,51885.0,close long,251.32725,0x980b3094e31b9487f1ab04199534980201fe0038c0e76048dee964365547d9e0,56496228558,True,2.624923,619000000000000.0,1730000000000.0,,,,,
0x4f93fead39b70a1824f981a54d4e55b278e9f760,BTC,97897.0,0.07152,7001.59,buy,16-01-2025 20:16,11.54368,open long,0.0,0x337a32102361441cd62b041b9b40520202d2005a8efee7f55db7952227af6787,63485704338,True,2.100478,596000000000000.0,1740000000000.0,,,,,
0xb1231a4a2dd02f2276fa3c5e2a2f3436e6bfed23,HYPE,23.204,18.96,439.95,buy,02-02-2025 04:51,-11468.65,close short,51.24888,0x0882dc6208261505b6f6041cf5f0c801b10092de5beb10994fb13e3f998c71c1,68338087946,True,0.153981,450000000000000.0,1740000000000.0,2025-02-02 04:51:00,2025-02-02,Greed,60.0,4.0
0xa0feb3725a9335f49874d7cd8eaad6be45b27416,ONDO,1.3442,120.0,161.3,buy,08-02-2025 19:46,2077.0,open long,0.0,0xcf159338a21ccc041fb7041d60eb570201950085809e6cb5b2c90f4a225acfec,70696535258,False,0.01613,453000000000000.0,1740000000000.0,2025-08-02 19:46:00,2025-08-02,,,19.0
0x28736f43f1e871e6aa8b1148d38d4994275d72c4,ETH,2431.1,0.125,303.89,sell,25-02-2025 18:42,0.125,close long,8.725,0x0edac565a17bce80aeb6041e70ded402013500a12bf4a5e19222b5f08f414f50,74834019575,True,0.10636,623000000000000.0,1740000000000.0,,,,,
0xbaaaf6571ab7d571043ff1e313a9609a10637864,HYPE,16.021,123.37,1976.51,sell,07-03-2025 20:39,46740.18,close long,72.714278,0x00f4bf283210e09cb09f041f17055702026900bab3394dcf73495437996023ea,77962361891,True,0.494127,437000000000000.0,1740000000000.0,2025-07-03 20:39:00,2025-07-03,,,20.0
0xbee1707d6b44d4d52bfe19e41f8a828645437aab,HYPE,19.785,1.06,20.97,sell,25-02-2025 22:15,-467.06,open short,0.0,0x5f282ec5d3ee909d6b9d041e7347720201ee0048be7e1482a1f135b36995421c,74903207914,True,0.00734,871000000000000.0,1740000000000.0,,,,,
0xbee1707d6b44d4d52bfe19e41f8a828645437aab,HYPE,15.91,32.02,509.44,sell,12-04-2025 13:36,-2186.32,open short,0.0,0xefd0f622be81efb25777042163aed402020300d1f59f269a4455b1b21bbfcd78,85981277124,True,0.178303,226000000000000.0,1740000000000.0,2025-12-04 13:36:00,2025-12-04,,,13.0
0xb1231a4a2dd02f2276fa3c5e2a2f3436e6bfed23,ETH,2528.3,0.012,30.34,buy,18-01-2024 03:26,19.7366,open long,0.0,0x7c4deaff9f88cae0ed5c0407331b75016b007b1b1d59d0c9c5d73bceea5e0a03,7381754123,True,0.007584,1120000000000000.0,1710000000000.0,,,,,
0x4acb90e786d897ecffb614dc822eb231b4ffb9f4,SUI,2.2763,219.6,499.88,sell,31-03-2025 19:38,26949.1,close long,11.120544,0x7e730897f950c3a1b0f60420a2490c020208000a372c09c6a2cfc6282387a99c,82936469561,True,0.174956,36800000000000.0,1740000000000.0,,,,,
0x8477e447846c758f5a675856001ea72298fd9cb5,kBONK,0.0153,6795.0,103.96,buy,23-04-2025 05:57,-6031279.0,close short,-3.730455,0x123f487904db400041ca0422104571020446004dc41834774dd6a8c49cce04b8,88146093924,False,0.010396,346000000000000.0,1750000000000.0,,,,,
0x271b280974205ca63b716753467d5a371de622ab,SOL,139.34,9.71,1352.99,sell,19-04-2025 20:06,-2578.09,open short,0.0,0x907580f0a20a912029f60421d9910f012400d5b8a7ebd20c78c57648e70b4777,87487218625,True,0.389661,781000000000000.0,1750000000000.0,,,,,
0xb1231a4a2dd02f2276fa3c5e2a2f3436e6bfed23,HYPE,23.8,48.96,1165.25,buy,06-02-2025 21:19,-5921.89,close short,123.94224,0x277ebc75f3588e5c775f041d419ac9020202006c524bdfa6cfc1f04ee484543f,70177940119,True,0.407836,1010000000000000.0,1740000000000.0,2025-06-02 21:19:00,2025-06-02,,,21.0
0x8477e447846c758f5a675856001ea72298fd9cb5,ZRO,4.9601,183.0,907.7,sell,20-07-2024 23:59,-18707.6,open short,0.0,0x5057557196472486c43e040dd124be012b000b0c326f1eaef25a9ff508869889,30545872036,True,0.317694,728000000000000.0,1720000000000.0,,,,,
0x28736f43f1e871e6aa8b1148d38d4994275d72c4,MKR,1496.3,0.0334,49.98,buy,24-02-2025 02:39,-0.6875,close short,1.30093,0xa818e4e1d94cd78ae84b041e55867f01480005d23c60269e7f5785918504168f,74310284871,True,0.017491,646000000000000.0,1740000000000.0,,,,,
0x28736f43f1e871e6aa8b1148d38d4994275d72c4,ETH,2182.3,0.0255,55.65,buy,01-03-2025 17:01,5.0,open long,0.0,0xc8de7e32d599fa78b4f6041eb20cd40203fe0053de786a3dc93f8d761af54664,76094148826,True,0.019477,263000000000000.0,1740000000000.0,2025-01-03 17:01:00,2025-01-03,Greed,74.0,17.0
0xbee1707d6b44d4d52bfe19e41f8a828645437aab,HYPE,27.536,4.03,110.97,sell,14-02-2025 19:55,-3601.29,open short,0.0,0xc23bd820411bf87fe533041dbfab840201310023d698287c87a25710996136cd,72274104148,True,0.038839,383000000000000.0,1740000000000.0,,,,,
0x513b8629fe877bb581bf244e326a047b249c4ff1,BTC,94082.0,0.10629,9999.98,buy,28-04-2025 19:32,3.85516,open long,0.0,0x1a5a2285991bb59abd9c04226aad4502014c008e3fbbc585e5bd547c5c6276d4,89541727306,True,2.299994,831000000000000.0,1750000000000.0,,,,,
0x4f93fead39b70a1824f981a54d4e55b278e9f760,BTC,104211.0,0.02166,2257.21,buy,19-01-2025 06:30,-1.98993,close short,4.02876,0x3b6bc931e327bd012353041bcd8c6902018f00bdbe83769d77ef200935723e67,64166845807,True,0.677163,661000000000000.0,1740000000000.0,,,,,
0xb899e522b5715391ae1d4f137653e7906c5e2115,BTC,83462.0,0.00984,821.27,sell,12-03-2025 07:13,-7.6112,open short,0.0,0xa41fd61332fd96bfe5c2041f6074ed0201d40067459fd46f1f19199cb1ae798b,79211580341,True,0.205316,1080000000000000.0,1740000000000.0,2025-12-03 07:13:00,2025-12-03,,,7.0
0xb899e522b5715391ae1d4f137653e7906c5e2115,SOL,121.73,57.5,6999.48,buy,11-03-2025 10:35,-438.25,close short,-80.868,0x7a534e7861d8e523d60f041f5225770203530025a2095b7ee5904c3dcae80c82,78951366931,True,1.749868,347000000000000.0,1740000000000.0,2025-11-03 10:35:00,2025-11-03,,,10.0
0x28736f43f1e871e6aa8b1148d38d4994275d72c4,kPEPE,0.020241,7660.0,155.05,buy,22-11-2024 23:31,175583.0,open long,0.0,0xa106bff80f86883cb1e6041772f26501b0007783c36fd3821e66b49add6546a0,49335251132,True,0.054266,817000000000000.0,1730000000000.0,,,,,
0xbaaaf6571ab7d571043ff1e313a9609a10637864,HYPE,13.25,50.0,662.5,buy,11-03-2025 06:03,132086.04,open long,0.0,0x429a474b5a35636ddc6e041f4f0fc702019000c0305cbd8b78e654ac2e5659af,78766120810,False,0.0,108000000000000.0,1740000000000.0,2025-11-03 06:03:00,2025-11-03,,,6.0
0xbee1707d6b44d4d52bfe19e41f8a828645437aab,@107,30.04,8.8,264.35,buy,20-12-2024 21:19,40263.18459,buy,0.0,0x72fcb8509618acf0693a0419b2858a02019b00e931ddfc167642171a1f4be5d0,57113783715,True,0.00263998,885000000000000.0,1730000000000.0,,,,,
0x47add9a56df66b524d5e2c1993a43cde53b6ed85,@107,10.5,14.28,149.94,buy,04-12-2024 03:32,920.6218108,buy,0.0,0x706c3fb8298f0b9f5cc004185a036002022600d4c2b887010d5fc9509ee3c855,52388271546,False,0.00137085,23900000000000.0,1730000000000.0,2024-04-12 03:32:00,2024-04-12,Extreme Greed,79.0,3.0
0xaf40fdc468c30116bd3307bcbf4a451a7ebf1deb,BTC,87450.0,0.00167,146.04,buy,26-03-2025 07:46,0.31677,open long,0.0,0x6b5575a89df6f070c5b004204776610202670012622383a31328f77d95bcf898,81824207328,False,0.014604,841000000000000.0,1740000000000.0,,,,,
0x4f93fead39b70a1824f981a54d4e55b278e9f760,ETH,3064.8,1.4633,4484.72,sell,19-04-2024 02:27,21.4021,close long,23.763992,0xed697c1784fcd4a9c675040888865001fe00ea286ffaee4d81ed9c4769fcc0e7,19067084791,True,1.569652,1030000000000000.0,1710000000000.0,,,,,
0xbee1707d6b44d4d52bfe19e41f8a828645437aab,HYPE,18.868,69.71,1315.29,sell,29-04-2025 17:22,-794.31,open short,0.0,0x277fc1242a7edfe75c28042279822902012900826be809efb026d772ba2731a6,89750008181,True,0.394586,547000000000000.0,1750000000000.0,,,,,
0xbaaaf6571ab7d571043ff1e313a9609a10637864,HYPE,11.717,120.3,1409.56,buy,03-04-2025 15:24,40198.4,open long,0.0,0x345c881325e72258f3d10420d10b5f02032000449836928c341cb1c84e685dc7,83555405448,False,0.070477,691000000000000.0,1740000000000.0,2025-03-04 15:24:00,2025-03-04,Extreme Fear,15.0,15.0
0xa0feb3725a9335f49874d7cd8eaad6be45b27416,HYPE,25.908,41.09,1064.56,sell,20-12-2024 18:29,3990.65,close long,46.953543,0x3ec8d26a09e735ce2cc60419b0d0d700001e150f31e9ac5db468b453f5cc48fc,56796599594,False,0.053227,739000000000000.0,1730000000000.0,,,,,
0x47add9a56df66b524d5e2c1993a43cde53b6ed85,HBAR,0.28917,3120.0,902.21,buy,19-12-2024 01:44,-3120.0,close short,17.7996,0x7aa5dd61cad468a8864c04198f73810203dd003c2468d2e8ec5f2b2a7b880849,56367471045,True,0.303142,24200000000000.0,1730000000000.0,,,,,
0xbee1707d6b44d4d52bfe19e41f8a828645437aab,HYPE,14.656,110.56,1620.37,sell,10-03-2025 06:23,7710.38,close long,27.949568,0xd258b3421a15750b5668041f3ea8870201e100396ac61e25787aff7ef4b34674,78540081172,True,0.48611,554000000000000.0,1740000000000.0,2025-10-03 06:23:00,2025-10-03,,,6.0
0x92f17e8d81a944691c10e753af1b1baae1a2cd0d,FARTCOIN,0.75336,3265.7,2460.25,sell,22-12-2024 06:28,-76654.3,open short,0.0,0x8ff45ae87d2fefc043b20419c692ea01e1008b89471e7048dcd369260f5531e7,57569962421,True,0.861086,439000000000000.0,1730000000000.0,,,,,
0x513b8629fe877bb581bf244e326a047b249c4ff1,SOL,148.18,11.85,1755.93,sell,01-05-2025 05:55,42318.62,close long,12.60603,0xeeb63a8706e6877761bb04229248a902011a00136ba57fb21a904d3823d97bc5,90100478094,True,0.403864,104000000000000.0,1750000000000.0,2025-01-05 05:55:00,2025-01-05,Greed,72.0,5.0
0x4f93fead39b70a1824f981a54d4e55b278e9f760,ETH,3420.0,6.0969,20851.4,buy,24-06-2024 02:55,24.9677,open long,0.0,0x3e1fd9b5cde232ce9b92040c2bb7670122009942a3d3e008c8316e3c423dda30,27240033489,True,7.297989,708000000000000.0,1720000000000.0,,,,,
0x513b8629fe877bb581bf244e326a047b249c4ff1,BTC,91170.0,0.01112,1013.81,sell,22-04-2025 23:03,58.09007,close long,5.173024,0x36315be5779a8e346fab04220b98180202f200b1c0d190d4574344a88e1789e2,88074001681,True,0.233176,254000000000000.0,1750000000000.0,,,,,
0x513b8629fe877bb581bf244e326a047b249c4ff1,BTC,87386.0,3.43297,299993.52,buy,21-04-2025 17:51,32.31794,open long,0.0,0xa51f91f3c5e6252256810421f7d1c801c60047ce3f3e9c9993f5bb2fed7388ad,87783068153,True,68.998508,774000000000000.0,1750000000000.0,,,,,
0xbee1707d6b44d4d52bfe19e41f8a828645437aab,@107,27.3,1.19,32.49,sell,01-02-2025 07:11,534.8496141,sell,1.170401,0x0000000000000000000000000000000000000000000000000000000000000000,68108390752,False,0.003248,1070000000000000.0,1740000000000.0,2025-01-02 07:11:00,2025-01-02,Greed,70.0,7.0
0xbaaaf6571ab7d571043ff1e313a9609a10637864,HYPE,20.274,32.92,667.42,buy,25-02-2025 03:43,133302.87,open long,0.0,0xfc430f7e23c99a7225a8041e66ab6b02027d00c9aba4da256417bca6196990b2,74479445882,False,0.064072,714000000000000.0,1740000000000.0,,,,,
0x23e7a7f8d14b550961925fbfdaa92f5d195ba5bd,HYPE,19.15,2.12,40.6,sell,23-04-2025 10:30,3945.17,close long,0.277508,0x6877a2b74cdd1ecba8a304221362230202b000b0cfa0d4a19dd41c0ce2c3d139,88209834406,False,0.004059,189000000000000.0,1750000000000.0,,,,,
0xb1231a4a2dd02f2276fa3c5e2a2f3436e6bfed23,BTC,42896.0,0.005,214.48,buy,06-02-2024 08:12,1.43346,open long,0.0,0x53173acd347ec508332d04077d8635013f00962cfcb311331418c06cd7738c9e,8914542116,True,0.05362,1010000000000000.0,1710000000000.0,2024-06-02 08:12:00,2024-06-02,Greed,73.0,8.0
0x513b8629fe877bb581bf244e326a047b249c4ff1,BTC,85600.0,0.22353,19134.17,sell,13-04-2025 02:21,0.22353,close long,140.399193,0x15aab441597bf611451204216c5cef020170004d1768e2f1d35f7e1ecc38815b,86099137215,True,4.783542,481000000000000.0,1740000000000.0,,,,,
0xbee1707d6b44d4d52bfe19e41f8a828645437aab,HYPE,14.318,34.97,500.7,buy,10-03-2025 20:57,3112.68,open long,0.0,0x995ac4c4a468b038d2ce041f48c01b01e00046b3b20c51f40579f6017a4274c6,78726105082,True,0.15021,986000000000000.0,1740000000000.0,2025-10-03 20:57:00,2025-10-03,,,20.0
0x8477e447846c758f5a675856001ea72298fd9cb5,kBONK,0.015233,15600.0,237.63,sell,23-04-2025 05:06,-5264916.0,open short,0.0,0x75c8c869b5a24a44c3da04220fb0e102016d00fcc88684f49fe763157339cdec,88138058324,True,0.083172,572000000000000.0,1750000000000.0,,,,,
0x4f93fead39b70a1824f981a54d4e55b278e9f760,ETH,2710.2,16.9,45802.38,buy,04-08-2024 23:39,20.9511,open long,0.0,0x27daab89a345b622f9e9040eae9483019b00d69ee86a5305a647a1de89976477,32445709967,True,16.030833,626000000000000.0,1720000000000.0,2024-04-08 23:39:00,2024-04-08,Extreme Greed,76.0,23.0
0xb899e522b5715391ae1d4f137653e7906c5e2115,SOL,145.51,1.0,145.51,sell,06-03-2025 20:11,2191.83,close long,0.2825,0x9b1c3171e4622af68dae041f0645130202fe00326493902e80078fca33740a65,77670237968,True,0.041905,185000000000000.0,1740000000000.0,2025-06-03 20:11:00,2025-06-03,,,20.0
0x271b280974205ca63b716753467d5a371de622ab,BTC,93054.0,0.1129,10505.8,buy,23-04-2025 03:19,-19.84219,close short,-266.73754,0xea8b615241af2e44ca2c04220e77910204aa00742821be90755473ad8b8fc8f4,88110273711,True,3.025668,18200000000000.0,1750000000000.0,,,,,
0x23e7a7f8d14b550961925fbfdaa92f5d195ba5bd,@107,22.008,94.15,2072.05,buy,24-01-2025 03:45,1905.188781,buy,0.0,0xa3d45ab716078c0d3dd3041c477dbb020192009e595880559d98fea58004c31b,66047624387,True,0.03295247,1060000000000000.0,1740000000000.0,,,,,
0x4acb90e786d897ecffb614dc822eb231b4ffb9f4,HYPE,17.466,11.45,199.99,buy,25-02-2025 15:43,5108.9,open long,0.0,0x0370d364b11b608786b7041e6ed47a02074000facba0279ff064702c437d0754,74778150195,True,0.069994,761000000000000.0,1740000000000.0,,,,,
0x47add9a56df66b524d5e2c1993a43cde53b6ed85,BTC,99844.0,0.00649,647.99,buy,16-01-2025 06:20,-0.06,close short,-32.489589,0xe6cb8d30ac62f55b0d12041b8f3039020171006bce411bafcace1a358191aca3,63335300628,True,0.217723,426000000000000.0,1740000000000.0,,,,,
0x4acb90e786d897ecffb614dc822eb231b4ffb9f4,BTC,82243.0,1.16736,96007.19,sell,10-04-2025 18:00,13.2028,close long,644.9664,0xa09ecd91122168c011e30421460b2d0207d20042e1d92a0ce0182531a1f02ddc,85566632472,True,28.802156,1010000000000000.0,1740000000000.0,2025-10-04 18:00:00,2025-10-04,,,18.0
0xbd5fead7180a9c139fa51a103cb6a2ce86ddb5c3,BTC,85670.0,0.00583,499.46,buy,07-03-2025 06:32,3.99261,open long,0.0,0xefbbabcb2813cd049bb0041f0d54840207a300ad2d39f45dc5eef5375251aedb,77804060305,True,0.149836,514000000000000.0,1740000000000.0,2025-07-03 06:32:00,2025-07-03,,,6.0
0x39cef799f8b69da1995852eea189df24eb5cae3c,XRP,1.9469,122289.0,238084.45,sell,10-04-2025 22:59,-38740.0,open short,0.0,0x9944fd27130302157e2e0421497ca2020313002bd9e21800f4d5b9c224511a77,85647936452,False,11.904222,370000000000000.0,1740000000000.0,2025-10-04 22:59:00,2025-10-04,,,22.0
0xbaaaf6571ab7d571043ff1e313a9609a10637864,HYPE,22.629,10.0,226.29,buy,24-02-2025 07:03,3775.53,open long,0.0,0x7800bc2f5f98d8298445041e587ee10202550016e32fcf6183bd5fb1bb3ed1aa,73505718926,False,0.021723,1010000000000000.0,1740000000000.0,,,,,
0xbaaaf6571ab7d571043ff1e313a9609a10637864,HYPE,11.7,6.33,74.06,sell,04-04-2025 19:24,15420.52,close long,3.325782,0xa2f1aa45928bf5526b120420e4765202043000293030ff4d2abb031b9428b410,83921650126,True,0.022218,565000000000000.0,1740000000000.0,2025-04-04 19:24:00,2025-04-04,Fear,28.0,19.0
0x4f93fead39b70a1824f981a54d4e55b278e9f760,BTC,91623.0,0.63846,58497.62,sell,10-01-2025 02:04,0.63846,close long,-4297.729644,0xa5a246e7b3b00b383fba041b11831202019800ce99b668093f04266d3e8be9f6,61875044905,True,20.474167,1010000000000000.0,1740000000000.0,2025-10-01 02:04:00,2025-10-01,,,2.0
0x8381e6d82f1affd39a336e143e081ef7620a3b7f,@107,24.574,10.0,245.74,sell,06-02-2025 20:39,819.811626,sell,-0.15847,0x659ca7cdc7fd97793532041d4126b702029f00fb65c51d1ffa217566f7c6aca6,70161569907,True,0.073722,57400000000000.0,1740000000000.0,2025-06-02 20:39:00,2025-06-02,,,20.0
0x92f17e8d81a944691c10e753af1b1baae1a2cd0d,FARTCOIN,0.7224,6963.9,5030.72,buy,23-12-2024 08:40,-15345.9,close short,205.992162,0xfc1107dcd4a2cc94c72b0419d63c510202a700b365fde3849473f951ba2f0ebe,57915977866,True,1.760752,247000000000000.0,1730000000000.0,,,,,
0x23e7a7f8d14b550961925fbfdaa92f5d195ba5bd,@107,22.144,87.08,1928.3,sell,24-01-2025 03:08,750.0586404,sell,13.17495,0x5fccf5dbc61debc349d4041c46cc75020213006c651e0873bc6c9744be56c95c,66039298052,True,0.674904,403000000000000.0,1740000000000.0,,,,,
0xbd5fead7180a9c139fa51a103cb6a2ce86ddb5c3,EIGEN,1.99,53.95,107.36,sell,21-02-2025 22:29,-990.9,open short,0.0,0xa4c26ab6f53ff727b07b041e3293a401d000d3c57f26c1d7e7542983b3525d92,73918622123,False,0.010736,543000000000000.0,1740000000000.0,,,,,
0xa520ded057a32086c40e7dd6ed4eb8efb82c00e0,PURR/USDC,0.16776,347.0,58.21,sell,27-01-2025 07:56,198730.35,sell,11.381271,0xbff5fffeec8b58e9cf94041c96f9eb02011a001dc92dd4aed24d4f4f2ac973fd,66769200349,True,0.020374,462000000000000.0,1740000000000.0,,,,,
0xbee1707d6b44d4d52bfe19e41f8a828645437aab,HYPE,25.713,76.08,1956.25,sell,17-02-2025 16:22,-479.57,open short,0.0,0x9b6e0d7593554c1ca5d9041ded3c2f02012300795c8a6d750c3e40d6fcf1bb88,72877721175,True,0.684685,93500000000000.0,1740000000000.0,,,,,
0x47add9a56df66b524d5e2c1993a43cde53b6ed85,HYPE,19.75,25.31,499.87,sell,25-02-2025 21:22,-1723.67,open short,0.0,0xd7ca6f35374b82811801041e72af000206050059cec781bc7bb537c81d207401,74663451099,False,0.047987,599000000000000.0,1740000000000.0,,,,,
0x7f4f299f74eec87806a830e3caa9afa5f2b9db8f,FARTCOIN,0.7678,4318.0,3315.36,buy,10-04-2025 04:02,-25360.7,close short,-32.55772,0xe4523dfb5e51b76639fc04213c7f8b015400545267a8cbdde6eb44ae1f451698,85442097871,False,0.331536,120000000000000.0,1740000000000.0,2025-10-04 04:02:00,2025-10-04,,,4.0
0x513b8629fe877bb581bf244e326a047b249c4ff1,BTC,85100.0,0.006,510.6,sell,16-04-2025 22:30,57.89212,close long,2.0544,0x7faa86f57bb58b65aa5a0421aae9b4019d009cd20abe7b153c8433f6ff17974a,86983564107,False,0.0,327000000000000.0,1740000000000.0,,,,,
0x8477e447846c758f5a675856001ea72298fd9cb5,GMX,44.2,26.68,1179.26,buy,06-06-2024 14:42,-60.99,close short,0.68034,0x36dd45c4875d2375848c040aceeb8101320028a47318760648d5a8b9831ab1e2,25132772576,False,0.117925,922000000000000.0,1720000000000.0,2024-06-06 14:42:00,2024-06-06,Extreme Greed,78.0,14.0
0xb1231a4a2dd02f2276fa3c5e2a2f3436e6bfed23,HYPE,24.602,166.49,4095.99,sell,07-02-2025 19:36,-645.08,open short,0.0,0x9835f5501a6abf7280bb041d50af3602058b003d3caef8b422910606c0a7e511,70461808227,True,1.433595,701000000000000.0,1740000000000.0,2025-07-02 19:36:00,2025-07-02,,,19.0
0x92f17e8d81a944691c10e753af1b1baae1a2cd0d,HYPE,22.747,0.89,20.24,buy,19-01-2025 18:33,27015.7,open long,0.0,0x85a201a9d67079bad815041bd7da3c0202ca006d124ef273cfe13828ae6732c1,64363449153,True,0.007085,408000000000000.0,1740000000000.0,,,,,
0xbee1707d6b44d4d52bfe19e41f8a828645437aab,@107,17.3,11.26,194.8,sell,06-03-2025 16:01,392.2225786,sell,3.420991,0x5e8a73ee3af28fcd7716041f036b700201f20022303ac9bf70e42dda69bfec46,77621884070,True,0.058439,1040000000000000.0,1740000000000.0,2025-06-03 16:01:00,2025-06-03,,,16.0
0xb1231a4a2dd02f2276fa3c5e2a2f3436e6bfed23,@107,18.49,1.0,18.49,sell,12-12-2024 19:57,57497.62,sell,18.48999,0x0000000000000000000000000000000000000000000000000000000000000000,54883939526,False,0.001849,334000000000000.0,1730000000000.0,2024-12-12 19:57:00,2024-12-12,Extreme Greed,83.0,19.0
0xa0feb3725a9335f49874d7cd8eaad6be45b27416,HYPE,17.9,25.49,456.27,buy,04-03-2025 00:43,7111.51,open long,0.0,0x14c6faa4df1a2f9abd9b041ed87c7302025400b2f5cce8159095fcea8f4ec4c1,76746319801,False,0.022813,690000000000000.0,1740000000000.0,2025-04-03 00:43:00,2025-04-03,Fear,25.0,0.0
0x513b8629fe877bb581bf244e326a047b249c4ff1,BTC,93322.0,0.10715,9999.45,buy,24-04-2025 01:11,46.70587,open long,0.0,0xe6bc2d6fcb8316230e4004221d72670201ea00a3589436563e2a38754cfe5f34,88406907259,True,2.299874,349000000000000.0,1750000000000.0,,,,,
0xa0feb3725a9335f49874d7cd8eaad6be45b27416,ONDO,1.3875,703.0,975.41,sell,13-02-2025 03:30,2941.0,close long,1.969103,0xb17bb84d9eb12d1b38ce041da4da05020139009f94c42f3071d94cc86ca5c469,71851846901,True,0.292623,613000000000000.0,1740000000000.0,,,,,
0x4f93fead39b70a1824f981a54d4e55b278e9f760,BTC,103967.0,0.0001,10.4,buy,19-01-2025 02:26,0.67547,open long,0.0,0xd1b69ca443521eaa227c041bca1b0601910028b7c4fc6c6e157dc598c70bd5c3,64126498402,True,0.003119,707000000000000.0,1740000000000.0,,,,,
0x8170715b3b381dffb7062c0298972d4727a0a63b,TRUMP,8.1,27.3,221.13,sell,19-04-2025 09:17,-48016.4,open short,0.0,0x7e67d2154cb81db0b58f0421d26ebd02011f00718e15aa70f4186b9302c4d825,86783522886,False,0.021228,636000000000000.0,1750000000000.0,,,,,
0xb899e522b5715391ae1d4f137653e7906c5e2115,SOL,144.99,7.01,1016.38,buy,02-03-2025 20:55,340.31,open long,0.0,0xdda5efe6902bea4a1d1e041ec548f7020494001abfaa38940954174a0979ddb6,76327309137,True,0.341502,656000000000000.0,1740000000000.0,2025-02-03 20:55:00,2025-02-03,Fear,44.0,20.0
0xbaaaf6571ab7d571043ff1e313a9609a10637864,HYPE,10.107,763.52,7716.9,buy,07-04-2025 04:41,23526.65,open long,0.0,0x7ff4eff93de4ce20d24b04210b63520202dc000d70e3ad720d98637e8de38994,84264598534,False,0.385844,195000000000000.0,1740000000000.0,2025-07-04 04:41:00,2025-07-04,,,4.0
0x8477e447846c758f5a675856001ea72298fd9cb5,W,0.7395,338.1,250.02,buy,07-06-2024 20:39,-23048.4,close short,0.760725,0xff8f27f2c53ef26dc449040ae7d58b011500ab84bf976c839486d6f0c8c154ff,25255991255,False,0.025002,667000000000000.0,1720000000000.0,2024-07-06 20:39:00,2024-07-06,Fear,26.0,20.0
0xbee1707d6b44d4d52bfe19e41f8a828645437aab,HYPE,16.513,32.33,533.87,sell,17-04-2025 13:44,-9864.33,open short,0.0,0xa70d64ec7cfa20ab619b0421b52b7e01bb0017be29e67bf8ec538a869c825f37,87124682412,True,0.186852,584000000000000.0,1740000000000.0,,,,,
0x4acb90e786d897ecffb614dc822eb231b4ffb9f4,SOL,119.37,229.76,27426.45,buy,03-04-2025 04:14,1207.6,open long,0.0,0x0b3299d4ffe80657ca600420c94edf0204270095e4954df10a5ebbf189b769f7,82464473039,False,2.742645,96800000000000.0,1740000000000.0,2025-03-04 04:14:00,2025-03-04,Extreme Fear,15.0,4.0
0x6d6a4b953f202f8df5bed40692e7fd865318264a,@107,26.487,1.96,51.91,sell,16-12-2024 13:39,7148.0,sell,40.843873,0xc88d9ebe6ada2704d07d04195c0c53016e00ff92c27cf35ceef8fa4511c6e345,55735706427,True,0.01817,232000000000000.0,1730000000000.0,,,,,
0xa0feb3725a9335f49874d7cd8eaad6be45b27416,HYPE,25.803,582.27,15024.31,sell,19-12-2024 03:36,583.65,close long,192.207327,0x7b16779171cba38d90960419910ec10165004aba54ba1bad95cab4ffa84d775b,56410881519,False,0.751215,362000000000000.0,1730000000000.0,,,,,
0x2c229d22b100a7beb69122eed721cee9b24011dd,SOL,254.9,123.01,31355.25,buy,22-11-2024 03:36,5.93,open long,0.0,0x37bd531993dced64585c041761a0c30201b200c55a881a69a33aadfab196cf41,49122586772,True,10.974337,900000000000000.0,1730000000000.0,,,,,
0xbee1707d6b44d4d52bfe19e41f8a828645437aab,HYPE,18.88,10.85,204.85,sell,29-04-2025 17:23,-1190.27,open short,0.0,0x883265020a35da0010f704227984e3020101000244280bd68990a01070cbe479,89750118399,True,0.061454,453000000000000.0,1750000000000.0,,,,,
0xb1231a4a2dd02f2276fa3c5e2a2f3436e6bfed23,HYPE,13.772,72.24,994.89,sell,14-03-2025 18:32,16504.16,close long,54.822936,0x9140e0913e967019d440041f899c71020190000eb2819f00ef755bdfea8ccf23,79807511273,True,0.348211,121000000000000.0,1740000000000.0,,,,,
0x513b8629fe877bb581bf244e326a047b249c4ff1,BTC,94615.0,0.00015,14.19,buy,26-04-2025 05:12,86.71479,open long,0.0,0x84a8a11c603e15c8320c0422409d5d01b700fb513b441f8a54c00721149d52c2,88964517201,True,0.003264,491000000000000.0,1750000000000.0,,,,,
0x92f17e8d81a944691c10e753af1b1baae1a2cd0d,HYPE,23.038,87.97,2026.65,buy,19-01-2025 18:40,34048.1,open long,0.0,0xbf40139b10da6a86d58e041bd7f66b0201a400556f7c78d2f8f9f001933878e6,64365737144,True,0.709328,876000000000000.0,1740000000000.0,,,,,
0xb1231a4a2dd02f2276fa3c5e2a2f3436e6bfed23,HYPE,23.546,42.47,1000.0,buy,24-02-2025 01:28,-8498.32,close short,49.60496,0xea7238ce3f0daae8b038041e54b86f01be00c2c68f1b7a614e305ef6148dbdae,74304854400,True,0.349999,16700000000000.0,1740000000000.0,,,,,
0xa0feb3725a9335f49874d7cd8eaad6be45b27416,@107,18.563,11.64,216.07,buy,23-04-2025 19:22,5829.701945,buy,0.0,0xdff23777551ebd0cb23604221979c502017b008e0d5d46d004db0a351966924c,88163006222,False,0.00116398,745000000000000.0,1750000000000.0,,,,,
0xbee1707d6b44d4d52bfe19e41f8a828645437aab,HYPE,17.795,56.29,1001.68,buy,19-04-2025 12:04,-16514.17,close short,-0.793689,0x7e09f4374cdece0532470421d444c7017200cc011f49f54ef306f889660ea21d,87444927903,True,0.300504,920000000000000.0,1750000000000.0,,,,,
0x23e7a7f8d14b550961925fbfdaa92f5d195ba5bd,@107,24.194,25.0,604.85,sell,02-02-2025 02:09,1486.800257,sell,2.302154,0x7454c815d6dc0af2c726041cf41b950201b9004af093b7d29e92cb49af457ea7,68306509730,True,0.211697,683000000000000.0,1740000000000.0,2025-02-02 02:09:00,2025-02-02,Greed,60.0,2.0
0xbaaaf6571ab7d571043ff1e313a9609a10637864,HYPE,12.587,175.09,2203.86,buy,30-03-2025 14:43,100479.41,open long,0.0,0x84566ce593f4f379c38804208e5d82019900fd4f8b74b1d50b8b73094e628f1b,82663032005,True,0.77135,951000000000000.0,1740000000000.0,,,,,
0x513b8629fe877bb581bf244e326a047b249c4ff1,BTC,94008.0,0.10637,9999.63,sell,28-04-2025 23:31,12.60971,close long,23.880065,0xed67e7de9abe94c4716a04226d721e02068500745aad1431144b3f3cb960cafc,89593472619,True,2.299915,74800000000000.0,1750000000000.0,,,,,
0xa0feb3725a9335f49874d7cd8eaad6be45b27416,HYPE,26.215,1.84,48.24,buy,15-02-2025 16:11,-1.85,close short,0.083168,0x254c5cfab61862588f0e041dcd3544013e00853c2c83e423afa687cada25cb9d,72484880389,False,0.002411,547000000000000.0,1740000000000.0,,,,,
0xbee1707d6b44d4d52bfe19e41f8a828645437aab,HYPE,17.698,2.3,40.71,sell,28-04-2025 09:17,3018.95,close long,0.86434,0x64433b1ba382b049805d042263a9a601f50049fee9afb058ad3ac7e9c5e09b94,89433982339,True,0.012211,800000000000000.0,1750000000000.0,,,,,
0x2c229d22b100a7beb69122eed721cee9b24011dd,IP,1.8711,10.0,18.71,sell,13-02-2025 18:57,7767.9,close long,0.433,0x4137cf28fcae0406402b041daee60602012700ce6d21a82c46c6f346703d4825,72009843436,False,0.001871,673000000000000.0,1740000000000.0,,,,,
0x513b8629fe877bb581bf244e326a047b249c4ff1,@107,24.893,10.0,248.93,sell,14-02-2025 00:31,2753.069748,sell,51.465938,0x889b8d1cdc3f424c30fe041db2b39202010300c462bf494a8a7e0e070baca404,72089199468,True,0.08364,691000000000000.0,1740000000000.0,,,,,
0xbaaaf6571ab7d571043ff1e313a9609a10637864,HYPE,19.361,2.0,38.72,buy,25-02-2025 07:24,239672.74,open long,0.0,0xe8dded4a1d0e29cb9438041e692aa602030800ebd1ca4c195c1d85e62dae7272,74607648914,False,0.001858,17800000000000.0,1740000000000.0,,,,,
0x92f17e8d81a944691c10e753af1b1baae1a2cd0d,FARTCOIN,1.1764,446.3,525.03,buy,23-04-2025 03:30,981696.3,open long,0.0,0x03a8b9ff0b84142fa1b104220e9715020b250036e19e6790c939e7621b393ed8,88114148455,True,0.183759,785000000000000.0,1750000000000.0,,,,,
0xa0feb3725a9335f49874d7cd8eaad6be45b27416,HYPE,23.886,68.01,1624.49,sell,16-12-2024 02:08,161.83,close long,5.121153,0x0000000000000000000000000000000000000000000000000000000000000000,55626521888,False,0.081224,906000000000000.0,1730000000000.0,,,,,
0xbee1707d6b44d4d52bfe19e41f8a828645437aab,@107,26.9,2.99,80.43,buy,31-01-2025 19:06,593.6921511,buy,0.0,0x4d1cc257884ec5440457041cdf370602025800eddd0a120023e801cdb0dff8ef,67981205871,False,0.00029899,309000000000000.0,1740000000000.0,,,,,
0xbaaaf6571ab7d571043ff1e313a9609a10637864,HYPE,13.298,1.96,26.06,buy,11-03-2025 05:58,92614.76,open long,0.0,0x0000000000000000000000000000000000000000000000000000000000000000,78808028755,False,0.0,688000000000000.0,1740000000000.0,2025-11-03 05:58:00,2025-11-03,,,5.0
0x513b8629fe877bb581bf244e326a047b249c4ff1,BTC,93245.0,0.011,1025.69,buy,25-04-2025 03:15,-60.19281,close short,0.6292,0x8543ffeb4fdab50bfa0304222f29b702012700b5ee6b85c21ed9215e3bc8ba45,88683244072,True,0.235909,896000000000000.0,1750000000000.0,,,,,
0x513b8629fe877bb581bf244e326a047b249c4ff1,@107,24.985,0.61,15.24,sell,14-02-2025 00:31,20176.96975,sell,3.195543,0x2926480c8e823afc8896041db2b25d0201ca00497223b7589c76d9a3573915d7,72089108457,True,0.00512,1080000000000000.0,1740000000000.0,,,,,
0x28736f43f1e871e6aa8b1148d38d4994275d72c4,ENA,0.87031,114.0,99.22,sell,21-01-2025 13:03,605.0,close long,3.189378,0x04d523b3ab47d0a1b47c041c008c30016e009bc22b77c20c20adf8b5227bd4e3,65207555832,True,0.034725,426000000000000.0,1740000000000.0,,,,,
0x4f93fead39b70a1824f981a54d4e55b278e9f760,ETH,3330.3,3.0031,10001.22,sell,06-04-2024 06:21,-1.5003,open short,0.0,0x86d0c997c8ab733a82d504085aa8cd02012300fee666cb7982987e1e7e06379a,16886617193,True,3.500428,250000000000000.0,1710000000000.0,2024-06-04 06:21:00,2024-06-04,Greed,73.0,6.0
0x75f7eeb85dc639d5e99c78f95393aa9a5f1170d4,NEAR,7.9751,62.8,500.84,sell,26-03-2024 17:33,3510.1,close long,20.13996,0x4e7d703fb85047a37649040833f5b0015e00d34c9324423ded94bcd4bae60bbf,15558793240,False,0.048079,6700000000000.0,1710000000000.0,,,,,
0x8477e447846c758f5a675856001ea72298fd9cb5,ANIME,0.13679,278.0,38.03,sell,21-01-2025 23:31,-36250.0,open short,0.0,0xcbb535b3ad3536618371041c0c63bc0202ea00e190fb3e2538531ac4626a9c78,65384392289,True,0.013309,950000000000000.0,1740000000000.0,,,,,
0xbaaaf6571ab7d571043ff1e313a9609a10637864,HYPE,13.269,910.81,12085.54,buy,12-03-2025 14:48,67102.99,open long,0.0,0x3dc28874d56345b9d1c4041f65bbe501ac0003de773844ba96f883b96943dc23,79163103797,False,0.604276,446000000000000.0,1740000000000.0,2025-12-03 14:48:00,2025-12-03,,,14.0
0x513b8629fe877bb581bf244e326a047b249c4ff1,BTC,84900.0,0.0118,1001.82,buy,19-04-2025 22:17,22.03328,open long,0.0,0xa847cabb64164d5388110421db08c0020228007b914c16193d14e074d2173d86,87496676650,False,0.0,43200000000000.0,1750000000000.0,,,,,
0xbaaaf6571ab7d571043ff1e313a9609a10637864,HYPE,21.458,2.0,42.92,buy,24-02-2025 13:37,106347.78,open long,0.0,0x6b5a1330766ecafa30fc041e5cfaa30205b800a5db2529d3a7a58af8082c865c,74400900711,False,0.004119,665000000000.0,1740000000000.0,,,,,
0xbee1707d6b44d4d52bfe19e41f8a828645437aab,@107,24.505,0.44,10.78,buy,18-12-2024 10:15,38639.23689,buy,0.0,0xba4fff2f78c3370e18c9041982372a0202590012cc177a0b23517789a5db2487,56184385413,True,0.00013197,644000000000000.0,1730000000000.0,,,,,
0x513b8629fe877bb581bf244e326a047b249c4ff1,BTC,94810.0,2.37301,224985.08,sell,29-04-2025 01:09,52.59969,close long,646.882526,0x18d61eeedaeadab9df2204226e8f8f017000a96ae5e23b690c6135dbf28b8714,89609661670,False,0.0,739000000000000.0,1750000000000.0,,,,,
0xb1231a4a2dd02f2276fa3c5e2a2f3436e6bfed23,ETHFI,4.7492,133.7,634.97,sell,23-05-2024 18:36,-16854.2,open short,0.0,0xe485be6cc0c343dfaeaa0409bb048802015a007ccf9846c73f2658c14a079b6f,23569613580,True,0.222238,316000000000000.0,1720000000000.0,,,,,
0xb899e522b5715391ae1d4f137653e7906c5e2115,ETH,2419.3,0.414,1001.59,buy,02-03-2025 22:09,331.8,open long,0.0,0x41e18be27eda81792ee5041ec6166202045200ba9c0cfcdc411487fbf2529da3,76363044785,True,0.336533,928000000000000.0,1740000000000.0,2025-02-03 22:09:00,2025-02-03,Fear,44.0,22.0
0x8477e447846c758f5a675856001ea72298fd9cb5,W,0.7434,642.9,477.93,sell,07-06-2024 20:18,-14516.8,open short,0.0,0xd7788d299fa5ea544321040ae78a900122009de31de1696b2c54970cf7a8574e,25254082885,True,0.167276,548000000000000.0,1720000000000.0,2024-07-06 20:18:00,2024-07-06,Fear,26.0,20.0
0xa0feb3725a9335f49874d7cd8eaad6be45b27416,BTC,96884.0,0.00974,943.65,sell,14-02-2025 21:59,0.34767,close long,0.607776,0x691fc65bb548c70cf6be041dc116310202dc00e4d818a7c56d9d2dd9af5ae93d,72307287723,False,0.047182,620000000000000.0,1740000000000.0,,,,,
0xb1231a4a2dd02f2276fa3c5e2a2f3436e6bfed23,@4,2.8718,8.0,22.97,sell,20-06-2024 00:04,3602.0,sell,0.0,0x008be83e2b3335f1c37c040bd9cbea012800604d8302c7f51187db043a988dd7,26780558028,True,0.008041,156000000000000.0,1720000000000.0,,,,,
0x083384f897ee0f19899168e3b1bec365f52a9012,SOL,172.59,34.22,5906.03,buy,03-03-2025 07:26,-2555.52,close short,1214.922926,0x97bf35030854c355f9d3041ecc83fa02011b0069b4d2bfe05b329db66d5517a5,76502914865,False,0.295301,927000000000000.0,1740000000000.0,2025-03-03 07:26:00,2025-03-03,Fear,33.0,7.0
0xbee1707d6b44d4d52bfe19e41f8a828645437aab,HYPE,15.59,19.24,299.95,buy,17-04-2025 09:12,-600.51,close short,10.914852,0x80978f67bad865abd9b60421b2221101910027e7275eade181a7a4b0e2ea5995,87094171544,True,0.104983,923000000000000.0,1740000000000.0,,,,,
0xbaaaf6571ab7d571043ff1e313a9609a10637864,HYPE,13.507,22.22,300.13,sell,02-04-2025 18:26,24901.36,close long,17.969314,0x4bfdb0182bd38db13bf90420c27fda01ed007ad6bfdd1282d3e370c1145da123,83365218219,True,0.105043,1090000000000000.0,1740000000000.0,2025-02-04 18:26:00,2025-02-04,Greed,72.0,18.0
0xbee1707d6b44d4d52bfe19e41f8a828645437aab,@107,26.964,95.21,2567.24,buy,31-01-2025 19:08,1127.924117,buy,0.0,0x0fcbf3681f6e4b6c68a3041cdf3d7b01ba0027d7480589f5042d1f99a5e0e2af,67981726657,True,0.03332346,722000000000000.0,1740000000000.0,,,,,
0x75f7eeb85dc639d5e99c78f95393aa9a5f1170d4,ME,5.4795,7098.6,38896.78,sell,11-12-2024 05:49,7098.6,close long,2512.19454,0x6b574262c9cfb00ccdc90418ed67d701b0008df7d343724286f54b28ceac38d3,54503596337,False,3.734089,150000000000000.0,1730000000000.0,2024-11-12 05:49:00,2024-11-12,Extreme Greed,80.0,5.0
0xbee1707d6b44d4d52bfe19e41f8a828645437aab,@107,17.6,443.31,7802.26,buy,13-12-2024 01:10,11717.13209,buy,0.0,0xf50ae6d8df4a9a9cbbc6041912da980201530066d81bc21bf6dd151edecb7714,54907212345,False,0.0,1010000000000000.0,1730000000000.0,,,,,
0x8477e447846c758f5a675856001ea72298fd9cb5,WLD,4.9468,112.2,555.03,sell,29-05-2024 14:47,-545.4,open short,0.0,0xc3ba2d4b5f59803c649a040a2f72230144005c322ee35f936effbbb3952278ed,24273752702,True,0.19426,189000000000000.0,1720000000000.0,,,,,
0x513b8629fe877bb581bf244e326a047b249c4ff1,BTC,95400.0,0.0005,47.7,sell,29-04-2025 22:05,11.0758,close long,0.33045,0x32031df605de83ad680c04227cb8d1018c0015e99e5da99712acd3e9e40411f6,89780797787,False,0.0,45200000000000.0,1750000000000.0,,,,,
0xb1231a4a2dd02f2276fa3c5e2a2f3436e6bfed23,@107,15.199,3.61,54.87,sell,11-12-2024 20:20,89237.57,sell,54.868354,0x0000000000000000000000000000000000000000000000000000000000000000,54678661988,False,0.005486,792000000000000.0,1730000000000.0,2024-11-12 20:20:00,2024-11-12,Extreme Greed,80.0,20.0
0x6d6a4b953f202f8df5bed40692e7fd865318264a,FARTCOIN,0.48356,516.9,249.95,sell,04-04-2025 14:33,-4152.7,open short,0.0,0x5c0f5f7c15b3b2f31ade0420e116a9017100d6bf8832549166e1e8a3c793a2e8,83852009353,True,0.083983,483000000000000.0,1740000000000.0,2025-04-04 14:33:00,2025-04-04,Fear,28.0,14.0
0x28736f43f1e871e6aa8b1148d38d4994275d72c4,@107,9.1368,10.39,94.93,sell,02-12-2024 03:22,4189.497095,sell,85.30125,0x3ba3516a2a5684bc8df2041830531101d1004c1c756205c5302cfa7f2a5cde47,51759844619,True,0.033225,273000000000000.0,1730000000000.0,2024-02-12 03:22:00,2024-02-12,Greed,70.0,3.0
0xbd5fead7180a9c139fa51a103cb6a2ce86ddb5c3,FARTCOIN,0.56408,28415.8,16028.78,buy,03-04-2025 01:46,-94811.5,close short,-1110.489464,0x481dc7ebc405d15b52de0420c79b2e02056400b98ade38791980cd392535b9ab,83383708170,True,5.610074,769000000000000.0,1740000000000.0,2025-03-04 01:46:00,2025-03-04,Extreme Fear,15.0,1.0
0xbee1707d6b44d4d52bfe19e41f8a828645437aab,HYPE,25.115,8.88,223.02,sell,21-02-2025 12:36,-5257.05,open short,0.0,0xf6a05f0b339199a9843f041e2bd8d10201200014d58a388ba4d426785d53456b,73797649337,True,0.078057,686000000000000.0,1740000000000.0,,,,,
0x47add9a56df66b524d5e2c1993a43cde53b6ed85,FTT,2.8891,232.5,671.72,sell,11-12-2024 10:22,-182.1,open short,0.0,0xce08f7ba8c75cfe742de0418f1539b01c1005b214ca6fa07ec59ca942e3062d9,54571639617,True,0.225696,157000000000000.0,1730000000000.0,2024-11-12 10:22:00,2024-11-12,Extreme Greed,80.0,10.0
0x513b8629fe877bb581bf244e326a047b249c4ff1,@107,24.701,147.83,3651.55,buy,19-12-2024 02:40,32532.48542,buy,0.0,0x147c484bc26629c952260419903f8402014000f87068f360fa778e2a7dad8ca3,56394459751,True,0.04967086,473000000000000.0,1730000000000.0,,,,,
0xa0feb3725a9335f49874d7cd8eaad6be45b27416,BTC,97656.0,0.01504,1468.75,buy,13-02-2025 03:33,0.01232,open long,0.0,0xafd21848a3c9ac6b814e041da4e01b0203d6006af9223c8940c0183cd00d018b,71858099821,False,0.073437,534000000000000.0,1740000000000.0,,,,,
0xbaaaf6571ab7d571043ff1e313a9609a10637864,HYPE,22.066,33.78,745.39,sell,24-02-2025 18:53,106926.84,close long,5.796648,0x46d08deaea4f5f2897d4041e6099d902033c009e7e16d5636d5174000230fdf3,74429390069,False,0.071556,521000000000000.0,1740000000000.0,,,,,
0x47add9a56df66b524d5e2c1993a43cde53b6ed85,@107,16.186,5.0,80.93,sell,17-04-2025 11:54,700.9518067,sell,0.06765,0x9cbd0424a06efc8edf350421b3eeaf016d0052a4badfd731ca8c954e8dcccfd5,87111863762,True,0.027192,471000000000000.0,1740000000000.0,,,,,
0x8170715b3b381dffb7062c0298972d4727a0a63b,MELANIA,0.5,1626.7,813.35,sell,11-04-2025 13:35,-1157652.6,open short,0.0,0x72b28c46dd8dd572dcce0421536d770204ce00ee5511a96ddb59c78f27ef4477,85638916285,False,0.078081,514000000000000.0,1740000000000.0,2025-11-04 13:35:00,2025-11-04,,,13.0
0x23e7a7f8d14b550961925fbfdaa92f5d195ba5bd,HYPE,18.177,51.06,928.12,sell,19-04-2025 13:30,-329.18,open short,0.0,0x21f60e9bca7d353720660421d5360001d700755c16ca2bb46515403ee95a1455,87452248678,True,0.324841,527000000000000.0,1750000000000.0,,,,,
0xa0feb3725a9335f49874d7cd8eaad6be45b27416,HYPE,24.554,113.52,2787.37,sell,15-12-2024 06:30,206.37,close long,29.11788,0x9728e87e52168273beb20419412465019c00839e34865561d7f9ed5f72b54c4e,55489444101,False,0.139368,371000000000000.0,1730000000000.0,,,,,
0x28736f43f1e871e6aa8b1148d38d4994275d72c4,MELANIA,10.708,23.6,252.71,sell,20-01-2025 15:08,49.3,close long,12.838164,0x90c257127ac060fbe53c041be9ba4902038e003d7a9df186675664dee6ca5de5,64786184054,True,0.088448,525000000000000.0,1740000000000.0,,,,,
0xbee1707d6b44d4d52bfe19e41f8a828645437aab,HYPE,13.747,36.37,499.98,sell,28-03-2025 18:18,3246.55,close long,5.197273,0xcf0c0e2ccd2b471e483404206fca4101d60085bc50b41d4852de5c25432782cc,82312517667,True,0.149993,1030000000000000.0,1740000000000.0,,,,,
0x8477e447846c758f5a675856001ea72298fd9cb5,FARTCOIN,0.35206,1509.0,531.26,buy,03-03-2025 20:51,-1509.0,close short,24.53634,0x2b7e7923e37ea425d733041ed5cc7002082a00d25e6d71ef5bff0ddba3ce58a1,76684156689,True,0.18594,935000000000000.0,1740000000000.0,2025-03-03 20:51:00,2025-03-03,Fear,33.0,20.0
0xbee1707d6b44d4d52bfe19e41f8a828645437aab,HYPE,13.0,10.52,136.76,buy,18-03-2025 11:57,2324.14,open long,0.0,0x7b596dd9073a59254219041fc6c8c6017400b92e259985dac18d10904657c26d,80485297580,False,0.006838,757000000000000.0,1740000000000.0,,,,,
0xbee1707d6b44d4d52bfe19e41f8a828645437aab,HYPE,12.832,38.96,499.93,sell,29-03-2025 13:55,17517.2,close long,5.781664,0x3a90403b9944b62c377104207d4ead016100cf3bb263601e0d932d3192207be4,82466762727,True,0.14998,93600000000000.0,1740000000000.0,,,,,
0xbee1707d6b44d4d52bfe19e41f8a828645437aab,@107,15.611,5.0,78.06,sell,07-03-2025 06:43,1243.89813,sell,0.18675,0xb8c89d95c9a8307e084c041f0d752f0203b200abbac0506b910dbeb2e3839201,77807838180,True,0.023416,528000000000000.0,1740000000000.0,2025-07-03 06:43:00,2025-07-03,,,6.0
0x3998f134d6aaa2b6a5f723806d00fd2bbbbce891,MELANIA,0.50251,1367.8,687.33,buy,12-04-2025 08:21,-67048.0,close short,47.148066,0xcd4657069e7d2118cdd70421602a7b020210003234a9da689a6d73e9855207af,85929818761,False,0.065983,52700000000000.0,1740000000000.0,2025-12-04 08:21:00,2025-12-04,,,8.0
0x28736f43f1e871e6aa8b1148d38d4994275d72c4,PENGU,0.034038,440.0,14.98,buy,27-12-2024 23:49,-15516.0,close short,0.07744,0xa7d43ff5c4f8fea833fc041a18b3fc0201b4009f3143e7213dcd119882045ced,59073755831,True,0.005241,97100000000000.0,1740000000000.0,,,,,
0xbee1707d6b44d4d52bfe19e41f8a828645437aab,@107,32.0,105.85,3387.2,sell,21-12-2024 21:05,19487.82444,sell,75.167779,0xd2a400830b37401a86120419c0fb950201da001bcdd1b27f9b7fce51e99cf0cc,57423577963,False,0.16936,584000000000000.0,1730000000000.0,,,,,
0xae5eacaf9c6b9111fd53034a602c192a04e082ed,@107,7.5282,144.09,1084.74,buy,02-12-2024 23:21,9323.665576,buy,0.0,0xd273459b8ff175c0c53d041841a2b00201f80053c9adb62a930c0ff2b3d863c0,52027812614,True,0.05043144,234000000000000.0,1730000000000.0,2024-02-12 23:21:00,2024-02-12,Greed,70.0,23.0
0x4f93fead39b70a1824f981a54d4e55b278e9f760,BTC,97352.0,0.20671,20123.63,sell,15-02-2025 03:08,0.20671,close long,123.19916,0x157cf26a1cf32590836e041dc49a5601dd002fce513df2c71d7333476dda55ec,72376362181,True,6.037089,467000000000000.0,1740000000000.0,,,,,
0x23e7a7f8d14b550961925fbfdaa92f5d195ba5bd,@107,17.773,5.03,89.4,sell,20-04-2025 01:46,448.0087924,sell,0.001081,0x758ac0e29adec60031860421dd595e02012c00776d15c1b26bcf27d8522de1a6,87522538359,True,0.031289,182000000000000.0,1750000000000.0,,,,,
0xa0feb3725a9335f49874d7cd8eaad6be45b27416,BTC,96463.0,0.01741,1679.42,buy,20-02-2025 05:47,0.4085,open long,0.0,0x2954765a19e92e1db376041e1709460201aa00df0894fd61bde022ebae0994e7,73517218689,False,0.083971,956000000000000.0,1740000000000.0,,,,,
0xbaaaf6571ab7d571043ff1e313a9609a10637864,HYPE,12.861,141.14,1815.2,sell,14-03-2025 09:51,45942.79,close long,12.123926,0x9666e5c75e55f2bcdee0041f83b281013500d88367145c4e93e87cd496ba3310,79743319136,False,0.0,1110000000000000.0,1740000000000.0,,,,,
0xbee1707d6b44d4d52bfe19e41f8a828645437aab,HYPE,11.3,1919.54,21690.8,buy,03-04-2025 16:53,14890.69,open long,0.0,0xd9fc5ae30d769553af260420d213a60110007ebf00bf79134a59ae82463a33ee,83615504432,False,1.08454,349000000000000.0,1740000000000.0,2025-03-04 16:53:00,2025-03-04,Extreme Fear,15.0,16.0
0xbaaaf6571ab7d571043ff1e313a9609a10637864,HYPE,19.351,10.0,193.51,buy,25-02-2025 07:24,243132.88,open long,0.0,0x302faa5ee9eceb927b12041e692c1d0201f00020d76a48276179cf956bb19838,74607648909,False,0.009288,1070000000000000.0,1740000000000.0,,,,,
0xb1231a4a2dd02f2276fa3c5e2a2f3436e6bfed23,HYPE,25.694,153.69,3948.91,sell,05-02-2025 10:11,-8105.82,open short,0.0,0x034c36105c581de13b06041d29fb02019200e00099a876594b55a58d1e1bd6a2,69714380864,True,1.382118,700000000000000.0,1740000000000.0,2025-05-02 10:11:00,2025-05-02,Greed,67.0,10.0
0xbee1707d6b44d4d52bfe19e41f8a828645437aab,HYPE,16.477,12.14,200.03,buy,13-04-2025 07:24,-9300.16,close short,2.211908,0x180d1f155ec5c342c31004216fc1a102020100c5b320bbf4ed230a906f1b125b,86139835498,True,0.07001,645000000000000.0,1740000000000.0,,,,,
0x23e7a7f8d14b550961925fbfdaa92f5d195ba5bd,@107,22.246,37.5,834.22,buy,02-02-2025 09:16,1506.601687,buy,0.0,0xde4e144e3901603f3ab9041cf8f57e019600d56b17520f3a2f132b45eab2932b,68393787555,True,0.01312496,125000000000000.0,1740000000000.0,2025-02-02 09:16:00,2025-02-02,Greed,60.0,9.0
0xbaaaf6571ab7d571043ff1e313a9609a10637864,HYPE,16.41,60.85,998.55,buy,06-03-2025 18:54,14076.23,open long,0.0,0x0381081163629a425d2d041f0566a40201dd0102cd44502ed6cdeb69eb300b3b,77431179629,False,0.0,122000000000000.0,1740000000000.0,2025-06-03 18:54:00,2025-06-03,,,18.0
0x8477e447846c758f5a675856001ea72298fd9cb5,SOL,119.3,13.14,1567.6,sell,09-04-2025 23:28,-104.42,open short,0.0,0x8f57abb9e3ffb56ce14804213953340204ed00999662da62c69497ac74c2ea74,85381595088,True,0.54866,935000000000000.0,1740000000000.0,2025-09-04 23:28:00,2025-09-04,,,23.0
0x7f4f299f74eec87806a830e3caa9afa5f2b9db8f,ETH,1474.0,0.68,1002.32,sell,09-04-2025 04:56,-14.9077,open short,0.0,0x58dc5ae2f0c5704c0d8a04212c92cf020126009e347a9be50851ac2812a4d747,85105952086,False,0.100232,1060000000000000.0,1740000000000.0,2025-09-04 04:56:00,2025-09-04,,,4.0
0x8477e447846c758f5a675856001ea72298fd9cb5,FARTCOIN,1.0722,387.3,415.26,buy,22-04-2025 18:11,-14229.5,close short,0.112317,0x21500f014a3a1cf20c290422083df001ed00610b66e0b88e21d415fa1b4e037e,88002577645,True,0.145342,987000000000000.0,1750000000000.0,,,,,
0xa0feb3725a9335f49874d7cd8eaad6be45b27416,@142,92752.0,0.00139,128.93,buy,24-04-2025 09:24,1.030126987,buy,0.0,0x46522dec74738cca43b6042222fdc10201eb0031005169c3195635100c8dcfff,88483225999,False,1.39e-07,1040000000000000.0,1750000000000.0,,,,,
0xbee1707d6b44d4d52bfe19e41f8a828645437aab,@107,13.97,0.52,7.26,sell,10-12-2024 15:38,32680.74367,sell,0.276792,0x0000000000000000000000000000000000000000000000000000000000000000,54250791283,False,0.0,681000000000000.0,1730000000000.0,2024-10-12 15:38:00,2024-10-12,Neutral,49.0,15.0
0xbee1707d6b44d4d52bfe19e41f8a828645437aab,HYPE,12.635,0.85,10.74,sell,29-03-2025 13:07,4133.49,close long,-0.461635,0x951520951e253f73635104207cc27702039700fee620c558e4f8ae482dac7daa,82459319748,True,0.003221,1080000000000000.0,1740000000000.0,,,,,
0x4f93fead39b70a1824f981a54d4e55b278e9f760,BTC,93179.0,0.64398,60005.41,sell,10-01-2025 20:59,2.57198,close long,56.863434,0x7fd526447556ad8fbf48041b21de670201eb00ae9ff04aac6596ea172a92467b,62099400127,True,18.001623,788000000000000.0,1740000000000.0,2025-10-01 20:59:00,2025-10-01,,,20.0
0x92f17e8d81a944691c10e753af1b1baae1a2cd0d,@123,27.813,109.09,3034.12,buy,13-12-2024 20:51,3217.053638,buy,0.0,0x8c587ee787b458d85104041923f74e020144003a3b1f35bfa985c16393033c89,55211383468,True,0.03818149,534000000000000.0,1730000000000.0,,,,,
0xbee1707d6b44d4d52bfe19e41f8a828645437aab,HYPE,20.73,372.19,7715.5,sell,27-02-2025 11:08,-5686.33,open short,0.0,0x0000000000000000000000000000000000000000000000000000000000000000,75397493281,False,0.385774,2367595356.0,1740000000000.0,,,,,
0xbaaaf6571ab7d571043ff1e313a9609a10637864,HYPE,22.096,1244.38,27495.82,sell,24-02-2025 18:58,37513.38,close long,250.867008,0x261c1d59be3693c331ad041e60aa140194007cbd75db11383b1f7bf76940afd3,74429390039,False,2.639598,999000000000000.0,1740000000000.0,,,,,
0x92f17e8d81a944691c10e753af1b1baae1a2cd0d,BTC,83493.0,0.4432,37004.1,sell,14-04-2025 03:32,1.63146,close long,-91.78672,0x96ab01cd525d76998c5904217d61a00201fb0060f017ec39b83c597ea22f7813,86325012404,True,12.951434,1060000000000000.0,1740000000000.0,,,,,
0xb1231a4a2dd02f2276fa3c5e2a2f3436e6bfed23,@4,2.6088,1.0,2.61,buy,11-06-2024 01:38,1154.0,buy,0.0,0xacd5b846a9c5fb2a63fb040b27ac6101dc0018ddaedde4b7c430fc2d3d51686f,25578120824,True,0.00034,503000000000000.0,1720000000000.0,2024-11-06 01:38:00,2024-11-06,Greed,70.0,1.0
0x28736f43f1e871e6aa8b1148d38d4994275d72c4,BTC,96337.0,0.00264,254.33,buy,22-12-2024 11:41,0.08808,open long,0.0,0xd16dfc7c713b86c254610419c9b00d0201150016017975a5764902667422bb2d,57641318680,True,0.089015,369000000000000.0,1730000000000.0,,,,,
0xbaaaf6571ab7d571043ff1e313a9609a10637864,HYPE,13.004,61.76,803.13,sell,14-03-2025 00:00,178400.37,close long,2.587744,0x0000000000000000000000000000000000000000000000000000000000000000,79575525410,False,0.0,129000000000000.0,1740000000000.0,,,,,
0x75f7eeb85dc639d5e99c78f95393aa9a5f1170d4,GRIFFAIN,0.3065,1195.0,366.27,sell,27-01-2025 07:06,35162.0,close long,6.51275,0x8b0ba3e8bb00ab54fbcf041c96677c02029500abb60c02fb9b4e688eca5d0220,66755599448,False,0.03516,485000000000000.0,1740000000000.0,,,,,
0xa0feb3725a9335f49874d7cd8eaad6be45b27416,HYPE,23.33,10.71,249.86,buy,07-02-2025 21:35,1163.54,open long,0.0,0xec0da85f23a580ea1d37041d5204fe0201e400119c219fad72ac39caa0ddafb3,70504387745,True,0.087452,60600000000000.0,1740000000000.0,2025-07-02 21:35:00,2025-07-02,,,21.0
0x47add9a56df66b524d5e2c1993a43cde53b6ed85,PENGU,0.037712,17192.0,648.34,buy,26-12-2024 23:51,-18746.0,close short,24.15476,0x882962b96fb908aa4936041a0a54ae01a400cecd0ae327ec5f5f9a465e5572fa,58829448283,True,0.217843,726000000000000.0,1740000000000.0,,,,,
0x4f93fead39b70a1824f981a54d4e55b278e9f760,BTC,103700.0,0.001,103.7,sell,21-01-2025 01:31,0.38334,close long,0.1671,0x8a86b5fc241d8308c77f041bf385fe0202f800aa4e05460221c7f453224eb3fb,65002815906,True,0.025925,1000000000000000.0,1740000000000.0,,,,,
0xbee1707d6b44d4d52bfe19e41f8a828645437aab,HYPE,15.694,21.0,329.57,buy,26-03-2025 10:12,12214.4,open long,0.0,0x3f7c6e2d0c31023e1f1b042049211301ba008aee7a67f4fa65e69a6b3b7e1cb3,81849547644,True,0.098872,898000000000000.0,1740000000000.0,,,,,
0x8170715b3b381dffb7062c0298972d4727a0a63b,TRUMP,7.96,62.1,494.32,buy,15-04-2025 01:32,-34463.3,close short,4.79412,0x3f28d89427f195dd8e7804218c7563010d00d856b4cd1cb3c0b3ac90139cd4ea,86563911197,False,0.047453,1060000000000000.0,1740000000000.0,,,,,
0xb899e522b5715391ae1d4f137653e7906c5e2115,SOL,144.44,48.46,6999.56,sell,07-03-2025 01:21,1386.2,close long,-3.372816,0xd8fb02bae3231940d657041f09cfaa02023700c641dd9b2bfdf21c8a5e8076d0,77741378803,True,2.015873,1090000000000000.0,1740000000000.0,2025-07-03 01:21:00,2025-07-03,,,1.0
0xbaaaf6571ab7d571043ff1e313a9609a10637864,HYPE,11.201,1500.0,16801.5,buy,06-04-2025 18:51,42172.42,open long,0.0,0xcdfb2c491782fb1bc7e6042104ad9601a300dba6cbfc2145394a84b86f86e113,83926311678,False,0.840075,679000000000000.0,1740000000000.0,2025-06-04 18:51:00,2025-06-04,,,18.0
0x8477e447846c758f5a675856001ea72298fd9cb5,POPCAT,0.2675,370.0,98.98,buy,13-04-2025 04:45,-101418.0,close short,-3.78436,0x1219fbc153c01213be2f04216df66e01f000e82e953a60e760714cc83de9755b,86116358606,False,0.009897,1060000000000000.0,1740000000000.0,,,,,
0x8477e447846c758f5a675856001ea72298fd9cb5,WLD,4.8816,42.6,207.96,buy,29-05-2024 14:58,-880.7,close short,1.129752,0x8ae3d74dfa5d71d122d5040a2f96ea013000c8696853ef1e43bd5e9103c4031a,24275078208,False,0.020795,615000000000000.0,1720000000000.0,,,,,
0xbee1707d6b44d4d52bfe19e41f8a828645437aab,@107,14.726,137.14,2019.52,sell,10-03-2025 15:52,2897.414798,sell,-32.393438,0x67876533b4ef2d4187ee041f4534ce02012a00d18927dfebc3e638d350dd19ba,78643963165,True,0.605857,373000000000000.0,1740000000000.0,2025-10-03 15:52:00,2025-10-03,,,15.0
0x513b8629fe877bb581bf244e326a047b249c4ff1,@107,25.127,10.0,251.27,sell,14-02-2025 00:31,34818.36975,sell,53.805938,0x199dc52e3f153c09c0e3041db2b1ce0202c400d4e6c023af30d6346b1805bb55,72089055424,True,0.084426,154000000000000.0,1740000000000.0,,,,,
0x4f93fead39b70a1824f981a54d4e55b278e9f760,BTC,86612.0,0.20036,17353.58,buy,25-03-2025 14:40,0.22931,open long,0.0,0x4644f879fdd5529bc90604203b9f1e01a9006610441d93b05812f04c5a83cbb4,81688288451,True,6.073753,781000000000000.0,1740000000000.0,,,,,
0x8477e447846c758f5a675856001ea72298fd9cb5,POPCAT,0.345,1246.0,429.87,buy,23-04-2025 12:38,-134417.0,close short,-26.37159,0x0b8efa5e999b70c32ecc042214dc2302065000acb87b35277ca5861102db67e5,88224270728,False,0.042987,512000000000000.0,1750000000000.0,,,,,
0x47add9a56df66b524d5e2c1993a43cde53b6ed85,BTC,85296.0,0.01539,1312.71,sell,02-03-2025 00:36,0.07331,close long,6.419169,0xaf3be245e46feef44ec4041eb74edb017c004125fea51106574e3f1f495d9285,76164584809,True,0.441068,64800000000000.0,1740000000000.0,2025-02-03 00:36:00,2025-02-03,Fear,44.0,0.0
0x75f7eeb85dc639d5e99c78f95393aa9a5f1170d4,RUNE,1.5407,500.5,771.12,buy,01-02-2025 19:31,-6056.3,close short,10.7107,0x9840dd9cca4f6194c13f041cef9db10201f400eac7defd3ac53cd51ecfc3eb23,68231669843,False,0.074027,63400000000000.0,1740000000000.0,2025-01-02 19:31:00,2025-01-02,Greed,70.0,19.0
0xbee1707d6b44d4d52bfe19e41f8a828645437aab,HYPE,12.292,238.07,2926.36,sell,08-04-2025 08:17,1552.31,close long,125.415276,0xc6fd87499c07ef27d57104211e587d019a00a5eaa728d9d3b60c2e01a4dbba3d,84858935164,True,0.877906,723000000000000.0,1740000000000.0,2025-08-04 08:17:00,2025-08-04,,,8.0
0x4acb90e786d897ecffb614dc822eb231b4ffb9f4,SOL,130.24,18.43,2400.32,sell,12-04-2025 19:54,-4001.0,open short,0.0,0xffb43d613c9d5eecf52a042167f5d401f3000514858aeb28b8350026f47bd8e3,86036855674,True,0.720096,811000000000000.0,1740000000000.0,2025-12-04 19:54:00,2025-12-04,,,19.0
0xa0feb3725a9335f49874d7cd8eaad6be45b27416,HYPE,32.309,126.81,4097.1,buy,22-12-2024 10:41,1855.28,open long,0.0,0xf8cf8f3d171a9870a4900419c916100203e600940016947d4464307a6f6c062b,57590590894,False,0.204855,823000000000000.0,1730000000000.0,,,,,
0x8477e447846c758f5a675856001ea72298fd9cb5,WLD,2.5714,166.8,428.91,sell,24-11-2024 10:53,-13786.6,open short,0.0,0x70769e3ba669b735a27d041791c58401a1008d9547ac10a4c7b30b4a9465d251,49728171682,True,0.150118,771000000000000.0,1730000000000.0,,,,,
0x72743ae2822edd658c0c50608fd7c5c501b2afbd,KAITO,0.866,199.0,172.33,sell,24-04-2025 10:32,-60657.0,open short,0.0,0x275293de3703c6b39423042223c20502012300836186777943b061fa088a3e20,88499219447,False,0.017233,769000000000000.0,1750000000000.0,,,,,
0x8170715b3b381dffb7062c0298972d4727a0a63b,TRUMP,8.6,120.9,1039.74,sell,13-04-2025 02:08,-35157.8,open short,0.0,0x93477415d895d4042b3e04216c37f302058600314fde07fcf23ecf58d290e77f,84866600740,False,0.099815,979000000000000.0,1740000000000.0,,,,,
0xbee1707d6b44d4d52bfe19e41f8a828645437aab,@107,25.39,0.72,18.28,sell,19-12-2024 13:12,33037.20021,sell,0.143051,0x0000000000000000000000000000000000000000000000000000000000000000,56546582228,False,0.000914,431000000000000.0,1730000000000.0,,,,,
0xbee1707d6b44d4d52bfe19e41f8a828645437aab,HYPE,14.207,3.0,42.62,sell,12-03-2025 18:01,-1703.05,open short,0.0,0x2e1b1648f2814c872594041f67fb9d02021d00ff1d7cf40dd8acc79c64fd9589,79334798807,True,0.012786,111000000000000.0,1740000000000.0,2025-12-03 18:01:00,2025-12-03,,,18.0
0x513b8629fe877bb581bf244e326a047b249c4ff1,SOL,140.48,591.71,83123.42,sell,22-04-2025 17:55,7396.86,close long,997.208863,0x11142bd4c52f2f96a8ff0422080d5c02011c00502923146778d9deecac4c5077,87999512482,True,19.118386,103000000000000.0,1750000000000.0,,,,,
0x271b280974205ca63b716753467d5a371de622ab,PAXG,3356.4,0.019,63.77,sell,20-04-2025 20:16,-92.995,open short,0.0,0x1ce47fc4ceee7ae9c3df0421e9853402011200554cd602cfcb936559b96590cd,87625325796,False,0.00306,934000000000000.0,1750000000000.0,,,,,
0xb1231a4a2dd02f2276fa3c5e2a2f3436e6bfed23,HYPE,24.35,83.15,2024.7,sell,20-02-2025 04:36,-8292.77,open short,0.0,0x192021c35cd571c1d1c6041e163b9d0176001526f31bd0f16bb821cbce45667c,73510973011,True,0.708645,360000000000000.0,1740000000000.0,,,,,
0x513b8629fe877bb581bf244e326a047b249c4ff1,BTC,94018.0,0.25241,23731.08,sell,28-04-2025 23:31,33.35131,close long,59.190145,0xed67e7de9abe94c4716a04226d721e02068500745aad1431144b3f3cb960cafc,89593472619,True,5.458149,869000000000000.0,1750000000000.0,,,,,
0x23e7a7f8d14b550961925fbfdaa92f5d195ba5bd,@107,18.171,3.33,60.51,sell,26-04-2025 06:33,550.1553247,sell,-3.017972,0x0cd2b9e134c2d312b857042241888702026f00ef695509533570ba6df9d91930,88978461425,True,0.018152,103000000000000.0,1750000000000.0,,,,,
0xb899e522b5715391ae1d4f137653e7906c5e2115,BTC,77651.0,0.013,1009.46,sell,08-04-2025 22:21,3.70848,close long,1.1336,0x902b01513154dd158b5d042128090d01ca00b57db4e81d0958a4d05880a6f8d5,85019488631,True,0.302838,473000000000000.0,1740000000000.0,2025-08-04 22:21:00,2025-08-04,,,22.0
0x75f7eeb85dc639d5e99c78f95393aa9a5f1170d4,IP,4.7309,0.1,0.47,sell,31-03-2025 09:50,0.1,close long,0.02324,0x75a23ebcf5e047a9ea1104209b7a1d01f30041beb9535564f0ab1b66de120c6e,82826242306,True,0.000158,1100000000000000.0,1740000000000.0,,,,,
0x513b8629fe877bb581bf244e326a047b249c4ff1,BTC,90710.0,0.00015,13.61,buy,22-04-2025 21:22,32.89671,open long,0.0,0x8470e0af0328542d2c9704220a6d0f0204aa00d35aa3183310274de163371c9a,88053017872,True,0.003129,844000000000000.0,1750000000000.0,,,,,
0x513b8629fe877bb581bf244e326a047b249c4ff1,@107,26.472,77.38,2048.4,buy,17-02-2025 08:24,5276.576227,buy,0.0,0x61baf90969d7ec39d024041de7d82f020276007b66d6581a9608b77a7a2e5e40,72794175857,True,0.02599966,88700000000000.0,1740000000000.0,,,,,
0x28736f43f1e871e6aa8b1148d38d4994275d72c4,BNB,556.44,5.0,2782.2,sell,12-03-2025 23:27,20.0,close long,28.02,0x94ed16ace06a1e34466f041f6bd40a0202ab006ca4978de87f79f08b0a984880,79420387971,True,0.97377,248000000000000.0,1740000000000.0,2025-12-03 23:27:00,2025-12-03,,,23.0
0xbaaaf6571ab7d571043ff1e313a9609a10637864,HYPE,20.585,92.99,1914.2,buy,25-02-2025 02:34,56923.08,open long,0.0,0x492cfd08bfcfb79aa1e7041e65de25014800ae53377d5c024729d5b7a16098bb,74556530768,True,0.64317,574000000000000.0,1740000000000.0,,,,,
0x4acb90e786d897ecffb614dc822eb231b4ffb9f4,SOL,106.77,20.0,2135.4,buy,07-04-2025 00:39,13446.06,open long,0.0,0xb94cd141048adb698c3a04210895fa02024f0056554c4288d3b19ac823c76ba9,83700278486,False,0.10677,141000000000000.0,1740000000000.0,2025-07-04 00:39:00,2025-07-04,,,0.0
0x28736f43f1e871e6aa8b1148d38d4994275d72c4,@107,21.2,42.77,906.72,buy,27-01-2025 18:12,450.4923024,buy,0.0,0x6a0da3c23f1edf0f41a3041c9df18702018c00f763350a352a8979caf346bc6f,66916692777,True,0.01496948,1020000000000000.0,1740000000000.0,,,,,
0xa0feb3725a9335f49874d7cd8eaad6be45b27416,TAO,364.11,0.741,269.81,buy,04-02-2025 19:28,4.477,open long,0.0,0xff1a0bc009f5525a20ab041d200de10201d200ee83942d9c62d7549e1b227e01,69435162032,False,0.02698,653000000000000.0,1740000000000.0,2025-04-02 19:28:00,2025-04-02,Fear,44.0,19.0
0xb1231a4a2dd02f2276fa3c5e2a2f3436e6bfed23,PURR/USDC,0.24651,347.0,85.54,buy,08-01-2025 01:32,12739.6195,buy,0.0,0xecd2fa49b3c2889613e7041ae7862401a5001363c376656dd4d6b64bcc74e59d,61260745887,True,0.12144,818000000000000.0,1740000000000.0,2025-08-01 01:32:00,2025-08-01,,,1.0
0xbee1707d6b44d4d52bfe19e41f8a828645437aab,@107,23.7,439.56,10417.57,buy,20-12-2024 14:02,37409.49354,buy,0.0,0x23c67f1c11195da4ac6f0419ae4e8e0202550070d7c0acb6d0d3c138e4f1b139,56897082299,False,0.02197797,644000000000000.0,1730000000000.0,,,,,
0x39cef799f8b69da1995852eea189df24eb5cae3c,BTC,85362.0,0.00013,11.1,sell,13-04-2025 02:00,5.43013,close long,0.039013,0xb9cf8e40b89769e4bb5104216c1fcc01a1008696b1ec3826ed678fd7ba45f09c,86086081364,False,0.000554,881000000000000.0,1740000000000.0,,,,,
0x75f7eeb85dc639d5e99c78f95393aa9a5f1170d4,BIO,0.07025,1249.0,87.74,sell,25-04-2025 08:20,203424.0,close long,4.84612,0x9f1db1494d99ef1a7c5b042232981d0203bb001fcec9fc369b9bc70c93dfd291,88731770014,False,0.008774,662000000000000.0,1750000000000.0,,,,,
0xa0feb3725a9335f49874d7cd8eaad6be45b27416,@142,93438.0,0.01147,1071.73,buy,30-04-2025 19:23,1.252228479,buy,0.0,0x25bd6a88f087f68d487d04228b0b410203d6009cbea476cae728b59f91f94849,89844065520,False,1.15e-06,1080000000000000.0,1750000000000.0,,,,,
0x513b8629fe877bb581bf244e326a047b249c4ff1,BTC,93927.0,0.00023,21.6,buy,28-04-2025 23:16,49.7436,open long,0.0,0xa799d3b755d651b436ab04226d452802028a00deb052e7648923c2048b7dad02,89590969921,True,0.004968,333000000000000.0,1750000000000.0,,,,,
0x47add9a56df66b524d5e2c1993a43cde53b6ed85,VVV,5.8914,10.78,63.51,buy,06-02-2025 10:15,-113.85,close short,2.352196,0x592fbbff3fddef6581c2041d3a22c40202430021bd496258a09e4bdf1b7b8128,70035733946,True,0.021338,296000000000000.0,1740000000000.0,2025-06-02 10:15:00,2025-06-02,,,10.0
0xbee1707d6b44d4d52bfe19e41f8a828645437aab,@107,22.7,2.0,45.4,buy,19-02-2025 14:28,1121.670488,buy,0.0,0xf533a9f2e9aa6ed116e1041e0c90a501f200dcbd08387d1332bf2c8f4cddb5f0,73354018314,False,0.0002,14800000000000.0,1740000000000.0,,,,,
0xbee1707d6b44d4d52bfe19e41f8a828645437aab,HYPE,18.2,36.41,662.66,buy,30-04-2025 04:32,-0.01,short > long,0.007418,0x3ff8be3ef683e06d2a8f0422811aca02019b00da7138187078bbd8e8b892c0b0,89844008099,False,0.033133,616000000000000.0,1750000000000.0,,,,,
0x8477e447846c758f5a675856001ea72298fd9cb5,BTC,94046.0,0.0319,3000.07,buy,28-04-2025 19:31,-0.66159,close short,-48.18814,0x1047a4ce3a94a384e85d04226aaa4e0201f000fc68f6c234ffbae63992f5f448,89541406632,True,1.050023,432000000000000.0,1750000000000.0,,,,,
0x4f93fead39b70a1824f981a54d4e55b278e9f760,BTC,88116.0,0.01056,930.5,sell,07-03-2025 12:35,0.69338,close long,18.038592,0xeb61c192f69909e55513041f11789b016e0006de5291d3d8ad1d087401f9ff3e,77872322970,True,0.279151,136000000000000.0,1740000000000.0,2025-07-03 12:35:00,2025-07-03,,,12.0
0x28736f43f1e871e6aa8b1148d38d4994275d72c4,MNT,0.7462,425.4,317.43,buy,21-11-2024 14:36,-425.4,close short,-7.627422,0x02157a60a6ee24ea05f50417565918017f004d11996bf73b91269e6e710b7867,48956794539,True,0.111101,215000000000000.0,1730000000000.0,,,,,
0x8477e447846c758f5a675856001ea72298fd9cb5,AIXBT,0.13731,7471.0,1025.84,sell,27-03-2025 20:53,0.0,open short,0.0,0x6e155acc8655385a92b604206112cf016a00e9e4daa1535ab0eab3e588db780f,82136976707,True,0.359045,115000000000000.0,1740000000000.0,,,,,
0xbee1707d6b44d4d52bfe19e41f8a828645437aab,HYPE,16.383,298.1,4883.77,buy,04-03-2025 08:49,188.44,open long,0.0,0x5e850abe6ef7c7cd442b041ede08c70202d500be14c56149df2705ed37a44465,76899018833,True,1.465131,219000000000000.0,1740000000000.0,2025-04-03 08:49:00,2025-04-03,Fear,25.0,8.0
0xbee1707d6b44d4d52bfe19e41f8a828645437aab,HYPE,14.111,138.93,1960.44,sell,21-03-2025 19:53,9727.75,close long,11.183865,0x0fba0fed9efa53c0e61b041ffdadad0202ac008e7ac73c4cfac3cd6d628fb8a1,81121317943,True,0.588132,744000000000000.0,1740000000000.0,,,,,
0x8477e447846c758f5a675856001ea72298fd9cb5,OP,0.9664,229.6,221.89,sell,05-03-2025 17:44,0.0,open short,0.0,0x8f1ebd7258271072f626041ef4106e02020d004792253b7fe4165fcb656833d9,77360756446,True,0.077659,714000000000000.0,1740000000000.0,2025-05-03 17:44:00,2025-05-03,,,17.0
0x92f17e8d81a944691c10e753af1b1baae1a2cd0d,@107,23.841,66.45,1584.23,buy,15-12-2024 10:26,83357.39498,buy,0.0,0xadc331dfd6b394af22a90419448c25014a0020d42363e3b23777f1e5ce3a2ee9,55518678633,True,0.02325749,689000000000000.0,1730000000000.0,,,,,
0x39cef799f8b69da1995852eea189df24eb5cae3c,HYPE,16.18,3.0,48.54,sell,24-03-2025 06:47,2059.79,close long,5.5512,0x59f7e16ad1f55340b1ca042025ad6102021b008fb092188fa0b478b1f29db40e,81449375914,False,0.004854,1050000000000000.0,1740000000000.0,,,,,
0xbaaaf6571ab7d571043ff1e313a9609a10637864,HYPE,16.102,309.32,4980.67,sell,07-03-2025 20:39,122257.96,close long,207.368128,0xa67acabfc24d0cb5d05b041f1704590204f000525423d8cded7ec70825f7b658,77962266892,True,1.245167,687000000000000.0,1740000000000.0,2025-07-03 20:39:00,2025-07-03,,,20.0
0x4f93fead39b70a1824f981a54d4e55b278e9f760,BTC,91412.0,0.21056,19247.71,buy,10-01-2025 02:09,9.17868,open long,0.0,0x46a620de844dd6bf205c041b1198c601cc005ccc150ec99464ca6e8e485f8a85,61876923516,True,6.736698,972000000000000.0,1740000000000.0,2025-10-01 02:09:00,2025-10-01,,,2.0
0xbee1707d6b44d4d52bfe19e41f8a828645437aab,@107,22.184,55.06,1221.45,buy,10-02-2025 03:24,5472.10473,buy,0.0,0x771ca6babf3007039f25041d76175002028a009cdc6c5f018d2a7f217f507dcd,71035730441,True,0.01927096,690000000000000.0,1740000000000.0,2025-10-02 03:24:00,2025-10-02,,,3.0
0xbee1707d6b44d4d52bfe19e41f8a828645437aab,HYPE,12.743,125.55,1599.88,sell,13-03-2025 12:30,1278.85,close long,39.008385,0xb9dcd6654e3aad36bb37041f74e401020184008664f5a9f74727552a693cb571,79538804707,True,0.479965,435000000000000.0,1740000000000.0,,,,,
0x271b280974205ca63b716753467d5a371de622ab,HYPE,18.151,1.07,19.42,sell,19-04-2025 20:05,-1231.71,open short,0.0,0x0000000000000000000000000000000000000000000000000000000000000000,87487192171,False,0.000932,590000000000000.0,1750000000000.0,,,,,
0xbaaaf6571ab7d571043ff1e313a9609a10637864,HYPE,13.5,85.68,1156.68,sell,02-04-2025 18:22,40321.29,close long,68.689656,0x691bfc6f9dc0c18890a20420c27368015600761197e63f50f42e9c91128ad523,83364353312,False,0.115668,172000000000000.0,1740000000000.0,2025-02-04 18:22:00,2025-02-04,Greed,72.0,18.0
0x28736f43f1e871e6aa8b1148d38d4994275d72c4,@107,21.439,4.5,96.48,sell,14-12-2024 14:23,1594.527389,sell,71.940328,0x2e5db4f4c9a69a8d1da70419332f020189008c9ee1af5ef9d52276aca9e9e92f,55361131836,True,0.033766,161000000000000.0,1730000000000.0,,,,,
0xb1231a4a2dd02f2276fa3c5e2a2f3436e6bfed23,ETH,2705.2,0.7399,2001.58,buy,04-08-2024 23:24,46.1135,open long,0.0,0x1af450ffdf9769accc9a040eae6d530194000cbe0770c7f90c851cfa6c443692,32442886249,True,0.700552,974000000000000.0,1720000000000.0,2024-04-08 23:24:00,2024-04-08,Extreme Greed,76.0,23.0
0x8477e447846c758f5a675856001ea72298fd9cb5,W,0.65819,808.0,531.82,sell,06-06-2024 19:39,-3429.4,open short,0.0,0x879ade703d146b141c41040ad30a8b013800a1362feb7fdca47e0f3a9736f4d0,25155175636,True,0.186136,495000000000000.0,1720000000000.0,2024-06-06 19:39:00,2024-06-06,Extreme Greed,78.0,19.0
0x75f7eeb85dc639d5e99c78f95393aa9a5f1170d4,ZEREBRO,0.036112,831.0,30.01,sell,23-02-2025 09:36,1223273.0,close long,0.662307,0x465c0f8e469ac572a5a7041e4a172301e3008888749d5c536dbef701f230aac8,74203874084,True,0.010082,302000000000000.0,1740000000000.0,,,,,
0x8170715b3b381dffb7062c0298972d4727a0a63b,MELANIA,0.53,1853.7,982.46,buy,23-04-2025 22:07,-1034744.1,close short,48.066441,0xf310264e34e7ae401e3204221b568e02036e0041dd7af54d5ae5052a05c78839,88368703390,False,0.094316,981000000000000.0,1750000000000.0,,,,,
0x28736f43f1e871e6aa8b1148d38d4994275d72c4,ENA,1.0145,24.0,24.35,sell,06-12-2024 11:24,-558.0,open short,0.0,0xb96257aaa01894b8764d04188a40c301a900071ece10ce9598f57ad2ea73e404,53148390098,True,0.008521,161000000000000.0,1730000000000.0,2024-06-12 11:24:00,2024-06-12,Greed,72.0,11.0
0x72c6a4624e1dffa724e6d00d64ceae698af892a0,S,0.521,2157.0,1123.8,buy,04-03-2025 07:51,-27525.0,close short,-200.1696,0xace094db2c8cdb84216b041edd60eb02027f00481f22d3c9b95886e5d7894653,74815590685,False,0.107883,726000000000000.0,1740000000000.0,2025-04-03 07:51:00,2025-04-03,Fear,25.0,7.0
0x3998f134d6aaa2b6a5f723806d00fd2bbbbce891,@107,14.45,250.0,3612.5,sell,10-03-2025 06:14,47166.22911,sell,-656.249258,0x5d9f041fb06aab1a0c85041f3e8dd0020773009430411a38ea3bc456f5239705,78534240765,False,0.3468,996000000000000.0,1740000000000.0,2025-10-03 06:14:00,2025-10-03,,,6.0
0x513b8629fe877bb581bf244e326a047b249c4ff1,BTC,83180.0,0.013,1081.34,sell,12-04-2025 04:58,-2.01579,open short,0.0,0x6b313e029807198fba0f04215de94801ac001092edd85e7c214059795735b0c6,85920946401,True,0.324402,248000000000000.0,1740000000000.0,2025-12-04 04:58:00,2025-12-04,,,4.0
0xbee1707d6b44d4d52bfe19e41f8a828645437aab,HYPE,15.691,318.15,4992.09,buy,26-03-2025 10:12,11403.2,open long,0.0,0x3f7c6e2d0c31023e1f1b042049211301ba008aee7a67f4fa65e69a6b3b7e1cb3,81849547644,True,1.497627,96200000000000.0,1740000000000.0,,,,,
0xa0feb3725a9335f49874d7cd8eaad6be45b27416,ONDO,1.3712,9.0,12.34,sell,13-02-2025 00:05,22140.0,close long,0.041517,0x6fd0218df820b62e0968041da2d2cb02020200df8345b84c33d3152b3b24f8b5,71821835641,False,0.000617,1030000000000000.0,1740000000000.0,,,,,
0x2c229d22b100a7beb69122eed721cee9b24011dd,ALT,0.036888,27843.0,1027.07,buy,21-03-2025 00:21,144322.0,open long,0.0,0x5f3bb1525d11f2919c57041ff05f2e0202730005dd9d9940146232f9657cc5c8,80994461763,True,0.359475,215000000000000.0,1740000000000.0,,,,,
0xbaaaf6571ab7d571043ff1e313a9609a10637864,HYPE,22.069,10.05,221.79,sell,24-02-2025 18:54,94887.92,close long,1.75473,0x0a9e74aed12b2b312d0e041e609d5801a900e5d0759b7990fcd09ecb32b98a71,74429390066,False,0.021291,992000000000000.0,1740000000000.0,,,,,
0xbee1707d6b44d4d52bfe19e41f8a828645437aab,@107,25.416,300.0,7624.8,sell,19-12-2024 13:20,5718.250211,sell,67.404213,0x049c734ef9fa3850586f041999645b02011d00aa103f25971646f34474072791,56547695907,True,2.28744,155000000000000.0,1730000000000.0,,,,,
0x6d6a4b953f202f8df5bed40692e7fd865318264a,@107,25.793,34.18,881.6,buy,15-02-2025 04:32,2151.94415,buy,0.0,0x0f9ee44600f9c4ded8ae041dc588f10203ff0040e7475e75d8f27db46e8736b1,72390546111,True,0.01148443,623000000000000.0,1740000000000.0,,,,,
0xbd5fead7180a9c139fa51a103cb6a2ce86ddb5c3,ETH,2278.7,0.917,2089.57,buy,28-02-2025 03:25,-60.917,close short,437.24394,0xbcf41eb9ab1e4cb952ff041e9822dc020188008f652a9e60c3478feb4285af49,75615345364,True,0.731348,649000000000000.0,1740000000000.0,,,,,
0xb1231a4a2dd02f2276fa3c5e2a2f3436e6bfed23,HYPE,24.737,40.42,999.87,sell,12-02-2025 23:19,-7806.56,open short,0.0,0x6748b16bacc115436486041da25ea00201b300703d9a7cb60df9ee411e318f6f,71813014382,True,0.29996,366000000000000.0,1740000000000.0,2025-12-02 23:19:00,2025-12-02,,,23.0
0x271b280974205ca63b716753467d5a371de622ab,SOL,117.88,128.21,15113.39,buy,10-04-2025 00:38,-1658.11,close short,16.218565,0x3b3cbe15e087a58ae37204213a21900167002b7262487f89d50b569d9f054138,85405524974,True,5.0781,1030000000000000.0,1740000000000.0,2025-10-04 00:38:00,2025-10-04,,,0.0
0xbee1707d6b44d4d52bfe19e41f8a828645437aab,@107,34.44,57.98,1996.83,sell,21-12-2024 12:21,18438.19296,sell,316.1889,0x0000000000000000000000000000000000000000000000000000000000000000,57302611257,False,0.099841,1120000000000000.0,1730000000000.0,,,,,
0x75f7eeb85dc639d5e99c78f95393aa9a5f1170d4,NEAR,7.5318,6638.0,49996.09,sell,11-03-2024 19:36,0.0,open short,0.0,0x20307f70818d5bfabfca0407fdc22201220097b441ea8b0b9d17b03a3c17216d,13106972313,False,2.399811,601000000000000.0,1710000000000.0,2024-11-03 19:36:00,2024-11-03,Greed,74.0,19.0
0xbaaaf6571ab7d571043ff1e313a9609a10637864,HYPE,14.517,41.46,601.87,sell,12-03-2025 01:12,160185.75,close long,51.157494,0xb3a9e6e4f5293d501bb3041f5c49ec02018b00ecdfb8798414bcd103222f2c30,79154664708,True,0.150468,526000000000000.0,1740000000000.0,2025-12-03 01:12:00,2025-12-03,,,1.0
0xa0feb3725a9335f49874d7cd8eaad6be45b27416,@151,1763.9,0.0171,30.16,sell,23-04-2025 05:20,240.5142197,sell,0.347282,0x0000000000000000000000000000000000000000000000000000000000000000,88127984243,False,0.003016,723000000000000.0,1750000000000.0,,,,,
0xbaaaf6571ab7d571043ff1e313a9609a10637864,HYPE,13.217,39.74,525.24,buy,11-03-2025 06:04,148411.52,open long,0.0,0x96609c4b7eb37752df8e041f4f12070204ae0041ce07fe1ab0bcdce0989761b8,78808032399,False,0.0,735000000000000.0,1740000000000.0,2025-11-03 06:04:00,2025-11-03,,,6.0
0x8477e447846c758f5a675856001ea72298fd9cb5,kPEPE,0.007682,65053.0,499.74,sell,20-04-2025 22:31,-195174.0,open short,0.0,0xbba51e0a61f49bfa31490421eb02a001d100cdafc659728fc6965a5ff2c7ba46,87647520987,True,0.174908,879000000000000.0,1750000000000.0,,,,,
0x75f7eeb85dc639d5e99c78f95393aa9a5f1170d4,JELLY,0.02663,772.0,20.56,buy,17-03-2025 23:09,-324235.0,close short,4.22284,0xe713bd449dae887fd369041fbe0d6a02010f0048a16e60ee0cec2a590b9197e1,80397959958,True,0.006907,72400000000000.0,1740000000000.0,,,,,
0xa0feb3725a9335f49874d7cd8eaad6be45b27416,HYPE,26.684,38.08,1016.13,buy,16-12-2024 21:42,1229.46,open long,0.0,0xb80d53337bf39bf6ee70041962ea5e02015f00d7653bae95f5040fcb762b6b69,55820318171,True,0.304838,182000000000000.0,1730000000000.0,,,,,
0xbee1707d6b44d4d52bfe19e41f8a828645437aab,HYPE,11.976,8.35,100.0,sell,09-04-2025 08:32,3737.71,close long,5.291395,0xe339d6175c6dca4a28c004212f0adf0202130049c860fb4cc2690ef73c842e8d,85165191542,True,0.029999,1040000000000000.0,1740000000000.0,2025-09-04 08:32:00,2025-09-04,,,8.0
0xb1231a4a2dd02f2276fa3c5e2a2f3436e6bfed23,HYPE,25.768,23.77,612.51,sell,06-02-2025 10:03,-7695.41,open short,0.0,0xcf6939f41cfd6713fa75041d3a021902014b006852da3234c751ed75f737dfb1,70034156813,True,0.214376,419000000000000.0,1740000000000.0,2025-06-02 10:03:00,2025-06-02,,,10.0
0xbee1707d6b44d4d52bfe19e41f8a828645437aab,@107,32.026,20.47,655.57,sell,21-12-2024 21:05,21805.61444,sell,15.068682,0x9a65ba4610cb070219270419c0fb8c020109009c21c4601f87746e90f26cd4ad,57423577963,True,0.196671,169000000000000.0,1730000000000.0,,,,,
0xb899e522b5715391ae1d4f137653e7906c5e2115,SOL,119.88,14.11,1691.51,buy,11-03-2025 07:57,-979.84,close short,2.508758,0x3e95385012f0824baa80041f50537b01ab004d65e9310c3dccd9278139a06fce,78921258827,True,0.422876,12300000000000.0,1740000000000.0,2025-11-03 07:57:00,2025-11-03,,,7.0
0xa0feb3725a9335f49874d7cd8eaad6be45b27416,BTC,100430.0,0.00859,862.69,buy,04-02-2025 09:36,0.81904,open long,0.0,0xc7e8bac11a24cc6e19a1041d196240011400ae1a90373dd7a1de168dab3a643d,69269202311,False,0.086269,642000000000000.0,1740000000000.0,2025-04-02 09:36:00,2025-04-02,Fear,44.0,9.0
0xbaaaf6571ab7d571043ff1e313a9609a10637864,HYPE,13.456,148.63,1999.97,sell,02-04-2025 18:30,10937.54,close long,112.616951,0x836298a0842543021cac0420c28b240202a000489fb43391b9bf305bfd60964e,83365835018,True,0.699987,827000000000000.0,1740000000000.0,2025-02-04 18:30:00,2025-02-04,Greed,72.0,18.0
0xbee1707d6b44d4d52bfe19e41f8a828645437aab,@107,23.056,2.0,46.11,buy,24-02-2025 04:19,5462.930876,buy,0.0,0xa334aeb0aa2a82a4d11e041e56a19d017f00ad5849402905733c8fbfc1c3f6e3,74317253069,True,0.00069999,484000000000000.0,1740000000000.0,,,,,
0xa0feb3725a9335f49874d7cd8eaad6be45b27416,BTC,97749.0,0.0103,1006.81,sell,10-02-2025 19:15,1.38023,close long,6.53535,0x1956b160ace0189ea4dd041d80e2e201f3007b63c3446e8534cc761de8b830b6,71232689525,False,0.05034,673000000000000.0,1740000000000.0,2025-10-02 19:15:00,2025-10-02,,,19.0
0x083384f897ee0f19899168e3b1bec365f52a9012,ETH,2704.9,0.37,1000.81,buy,03-02-2025 07:16,902.9575,open long,0.0,0x898c3d5417e591cf2968041d07a5e70203c400bcb8d37943e5b1e59e4dd0e6fc,68775602622,True,0.300243,608000000000000.0,1740000000000.0,2025-03-02 07:16:00,2025-03-02,Fear,26.0,7.0
0xbee1707d6b44d4d52bfe19e41f8a828645437aab,HYPE,18.173,16.54,300.58,sell,19-04-2025 13:23,-23613.11,open short,0.0,0x2ea489521887ed6b53060421d5214901410052391a7d506f796c0556f52c40a3,87451679531,True,0.090174,14300000000000.0,1750000000000.0,,,,,
0x6d6a4b953f202f8df5bed40692e7fd865318264a,HYPE,18.035,1.09,19.66,sell,19-04-2025 14:30,-1513.37,open short,0.0,0x5479df188419dcf4003d0421d5de920201a300fcf67db19f10ee0a2144ce102b,87457648019,True,0.006604,890000000000000.0,1750000000000.0,,,,,
0xbaaaf6571ab7d571043ff1e313a9609a10637864,HYPE,13.94,1179.07,16436.24,sell,10-03-2025 22:47,60418.41,close long,4.952094,0x45572e71ce1cf88e4569041f4a06d8020318009e39bf24ca1bcaef47c0039e00,78756679218,False,0.0,672000000000000.0,1740000000000.0,2025-10-03 22:47:00,2025-10-03,,,22.0
0xbee1707d6b44d4d52bfe19e41f8a828645437aab,@107,26.89,60.08,1615.55,sell,20-12-2024 20:33,37909.52577,sell,72.757016,0xe0b6881862f8bc9fdf710419b20f3901e5009b175e35bf36e2e3a2c6c40795eb,57099073061,False,0.080777,611000000000000.0,1730000000000.0,,,,,
0xbee1707d6b44d4d52bfe19e41f8a828645437aab,@107,25.931,28.92,749.92,sell,18-02-2025 13:05,2513.083477,sell,13.948056,0x54efb1a3cac9d0f74f89041dfb40bd01c300a9ba518ee711f918bd04fee968d5,73098987643,True,0.262473,135000000000000.0,1740000000000.0,,,,,
0xbee1707d6b44d4d52bfe19e41f8a828645437aab,HYPE,13.525,22.88,309.45,sell,01-04-2025 18:31,167.55,close long,2.095808,0x268b211b3e2c3aad37200420b206960202440072040c84bba340e398726d1552,83139918982,True,0.092835,764000000000000.0,1740000000000.0,2025-01-04 18:31:00,2025-01-04,Greed,73.0,18.0
0xb1231a4a2dd02f2276fa3c5e2a2f3436e6bfed23,HYPE,25.497,11.45,291.94,buy,23-12-2024 20:52,-4675.47,close short,33.37904,0x4f8bef5e6915d91a0fbe0419dd632502012a0084d74891f8ddb3350590a9fae7,58069604769,True,0.102179,804000000000000.0,1730000000000.0,,,,,
0x4acb90e786d897ecffb614dc822eb231b4ffb9f4,SUI,2.2762,1620.2,3687.9,sell,31-03-2025 19:38,15267.4,close long,81.884908,0x7e730897f950c3a1b0f60420a2490c020208000a372c09c6a2cfc6282387a99c,82936469561,True,1.290764,509000000000000.0,1740000000000.0,,,,,
0x23e7a7f8d14b550961925fbfdaa92f5d195ba5bd,@107,18.17,4.37,79.4,sell,26-04-2025 06:35,62.28532469,sell,-3.964892,0x6a215b2fe3c8ac6fccc10422418def020181001e72c8690d74c6ff7273e649dd,88978749858,True,0.02382,223000000000000.0,1750000000000.0,,,,,
0x75f7eeb85dc639d5e99c78f95393aa9a5f1170d4,kPEPE,0.007001,6200000.0,43406.2,buy,04-03-2024 23:17,0.0,open long,0.0,0xdb9be84ea6e87c88bddf0407e4b1fc02015b00874340fdec4ddf3c59e4febe86,11997587048,False,-0.868124,793000000000000.0,1710000000000.0,2024-04-03 23:17:00,2024-04-03,Greed,71.0,23.0
0x75f7eeb85dc639d5e99c78f95393aa9a5f1170d4,kBONK,0.01435,35524.0,509.77,buy,16-02-2024 07:35,-903028.0,close short,9.94672,0xf3d285e1fcd86d3e5a920407a36c930178000ec7cb1d048ed7476a5f5167e7f7,9802817280,False,-0.010195,416000000000000.0,1710000000000.0,,,,,
0x28736f43f1e871e6aa8b1148d38d4994275d72c4,VIRTUAL,4.0149,6.2,24.89,sell,31-12-2024 21:14,-511.6,open short,0.0,0xb9d5a42f1fd2ca743164041a524fbb0163000cc1baaf5a581cfd86730e47280b,59845836719,True,0.008712,731000000000000.0,1740000000000.0,,,,,
0xbaaaf6571ab7d571043ff1e313a9609a10637864,HYPE,14.604,216.06,3155.34,sell,12-03-2025 00:44,216497.05,close long,285.393654,0x6ca46180364270a635a9041f5bf6220203d600afc50b2d81a77f3aef54933430,79148105573,True,0.788835,451000000000000.0,1740000000000.0,2025-12-03 00:44:00,2025-12-03,,,0.0
0x28736f43f1e871e6aa8b1148d38d4994275d72c4,SUI,3.4947,14.3,49.97,buy,21-11-2024 17:34,-105.6,close short,1.036607,0x2bd3327d35547f35b0f6041758ebee01c300be977a6452674c852d28c41eb456,48984294319,True,0.01749,237000000000000.0,1730000000000.0,,,,,
0x75f7eeb85dc639d5e99c78f95393aa9a5f1170d4,GRIFFAIN,0.4633,1081.0,500.83,buy,07-01-2025 20:42,-18973.0,close short,15.58802,0xfd97d4a4ba5183462dd7041ae3515b0203840004d02013541f64a93bd5cec933,61181774278,False,0.048078,686000000000000.0,1740000000000.0,2025-07-01 20:42:00,2025-07-01,,,20.0
0xb1231a4a2dd02f2276fa3c5e2a2f3436e6bfed23,HYPE,13.831,57.34,793.07,sell,14-03-2025 18:56,6032.56,close long,46.898386,0xea9713ab1820bb84a3b9041f89e00d02014d00c5e58efa5236f9dbcf0d2e7b7b,79810320519,True,0.277574,1120000000000000.0,1740000000000.0,,,,,
0x72c6a4624e1dffa724e6d00d64ceae698af892a0,S,0.521,8571.0,4465.49,buy,04-03-2025 07:51,-104889.0,close short,-795.3888,0x53ac6cacb4bf173a79c0041edd5f5e02067500502a6234972dc6a1ac7d890136,74815590685,False,0.428687,712000000000000.0,1740000000000.0,2025-04-03 07:51:00,2025-04-03,Fear,25.0,7.0
0xa0feb3725a9335f49874d7cd8eaad6be45b27416,HYPE,24.518,3.9,95.62,buy,21-02-2025 01:03,1275.38,open long,0.0,0x6b05fac6e6b8c3539783041e2411d801bb00224f55dfaa674ae1a67399c137b0,73700542387,True,0.028686,532000000000000.0,1740000000000.0,,,,,
0xbee1707d6b44d4d52bfe19e41f8a828645437aab,HYPE,14.352,34.83,499.88,sell,10-03-2025 20:59,5661.01,close long,0.619974,0x52dd513606979a26c8d0041f48c4d10201bf008689f1b688f9281a9df6ce9294,78726466363,True,0.149964,532000000000000.0,1740000000000.0,2025-10-03 20:59:00,2025-10-03,,,20.0
0xbee1707d6b44d4d52bfe19e41f8a828645437aab,HYPE,16.146,49.54,799.87,sell,17-04-2025 03:30,-259.62,open short,0.0,0xee35dda4dd5e47b8608e0421ae5026020144007bbb8b5c2db911c9259dd36be2,87052097707,True,0.279955,686000000000000.0,1740000000000.0,,,,,
0x8477e447846c758f5a675856001ea72298fd9cb5,WLD,3.0841,161.4,497.77,buy,17-07-2024 16:50,-9034.4,close short,10.179498,0xea6ce58c78ca44178744040da0b8df02010900022283a17ad62608730a9f42a8,30146660547,True,0.17422,602000000000000.0,1720000000000.0,,,,,
0xbee1707d6b44d4d52bfe19e41f8a828645437aab,HYPE,15.87,49.98,793.18,sell,26-03-2025 12:18,5618.77,close long,7.387044,0x33d6aa155c4e41a9e94b04204a8e120167006b7717dc60a3be15015214ab8106,81862067252,True,0.237954,1120000000000000.0,1740000000000.0,,,,,
0xbee1707d6b44d4d52bfe19e41f8a828645437aab,HYPE,19.0,475.0,9025.0,sell,23-04-2025 03:19,-9739.44,open short,0.0,0xd34faa6f16ae34fab5c904220e781d0201db00c17b6e6f144b59ade4731ef77c,87751612329,False,0.45125,920000000000000.0,1750000000000.0,,,,,
0x28736f43f1e871e6aa8b1148d38d4994275d72c4,AI16Z,1.8476,25.9,47.85,buy,05-01-2025 17:36,-165.4,close short,5.48303,0x2da09dafea406f4481fb041ab6fddc01940040215e664641107470127b5f6d1b,60782100766,True,0.016748,701000000000000.0,1740000000000.0,2025-05-01 17:36:00,2025-05-01,Neutral,53.0,17.0
0xb1231a4a2dd02f2276fa3c5e2a2f3436e6bfed23,ETH,2392.4,0.005,11.96,sell,10-01-2024 06:06,12.815,close long,0.2615,0x834e021e0b6a295de079040713db9701070073cd603256a65303b06db7e6fb9e,6656410848,True,0.00299,1110000000000000.0,1700000000000.0,2024-10-01 06:06:00,2024-10-01,Neutral,50.0,6.0
0x8170715b3b381dffb7062c0298972d4727a0a63b,MELANIA,0.556,900.5,500.68,buy,06-04-2025 22:12,-626263.8,close short,221.86519,0x6c17c6aef8aea440aafa042106e4d502065f005af5e4be632200ee73cb264887,83816029808,False,0.048064,299000000000000.0,1740000000000.0,2025-06-04 22:12:00,2025-06-04,,,22.0
0xbee1707d6b44d4d52bfe19e41f8a828645437aab,HYPE,18.066,44.28,799.96,sell,20-04-2025 04:09,-1847.07,open short,0.0,0x29f5c5bd40644141dcc50421dee7c3017e002cab433822a8e4ff73d1689c5d69,87533469989,True,0.239988,364000000000000.0,1750000000000.0,,,,,
0x083384f897ee0f19899168e3b1bec365f52a9012,SOL,172.59,70.05,12089.93,buy,03-03-2025 07:27,-1062.87,close short,2487.006165,0x1864b5007e1708340206041ecc85ed02015d00ff270d3217326db3a655247cae,76502914865,False,0.604496,332000000000000.0,1740000000000.0,2025-03-03 07:27:00,2025-03-03,Fear,33.0,7.0
0x72743ae2822edd658c0c50608fd7c5c501b2afbd,ETH,3297.0,0.0752,247.93,buy,22-12-2024 20:36,-340.5733,close short,54.736576,0x1a4c40dc303434161bc60419cef9d801a60089aa9a8ff37e2925c914bef77f6c,57745651640,False,0.024793,411000000000000.0,1730000000000.0,,,,,
0x28736f43f1e871e6aa8b1148d38d4994275d72c4,ETH,2379.6,1.5,3569.4,sell,25-02-2025 13:18,3.0,close long,27.45,0x5f040ae76324e19376ce041e6d2bc20203bd00ededea719e67cf6ea690eccd9b,74735883998,True,1.24929,465000000000000.0,1740000000000.0,,,,,
0xbee1707d6b44d4d52bfe19e41f8a828645437aab,HYPE,25.099,2.72,68.27,sell,21-02-2025 12:34,-5030.08,open short,0.0,0x53046d1d7def5d713af7041e2bd4510203c40034ebdf262241da1de9cbde0ef1,73797454731,True,0.023894,1030000000000000.0,1740000000000.0,,,,,
0xbee1707d6b44d4d52bfe19e41f8a828645437aab,HYPE,14.719,46.46,683.84,sell,20-03-2025 16:50,5221.25,close long,-4.915468,0xcfa0c6e2b0b346a935da041feb1ea3019600cca90cc683d74014d89a5b6e2a60,80923024861,True,0.205153,748000000000000.0,1740000000000.0,,,,,
0x8477e447846c758f5a675856001ea72298fd9cb5,POPCAT,0.34,712.0,242.08,buy,23-04-2025 05:14,-190626.0,close short,-17.571448,0xd55e2a03306e6a20684104220fc78d02049500c0e90a91bfd44330ec6e6c3745,88139739287,False,0.024208,420000000000000.0,1750000000000.0,,,,,
0x271b280974205ca63b716753467d5a371de622ab,SOL,150.5,7.78,1170.89,sell,23-04-2025 21:17,-2040.31,open short,0.0,0xf00521215508b929e28404221ac63202052400d2a6e02a3ec4d200f158a6d74d,88353676241,False,0.0,727000000000000.0,1750000000000.0,,,,,
0x2c229d22b100a7beb69122eed721cee9b24011dd,KAITO,1.7164,1456.0,2499.08,sell,05-03-2025 08:20,22255.0,close long,230.770176,0x3b0bfcb4b35d2051cfa6041eeda3100202f600545968661ac9764fe50fbb288d,77257820855,True,0.874677,651000000000000.0,1740000000000.0,2025-05-03 08:20:00,2025-05-03,,,8.0
0x8477e447846c758f5a675856001ea72298fd9cb5,WLD,0.70909,2110.2,1496.32,sell,10-04-2025 04:21,-10593.1,open short,0.0,0x9adc754ec19d3b58dee704213cb5700204ba00b8262364caa72e84fa89813117,85444554537,True,0.523712,1010000000000000.0,1740000000000.0,2025-10-04 04:21:00,2025-10-04,,,4.0
0xa0feb3725a9335f49874d7cd8eaad6be45b27416,HYPE,25.228,13.17,332.25,buy,21-02-2025 19:53,554.36,open long,0.0,0x6e4374855cc0c378669b041e30cb10010100dea5b498ed872512bdb121f5cbc4,73867151418,False,0.016612,639000000000000.0,1740000000000.0,,,,,
0xbee1707d6b44d4d52bfe19e41f8a828645437aab,@107,19.804,303.99,6020.22,sell,02-03-2025 07:20,749.3344676,sell,191.73331,0xdffdcc34fbee51a13416041ebbf55b01a4005d5708c6d8a0b91e7f2c2dc3f29c,76218775873,True,1.806065,755000000000000.0,1740000000000.0,2025-02-03 07:20:00,2025-02-03,Fear,44.0,7.0
0xbee1707d6b44d4d52bfe19e41f8a828645437aab,@107,17.278,116.9,2019.8,sell,06-03-2025 16:01,260.6825786,sell,32.944528,0x5e8a73ee3af28fcd7716041f036b700201f20022303ac9bf70e42dda69bfec46,77621884070,True,0.605939,471000000000000.0,1740000000000.0,2025-06-03 16:01:00,2025-06-03,,,16.0
0x75f7eeb85dc639d5e99c78f95393aa9a5f1170d4,ZEREBRO,0.028226,10743.0,303.23,buy,22-04-2025 09:44,-233673.0,close short,11.097519,0x57d244fa96cb8a4ea0790422028cf8014e003ff91f8815028489d013b1cf556d,87933530575,False,0.02911,1020000000000000.0,1750000000000.0,,,,,
0xbee1707d6b44d4d52bfe19e41f8a828645437aab,HYPE,10.252,58.87,603.54,sell,07-04-2025 15:11,18704.64,close long,-49.898212,0x535b5512154a0cd5a73b04211291b5017300c5e03d0ed08672b3c0cc6c5e5aa3,84581837031,True,0.18106,359000000000000.0,1740000000000.0,2025-07-04 15:11:00,2025-07-04,,,15.0
0xb1231a4a2dd02f2276fa3c5e2a2f3436e6bfed23,ETH,2366.2,0.0217,51.35,sell,31-01-2024 04:36,-25.2526,open short,0.0,0xc5201391ac5aba876d3e04076597680117003c6af7db8cecbfd9b531118ee5c8,8483341609,True,0.012836,263000000000000.0,1710000000000.0,,,,,
0x75f7eeb85dc639d5e99c78f95393aa9a5f1170d4,BRETT,0.14439,188.0,27.15,sell,19-12-2024 01:39,216122.0,close long,1.185528,0x5d58a68fcee2465cba8304198f61c2020258002002174ca75068ceeb0a4162a7,56364837998,False,0.002605,102000000000.0,1730000000000.0,,,,,
0x271b280974205ca63b716753467d5a371de622ab,SOL,138.53,7.22,1000.19,sell,20-04-2025 00:43,-7770.58,open short,0.0,0x18afc60489751174e1670421dcaa0d02038e00b668e4308d419095ee86223508,87517184953,False,0.048008,332000000000000.0,1750000000000.0,,,,,
0x8170715b3b381dffb7062c0298972d4727a0a63b,MELANIA,0.467,107.1,50.02,sell,23-04-2025 23:21,-130742.0,open short,0.0,0x321bbed3befd8c30139004221c2dce02023100787554ffac98b386d303513aa1,88386194098,False,0.0048,235000000000000.0,1750000000000.0,,,,,
0xbee1707d6b44d4d52bfe19e41f8a828645437aab,HYPE,15.65,2.22,34.74,sell,24-03-2025 00:06,8137.39,close long,0.0999,0xf8d6502a28fb42b743f90420211f3c01ce0006593693ccaf73173306ade22a02,81412118530,True,0.010422,764000000000000.0,1740000000000.0,,,,,
0xbaaaf6571ab7d571043ff1e313a9609a10637864,HYPE,13.278,30.3,402.32,buy,29-03-2025 00:48,28945.17,open long,0.0,0x032c1431ca870f7f5fc00420745201020265007a43b86c64cc71baca1b66885e,82272850634,False,0.040232,939000000000000.0,1740000000000.0,,,,,
0xbee1707d6b44d4d52bfe19e41f8a828645437aab,HYPE,21.9,0.85,18.61,sell,24-02-2025 10:47,8462.5,close long,-0.66572,0xc2b56876a191086e4c08041e5b0d40017d00f5caafabd57ecc2dad08e8f89e86,74386370546,False,0.001861,44000000000000.0,1740000000000.0,,,,,
0x28736f43f1e871e6aa8b1148d38d4994275d72c4,TIA,7.9564,5.6,44.56,buy,29-11-2024 22:52,-43.7,close short,1.68756,0xb7e2960761331365f933041802d05202011e00bf88729167f166c9c0c7dad90e,51325160706,True,0.015594,400000000000000.0,1730000000000.0,,,,,
0xb1231a4a2dd02f2276fa3c5e2a2f3436e6bfed23,BTC,43325.0,0.00026,11.26,buy,31-01-2024 04:30,-0.68815,close short,-0.00026,0xab19bc8f78fc6dcbc859040765933b020164006988d4e569771b2ba1fdf9fe04,8482961030,True,0.002816,1050000000000000.0,1710000000000.0,,,,,
0xb1231a4a2dd02f2276fa3c5e2a2f3436e6bfed23,ARB,1.8166,4636.1,8421.94,buy,10-01-2024 03:44,22554.5,open long,0.0,0xf3cb8df03bb43758a6a5040713778e01970083d6e2a8c1e16c5048e7e19cdb5e,6646527733,True,2.105484,304000000000000.0,1700000000000.0,2024-10-01 03:44:00,2024-10-01,Neutral,50.0,3.0
0xbee1707d6b44d4d52bfe19e41f8a828645437aab,HYPE,13.906,2.87,39.91,buy,26-03-2025 19:33,-567.62,close short,1.308433,0xe391e961f783a0d5ff3904204f8ead02026f00f29d8f1dcaaa5e63d145564253,81921718001,True,0.011973,530000000000000.0,1740000000000.0,,,,,
0x28736f43f1e871e6aa8b1148d38d4994275d72c4,PURR,0.22188,226.0,50.14,buy,17-11-2024 03:12,-1118.0,close short,1.966652,0xf5fb4e29abf1a50f3cee0416f9598501af000db8b25686e54570545a1027c420,47859099257,True,0.01755,453000000000000.0,1730000000000.0,,,,,
0xbee1707d6b44d4d52bfe19e41f8a828645437aab,@107,25.279,37.4,945.43,buy,19-12-2024 13:44,1253.301671,buy,0.0,0xb3e126292e9bcb785f21041999bf0f0201590017dd8214fb234b5d9174bed38a,56551631544,True,0.01121998,889000000000000.0,1730000000000.0,,,,,
0xbaaaf6571ab7d571043ff1e313a9609a10637864,HYPE,22.054,6.59,145.34,sell,24-02-2025 18:23,122825.44,close long,1.051764,0xb9aa41deab3ede606df5041e60410b01e300e9329d7bec08d92f2563d6eef543,74429390081,False,0.013951,327000000000000.0,1740000000000.0,,,,,
0x083384f897ee0f19899168e3b1bec365f52a9012,ETH,2715.0,0.362,982.83,sell,03-02-2025 21:14,26.3495,close long,19.29098,0xb73e818bdef9250e6b8d041d10ff73020516001c9195a4e999a6b445b9b0a18f,69064166553,False,0.049141,126000000000000.0,1740000000000.0,2025-03-02 21:14:00,2025-03-02,Fear,26.0,21.0
0x75f7eeb85dc639d5e99c78f95393aa9a5f1170d4,GRIFFAIN,0.22457,2227.0,500.12,sell,31-01-2025 05:00,150306.0,close long,15.52219,0x5d71e4d8a6fc390ac3b8041cd5c4bf015e00a8e7649db07e04a7e8e641833037,67854953268,True,0.168039,29400000000000.0,1740000000000.0,,,,,
0xbee1707d6b44d4d52bfe19e41f8a828645437aab,HYPE,18.694,14.44,269.94,sell,29-04-2025 05:33,-4100.89,open short,0.0,0x1048da3a705feb6859ce04227183fc0201ff009f7b611e2cc0ae862b6addca9e,89642726872,True,0.080982,418000000000000.0,1750000000000.0,,,,,
0xbaaaf6571ab7d571043ff1e313a9609a10637864,HYPE,11.683,51.66,603.54,sell,04-04-2025 19:24,9692.39,close long,26.263944,0xa2f1aa45928bf5526b120420e4765202043000293030ff4d2abb031b9428b410,83921650126,True,0.181063,200000000000000.0,1740000000000.0,2025-04-04 19:24:00,2025-04-04,Fear,28.0,19.0
0xbee1707d6b44d4d52bfe19e41f8a828645437aab,HYPE,16.045,124.31,1994.55,buy,26-03-2025 03:34,7249.14,open long,0.0,0x9f142cf0071910377b6904204496a501d3007837f5dc0eb9a97f400b41dc3976,81803572633,True,0.598366,36300000000000.0,1740000000000.0,,,,,
0x8170715b3b381dffb7062c0298972d4727a0a63b,MELANIA,2.5888,123.3,319.2,sell,26-01-2025 23:04,-705.1,open short,0.0,0x027df682465e55363436041c911784010e00851498ccb1c8ffe9846183788ab7,66674785769,False,0.030642,1080000000000000.0,1740000000000.0,,,,,
0x28736f43f1e871e6aa8b1148d38d4994275d72c4,MKR,1534.7,0.0541,83.03,buy,24-02-2025 18:46,-0.1934,close short,0.029755,0x46f7d89379d8c12f19f8041e6084ed01d100153d0ffd23378c9feab6d9dcd648,74458931565,True,0.029059,796000000000000.0,1740000000000.0,,,,,
0x75f7eeb85dc639d5e99c78f95393aa9a5f1170d4,FARTCOIN,1.2815,268.0,343.44,buy,20-12-2024 21:38,-9865.5,close short,13.266,0xd166e303bebbfb570a100419b2b612020122004e7752006cd1f48b025f201225,57119527333,False,0.03297,163000000000000.0,1730000000000.0,,,,,
0x75f7eeb85dc639d5e99c78f95393aa9a5f1170d4,ONDO,1.4016,245.0,343.39,sell,20-01-2025 03:11,25103.0,close long,11.0495,0xb30207804d894bb9a32b041bdf52ad02020f0018fa1d179ddca630623af04250,64507400787,False,0.032965,471000000000000.0,1740000000000.0,,,,,
0x8381e6d82f1affd39a336e143e081ef7620a3b7f,AVAX,19.596,255.15,4999.92,sell,12-04-2025 19:40,683.63,close long,48.4785,0x3f3e6bf000743ece6a2c042167cb0d01c000a28fde460e09095c87994e718db1,86033679248,True,1.749971,707000000000000.0,1740000000000.0,2025-12-04 19:40:00,2025-12-04,,,19.0
0xb1231a4a2dd02f2276fa3c5e2a2f3436e6bfed23,ETH,2343.5,0.3018,707.27,buy,06-02-2024 20:59,40.3348,open long,0.0,0x31af0e49ab3f890472c204077f96f4012900969e109281d9da62a5f4e055268f,8953484805,False,-0.014145,47200000000000.0,1710000000000.0,2024-06-02 20:59:00,2024-06-02,Greed,73.0,20.0
0x8477e447846c758f5a675856001ea72298fd9cb5,kBONK,0.014965,18879.0,282.52,buy,23-04-2025 04:41,-5590167.0,close short,-12.025923,0x162c5268a756118df78d04220f680402074300da02470a8899fc77aba8ceb74e,88129914263,False,0.028252,871000000000000.0,1750000000000.0,,,,,
0xa0feb3725a9335f49874d7cd8eaad6be45b27416,@142,93377.0,0.02435,2273.73,buy,24-04-2025 05:58,0.365263474,buy,0.0,0xec2085819f399de1f6f4042220a5ed02044900ab903312206a9d895e135885e5,88434032376,False,2.43e-06,305000000000000.0,1750000000000.0,,,,,
0xa0feb3725a9335f49874d7cd8eaad6be45b27416,BTC,98742.0,0.01964,1939.29,buy,05-02-2025 02:28,0.90483,open long,0.0,0xc852ccfdad6afdd6c034041d24c71302010800814d8e0ed986b2cef7d456f534,69587600551,False,0.193929,17300000000000.0,1740000000000.0,2025-05-02 02:28:00,2025-05-02,Greed,67.0,2.0
0x8477e447846c758f5a675856001ea72298fd9cb5,ANIME,0.069093,12039.0,831.81,buy,24-01-2025 09:01,-12039.0,close short,277.282248,0xf2a24f6cc4681617784b041c4d78e5020200006ea012601a09eb605f62c1829d,66113622075,True,0.291133,492000000000000.0,1740000000000.0,,,,,
0xbee1707d6b44d4d52bfe19e41f8a828645437aab,HYPE,16.364,18.33,299.95,buy,13-04-2025 07:49,-426.7,close short,5.411016,0x52238a24f6a519474ba40421700a3d01a0009c48fb29cc010d69d12c1bf07ad3,86143907926,True,0.104983,43000000000000.0,1740000000000.0,,,,,
0x28736f43f1e871e6aa8b1148d38d4994275d72c4,DOGE,0.32401,1916.0,620.8,sell,27-01-2025 19:07,32999.0,close long,7.294212,0x3f7d3e6fa2c34d64d538041c9e931901dc00e01544d6ad6c86b027283193c2a3,66935857832,True,0.217281,878000000000000.0,1740000000000.0,,,,,
0x28736f43f1e871e6aa8b1148d38d4994275d72c4,HYPE,26.08,1.0,26.08,sell,19-12-2024 16:36,-6.41,open short,0.0,0x03639148188d00cc087304199c31b402013a006346960ce95e5d253b6604f748,56579933001,True,0.009128,835000000000000.0,1730000000000.0,,,,,
0xb1231a4a2dd02f2276fa3c5e2a2f3436e6bfed23,HYPE,23.809,29.16,694.27,sell,20-02-2025 01:00,-50.47,open short,0.0,0x11570e40ca6e46c9f02b041e13ce3a01ee00896d0335eb8502cbcf5dc759f88e,73479084496,True,0.242994,960000000000000.0,1740000000000.0,,,,,
0x39cef799f8b69da1995852eea189df24eb5cae3c,ETH,1769.7,10.3168,18257.64,sell,03-04-2025 18:59,-292.9582,open short,0.0,0x7125c205d6232206d2130420d38d4102023d00388a5785dfb8a34e2b0e9c6b84,83660205277,False,1.825764,901000000000000.0,1740000000000.0,2025-03-04 18:59:00,2025-03-04,Extreme Fear,15.0,18.0
0x28736f43f1e871e6aa8b1148d38d4994275d72c4,@107,24.62,0.01,0.25,buy,07-02-2025 19:24,825.1153465,buy,0.0,0xf43d011eef296fb8f194041d5089af0203bc007d5a80013c2e2310fc1103831f,70457483541,True,3.49e-06,518000000000000.0,1740000000000.0,2025-07-02 19:24:00,2025-07-02,,,19.0
0xbee1707d6b44d4d52bfe19e41f8a828645437aab,HYPE,12.997,138.03,1793.98,buy,29-03-2025 10:05,15256.35,open long,0.0,0xc7af5076102daec025b504207aad2f02018d00db08a10cacc0a14ca80fea329d,82436961786,True,0.538192,940000000000000.0,1740000000000.0,,,,,
0xbee1707d6b44d4d52bfe19e41f8a828645437aab,@107,27.376,3.65,99.92,buy,23-12-2024 16:43,9559.330882,buy,0.0,0xf50e898ace6267f62bc30419dae07d0203e600ee40f3fa96e21a1b5ef61c60f8,58012050313,True,0.00109497,240000000000000.0,1730000000000.0,,,,,
0x7f4f299f74eec87806a830e3caa9afa5f2b9db8f,ETH,1478.2,0.339,501.11,buy,09-04-2025 19:14,-75.4034,close short,0.8475,0xb4afd9f1aa339ebe34000421366c300201c6008c14712da783c19762b9c9e597,85305663820,False,0.05011,349000000000000.0,1740000000000.0,2025-09-04 19:14:00,2025-09-04,,,19.0
0x47add9a56df66b524d5e2c1993a43cde53b6ed85,@107,8.3557,50.0,417.79,buy,03-12-2024 08:29,624.7625012,buy,0.0,0x46dcfa6e6b30c7889d2c04184980c80201450044b974b765e5f6ebb51cf03173,52127348224,True,0.01749991,111000000000000.0,1730000000000.0,2024-03-12 08:29:00,2024-03-12,Extreme Greed,81.0,8.0
0x8381e6d82f1affd39a336e143e081ef7620a3b7f,@107,24.638,93.95,2314.74,buy,11-02-2025 16:51,1282.027748,buy,0.0,0x801897b9c8f0d2a8fdf6041d8f430b0196006e58a68ac7493363629691aab0b8,71457012627,True,0.02818499,364000000000000.0,1740000000000.0,2025-11-02 16:51:00,2025-11-02,,,16.0
0x430f09841d65beb3f27765503d0f850b8bce7713,ZRO,5.24,219.2,1148.61,sell,23-07-2024 03:07,84724.7,close long,412.039008,0x0e06fc63c0e74f7435b8040df076bd0122007dd17afb0ac113a0dc7ceb36a0eb,30774951211,False,0.11486,76600000000000.0,1720000000000.0,,,,,
0x513b8629fe877bb581bf244e326a047b249c4ff1,BTC,87800.0,0.018,1580.4,sell,21-04-2025 19:50,47.32488,close long,7.542,0x831270b170a3220246cc0421f929690202f700eadf24804f23b5e8a49be4b671,87788597919,False,0.0,854000000000000.0,1750000000000.0,,,,,
0xbee1707d6b44d4d52bfe19e41f8a828645437aab,HYPE,20.185,99.09,2000.13,buy,27-02-2025 10:34,-965.42,close short,42.232158,0xbba53db2bb4206eac8bc041e8c538c02020300ef2a53a9aa2855d2d63776b2b9,75424234674,True,0.600039,977000000000000.0,1740000000000.0,,,,,
0xb1231a4a2dd02f2276fa3c5e2a2f3436e6bfed23,HYPE,25.955,59.2,1536.54,sell,04-02-2025 03:45,-5285.11,open short,0.0,0x49932208937d657893a8041d156a8d0202c4002273f7d39cd19d70476b7a1993,69198496668,True,0.537787,866000000000000.0,1740000000000.0,2025-04-02 03:45:00,2025-04-02,Fear,44.0,3.0
0x28736f43f1e871e6aa8b1148d38d4994275d72c4,SOL,132.0,25.0,3300.0,buy,28-02-2025 07:03,0.0,open long,0.0,0xe88f1b0c78e811465fa4041e9aa29c0203860071f0bb8fd4052f48f9c244ec1a,75500450642,False,0.33,1070000000000000.0,1740000000000.0,,,,,
0x8477e447846c758f5a675856001ea72298fd9cb5,ETH,3905.0,0.2845,1110.97,buy,23-05-2024 18:26,1.2864,open long,0.0,0xd0cef77eb1379bade1a00409bae10a02018a00796283e1c45cf39e2310bea381,23562993589,False,0.111097,483000000000000.0,1720000000000.0,,,,,
0xbee1707d6b44d4d52bfe19e41f8a828645437aab,HYPE,16.336,53.4,872.34,sell,25-03-2025 15:24,6718.35,close long,5.85264,0xf7f147c1bdf4d2ad774804203c21eb02018400e91c8ec673c78a27f5f8e90f39,81694220934,True,0.261702,1000000000000000.0,1740000000000.0,,,,,
0xa0feb3725a9335f49874d7cd8eaad6be45b27416,ONDO,1.3387,20.0,26.77,sell,08-02-2025 22:45,4476.0,close long,0.06662,0x2a2ea888495cb46ba52b041d62f1980202b000cf2ce1b5c110b07c279a10acf6,70776158253,False,0.002677,205000000000000.0,1740000000000.0,2025-08-02 22:45:00,2025-08-02,,,22.0
0xbaaaf6571ab7d571043ff1e313a9609a10637864,HYPE,16.107,3053.39,49180.95,sell,07-03-2025 20:39,126033.08,close long,2062.259606,0xa67acabfc24d0cb5d05b041f1704590204f000525423d8cded7ec70825f7b658,77962266892,True,12.295238,517000000000000.0,1740000000000.0,2025-07-03 20:39:00,2025-07-03,,,20.0
0xbee1707d6b44d4d52bfe19e41f8a828645437aab,HYPE,26.908,76.47,2057.65,sell,18-02-2025 11:50,-82.8,open short,0.0,0x143d62b3b21b3ff20afe041dfa62950201bd00dd6151e9aea6c9ab120f6bdb00,73079574294,True,0.720179,1020000000000000.0,1740000000000.0,,,,,
0xb1231a4a2dd02f2276fa3c5e2a2f3436e6bfed23,HYPE,26.462,618.6,16369.39,sell,04-02-2025 18:58,-3445.62,open short,0.0,0xb149b0dce0bd343ce47a041d1fb67102065800f74a2a95c35fe591fe8bb912aa,69440584712,True,5.729287,971000000000000.0,1740000000000.0,2025-04-02 18:58:00,2025-04-02,Fear,44.0,18.0
0x430f09841d65beb3f27765503d0f850b8bce7713,ZRO,5.24,44.1,231.08,sell,23-07-2024 03:18,44506.8,close long,82.896534,0xf299db071d11962b9455040df093ed012e00bd8f674fb1c63e9b3bf88b44f8b2,30774951211,False,0.023108,691000000000000.0,1720000000000.0,,,,,
0x8477e447846c758f5a675856001ea72298fd9cb5,FARTCOIN,0.49018,1021.0,500.47,buy,23-03-2025 23:37,-3571.4,close short,11.70066,0x3b8eb54fcd65a312bd88042020c9c701af00f1bbf0cbe88c2bd9650b4750c422,81409591756,True,0.175165,1120000000000000.0,1740000000000.0,,,,,
0x8477e447846c758f5a675856001ea72298fd9cb5,ZRO,4.805,104.0,499.72,sell,20-07-2024 21:10,-3091.7,open short,0.0,0x441a5f7c713f47a35b9f040dcf6ae4014300e37943bf9615b8ea6d7a23679a40,30526235251,False,0.049972,269000000000000.0,1720000000000.0,,,,,
0x23e7a7f8d14b550961925fbfdaa92f5d195ba5bd,@107,13.87,10.0,138.7,sell,12-03-2025 14:09,1228.383791,sell,3.686483,0x26c09ced5d98c2547feb041f6545690201fd00f5bb0a1744361f97c038699684,79290409692,True,0.048545,914000000000000.0,1740000000000.0,2025-12-03 14:09:00,2025-12-03,,,14.0
0xbee1707d6b44d4d52bfe19e41f8a828645437aab,@107,23.1,77.06,1780.09,sell,19-02-2025 11:38,6610.888802,sell,10.102376,0x0cd09b1d29c77d48f96a041e0aa49802043e00eeb06bfe2c725951d32092f482,73334361026,False,0.178008,25000000000000.0,1740000000000.0,,,,,
0x8381e6d82f1affd39a336e143e081ef7620a3b7f,SOL,200.92,129.58,26035.21,sell,09-02-2025 18:09,-270.44,open short,0.0,0x55301cbd631ddc00a946041d6fdc1701ab000832bfd9c92cd782afac8ef9b6e8,70944447393,True,7.810564,125000000000000.0,1740000000000.0,2025-09-02 18:09:00,2025-09-02,,,18.0
0xbee1707d6b44d4d52bfe19e41f8a828645437aab,HYPE,14.355,111.46,1600.01,buy,10-03-2025 14:02,6862.29,open long,0.0,0x7530a8a4424a7ed1442f041f43f0e6018500fd23642170c1eefe9d0797880561,78616275687,True,0.480002,23300000000000.0,1740000000000.0,2025-10-03 14:02:00,2025-10-03,,,14.0
0xbaaaf6571ab7d571043ff1e313a9609a10637864,HYPE,21.2,6.07,128.68,buy,24-02-2025 13:50,116679.99,open long,0.0,0x0000000000000000000000000000000000000000000000000000000000000000,74410211133,False,0.012353,487000000000000.0,1740000000000.0,,,,,
0xbaaaf6571ab7d571043ff1e313a9609a10637864,HYPE,17.078,606.68,10360.88,buy,04-03-2025 07:05,83880.95,open long,0.0,0x75efca88a61bf93bdcf6041edcddf8011900aedf4cf8923aa480b78bcfe9bba4,75775902040,False,0.497322,727000000000000.0,1740000000000.0,2025-04-03 07:05:00,2025-04-03,Fear,25.0,7.0
0x39cef799f8b69da1995852eea189df24eb5cae3c,FARTCOIN,0.45792,3971.3,1818.54,sell,07-04-2025 03:45,-164789.3,open short,0.0,0x9632cb723df18f71024104210abcca02030600d23e9abe275d663872a21e846c,84366404051,False,0.181853,676000000000000.0,1740000000000.0,2025-07-04 03:45:00,2025-07-04,,,3.0
0x75f7eeb85dc639d5e99c78f95393aa9a5f1170d4,CHILLGUY,0.32696,6143.0,2008.52,buy,14-12-2024 05:46,-63426.0,close short,-2.82578,0x8e460152450d609987c704192bb58002015c00f056e595bcb00dad3c00a6fcc1,55299649085,False,0.192816,875000000000000.0,1730000000000.0,,,,,
0x083384f897ee0f19899168e3b1bec365f52a9012,ETH,2677.8,0.0895,239.66,sell,24-02-2025 18:44,-1562.0391,open short,0.0,0x5fd2aa8151f4fc102854041e60803a020128000b94a75fd1f5b147e0399c8ca3,74458516857,True,0.083882,148000000000000.0,1740000000000.0,,,,,
0x4f93fead39b70a1824f981a54d4e55b278e9f760,ETH,3228.2,0.025,80.7,sell,22-04-2024 11:30,-14.5501,open short,0.0,0xecd98f7df2ed4d5af824040894a6ae0196009cc2ad92eb2d2a9e173d7438949c,19647111250,True,0.028246,698000000000000.0,1710000000000.0,,,,,
0x72743ae2822edd658c0c50608fd7c5c501b2afbd,KAITO,0.866,2309.0,1999.59,sell,24-04-2025 10:32,-76824.0,open short,0.0,0xe955af48c1363599f7b3042223c2e202012400d1ce12fac3dd9fec4f0997d01e,88499219447,False,0.199959,876000000000000.0,1750000000000.0,,,,,
0xbee1707d6b44d4d52bfe19e41f8a828645437aab,HYPE,14.819,6.75,100.03,sell,26-03-2025 19:22,-740.46,open short,0.0,0xb3279bd352df297ca88304204f6d3602019900cbd0d597dde7bde1fd524f8950,81918338147,True,0.030008,233000000000000.0,1740000000000.0,,,,,
0x28736f43f1e871e6aa8b1148d38d4994275d72c4,PURR/USDC,0.49821,100.0,49.82,sell,21-12-2024 00:57,22978.39504,sell,6.9952,0x016ec4739534c2620dc60419b4b8ee02019c00e6df74ea69aba31185d9e87a89,57169911242,True,0.017437,59200000000000.0,1730000000000.0,,,,,
0x513b8629fe877bb581bf244e326a047b249c4ff1,BTC,94032.0,0.00265,249.18,sell,28-04-2025 23:31,56.20411,close long,0.658525,0xed67e7de9abe94c4716a04226d721e02068500745aad1431144b3f3cb960cafc,89593472619,True,0.057312,872000000000000.0,1750000000000.0,,,,,
0x23e7a7f8d14b550961925fbfdaa92f5d195ba5bd,PENDLE,3.27,5.0,16.35,buy,24-04-2025 00:59,15611.0,open long,0.0,0x58ea21e652fb7d63f8c304221d4e450201850101d7b21004419de23ecfa7db29,88404286876,False,0.001635,587000000000000.0,1750000000000.0,,,,,
0xbaaaf6571ab7d571043ff1e313a9609a10637864,HYPE,14.443,35.4,511.28,sell,12-03-2025 01:20,77324.05,close long,41.06046,0x1421828c8ee703ea7718041f5c61ee0204a900a3d25d5f622d3ca2bd318d90a0,79156331579,True,0.12782,14900000000000.0,1740000000000.0,2025-12-03 01:20:00,2025-12-03,,,1.0
0xbee1707d6b44d4d52bfe19e41f8a828645437aab,@107,25.8,76.0,1960.8,buy,26-12-2024 06:56,9332.33808,buy,0.0,0xb8fdb18507327d1a884a041a0032f3017000000eca47cc0818104fb567394822,58658587476,False,0.0038,246000000000000.0,1740000000000.0,,,,,
0x47add9a56df66b524d5e2c1993a43cde53b6ed85,FXS,3.6499,18.3,66.79,sell,02-01-2025 07:39,-214.5,open short,0.0,0x6682a26d16079b1290d5041a7019b5014c00e11c53ad81093e4d785a5e68ecef,60127237356,True,0.022441,598000000000000.0,1740000000000.0,2025-02-01 07:39:00,2025-02-01,Greed,68.0,7.0
0xbd5fead7180a9c139fa51a103cb6a2ce86ddb5c3,BERA,10.75,10000.0,107500.0,sell,06-02-2025 20:34,10000.0,close long,-24500.0,0xae8a0cefc7a10e977bfd041d411955020334004fa7afea665e6326fef06ccb51,70158958316,False,10.75,496000000000000.0,1740000000000.0,2025-06-02 20:34:00,2025-06-02,,,20.0
0xbaaaf6571ab7d571043ff1e313a9609a10637864,HYPE,14.488,117.8,1706.69,sell,12-03-2025 01:12,151454.34,close long,141.93722,0xb3a9e6e4f5293d501bb3041f5c49ec02018b00ecdfb8798414bcd103222f2c30,79154664708,True,0.426671,1000000000000000.0,1740000000000.0,2025-12-03 01:12:00,2025-12-03,,,1.0
0x4acb90e786d897ecffb614dc822eb231b4ffb9f4,SUI,4.5144,2.7,12.19,buy,08-01-2025 17:09,3100.5,open long,0.0,0x868122098516292eed96041af508cb02029f008b9be8817f18c1deb9f10d88db,61425633885,True,0.004266,1010000000000000.0,1740000000000.0,2025-08-01 17:09:00,2025-08-01,,,17.0
0x72c6a4624e1dffa724e6d00d64ceae698af892a0,HYPE,27.11,36.89,1000.09,sell,23-12-2024 17:52,-29486.59,open short,0.0,0x54e6b0fdacc50dd789b20419db93a902023e003fcbbb37b82a207244d9737296,58023285457,False,0.096007,361000000000000.0,1730000000000.0,,,,,
0x8170715b3b381dffb7062c0298972d4727a0a63b,SOL,137.0,4.0,548.0,sell,24-03-2025 08:44,1003.39,close long,2.0636,0x692233d1731bbeff2e9e042027056a0203dc00c740dca2c2d1f12157df12f97d,79918901499,False,0.052608,508000000000000.0,1740000000000.0,,,,,
0x75f7eeb85dc639d5e99c78f95393aa9a5f1170d4,BERA,5.407,54.0,291.98,sell,10-02-2025 05:35,-4616.3,open short,0.0,0x7761164ec77f483d6c24041d7793500000254e26eb104f67433967da8038ab1f,71061439160,False,0.028029,800000000000000.0,1740000000000.0,2025-10-02 05:35:00,2025-10-02,,,5.0
0x4acb90e786d897ecffb614dc822eb231b4ffb9f4,TRUMP,11.44,5944.9,68009.66,buy,23-03-2025 23:03,2796.3,open long,0.0,0xcecb1ebf6cf4567ff001042020654e0201bb0082a8f591ea5bfbb7cc38cafd5f,81404036233,False,6.800965,433000000000000.0,1740000000000.0,,,,,
0x47add9a56df66b524d5e2c1993a43cde53b6ed85,HYPE,22.904,32.74,749.88,sell,15-01-2025 03:11,-2269.63,open short,0.0,0xf2a32af7b0d224f1c09e041b779d2801fc0081157e3c933494b078a59f9edf1b,63056468610,True,0.251957,920000000000000.0,1740000000000.0,,,,,
0x6d6a4b953f202f8df5bed40692e7fd865318264a,SOL,118.71,8.42,999.54,sell,09-04-2025 23:48,-53.98,open short,0.0,0xd7e6ad9b7078e110b6af0421398dfe02025f0080e3e58380c3fb33ceb1c342df,85390076755,True,0.335844,589000000000000.0,1740000000000.0,2025-09-04 23:48:00,2025-09-04,,,23.0
0x8477e447846c758f5a675856001ea72298fd9cb5,APE,1.5289,72.6,111.0,buy,21-10-2024 15:10,-6617.8,close short,0.728178,0xe7264ab32690b21974240414d01066015c0023cf159ce1385c2e407e3a997aca,42745090868,True,0.038849,287000000000000.0,1730000000000.0,,,,,
0x28736f43f1e871e6aa8b1148d38d4994275d72c4,ENA,0.71621,90.0,64.46,buy,27-01-2025 18:14,7614.0,open long,0.0,0xe1dcb9a339dee8fae04f041c9df7250201ea00ac4210a5b2aff380a449e4b9cd,66917108889,True,0.02256,8880000000000.0,1740000000000.0,,,,,
0x4f93fead39b70a1824f981a54d4e55b278e9f760,ETH,2944.9,0.9,2650.41,buy,09-05-2024 02:38,40.5208,open long,0.0,0xe9634d59da63902167680408d0f852011c004a3aeb91b261a87a8419a39a0235,21943919842,True,0.927643,754000000000000.0,1720000000000.0,2024-09-05 02:38:00,2024-09-05,Fear,29.0,2.0
0xb1231a4a2dd02f2276fa3c5e2a2f3436e6bfed23,HYPE,25.83,1354.02,34974.34,sell,22-01-2025 09:43,-4167.13,open short,0.0,0xeb360bc605b9b9d3f9f3041c17ef21020141005584118ab7c7c04910cfd502b9,65509808051,True,12.241017,519000000000000.0,1740000000000.0,,,,,
0xbee1707d6b44d4d52bfe19e41f8a828645437aab,@107,25.36,22.12,560.96,sell,19-12-2024 13:11,35110.97021,sell,3.731218,0x0000000000000000000000000000000000000000000000000000000000000000,56546524121,False,0.028048,933000000000000.0,1730000000000.0,,,,,
0xbaaaf6571ab7d571043ff1e313a9609a10637864,HYPE,17.028,1.56,26.56,buy,04-03-2025 07:05,96321.46,open long,0.0,0x24367baf5689db5f7c13041edcde150202cb00afd36f65a78246deaff45831a8,75775902054,False,0.001274,166000000000000.0,1740000000000.0,2025-04-03 07:05:00,2025-04-03,Fear,25.0,7.0
0xbee1707d6b44d4d52bfe19e41f8a828645437aab,HYPE,14.867,318.15,4729.94,sell,26-03-2025 19:13,10126.94,close long,-203.616,0x63f9d85cc686aae882b504204f52d20202af003492125110aa92610042dce431,81916099745,True,1.41898,137000000000000.0,1740000000000.0,,,,,
0xbee1707d6b44d4d52bfe19e41f8a828645437aab,HYPE,15.118,52.17,788.71,buy,16-04-2025 09:56,613.58,open long,0.0,0xdfb2933da9dd84f13b7a0421a25cc20201c6008da7288a722029cdf744a49601,86862410142,True,0.276047,654000000000000.0,1740000000000.0,,,,,
0x39cef799f8b69da1995852eea189df24eb5cae3c,XRP,1.905,450.0,857.25,sell,07-04-2025 20:32,-92766.0,open short,0.0,0x0b895bdf6421cc2e2e660421163c800205610032ef8130e00e9af98cda536914,84695508070,False,0.085725,928000000000000.0,1740000000000.0,2025-07-04 20:32:00,2025-07-04,,,20.0
0xbaaaf6571ab7d571043ff1e313a9609a10637864,HYPE,14.431,41.46,598.31,sell,12-03-2025 01:12,121563.69,close long,47.591934,0xb3a9e6e4f5293d501bb3041f5c49ec02018b00ecdfb8798414bcd103222f2c30,79154664708,True,0.149577,786000000000000.0,1740000000000.0,2025-12-03 01:12:00,2025-12-03,,,1.0
0xbee1707d6b44d4d52bfe19e41f8a828645437aab,@107,34.44,2.88,99.19,sell,21-12-2024 12:22,15252.26296,sell,15.705831,0xf4e72d4d1d8f3e08d23d0419bbb25202012400ae4f62d4a4dc5237be409c21d1,57303009091,False,0.004959,710000000000000.0,1730000000000.0,,,,,
0x8477e447846c758f5a675856001ea72298fd9cb5,WLD,0.93745,106.7,100.03,sell,25-04-2025 12:55,-46957.9,open short,0.0,0xb0814b30bb9430eeabef0422357bed0201d100a970fa3321b02de5f12537daa7,88773756799,True,0.035009,930000000000000.0,1750000000000.0,,,,,
0xbaaaf6571ab7d571043ff1e313a9609a10637864,HYPE,21.062,10.0,210.62,buy,24-02-2025 20:22,37071.31,open long,0.0,0x3c6b49aa73a2fb0ce162041e61a04302054a002a1478250d094379a97b26a63b,74468249842,False,0.020219,679000000000000.0,1740000000000.0,,,,,
0xbee1707d6b44d4d52bfe19e41f8a828645437aab,@107,25.18,0.58,14.6,sell,19-12-2024 11:00,39771.8041,sell,0.057572,0x0000000000000000000000000000000000000000000000000000000000000000,56527471760,False,0.00073,1050000000000000.0,1730000000000.0,,,,,
0x39cef799f8b69da1995852eea189df24eb5cae3c,XRP,1.8602,17821.0,33150.62,buy,08-04-2025 06:31,-163639.0,close short,782.805246,0x4636f404fb90954832c004211d1fa002014b00b815ad12dd6874d29c00d88e7e,84813555709,False,1.657531,831000000000000.0,1740000000000.0,2025-08-04 06:31:00,2025-08-04,,,6.0
0xbee1707d6b44d4d52bfe19e41f8a828645437aab,@107,30.89,1.14,35.21,sell,20-12-2024 21:50,22503.57067,sell,3.281271,0x660d1f79df8fedb002f50419b2d5540201050033751d06dc490cac7686e6d208,57123239129,False,0.00176,808000000000000.0,1730000000000.0,,,,,
0x4acb90e786d897ecffb614dc822eb231b4ffb9f4,BTC,87725.0,0.00015,13.16,sell,21-04-2025 22:01,1.81613,close long,-0.02595,0x3178375ded081e43e0da0421faace402015400b891e41404a4e5819d05e7d095,87828944630,True,0.003947,1110000000000000.0,1750000000000.0,,,,,
0x92f17e8d81a944691c10e753af1b1baae1a2cd0d,FARTCOIN,0.91209,6027.3,5497.44,buy,29-01-2025 23:48,-149556.3,close short,437.340888,0xaa0ea878a2a1ae7437cf041cc22b2001f200a5ca6d5f870072f31018d0cb162d,67529850218,True,1.924104,891000000000000.0,1740000000000.0,,,,,
0x72c6a4624e1dffa724e6d00d64ceae698af892a0,TRUMP,21.277,25.9,551.07,sell,02-02-2025 18:41,-575.7,open short,0.0,0x36a5c68471465cbc4a43041cff4cca02010f000704142b6e05330acf91fce0ca,68467222111,False,0.052902,1090000000000000.0,1740000000000.0,2025-02-02 18:41:00,2025-02-02,Greed,60.0,18.0
0x513b8629fe877bb581bf244e326a047b249c4ff1,BTC,80392.0,0.00019,15.27,buy,10-04-2025 20:53,-9.79315,close short,0.146908,0xbd490c603a8faf1444dd0421480bcd02032600db8eb7f5c8bffe8894258be56f,85610828347,False,0.001465,25000000000000.0,1740000000000.0,2025-10-04 20:53:00,2025-10-04,,,20.0
0x47add9a56df66b524d5e2c1993a43cde53b6ed85,PURR/USDC,0.49751,398.0,198.01,sell,21-12-2024 00:54,2984.24625,sell,17.394066,0x53ffab11f5ad28e58ab20419b4b0a302013b00988219eac1a27dccbd913e8f83,57169109271,True,0.06653,193000000000000.0,1730000000000.0,,,,,
0x47add9a56df66b524d5e2c1993a43cde53b6ed85,HBAR,0.37,811.0,300.07,sell,07-12-2024 05:30,-15489.0,open short,0.0,0xa8f658b9ee37b866b1fb041899f1f5019200b1bbc95c668f40c72ae1339bc343,53344605549,False,0.028806,702000000000000.0,1730000000000.0,2024-07-12 05:30:00,2024-07-12,Fear,25.0,5.0
0xbaaaf6571ab7d571043ff1e313a9609a10637864,HYPE,22.013,92.99,2046.99,sell,24-02-2025 18:57,59815.87,close long,11.028614,0x22523731265070ae03ef041e60a4c702022b0078b5db80ad07ec26c90060e43d,74460990574,True,0.687788,1040000000000000.0,1740000000000.0,,,,,
0xa0feb3725a9335f49874d7cd8eaad6be45b27416,HYPE,23.835,35.0,834.23,sell,15-12-2024 23:34,1279.08,close long,6.909,0xb144932ea0c0be4d56ae04194fe151016900435fde866ccfcc06d689498b11d7,55612401709,False,0.041711,571000000000000.0,1730000000000.0,,,,,
0xbee1707d6b44d4d52bfe19e41f8a828645437aab,HYPE,14.35,36.59,525.07,buy,19-03-2025 13:11,-805.2,close short,2.539346,0x9fed657d2dbbe68d6be9041fd806c20187002334c492f813c53e0c77e2c0e6ee,80682286105,True,0.157519,520000000000000.0,1740000000000.0,,,,,
0xbee1707d6b44d4d52bfe19e41f8a828645437aab,@107,28.471,351.23,9999.87,sell,17-12-2024 12:15,25585.74822,sell,1923.912764,0xa24739c6e6e8194865da04196f68ce02015f00fac3295edcbb6124a42990f445,55950875190,True,2.99996,291000000000000.0,1730000000000.0,,,,,
0x4acb90e786d897ecffb614dc822eb231b4ffb9f4,SOL,142.97,7.01,1002.22,sell,28-02-2025 19:44,2491.72,close long,11.668145,0xecacfd0047f1ff7c1c78041ea3601002045b0077b73cd12460bbbdcea76828cc,75867531802,True,0.350776,233000000000000.0,1740000000000.0,,,,,
0x513b8629fe877bb581bf244e326a047b249c4ff1,BTC,83861.0,0.00018,15.09,buy,11-04-2025 23:48,19.82882,open long,0.0,0x7de0147424c9cd7b38c704215a6c4502036e0064436d24afaf74398d51466f01,85885774868,False,0.000723,852000000000000.0,1740000000000.0,2025-11-04 23:48:00,2025-11-04,,,23.0
0x513b8629fe877bb581bf244e326a047b249c4ff1,BTC,93245.0,2.1463,200131.74,buy,25-04-2025 03:15,-59.71605,close short,122.76836,0x8543ffeb4fdab50bfa0304222f29b702012700b5ee6b85c21ed9215e3bc8ba45,88683244072,True,46.030301,660000000000000.0,1750000000000.0,,,,,
0x083384f897ee0f19899168e3b1bec365f52a9012,ETH,2871.3,12.1936,35011.48,sell,03-02-2025 05:28,300.0,close long,960.85568,0xa2e40fb96f32bbe61041041d06852f0202fe002b2065f633ae7295cd8994c039,68724428967,True,10.503445,626000000000000.0,1740000000000.0,2025-03-02 05:28:00,2025-03-02,Fear,26.0,5.0
0xbee1707d6b44d4d52bfe19e41f8a828645437aab,HYPE,22.0,5.75,126.5,sell,24-02-2025 18:51,12295.18,close long,0.430675,0xa051e769454d105b69d9041e60940601c5000c54248cc006c3bab55346d98621,74457223148,False,0.01265,1120000000000000.0,1740000000000.0,,,,,
0x28736f43f1e871e6aa8b1148d38d4994275d72c4,PENDLE,3.0137,51.0,153.7,sell,03-02-2025 20:59,3369.0,close long,3.565563,0x94737254fa39fc59e78e041d10d7940202b8005fe2a23a632d9730f75ad08e41,69063137137,True,0.053794,634000000000000.0,1740000000000.0,2025-03-02 20:59:00,2025-03-02,Fear,26.0,20.0
0x513b8629fe877bb581bf244e326a047b249c4ff1,BTC,83955.0,0.00015,12.59,buy,16-04-2025 01:59,40.70471,open long,0.0,0x4e0ee33ac416d8feb23b04219d063001ef0000c85655f7f00ebe71c4295a11ab,86800181432,True,0.003148,738000000000000.0,1740000000000.0,,,,,
0xa0feb3725a9335f49874d7cd8eaad6be45b27416,HYPE,26.59,0.01,0.27,buy,04-02-2025 21:09,-0.01,close short,-0.002029,0x876c6783d14018f0d932041d212fc4020134005952a2254746f9cf2762522467,69491325817,True,9.3e-05,979000000000000.0,1740000000000.0,2025-04-02 21:09:00,2025-04-02,Fear,44.0,21.0
0x271b280974205ca63b716753467d5a371de622ab,FARTCOIN,1.1244,1334.0,1499.95,buy,23-04-2025 03:19,-131068.5,close short,-101.43736,0xc50d67e13061d73a7d6404220e7772012d00cd47dda197ae150fee068f81ace5,88110242922,True,0.431984,692000000000000.0,1750000000000.0,,,,,
0xb1231a4a2dd02f2276fa3c5e2a2f3436e6bfed23,BTC,43533.0,0.0846,3682.89,buy,30-01-2024 08:06,-0.57618,close short,-33.56082,0xa8aa9cb57dfaf3e4d50804076234f5019c00928bab0edeaa847465b3ed797e10,8417689407,True,0.920722,648000000000000.0,1710000000000.0,,,,,
0x23e7a7f8d14b550961925fbfdaa92f5d195ba5bd,@107,17.781,39.59,703.95,sell,20-04-2025 01:46,886.0687924,sell,0.325221,0xa058e04537ed935a71970421dd591802015400bf34b0a4cccd11d6d98e20190a,87522526335,True,0.246382,1100000000000000.0,1750000000000.0,,,,,
0x513b8629fe877bb581bf244e326a047b249c4ff1,@107,18.051,29.41,530.88,buy,12-12-2024 22:17,16279.53824,buy,0.0,0x90049e3fcb8b680b1e170419105a87020220002db7b003d8a7f081d839bffc14,54977370603,True,0.00988166,842000000000000.0,1730000000000.0,2024-12-12 22:17:00,2024-12-12,Extreme Greed,83.0,22.0
0x75f7eeb85dc639d5e99c78f95393aa9a5f1170d4,ALT,0.51898,990.0,513.79,sell,27-02-2024 08:15,-21359.0,open short,0.0,0x9540ea40c536b724224e0407cc8de1015900a496fcb107ace9e50b07a16299c7,11041648763,False,-0.010275,293000000000000.0,1710000000000.0,,,,,
0xbaaaf6571ab7d571043ff1e313a9609a10637864,HYPE,22.058,0.6,13.23,sell,24-02-2025 18:25,117881.31,close long,0.09816,0x0000000000000000000000000000000000000000000000000000000000000000,74429390077,False,0.00127,882000000000000.0,1740000000000.0,,,,,
0x28736f43f1e871e6aa8b1148d38d4994275d72c4,kPEPE,0.02094,19491.0,408.14,buy,21-11-2024 20:37,126063.0,open long,0.0,0xc631ba2913f930b4582f04175b91400201b8008957eb95e87b384f69ca6bcb4c,49035606266,True,0.142849,242000000000000.0,1730000000000.0,,,,,
0x47add9a56df66b524d5e2c1993a43cde53b6ed85,BTC,83921.0,0.02296,1926.83,sell,28-02-2025 22:56,0.17665,close long,-21.993384,0x17d941ad09b7b531bf84041ea5997a01510087e408d4d257d6bbb6cca0390b7f,75920305478,True,0.647413,685000000000000.0,1740000000000.0,,,,,
0x75f7eeb85dc639d5e99c78f95393aa9a5f1170d4,MOVE,0.30633,3281.0,1005.07,buy,15-04-2025 07:50,-30502.0,close short,42.19366,0x5b9c24a865d0a848486b042190b8ec018600df5e48773118cc4232885d96022a,86630958895,False,0.096485,1120000000000000.0,1740000000000.0,,,,,
0xbd5fead7180a9c139fa51a103cb6a2ce86ddb5c3,FARTCOIN,0.52182,1655.0,863.61,buy,01-04-2025 14:17,-116099.2,close short,-102.5438,0xeeb86902e9b6fe7d134d0420af18f8010b004d3451cae261a27daf67f1899a42,82786393354,True,0.302264,608000000000000.0,1740000000000.0,2025-01-04 14:17:00,2025-01-04,Greed,73.0,14.0
0xbee1707d6b44d4d52bfe19e41f8a828645437aab,@107,22.438,8.35,187.36,sell,24-01-2025 05:10,945.5655109,sell,4.565921,0x4f8c73cb86fd9a38ac75041c491ad1018400c7ab4ed450ee4ebeb01dfff49b16,66063481659,True,0.065575,385000000000000.0,1740000000000.0,,,,,
0x8477e447846c758f5a675856001ea72298fd9cb5,ZRO,4.775,30.5,145.64,sell,20-07-2024 21:10,-2465.4,open short,0.0,0xf9c215ed9a78ef1bad04040dcf69ca0000964bd64148ec95d3beaa0e76ecc5b3,30526219311,False,0.014563,1070000000000000.0,1720000000000.0,,,,,
0xbaaaf6571ab7d571043ff1e313a9609a10637864,HYPE,21.462,10.0,214.62,buy,24-02-2025 13:37,105633.35,open long,0.0,0x42b38cbdd93642201bdf041e5cfa4302034e002670e4106f8a0929d9970204f6,74400900709,False,0.020603,1050000000000000.0,1740000000000.0,,,,,
0x75f7eeb85dc639d5e99c78f95393aa9a5f1170d4,BRETT,0.18342,11796.0,2163.62,sell,12-12-2024 14:34,-75086.0,open short,0.0,0x6e5533a9638c967cf417041909ae7a01ba0013eba5a13ae83f80c3a302441b37,54868058456,True,0.726976,817000000000000.0,1730000000000.0,2024-12-12 14:34:00,2024-12-12,Extreme Greed,83.0,14.0
0xbd5fead7180a9c139fa51a103cb6a2ce86ddb5c3,BTC,84700.0,0.00218,184.65,buy,14-04-2025 00:27,20.26342,open long,0.0,0x306d2581c5f9ea4badb504217b495d01f700b69b6a8eb5f696a0c4b7e751c3df,86282879463,False,0.009232,781000000000000.0,1740000000000.0,,,,,
0xb1231a4a2dd02f2276fa3c5e2a2f3436e6bfed23,BTC,63616.0,0.03131,1991.82,sell,24-08-2024 01:32,-0.03065,open short,0.0,0x178815163b3238d128e0041015f021020166003ef3616165aebaf9b679230d8a,35256577005,True,0.697135,811000000000000.0,1720000000000.0,,,,,
0xbee1707d6b44d4d52bfe19e41f8a828645437aab,HYPE,16.528,120.11,1985.18,buy,13-04-2025 07:23,-10928.09,close short,15.758432,0xb2d7dbea34b54eae259004216fbc240203d800c1b1006a9c6db9df55b70473bf,86139524880,True,0.694812,560000000000000.0,1740000000000.0,,,,,
0x8477e447846c758f5a675856001ea72298fd9cb5,APE,0.52833,934.7,493.83,buy,30-04-2025 13:11,-1020.5,close short,14.58132,0x5097a410d36231852146042286e8e402019000d1491f2a0035ddec805e97e4da,89928202038,True,0.17284,745000000000000.0,1750000000000.0,,,,,
0x4f93fead39b70a1824f981a54d4e55b278e9f760,BTC,84210.0,0.00015,12.63,sell,17-03-2025 23:26,1.22645,close long,0.22956,0x78abdd70313f0ac4e1fe041fbe3f9202018300c6bc62da3b45e02d54549a1bdf,80400360521,True,0.003789,792000000000000.0,1740000000000.0,,,,,
0x8477e447846c758f5a675856001ea72298fd9cb5,WLD,3.1658,252.6,799.68,sell,17-07-2024 15:55,-39265.7,open short,0.0,0xe1b0e0a0021dc176d13b040da02a7e016b000dd8e8bfe439a99d1373e8c19644,30141247732,True,0.279888,1060000000000000.0,1720000000000.0,,,,,
0xbd5fead7180a9c139fa51a103cb6a2ce86ddb5c3,ENA,0.49,73.0,35.77,sell,10-02-2025 06:37,-315826.0,open short,0.0,0xa2ddfdf5b8301fc99911041d784ab402025c006353653b8dcd30edc5dcb76110,71079289336,False,0.003577,173000000000000.0,1740000000000.0,2025-10-02 06:37:00,2025-10-02,,,6.0
0xbee1707d6b44d4d52bfe19e41f8a828645437aab,HYPE,15.698,153.01,2401.95,buy,12-04-2025 15:54,-3376.72,close short,30.158271,0xa9d713f09a3e9304696f0421653b3101890015717960e76b43f970f1e81f098f,85999362391,True,0.840682,315000000000000.0,1740000000000.0,2025-12-04 15:54:00,2025-12-04,,,15.0
0x23e7a7f8d14b550961925fbfdaa92f5d195ba5bd,@107,18.439,95.64,1763.51,sell,21-04-2025 14:24,1169.835887,sell,70.359874,0xbd1f269cd07834e4bee50421f582a1019e00bda32f2bdaef7be8c15ff98da1b1,87758247206,True,0.617227,972000000000000.0,1750000000000.0,,,,,
0x4f93fead39b70a1824f981a54d4e55b278e9f760,BTC,96196.0,0.13552,13036.48,sell,12-02-2025 03:13,1.79974,close long,50.88776,0x56e0ad1268701f7d1068041d9631ec0201fd001298671664336707c3b95558e4,71583399176,True,3.910944,514000000000000.0,1740000000000.0,2025-12-02 03:13:00,2025-12-02,,,3.0
0xae5eacaf9c6b9111fd53034a602c192a04e082ed,DYDX,0.61102,70343.7,42981.41,buy,04-03-2025 23:23,29656.3,open long,0.0,0x6062349d392719a20336041ee797e502012c0064a4a255deec6b8adf73abac1b,77138632929,True,14.441752,1090000000000000.0,1740000000000.0,2025-04-03 23:23:00,2025-04-03,Fear,25.0,23.0
0xbaaaf6571ab7d571043ff1e313a9609a10637864,HYPE,13.238,45.98,608.68,sell,12-03-2025 15:07,184548.17,close long,7.83959,0x2ead067a462f0396c7a3041f65f3cb02011d00f2eddbc637ddba46e9c17e3037,79305129371,True,0.182604,1090000000000000.0,1740000000000.0,2025-12-03 15:07:00,2025-12-03,,,15.0
0xb1231a4a2dd02f2276fa3c5e2a2f3436e6bfed23,BTC,42942.0,0.0003,12.88,sell,06-02-2024 08:16,-0.00759,open short,0.0,0xb8525dcbf6e29b355d1e04077d897701ee00a65237bfedf1e5a406bc027b8b00,8914778809,True,0.00322,358000000000000.0,1710000000000.0,2024-06-02 08:16:00,2024-06-02,Greed,73.0,8.0
0xa0feb3725a9335f49874d7cd8eaad6be45b27416,ONDO,1.3488,779.0,1050.72,buy,10-02-2025 20:12,14683.0,open long,0.0,0xc4d2b8edb1eb14f7b94d041d818ad60202e50038447ffc1dd4f0f398b9ae5ca1,71239576047,False,0.052535,540000000000000.0,1740000000000.0,2025-10-02 20:12:00,2025-10-02,,,20.0
0xa0feb3725a9335f49874d7cd8eaad6be45b27416,HYPE,24.986,12.37,309.08,buy,04-02-2025 10:10,714.37,open long,0.0,0x33366d0590f72e81c647041d19c40e02019600b9ffa8400326730f92e4e165a0,69280230699,False,0.030907,497000000000000.0,1740000000000.0,2025-04-02 10:10:00,2025-04-02,Fear,44.0,10.0
0xaf40fdc468c30116bd3307bcbf4a451a7ebf1deb,@142,83600.0,0.00632,528.35,buy,16-03-2025 23:05,3.005561651,buy,0.0,0xa34b40ba660049eda628041fad8914019300c9ba872f822ecc863354aa51d723,80198853866,True,2.21e-06,931000000000000.0,1740000000000.0,,,,,
0xbee1707d6b44d4d52bfe19e41f8a828645437aab,@107,14.751,559.82,8257.9,sell,07-03-2025 06:24,3932.51813,sell,-460.536002,0x90a2fd6f4e5b7dcc54bb041f0d3cc002026100a1ea709341cc9b9b0851f37635,77801146709,True,2.477371,325000000000000.0,1740000000000.0,2025-07-03 06:24:00,2025-07-03,,,6.0
0x75f7eeb85dc639d5e99c78f95393aa9a5f1170d4,MELANIA,0.70308,2290.3,1610.26,sell,11-03-2025 07:18,151324.6,close long,177.108899,0x73cca2c3e11b9e35914a041f4fe0bb0202af001bd2f084eb40cb32a41496e7c1,78909031515,True,0.541048,450000000000000.0,1740000000000.0,2025-11-03 07:18:00,2025-11-03,,,7.0
0x8477e447846c758f5a675856001ea72298fd9cb5,kBONK,0.014925,37185.0,554.99,buy,23-04-2025 06:22,-2392846.0,close short,-6.47019,0x4f96f2de9fec5edb10080422108dec02050f00ac56e80a5d9a869f37efd076d1,88136755322,False,0.055498,121000000000000.0,1750000000000.0,,,,,
0x8477e447846c758f5a675856001ea72298fd9cb5,SOL,172.6,5.06,873.36,sell,23-05-2024 20:50,44.02,close long,5.320084,0x331b53ef0f04735206fe0409bce03301ab002e523a5bed6b2a53313f94e7b123,23595103472,True,0.305674,533000000000000.0,1720000000000.0,,,,,
0x28736f43f1e871e6aa8b1148d38d4994275d72c4,AIXBT,0.71898,211.0,151.7,buy,23-01-2025 12:17,-211.0,close short,27.385057,0x0fe9de61b9eaa9215eeb041c3600690202f1003c9927e338cbf2d3caec43cbd6,65815009071,True,0.053096,306000000000000.0,1740000000000.0,,,,,
0xbaaaf6571ab7d571043ff1e313a9609a10637864,HYPE,22.511,509.82,11476.56,buy,24-02-2025 08:34,24556.69,open long,0.0,0xc9b072c78ef15a1d5d2b041e598a6c0201e9004aa6e9723da53c4323157d3570,73505718965,False,1.101748,233000000000000.0,1740000000000.0,,,,,
0xa0feb3725a9335f49874d7cd8eaad6be45b27416,BTC,97644.0,0.00013,12.69,buy,13-02-2025 02:47,0.0126,open long,0.0,0xbf7cff548d4163be99ff041da46e4a020148000634ab620d039543b21df01d09,71851719271,False,0.000634,255000000000000.0,1740000000000.0,,,,,
0x47add9a56df66b524d5e2c1993a43cde53b6ed85,BADGER,4.3329,79.9,346.2,buy,25-12-2024 22:01,-613.4,close short,1.151359,0x48bb45abc58f7f72dde70419fadd1002016a00b49b052bcf983ce5e6745775bd,58586525298,True,0.116322,465000000000000.0,1740000000000.0,,,,,
0x23e7a7f8d14b550961925fbfdaa92f5d195ba5bd,TAO,345.0,0.679,234.26,buy,24-04-2025 00:45,-145.773,close short,1.183497,0xff39c8118945f7bcef2804221d23500204b7008838630fe4f42073fd3683b730,88401452203,False,0.023425,521000000000000.0,1750000000000.0,,,,,
0x4f93fead39b70a1824f981a54d4e55b278e9f760,ETH,3339.8,0.019,63.46,sell,02-04-2024 14:58,-5.3471,open short,0.0,0xd665f5ed2313ab9ed46204084d82c601ad0095b9ab391bd988e32d1fdf74a430,16391215045,True,0.022209,133000000000000.0,1710000000000.0,2024-02-04 14:58:00,2024-02-04,Greed,60.0,14.0
0x4f93fead39b70a1824f981a54d4e55b278e9f760,BTC,82426.0,0.10247,8446.19,buy,18-03-2025 18:50,2.06048,open long,0.0,0xe3205371bd5e126380c2041fcb7810020150004c2b37beed9561a912b0b3a60e,80545018367,True,2.533857,646000000000000.0,1740000000000.0,,,,,
0xbaaaf6571ab7d571043ff1e313a9609a10637864,HYPE,21.2,10.0,212.0,buy,24-02-2025 13:54,119873.9,open long,0.0,0xf2fd166710a85463c79f041e5d2dff02032900840bb4945a10a5476344b87ca8,74411268954,False,0.020352,941000000000000.0,1740000000000.0,,,,,
0xb1231a4a2dd02f2276fa3c5e2a2f3436e6bfed23,ETH,2293.5,0.3096,710.07,sell,06-02-2024 04:32,39.3059,close long,-0.517032,0x93bfedb165d5a297af6c04077cefd502017b005831f596a593d41e38025f6d39,8904742210,False,-0.014201,16200000000000.0,1710000000000.0,2024-06-02 04:32:00,2024-06-02,Greed,73.0,4.0
0x8477e447846c758f5a675856001ea72298fd9cb5,UNI,5.9494,40.0,237.98,sell,23-04-2025 12:29,0.0,open short,0.0,0xeceffeef9e11d6d2f31e042214c1ae02028e0084a98bf5bc991c08ea6ad3e643,88235054204,True,0.083291,52700000000000.0,1750000000000.0,,,,,
0x75f7eeb85dc639d5e99c78f95393aa9a5f1170d4,CHILLGUY,0.33754,75.0,25.32,sell,13-12-2024 04:11,90816.0,close long,0.75825,0x90ad80c585bdb4afe3ef0419157b8c01a200c357d67bc2b501ab7175576598db,55045847481,False,0.002429,1060000000000000.0,1730000000000.0,,,,,
0x47add9a56df66b524d5e2c1993a43cde53b6ed85,STX,2.5425,58.9,149.75,sell,16-12-2024 05:43,-1099.1,open short,0.0,0x76d284cc0c9d9bf3b21604195534960201e2009f9f07382aa30b705823c599b4,55663074004,True,0.050316,367000000000000.0,1730000000000.0,,,,,
0x8477e447846c758f5a675856001ea72298fd9cb5,IO,5.6435,170.4,961.65,buy,12-06-2024 20:21,-12443.5,close short,-195.95148,0xd893331285776cde8ea8040b4b2abc018500b8096303fcf0af91cb2ecdb47f32,25824135444,True,0.336578,171000000000000.0,1720000000000.0,2024-12-06 20:21:00,2024-12-06,Greed,72.0,20.0
0xbee1707d6b44d4d52bfe19e41f8a828645437aab,@107,18.14,1.04,18.87,sell,12-12-2024 13:02,5896.397731,sell,3.511276,0x0000000000000000000000000000000000000000000000000000000000000000,54856025057,False,0.0,332000000000000.0,1730000000000.0,2024-12-12 13:02:00,2024-12-12,Extreme Greed,83.0,13.0
0xbee1707d6b44d4d52bfe19e41f8a828645437aab,@107,18.445,106.96,1972.88,sell,25-02-2025 13:15,3213.07943,sell,37.096174,0x8a11f5673d1f4f1b1091041e6d2488020252008f86ef35ecefe6ef8a7042a965,74734593921,True,0.690507,537000000000000.0,1740000000000.0,,,,,
0x75f7eeb85dc639d5e99c78f95393aa9a5f1170d4,JELLY,0.004286,3578.0,15.34,sell,12-03-2025 20:20,5250280.0,close long,0.379268,0xb47971ef683058a98d7d041f699daf0201de008de0a03fd1615a003bee191841,79376564718,True,0.005152,486000000000000.0,1740000000000.0,2025-12-03 20:20:00,2025-12-03,,,20.0
0xbee1707d6b44d4d52bfe19e41f8a828645437aab,HYPE,19.769,1.0,19.77,buy,03-03-2025 12:44,-181.93,close short,1.0307,0xe356ebeb1a16eefa6943041ed02dc702012d0009ae612f6136d25000b4709ddb,76564579069,True,0.00593,239000000000000.0,1740000000000.0,2025-03-03 12:44:00,2025-03-03,Fear,33.0,12.0
0xbee1707d6b44d4d52bfe19e41f8a828645437aab,HYPE,11.296,17.73,200.28,buy,04-04-2025 16:39,12376.97,open long,0.0,0x87a623e20d7008110aaf0420e28d2c0201e400ff398b7b827979e1e887a9c7cb,83877559270,True,0.060083,786000000000000.0,1740000000000.0,2025-04-04 16:39:00,2025-04-04,Fear,28.0,16.0
0x8170715b3b381dffb7062c0298972d4727a0a63b,MELANIA,0.53,332.8,176.38,buy,23-04-2025 22:07,-1035118.4,close short,8.629504,0x0000000000000000000000000000000000000000000000000000000000000000,88368703390,False,0.016932,1120000000000000.0,1750000000000.0,,,,,
0xbaaaf6571ab7d571043ff1e313a9609a10637864,HYPE,21.072,346.0,7290.91,buy,24-02-2025 20:22,32254.7,open long,0.0,0x2d3adf7a273668e332be041e619f6b0201dc00127128b5223e2f97a0cec9355b,74468249839,False,0.699927,61500000000000.0,1740000000000.0,,,,,
0xbaaaf6571ab7d571043ff1e313a9609a10637864,HYPE,14.2,41.17,584.61,buy,10-03-2025 20:34,13112.66,open long,0.0,0x5907b571d9ea18930202041f487b7502030700482274989174de703603e4ebc9,78718157667,True,0.146153,488000000000000.0,1740000000000.0,2025-10-03 20:34:00,2025-10-03,,,20.0
0x72743ae2822edd658c0c50608fd7c5c501b2afbd,KAITO,0.82488,120.0,98.99,sell,23-04-2025 02:00,-37140.0,open short,0.0,0x2ee615f7a825c9fb2f7a04220d968301a2001e973a24b8eccdccbb9923ffa464,88083975922,False,0.009898,220000000000000.0,1750000000000.0,,,,,
0xbaaaf6571ab7d571043ff1e313a9609a10637864,HYPE,17.51,291.56,5105.22,sell,05-03-2025 14:55,41106.24,close long,260.975356,0x16c116a0000d45985767041ef21cd201f700fd2fe41aa4a28ca1aa81bbe351eb,77326279701,True,1.276303,455000000000000.0,1740000000000.0,2025-05-03 14:55:00,2025-05-03,,,14.0
0xbee1707d6b44d4d52bfe19e41f8a828645437aab,HYPE,16.318,0.68,11.1,sell,04-03-2025 13:01,18897.96,close long,0.060656,0x5d40f1490fe658279cb6041ee0e3a501df0005879e4db07be525943f43adc79d,76961923866,True,0.003328,240000000000000.0,1740000000000.0,2025-04-03 13:01:00,2025-04-03,Fear,25.0,13.0
0xbee1707d6b44d4d52bfe19e41f8a828645437aab,HYPE,14.892,14.46,215.34,buy,16-04-2025 13:09,2155.85,open long,0.0,0x7f6f9e5f2649cdd5b4930421a484cd02011a00dda27c7c3a123294daee67c56f,86886809543,True,0.075368,839000000000000.0,1740000000000.0,,,,,
0xbee1707d6b44d4d52bfe19e41f8a828645437aab,@107,13.093,153.3,2007.16,sell,12-03-2025 15:25,3640.218059,sell,-2.264307,0xc11e4eec801d5a648026041f662a81020105005a07833a78920c7e4dac37cff6,79308036272,True,0.602147,974000000000000.0,1740000000000.0,2025-12-03 15:25:00,2025-12-03,,,15.0
0x8170715b3b381dffb7062c0298972d4727a0a63b,MELANIA,0.563,24.5,13.79,buy,23-04-2025 22:02,-1505079.4,close short,-0.173215,0x12ffba65aa5a68ee1d6804221b49200202a500513a10ce6d3be0686ab71ff78b,88367251831,False,0.001323,560000000000000.0,1750000000000.0,,,,,
0x513b8629fe877bb581bf244e326a047b249c4ff1,BTC,94027.0,0.0454,4268.83,sell,28-04-2025 23:31,52.75753,close long,11.0549,0xed67e7de9abe94c4716a04226d721e02068500745aad1431144b3f3cb960cafc,89593472619,True,0.981829,176000000000000.0,1750000000000.0,,,,,
0xbaaaf6571ab7d571043ff1e313a9609a10637864,HYPE,20.0,528.42,10568.4,sell,26-02-2025 01:45,38985.93,close long,87.294984,0x0fc7a79008b8590f93d8041e75b09a020101007bd2c130e2480df1d8df6cdf1e,74784409742,False,0.507283,829000000000000.0,1740000000000.0,,,,,
0x75f7eeb85dc639d5e99c78f95393aa9a5f1170d4,OGN,0.05853,197.0,11.53,buy,22-04-2025 08:54,-328337.0,close short,0.723975,0xc80a7f6c6c0593cb22ac042201fdae02013a003df9795c28804ef09e6a23f71f,87927163591,True,0.003873,673000000000000.0,1750000000000.0,,,,,
0x4f93fead39b70a1824f981a54d4e55b278e9f760,BTC,96657.0,0.011,1063.23,sell,22-02-2025 23:15,0.56532,close long,1.276,0xaee4c7cf45c299f35303041e432fd601b500038ef6e51e5bd119552b25ea8c80,74137913000,True,0.318968,1100000000000000.0,1740000000000.0,,,,,
0x083384f897ee0f19899168e3b1bec365f52a9012,ETH,3590.6,20.1042,72186.14,buy,28-11-2024 00:10,-476.8487,close short,-8453.212974,0x88fa01729b56201725090417db95ed01f700d5aa0af93d8b4ef29f6a7ba918e9,50879745546,False,7.218614,899000000000000.0,1730000000000.0,,,,,
0xbee1707d6b44d4d52bfe19e41f8a828645437aab,@107,13.511,22.12,298.86,buy,12-03-2025 11:00,3104.5748,buy,0.0,0x186ed68829bf19a293d4041f6317b102013f003537da0dd906f57fcd45f584d8,79252039829,True,0.00663592,615000000000000.0,1740000000000.0,2025-12-03 11:00:00,2025-12-03,,,11.0
0x8477e447846c758f5a675856001ea72298fd9cb5,W,0.71255,1558.7,1110.65,sell,07-06-2024 18:29,-10958.5,open short,0.0,0xf75169cb92a78aa263f6040ae6075901380061f9dcd4e5a9b7b71cb245ac2797,25243536968,True,0.388728,716000000000000.0,1720000000000.0,2024-07-06 18:29:00,2024-07-06,Fear,26.0,18.0
0xbaaaf6571ab7d571043ff1e313a9609a10637864,HYPE,14.553,1.37,19.94,sell,12-03-2025 01:05,179290.43,close long,1.739763,0x26ee76e87b22c2385c84041f5c36a401a000c394ec13582e7ca39b451329fe0e,79153164571,True,0.004984,113000000000000.0,1740000000000.0,2025-12-03 01:05:00,2025-12-03,,,1.0
0x23e7a7f8d14b550961925fbfdaa92f5d195ba5bd,HYPE,19.15,0.6,11.49,sell,23-04-2025 10:29,4937.88,close long,0.07854,0x0000000000000000000000000000000000000000000000000000000000000000,88209834406,False,0.001149,164000000000000.0,1750000000000.0,,,,,
0xbee1707d6b44d4d52bfe19e41f8a828645437aab,HYPE,13.833,22.1,305.71,buy,12-03-2025 18:23,-727.84,close short,8.02451,0x35599c47a229b573b218041f683ce201c300f87a2ffe091dbbe047184d54d185,79342845237,True,0.091712,277000000000000.0,1740000000000.0,2025-12-03 18:23:00,2025-12-03,,,18.0
0x8477e447846c758f5a675856001ea72298fd9cb5,GRIFFAIN,0.074936,2959.0,221.74,sell,05-03-2025 17:43,0.0,open short,0.0,0x6be93360d8a0c2092a70041ef40c9e020580000aa7923d0af24c6c88a9395fcc,77360531615,True,0.077607,234000000000000.0,1740000000000.0,2025-05-03 17:43:00,2025-05-03,,,17.0
0xa0feb3725a9335f49874d7cd8eaad6be45b27416,IP,4.51,13.5,60.88,buy,25-02-2025 00:13,2024.1,open long,0.0,0x52411fe5fb140ed2936b041e64434b020189002ea0fe7b6dfe55cc803052f266,74518104390,False,0.003044,511000000000000.0,1740000000000.0,,,,,
0x8477e447846c758f5a675856001ea72298fd9cb5,POPCAT,0.314,686.0,215.4,buy,22-04-2025 19:35,-248548.0,close short,-7.250334,0xabd4d49f77a168685223042209349e02038200e4294c317caf65e87f6c2854cb,88021898694,False,0.02154,326000000000000.0,1750000000000.0,,,,,
0xbee1707d6b44d4d52bfe19e41f8a828645437aab,HYPE,17.851,17.34,309.54,buy,19-04-2025 18:48,-13951.78,close short,0.998784,0x4579f11672a7a9030e370421d8b53c016f00331825a80bbce2427f81a364192a,87480226206,True,0.09286,892000000000000.0,1750000000000.0,,,,,
0x75f7eeb85dc639d5e99c78f95393aa9a5f1170d4,MELANIA,0.72459,6900.4,4999.96,sell,11-03-2025 08:49,28618.3,close long,682.035536,0x54d6472a98b996166eb4041f50ef43020162008d4c96af970d82c20bf0ebc128,78933411858,True,1.679986,335000000000000.0,1740000000000.0,2025-11-03 08:49:00,2025-11-03,,,8.0
0x23e7a7f8d14b550961925fbfdaa92f5d195ba5bd,@107,17.781,17.93,318.81,sell,20-04-2025 01:46,846.4787924,sell,0.14729,0xa058e04537ed935a71970421dd591802015400bf34b0a4cccd11d6d98e20190a,87522526335,True,0.111584,203000000000000.0,1750000000000.0,,,,,
0xbee1707d6b44d4d52bfe19e41f8a828645437aab,@107,25.18,70.0,1762.6,sell,19-12-2024 11:00,39884.3241,sell,6.948247,0x4747d6554bbfca730aa4041997645301da005c97fffdf4cf411a28ff9ea2c346,56527471760,False,0.08813,337000000000000.0,1730000000000.0,,,,,
0x75f7eeb85dc639d5e99c78f95393aa9a5f1170d4,ZEREBRO,0.04004,999202.0,40008.05,sell,26-02-2025 20:39,0.0,open short,0.0,0x760fdeca12737cf8431b041e82b77202014f00c68008c48e39c656eaa019f4da,75185665810,False,3.840771,306000000000000.0,1740000000000.0,,,,,
0xbee1707d6b44d4d52bfe19e41f8a828645437aab,@107,12.934,41.98,542.97,sell,12-03-2025 15:33,3785.735267,sell,-6.122304,0xa6ce36e81798042a86f7041f6640b901ca0028b677dff98ae68b9f22528427d1,79309243992,True,0.16289,1000000000000000.0,1740000000000.0,2025-12-03 15:33:00,2025-12-03,,,15.0
0xbee1707d6b44d4d52bfe19e41f8a828645437aab,@107,26.8,684.89,18355.05,sell,23-12-2024 19:46,11811.78684,sell,-76.33066,0x91d5b4c6f796fffc6e0a0419dcb9c2020178006cdee24b41dabaf3f0779e9b2f,58048258245,False,0.917752,1090000000000000.0,1730000000000.0,,,,,
0xb1231a4a2dd02f2276fa3c5e2a2f3436e6bfed23,HYPE,24.346,42.41,1032.51,sell,11-02-2025 07:40,-2824.98,open short,0.0,0x1a05770a66020169d825041d89302801bb0055a3c2824cc584b35228101bb2fe,71366244999,True,0.361379,1120000000000000.0,1740000000000.0,2025-11-02 07:40:00,2025-11-02,,,7.0
0x4f93fead39b70a1824f981a54d4e55b278e9f760,BTC,98587.0,0.08768,8644.11,buy,23-11-2024 19:34,0.0,open long,0.0,0x4059932a76d5924095aa04178468f8020136004b5d69b8a73263ad0cf6b83731,49541182722,True,2.593232,136000000000000.0,1730000000000.0,,,,,
0xa0feb3725a9335f49874d7cd8eaad6be45b27416,HYPE,24.241,23.5,569.66,buy,15-12-2024 05:55,1278.86,open long,0.0,0x0000000000000000000000000000000000000000000000000000000000000000,55484730157,False,0.028483,903000000000000.0,1730000000000.0,,,,,
0x75f7eeb85dc639d5e99c78f95393aa9a5f1170d4,LAYER,1.3421,339.0,454.97,buy,12-02-2025 06:09,-41350.0,close short,-131.5659,0xec56b918e500ec9bd3e1041d98201e01fd00fbd84cc06d3b5609b4e9d7e1259d,71610861874,True,0.15287,717000000000000.0,1740000000000.0,2025-12-02 06:09:00,2025-12-02,,,6.0
0xbee1707d6b44d4d52bfe19e41f8a828645437aab,HYPE,14.36,343.7,4935.53,buy,10-03-2025 20:58,5092.05,open long,0.0,0x7ed7aa7505d5efbe173a041f48c31f02020200acc3b7fc969f29a0c377c3c815,78726346994,True,1.480659,893000000000000.0,1740000000000.0,2025-10-03 20:58:00,2025-10-03,,,20.0
0x8170715b3b381dffb7062c0298972d4727a0a63b,MELANIA,0.66349,29.6,19.64,buy,27-03-2025 03:18,-724619.4,close short,7.66048,0x9f421bfcd828b711997e042054fef001b800af1bef4e5f981b57466fac4991e3,81996868586,True,0.006598,894000000000000.0,1740000000000.0,,,,,
0xa0feb3725a9335f49874d7cd8eaad6be45b27416,HYPE,26.454,10.31,272.74,sell,16-02-2025 22:34,-311.32,open short,0.0,0x1937a9a3ea82f4c7b32b041de143ff0166003ce6e71bce4895c5a434e7e141db,72712106622,False,0.013637,1020000000000000.0,1740000000000.0,,,,,
0x8477e447846c758f5a675856001ea72298fd9cb5,ZRO,5.08,109.2,554.74,buy,21-07-2024 23:36,-22814.6,close short,-8.33742,0x279baf4e1137cba00644040ddf99ca02011900a5e4bc4fae86a9a5e1de8d6d88,30604874269,False,0.055473,349000000000000.0,1720000000000.0,,,,,
0xbaaaf6571ab7d571043ff1e313a9609a10637864,HYPE,12.802,30.91,395.71,sell,14-03-2025 09:39,109813.57,close long,0.831479,0xe8027289f3cd5c5d3f8f041f838ed60201b400287be10a7c1535654c44859dbc,79743319107,False,0.0,711000000000000.0,1740000000000.0,,,,,
0x513b8629fe877bb581bf244e326a047b249c4ff1,BTC,83167.0,0.013,1081.17,sell,12-04-2025 04:58,-8.28734,open short,0.0,0x6b313e029807198fba0f04215de94801ac001092edd85e7c214059795735b0c6,85920946401,True,0.324351,610000000000000.0,1740000000000.0,2025-12-04 04:58:00,2025-12-04,,,4.0
0x513b8629fe877bb581bf244e326a047b249c4ff1,@107,26.133,1.33,34.76,sell,14-02-2025 06:13,215.5497479,sell,8.49417,0xd3d7a62947458a629e10041db6847901ac00908aae5aebbfd8d88c56729d01d2,72139364576,True,0.011677,979000000000000.0,1740000000000.0,,,,,
0xbee1707d6b44d4d52bfe19e41f8a828645437aab,HYPE,14.699,12.49,183.59,sell,26-03-2025 19:25,1331.09,close long,-2.595422,0x218ecc36f1c01ca375a804204f77ba02036d00979e54394511d033ea08ea0d7f,81919367047,True,0.055077,757000000000000.0,1740000000000.0,,,,,
0x8477e447846c758f5a675856001ea72298fd9cb5,kPEPE,0.00915,38165.0,349.21,sell,23-04-2025 09:52,-9272564.0,open short,0.0,0x8970fb86af56c6ac39c8042212f3b602019b0094ae185acef6734fd7b81c8ff6,88201773142,True,0.122223,42000000000000.0,1750000000000.0,,,,,
0x2c229d22b100a7beb69122eed721cee9b24011dd,TRUMP,54.667,355.5,19434.12,buy,20-01-2025 10:46,475.9,open long,0.0,0xe97d068ed49ac682167e041be5e80702037b007eb5cf18008f98e4864dba37d8,64694514821,True,6.801941,851000000000000.0,1740000000000.0,,,,,
0xb899e522b5715391ae1d4f137653e7906c5e2115,BTC,83859.0,1.78871,149999.43,buy,11-04-2025 23:27,-9.03407,close short,150.25164,0x34047c86724f680d29ce04215a2d680201a10025c920b069c7964e360ca230c7,85881569376,True,44.999829,440000000000000.0,1740000000000.0,2025-11-04 23:27:00,2025-11-04,,,23.0
0x92f17e8d81a944691c10e753af1b1baae1a2cd0d,FARTCOIN,0.8197,2210.3,1811.78,sell,29-01-2025 04:00,-602976.8,open short,0.0,0xa8ed825c4f4ccaa20363041cb4d73801b5003618787157896fbbd80da5b16f18,67326902045,True,0.634124,188000000000000.0,1740000000000.0,,,,,
0x28736f43f1e871e6aa8b1148d38d4994275d72c4,HBAR,0.28618,192.0,54.95,buy,19-12-2024 12:57,-572.0,close short,1.825536,0xf978ce529817b4f0e0c7041999127101a3008853581637820344606cb26b18d9,56544561332,True,0.019231,184000000000000.0,1730000000000.0,,,,,
0x75f7eeb85dc639d5e99c78f95393aa9a5f1170d4,ONDO,0.27205,249.0,67.74,buy,22-01-2024 07:28,14139.0,open long,0.0,0xcce92ffcbf63ca530b42040743082e01d4005d5aa79080c365585c19af11ce79,7700952493,False,-0.001354,1070000000000000.0,1710000000000.0,,,,,
0xb1231a4a2dd02f2276fa3c5e2a2f3436e6bfed23,ETH,2300.5,1.0413,2395.51,buy,02-02-2024 03:55,2.6242,open long,0.0,0x565aa84b6bc24127032004076d391d0106002d472741d626c9eae35d655c600c,8654319958,False,-0.04791,328000000000000.0,1710000000000.0,2024-02-02 03:55:00,2024-02-02,Greed,63.0,3.0
0xbee1707d6b44d4d52bfe19e41f8a828645437aab,HYPE,12.51,46.21,578.09,sell,13-03-2025 13:20,258.25,close long,0.365059,0xd61e0f9dc8d9e0a07c32041f75763f01a90079320c79f382ff54cea4a0a98e2f,79545978230,True,0.173426,487000000000000.0,1740000000000.0,,,,,
0xa0feb3725a9335f49874d7cd8eaad6be45b27416,HYPE,24.332,32.54,791.76,buy,20-02-2025 21:27,347.62,open long,0.0,0x86fc3a451c908b06f32b041e21949002020a00cc407022a19b24251d3e1ad541,73604516145,False,0.039588,1120000000000000.0,1740000000000.0,,,,,
0xbee1707d6b44d4d52bfe19e41f8a828645437aab,HYPE,16.787,301.42,5059.94,sell,13-04-2025 06:43,-6102.7,open short,0.0,0xabf68d421fe2ef668ec804216f49d40201b600ad187af4a64a27707104d89546,86132118910,True,1.770978,185000000000000.0,1740000000000.0,,,,,
0x47add9a56df66b524d5e2c1993a43cde53b6ed85,HYPE,25.201,3.0,75.6,buy,15-12-2024 07:29,227.92,open long,0.0,0x2207cc2f211404d0ae82041941fd85017d001889b688d60354efac358af51c60,55497440402,True,0.025402,1060000000000000.0,1730000000000.0,,,,,
0xa0feb3725a9335f49874d7cd8eaad6be45b27416,ONDO,1.4017,278.0,389.67,buy,11-02-2025 20:57,9466.0,open long,0.0,0x419187ab8c6332a5a235041d91fe6a02020600d932693cc23bc0a48929e163ff,71504154157,False,0.019483,815000000000000.0,1740000000000.0,2025-11-02 20:57:00,2025-11-02,,,20.0
0x8477e447846c758f5a675856001ea72298fd9cb5,DOGE,0.38144,1455.0,555.0,sell,21-01-2025 22:33,-10597.0,open short,0.0,0x5d33bfe169ee4c428609041c0b4c7501740034d69e028b57c4de7c3fc182ed83,65371039534,True,0.194248,418000000000000.0,1740000000000.0,,,,,
0xbaaaf6571ab7d571043ff1e313a9609a10637864,HYPE,22.111,0.52,11.5,sell,24-02-2025 19:02,19927.29,close long,0.112632,0x0000000000000000000000000000000000000000000000000000000000000000,74429385597,False,0.001103,340000000000000.0,1740000000000.0,,,,,
0x75f7eeb85dc639d5e99c78f95393aa9a5f1170d4,MELANIA,0.63359,1163.2,736.99,sell,11-03-2025 05:53,231439.8,close long,9.119488,0x7040312b098eb3d91e30041f4ef47e02034b0053c06532bed91214b1f6164d40,78872077841,True,0.247629,723000000000000.0,1740000000000.0,2025-11-03 05:53:00,2025-11-03,,,5.0
0xb1231a4a2dd02f2276fa3c5e2a2f3436e6bfed23,HYPE,23.808,21.1,502.35,buy,06-02-2025 21:19,-4942.34,close short,53.24585,0x277ebc75f3588e5c775f041d419ac9020202006c524bdfa6cfc1f04ee484543f,70177940119,True,0.175822,1010000000000000.0,1740000000000.0,2025-06-02 21:19:00,2025-06-02,,,21.0
0xb899e522b5715391ae1d4f137653e7906c5e2115,SOL,143.84,12.24,1760.6,sell,26-03-2025 17:58,1539.11,close long,-2.859264,0xa4b29cee53253be5e05904204e73a00201f2006252953ebc5bfd38bb3f39f1f8,81904495650,True,0.44015,693000000000.0,1740000000000.0,,,,,
0xb899e522b5715391ae1d4f137653e7906c5e2115,SOL,135.25,10.0,1352.5,buy,04-03-2025 07:15,2318.39,open long,0.0,0xc05a878be584c32bfb92041edcfac602066f00a64762bd62def3d18bcdbf8eee,76862827927,True,0.45444,679000000000000.0,1740000000000.0,2025-04-03 07:15:00,2025-04-03,Fear,25.0,7.0
0x2c229d22b100a7beb69122eed721cee9b24011dd,LTC,119.82,8.78,1052.02,sell,25-01-2025 02:55,280.63,close long,17.18685,0x1d4ff1512ec32202da92041c61bd6002013200cfaf7e587319cdf96dd3bc840e,66325272593,False,0.105201,670000000000000.0,1740000000000.0,,,,,
0x8477e447846c758f5a675856001ea72298fd9cb5,BTC,93500.0,0.00593,554.46,buy,23-04-2025 19:07,-1.87039,close short,-11.133575,0x63fd8d0ef1c687f337e20422194e2e020549002a14bbfef0b58a25abaeae774e,88305382052,False,0.055445,416000000000000.0,1750000000000.0,,,,,
0x513b8629fe877bb581bf244e326a047b249c4ff1,@107,24.997,1.75,43.74,sell,14-02-2025 00:31,20754.33975,sell,9.18854,0x2926480c8e823afc8896041db2b25d0201ca00497223b7589c76d9a3573915d7,72089108457,True,0.014697,156000000000000.0,1740000000000.0,,,,,
0xbee1707d6b44d4d52bfe19e41f8a828645437aab,HYPE,16.8,65.84,1106.11,sell,13-04-2025 06:55,-12846.95,open short,0.0,0x861b75e59dfcaabb1e7204216f6a39017c0068b295e0dbc38a17f83ef5835ae7,86132986163,False,0.110611,321000000000000.0,1740000000000.0,,,,,
0xbaaaf6571ab7d571043ff1e313a9609a10637864,HYPE,19.359,10.0,193.59,buy,25-02-2025 07:24,240435.01,open long,0.0,0x57199c14d3e81ee2506f041e692ad802010b00a0bf05ecc45af3a70aeb664fc6,74607648913,False,0.009291,591000000000000.0,1740000000000.0,,,,,
0x513b8629fe877bb581bf244e326a047b249c4ff1,BTC,83077.0,0.24074,19999.96,sell,12-04-2025 09:15,15.40948,close long,47.78689,0x04142cf779dc722c14a2042160c2e70201900060892c1a0b1448bda3a619e60b,85949279872,True,4.999989,875000000000000.0,1740000000000.0,2025-12-04 09:15:00,2025-12-04,,,9.0
0x8381e6d82f1affd39a336e143e081ef7620a3b7f,@107,24.679,5.12,126.36,buy,06-02-2025 20:14,2117.656505,buy,0.0,0x5c96500e04dfd95b199c041d40defd0204e400a9de5708c983219918d4c00438,70153050321,True,0.00153596,739000000000000.0,1740000000000.0,2025-06-02 20:14:00,2025-06-02,,,20.0
0xbee1707d6b44d4d52bfe19e41f8a828645437aab,@107,15.877,21.63,343.42,sell,14-04-2025 12:48,329.5810256,sell,4.296756,0x7aad328d8d50af9c04c8042183b44b02031200df867f43539687caeb37cc2e87,86428069913,True,0.120196,336000000000000.0,1740000000000.0,,,,,
0xa0feb3725a9335f49874d7cd8eaad6be45b27416,HYPE,27.1,56.14,1521.39,buy,18-12-2024 07:04,0.01,open long,0.0,0xaf410cf47fab554993c204197f7f7201ae00f30ca44e59c04db49e18c49eb5b7,56145972020,False,0.076069,509000000000000.0,1730000000000.0,,,,,
0x083384f897ee0f19899168e3b1bec365f52a9012,ETH,2365.6,0.424,1003.01,buy,03-03-2025 12:25,-140.5243,close short,88.45912,0x761e0ac49e7575356a7e041ecff73e0201af00bdade4caca3ec0cecdaafce846,76557824768,False,0.05015,831000000000000.0,1740000000000.0,2025-03-03 12:25:00,2025-03-03,Fear,33.0,12.0
0x47add9a56df66b524d5e2c1993a43cde53b6ed85,SUI,4.3919,54.8,240.68,buy,15-12-2024 00:55,-238.7,close short,21.02676,0x4be00e38b6f2e3489d7004193c51860151005f8991ec6d6d3df1379a1a2f2da9,55453365598,True,0.080866,1000000000000000.0,1730000000000.0,,,,,
0x4acb90e786d897ecffb614dc822eb231b4ffb9f4,PNUT,0.59,363.0,214.17,sell,12-01-2025 21:21,256158.5,close long,0.61347,0x1d51b36c557f968a6757041b4b98fc019400d54086ff7f4fe05b1687bd787f36,61636246980,False,0.021417,840000000000000.0,1740000000000.0,2025-12-01 21:21:00,2025-12-01,,,21.0
0x8477e447846c758f5a675856001ea72298fd9cb5,ZRO,5.4,45.0,243.0,buy,22-07-2024 17:41,-22767.8,close short,-15.1497,0x3a2cbe87eb89fd7ef01b040deaabd8011b0066874027160a9bdfe6a63bd02f4e,30722577595,False,0.0243,541000000000000.0,1720000000000.0,,,,,
0x75f7eeb85dc639d5e99c78f95393aa9a5f1170d4,IP,7.093,391.3,2775.49,buy,26-02-2025 20:39,-928.5,close short,25.66928,0x93937651142f0c35c89c041e82b625020375007239b221d8329b7d684e1ae013,75185526507,False,0.266447,790000000000000.0,1740000000000.0,,,,,
0xbee1707d6b44d4d52bfe19e41f8a828645437aab,HYPE,15.941,31.36,499.91,sell,26-03-2025 08:52,13960.09,close long,-3.154816,0xbc6aa52f4257f04afa3e04204835b5020202004decf574f78a412f25731f0e4d,81840278308,True,0.149972,233000000000000.0,1740000000000.0,,,,,
0xbee1707d6b44d4d52bfe19e41f8a828645437aab,@107,17.33,1.17,20.28,buy,12-12-2024 11:43,22137.58011,buy,0.0,0x0000000000000000000000000000000000000000000000000000000000000000,54843762088,False,0.0,751000000000000.0,1730000000000.0,2024-12-12 11:43:00,2024-12-12,Extreme Greed,83.0,11.0
0x4f93fead39b70a1824f981a54d4e55b278e9f760,BTC,106314.0,0.03798,4037.81,sell,22-01-2025 02:11,0.0,open short,0.0,0xe944c5b0946f6e7887b8041c0f69bd01f000c48865eda0706c35887e77efb079,65422083562,True,1.009451,597000000000000.0,1740000000000.0,,,,,
0x2c229d22b100a7beb69122eed721cee9b24011dd,NIL,0.7973,175.0,139.53,buy,25-03-2025 08:27,276812.0,open long,0.0,0x247befb2a30b8426313e0420375ffd02058b00d4390cda28e9df62bdb7bf251b,81645640007,True,0.048834,652000000000000.0,1740000000000.0,,,,,
0xb1231a4a2dd02f2276fa3c5e2a2f3436e6bfed23,HYPE,13.825,36.17,500.05,sell,14-03-2025 18:56,4719.11,close long,29.366423,0xea9713ab1820bb84a3b9041f89e00d02014d00c5e58efa5236f9dbcf0d2e7b7b,79810320519,True,0.175017,280000000000000.0,1740000000000.0,,,,,
0xa0feb3725a9335f49874d7cd8eaad6be45b27416,VINE,0.14744,10878.0,1603.85,buy,06-02-2025 10:09,0.0,open long,0.0,0xd2b76315bc5de4427e20041d3a1247014400f03db8c70b1ea7572bd2f6576d83,70034960766,False,0.160385,903000000000000.0,1740000000000.0,2025-06-02 10:09:00,2025-06-02,,,10.0
0xbee1707d6b44d4d52bfe19e41f8a828645437aab,HYPE,15.656,63.87,999.95,buy,23-03-2025 21:36,3481.3,open long,0.0,0x0915d0144a4072be612704201f692202011c00236c1982895a487313626ceb3b,81396228934,True,0.299984,421000000000000.0,1740000000000.0,,,,,
0x4acb90e786d897ecffb614dc822eb231b4ffb9f4,HYPE,14.613,68.43,999.97,buy,20-03-2025 15:48,554.39,open long,0.0,0x6b3bf2c0f9335af8c5ee041fea651d0204fd0074439f5d58e20b44587dc8065b,80913709544,True,0.349988,818000000000000.0,1740000000000.0,,,,,
0xbee1707d6b44d4d52bfe19e41f8a828645437aab,HYPE,14.328,21.04,301.46,buy,10-03-2025 04:39,9051.3,open long,0.0,0xc1787d33f002c0201454041f3d7491020138006037c6419ced6c9f059d8dd0cc,78512166430,True,0.090438,659000000000000.0,1740000000000.0,2025-10-03 04:39:00,2025-10-03,,,4.0
0xa0feb3725a9335f49874d7cd8eaad6be45b27416,VINE,0.14281,2296.0,327.89,sell,06-02-2025 18:32,2301.0,close long,2.137576,0x6c393ee749a5824137a4041d3fb8c40201b90017a7051e24bd9209ac80546c61,70125907963,False,0.032789,111000000000000.0,1740000000000.0,2025-06-02 18:32:00,2025-06-02,,,18.0
0x75f7eeb85dc639d5e99c78f95393aa9a5f1170d4,ZEREBRO,0.039268,28955.0,1137.0,sell,23-02-2025 04:42,220774.0,close long,0.52119,0x1eec228c4a4d0464f147041e46d7a902018000b74760c2f1c5ebfe5c7229e442,74173162916,False,0.109152,756000000000000.0,1740000000000.0,,,,,
0xbee1707d6b44d4d52bfe19e41f8a828645437aab,@107,27.69,1589.11,44002.46,buy,16-12-2024 23:59,35511.76706,buy,0.0,0x5f2e0e0ddc9ba4d96bde041964de6b02019f001eb3296d138ee777e3b2b5e93f,55846884512,True,0.47673297,8030000000000.0,1730000000000.0,,,,,
0x2c229d22b100a7beb69122eed721cee9b24011dd,kPEPE,0.023577,18387.0,433.51,buy,14-11-2024 07:22,483239.0,open long,0.0,0xdb3c32cd9adea12dde800416be2a71020276003d42b2b66b6f3431cae212141e,47069909569,True,0.151728,985000000000000.0,1730000000000.0,,,,,
0xbee1707d6b44d4d52bfe19e41f8a828645437aab,@107,18.547,24.92,462.19,sell,25-02-2025 20:34,24.92167369,sell,7.914184,0xa34c4583802818183a4f041e72257e0201a50055b58cf10157b4dedd9fd931ca,74865909473,True,0.161766,153000000000000.0,1740000000000.0,,,,,
0xb1231a4a2dd02f2276fa3c5e2a2f3436e6bfed23,@107,17.98,9.95,178.9,sell,12-12-2024 16:09,61089.8,sell,178.900901,0x0000000000000000000000000000000000000000000000000000000000000000,54883143825,False,0.01789,1110000000000000.0,1730000000000.0,2024-12-12 16:09:00,2024-12-12,Extreme Greed,83.0,16.0
0xb1231a4a2dd02f2276fa3c5e2a2f3436e6bfed23,HYPE,24.93,2.04,50.86,sell,20-02-2025 09:52,-13295.78,open short,0.0,0x0000000000000000000000000000000000000000000000000000000000000000,73511011701,False,0.005085,589000000000000.0,1740000000000.0,,,,,
0x8477e447846c758f5a675856001ea72298fd9cb5,WLD,1.2353,449.4,555.14,sell,22-02-2025 21:04,0.0,open short,0.0,0x55e7f1c5e0e895ffe336041e41b379016000b60e5579d27cf4ef7ccc3e26417e,74115675425,True,0.1943,520000000000000.0,1740000000000.0,,,,,
0x39cef799f8b69da1995852eea189df24eb5cae3c,BTC,100464.0,0.39815,39999.74,sell,11-12-2024 20:51,1.23829,close long,930.038585,0x2b5bb5ec460155094b720418fa64730000402b92875fc1bbfcc947fc08c8bf79,54032028750,True,13.999909,424000000000000.0,1730000000000.0,2024-11-12 20:51:00,2024-11-12,Extreme Greed,80.0,20.0
0xbee1707d6b44d4d52bfe19e41f8a828645437aab,HYPE,13.3,202.93,2698.97,buy,16-03-2025 20:47,7014.57,open long,0.0,0x03d6be832059c6ef44fd041fabf27101b3002ca33783440feed913733518654f,80170921401,False,0.134948,715000000000000.0,1740000000000.0,,,,,
0x28736f43f1e871e6aa8b1148d38d4994275d72c4,HYPE,23.742,2.98,70.75,sell,09-01-2025 02:03,20.88,close long,7.2861,0xef8c620f41e38eb1f7c1041afcbb0001f800c81fa7842f4dcee0827855b10e1e,61575881040,True,0.024762,550000000000000.0,1740000000000.0,2025-09-01 02:03:00,2025-09-01,,,2.0
0xbee1707d6b44d4d52bfe19e41f8a828645437aab,HYPE,16.129,31.0,500.0,buy,25-03-2025 09:29,8616.25,open long,0.0,0xea4e4fa4cf1cc2b0e70704203818d402014200c471f674c7a63a4f4f8afa6fea,81654113346,True,0.149999,271000000000000.0,1740000000000.0,,,,,
0x47add9a56df66b524d5e2c1993a43cde53b6ed85,EIGEN,4.1455,153.16,634.92,buy,10-12-2024 09:02,-306.12,close short,115.55922,0x15ed3cae2dea162a7c590418db6d440203c50047cd6357e30c031f976b172cc3,54155355885,True,0.213334,995000000000000.0,1730000000000.0,2024-10-12 09:02:00,2024-10-12,Neutral,49.0,9.0
0xbee1707d6b44d4d52bfe19e41f8a828645437aab,HYPE,21.721,20.15,437.68,buy,24-02-2025 18:37,14229.36,open long,0.0,0xa4c20edcc0c7b9720e7a041e606c2f02029c0097f58574a350b83fa55a2259ad,74457195494,True,0.153187,323000000000000.0,1740000000000.0,,,,,
0xbee1707d6b44d4d52bfe19e41f8a828645437aab,HYPE,12.67,193.74,2454.69,sell,29-03-2025 13:07,15322.77,close long,-98.439294,0xb48b98f04190061ed9df04207cc11e01a2003a1d34b1410457feca8dd796e1eb,82459263579,True,0.736405,497000000000000.0,1740000000000.0,,,,,
0x430f09841d65beb3f27765503d0f850b8bce7713,LAYER,2.4584,205.0,503.97,sell,26-04-2025 00:27,-116763.0,open short,0.0,0x82c147e349c685f32dea04223d68db01f80084ced78583740466546d3eed229a,88924198848,False,0.050397,391000000000000.0,1750000000000.0,,,,,
0xbaaaf6571ab7d571043ff1e313a9609a10637864,HYPE,20.585,93.82,1931.28,buy,25-02-2025 02:34,56736.27,open long,0.0,0x492cfd08bfcfb79aa1e7041e65de25014800ae53377d5c024729d5b7a16098bb,74556530768,True,0.648911,709000000000000.0,1740000000000.0,,,,,
0xbaaaf6571ab7d571043ff1e313a9609a10637864,HYPE,13.54,38.9,526.71,buy,12-03-2025 14:46,6340.85,open long,0.0,0x1befdd709f4f18635ef3041f65b74701ba000260db0ad2c3bfd76098d30bce31,79283350744,False,0.026335,277000000000000.0,1740000000000.0,2025-12-03 14:46:00,2025-12-03,,,14.0
0xbee1707d6b44d4d52bfe19e41f8a828645437aab,@107,29.7,121.62,3612.11,sell,23-12-2024 09:24,22742.01438,sell,-177.993375,0xe04d33d021cf457d0ae70419d6aebc01c7008dfa4b95f75f6e09116196614978,57928707765,False,0.180605,843000000000000.0,1730000000000.0,,,,,
0xbee1707d6b44d4d52bfe19e41f8a828645437aab,@107,17.066,30.0,511.98,buy,13-12-2024 13:14,26609.81099,buy,0.0,0x10638d897a71923f133904191d5c7501a5000d210f2a5cf114b2f28f9418cf9e,55135325256,True,0.0075,547000000000000.0,1730000000000.0,,,,,
0xa0feb3725a9335f49874d7cd8eaad6be45b27416,BTC,99408.0,0.00161,160.05,buy,04-02-2025 18:43,1.90281,open long,0.0,0x0095ab1afecf5298acb8041d1f8bce0203ab0036a2f84e2aab6d9645d20138f8,69432611764,False,0.016004,688000000000000.0,1740000000000.0,2025-04-02 18:43:00,2025-04-02,Fear,44.0,18.0
0x23e7a7f8d14b550961925fbfdaa92f5d195ba5bd,PENDLE,3.285,296.0,972.36,buy,24-04-2025 00:50,11026.0,open long,0.0,0x1f3aed7b3169d2b2afa604221d33c202019100426386af1c9349c12da4e001af,88402626747,False,0.097236,370000000000000.0,1750000000000.0,,,,,
0x23e7a7f8d14b550961925fbfdaa92f5d195ba5bd,@107,20.65,2.9,59.88,sell,19-01-2025 15:37,850.4394058,sell,3.678373,0x4747d6b2b7065aea6aef041bd5503f0202f50063a8748c8b0573f86b8491d257,64311051705,True,0.020959,936000000000000.0,1740000000000.0,,,,,
0x8477e447846c758f5a675856001ea72298fd9cb5,WLD,2.3648,319.7,756.03,sell,18-11-2024 21:48,-2044.4,open short,0.0,0x837f861af297a7cffcb004171e4dc502016e0070efd60f7ea6810a97abfa9201,48304048443,True,0.264609,68100000000000.0,1730000000000.0,,,,,
0xa0feb3725a9335f49874d7cd8eaad6be45b27416,@142,93404.0,0.03141,2933.82,buy,24-04-2025 22:30,0.664763528,buy,0.0,0x5d6dc1ef5516dbebf35804222be83f02057a0064f289c4470616285cfafa86ed,88627697764,False,3.14e-06,659000000000000.0,1750000000000.0,,,,,
0xb1231a4a2dd02f2276fa3c5e2a2f3436e6bfed23,@107,15.169,4.05,61.43,sell,11-12-2024 20:13,91135.42,sell,61.43441,0x0000000000000000000000000000000000000000000000000000000000000000,54678012859,False,0.006143,841000000000000.0,1730000000000.0,2024-11-12 20:13:00,2024-11-12,Extreme Greed,80.0,20.0
0x72c6a4624e1dffa724e6d00d64ceae698af892a0,ENA,0.531,43.0,22.83,buy,07-02-2025 18:47,0.0,open long,0.0,0xfc31218b395e7eab0f03041d501fc4020423000e3987cc48558db38d650fef6f,70440107978,False,0.002191,625000000000000.0,1740000000000.0,2025-07-02 18:47:00,2025-07-02,,,18.0
0x39cef799f8b69da1995852eea189df24eb5cae3c,MELANIA,0.54482,10705.6,5832.62,buy,07-04-2025 04:22,-435770.3,close short,1071.523504,0x818b16f76f6a2469ce5804210b2b2c02019400fcd17e533535e33110a67f513c,84315432602,False,0.583262,479000000000000.0,1740000000000.0,2025-07-04 04:22:00,2025-07-04,,,4.0
0xbaaaf6571ab7d571043ff1e313a9609a10637864,HYPE,22.617,2.0,45.23,buy,24-02-2025 07:04,5870.68,open long,0.0,0x030d08dd7484a4f13a3c041e58820f02024100d8e8510ccce5ea72dabfc19da2,73505718930,False,0.004342,173000000000000.0,1740000000000.0,,,,,
0xbee1707d6b44d4d52bfe19e41f8a828645437aab,HYPE,14.577,54.46,793.86,buy,10-03-2025 12:29,2078.6,open long,0.0,0x56309c73a0f633ebeb51041f42df2201bc00c695b12ca6841f1e8ddf1811189c,78602315918,True,0.238159,95200000000000.0,1740000000000.0,2025-10-03 12:29:00,2025-10-03,,,12.0
0x28736f43f1e871e6aa8b1148d38d4994275d72c4,PENDLE,3.5419,6.0,21.25,sell,12-02-2025 14:18,315.0,close long,1.558776,0x916eefb2d7c748047184041d9d036602026e00c2a7fd7e93117cf5a3d4a8c629,71691758695,True,0.007437,77200000000000.0,1740000000000.0,2025-12-02 14:18:00,2025-12-02,,,14.0
0x23e7a7f8d14b550961925fbfdaa92f5d195ba5bd,@107,16.783,42.78,717.98,buy,19-04-2025 01:08,4718.605643,buy,0.0,0x769698ba0e78abbe34f80421cd143d0142006db76c5bd1b4f7156155686e5af9,87385178257,True,0.01497294,1060000000000000.0,1750000000000.0,,,,,
0xbaaaf6571ab7d571043ff1e313a9609a10637864,HYPE,13.42,10.0,134.2,buy,11-03-2025 05:53,52534.98,open long,0.0,0x38c96aa96ca39d18462b041f4ef453020331006808eb104567e5ee782df8d6f4,78800474927,False,0.0,30500000000000.0,1740000000000.0,2025-11-03 05:53:00,2025-11-03,,,5.0
0xa0feb3725a9335f49874d7cd8eaad6be45b27416,HYPE,24.04,10.0,240.4,sell,19-02-2025 04:40,2617.37,close long,1.26,0x118846731044cb81f6ff041e05f0ac01df00747c76cf72a9268cb4f5f271d812,73285044132,False,0.01202,79300000000000.0,1740000000000.0,,,,,
0x72743ae2822edd658c0c50608fd7c5c501b2afbd,KAITO,0.866,1728.0,1496.45,sell,24-04-2025 10:32,-94229.0,open short,0.0,0x3c50e4c91b55b508e522042223c37d0201b000a9c64aee15c1428dce7ede705c,88499219447,False,0.149644,568000000000000.0,1750000000000.0,,,,,
0xbaaaf6571ab7d571043ff1e313a9609a10637864,HYPE,13.636,872.72,11900.41,buy,10-03-2025 23:06,26102.73,open long,0.0,0xae548b866b63b1f37ae8041f4a3fb60203c900fb4c0b49179cd0e5b485c2e6af,78285868834,False,0.0,51500000000000.0,1740000000000.0,2025-10-03 23:06:00,2025-10-03,,,23.0
0xa520ded057a32086c40e7dd6ed4eb8efb82c00e0,@85,3.113,46.25,143.98,buy,07-11-2024 01:47,774.0190015,buy,0.0,0xe0c858db6c0ff4a030a1041627b7f4017b005b081c3a91ab1e74d523ca68c8b4,45091069763,True,0.01618727,112000000000000.0,1730000000000.0,2024-07-11 01:47:00,2024-07-11,Fear,29.0,1.0
0xb1231a4a2dd02f2276fa3c5e2a2f3436e6bfed23,PURR/USDC,0.087596,3424.0,299.93,buy,25-02-2025 09:06,1250440.278,buy,0.0,0x2bfb7e7d3e967ce74ee6041e6a559501fa0089d410dce75a8b56198c5a6d126a,74661098161,True,1.19839,55500000000000.0,1740000000000.0,,,,,
0x8477e447846c758f5a675856001ea72298fd9cb5,AIXBT,0.5794,1515.0,877.79,sell,10-01-2025 15:01,-2337.0,open short,0.0,0x4c05b6efa360e115b1ba041b1cb7cb0202610016f971260478384c926b4462b3,62015993771,True,0.307226,821000000000000.0,1740000000000.0,2025-10-01 15:01:00,2025-10-01,,,15.0
0x8477e447846c758f5a675856001ea72298fd9cb5,ETH,2007.9,1.2451,2500.04,sell,23-03-2025 18:31,0.0,open short,0.0,0xf6dd09a190d5f40f902604201d4d390189001d1cc76a6bf16e2cf9dbb33d7778,81376608417,True,0.875012,432000000000000.0,1740000000000.0,,,,,
0x4acb90e786d897ecffb614dc822eb231b4ffb9f4,PNUT,0.59,84.7,49.97,sell,12-01-2025 21:21,65858.3,close long,0.143143,0x2fc946daf544dfdc842b041b4b996801d200cf0816a196c50693039e8c007439,61636246980,False,0.004997,825000000000000.0,1740000000000.0,2025-12-01 21:21:00,2025-12-01,,,21.0
0xa0feb3725a9335f49874d7cd8eaad6be45b27416,HYPE,26.246,17.73,465.34,sell,17-02-2025 01:17,421.04,close long,1.512369,0x0000000000000000000000000000000000000000000000000000000000000000,72736151848,False,0.023267,304000000000000.0,1740000000000.0,,,,,
0x39cef799f8b69da1995852eea189df24eb5cae3c,MELANIA,0.73264,2831.8,2074.69,sell,20-03-2025 23:17,-586958.6,open short,0.0,0xb4e8b7b0c23f0c5959a3041fefa26901bc003551c2841a7c32281133d5a9162d,80963185708,False,0.207468,358000000000000.0,1740000000000.0,,,,,
0x8170715b3b381dffb7062c0298972d4727a0a63b,MELANIA,0.48754,2013.2,981.52,sell,23-04-2025 22:28,-52012.7,open short,0.0,0x5c9ece346aff57050acf04221b938c02020c007d84e91afac61d4aec9344889d,88374431959,True,0.329788,455000000000000.0,1750000000000.0,,,,,
0xbaaaf6571ab7d571043ff1e313a9609a10637864,HYPE,14.509,41.46,601.54,sell,12-03-2025 01:12,158612.48,close long,50.825814,0xb3a9e6e4f5293d501bb3041f5c49ec02018b00ecdfb8798414bcd103222f2c30,79154664708,True,0.150385,1020000000000000.0,1740000000000.0,2025-12-03 01:12:00,2025-12-03,,,1.0
0xbee1707d6b44d4d52bfe19e41f8a828645437aab,HYPE,14.053,34.73,488.06,sell,21-03-2025 19:24,8169.94,close long,1.976137,0xbd5610ad14816f040b97041ffd574d0201ba0094226b3f3cb01a9acf06223e17,81116055175,True,0.146418,1000000000000000.0,1740000000000.0,,,,,
0xbaaaf6571ab7d571043ff1e313a9609a10637864,HYPE,19.365,5.13,99.34,buy,25-02-2025 07:24,238429.5,open long,0.0,0x40aeaf1d77281470e10f041e692a6d02033800afaa9723b143a9ec5937cac8e8,74607648916,False,0.004768,28600000000000.0,1740000000000.0,,,,,
0x8477e447846c758f5a675856001ea72298fd9cb5,WLD,2.7906,141.9,395.99,sell,12-11-2024 07:52,-5709.3,open short,0.0,0x93e5ca612c375a619e95041694c13d01ed0099092d23e40c291df6bbb0fad8df,46311586948,True,0.138595,35100000000000.0,1730000000000.0,2024-12-11 07:52:00,2024-12-11,Greed,74.0,7.0
0x23e7a7f8d14b550961925fbfdaa92f5d195ba5bd,HYPE,18.473,5.41,99.94,sell,24-04-2025 02:51,636.24,close long,0.398717,0x3311c4b670cb10ef75ea04221e90b902017400916d315a9d35519a46ab07ba35,88422028222,True,0.034978,508000000000000.0,1750000000000.0,,,,,
0x083384f897ee0f19899168e3b1bec365f52a9012,ETH,3090.6,0.9184,2838.41,buy,02-02-2025 13:02,-201.5171,close short,234.83488,0x6b59318b75aaa3c576f0041cfb7ec902032f005775d7f1195600505a6a88d75f,68441119683,False,0.14192,896000000000000.0,1740000000000.0,2025-02-02 13:02:00,2025-02-02,Greed,60.0,13.0
0x39cef799f8b69da1995852eea189df24eb5cae3c,@107,22.533,892.27,20105.52,sell,19-01-2025 23:16,1182.941806,sell,-695.366235,0x5396b78f8a24f2a8e50c041bdbed72016600e73dd31632c3f5ff4e4f11e844b5,64448830132,False,2.010551,605000000000000.0,1740000000000.0,,,,,
0x39cef799f8b69da1995852eea189df24eb5cae3c,FARTCOIN,0.45792,3249.9,1488.19,sell,07-04-2025 03:45,-139972.8,open short,0.0,0xdba896d500a45117962004210abcc702028f00720d4d56b7a59870b7691b4222,84366404051,False,0.148819,420000000000000.0,1740000000000.0,2025-07-04 03:45:00,2025-07-04,,,3.0
0xb1231a4a2dd02f2276fa3c5e2a2f3436e6bfed23,HYPE,25.528,197.19,5033.87,sell,04-02-2025 08:01,-4230.2,open short,0.0,0x9bb5fc9c6106d5a149d0041d18511101870046b0abb50f0fdd89af7dadfb359e,69256550638,True,1.761853,84300000000000.0,1740000000000.0,2025-04-02 08:01:00,2025-04-02,Fear,44.0,8.0
0x8477e447846c758f5a675856001ea72298fd9cb5,kPEPE,0.00903,8991.0,81.19,buy,23-04-2025 19:07,-7132375.0,close short,-3.884112,0x0000000000000000000000000000000000000000000000000000000000000000,88248475710,False,0.008118,1090000000000000.0,1750000000000.0,,,,,
0x92f17e8d81a944691c10e753af1b1baae1a2cd0d,@123,38.717,47.59,1842.54,buy,13-12-2024 21:07,11396.60979,buy,0.0,0xa910fe8796515611db2a0419242f6a020109001051c371b4f5d6aa135e0aa27c,55214888332,True,0.01665648,796000000000000.0,1730000000000.0,,,,,
0x47add9a56df66b524d5e2c1993a43cde53b6ed85,HYPE,18.15,13.77,249.93,buy,26-04-2025 06:36,-1128.08,close short,2.336769,0x8ab9e1b55499b1d6cbb004224190fd020259000b882246e9fff62945ddc881cf,88950406794,False,0.023992,952000000000000.0,1750000000000.0,,,,,
0xbaaaf6571ab7d571043ff1e313a9609a10637864,HYPE,13.024,219.26,2855.64,sell,29-03-2025 21:34,111237.44,close long,6.02965,0x0000000000000000000000000000000000000000000000000000000000000000,82482991555,False,0.285564,256000000000000.0,1740000000000.0,,,,,
0x513b8629fe877bb581bf244e326a047b249c4ff1,BTC,90703.0,0.11024,9999.1,buy,22-04-2025 21:19,25.78904,open long,0.0,0xfc7a31525c08282af8b404220a646b0202a4005924aa5faea61c104bd37d063d,88052378365,True,2.299792,486000000000000.0,1750000000000.0,,,,,
0x271b280974205ca63b716753467d5a371de622ab,PAXG,3085.5,0.363,1120.04,buy,09-04-2025 23:38,-95.804,close short,1.231296,0x391f6886a0e3fef406e70421396f3b0205cc00d3bba419f2e26a8f551673d9a4,85379430895,False,0.107522,81100000000000.0,1740000000000.0,2025-09-04 23:38:00,2025-09-04,,,23.0
0xbee1707d6b44d4d52bfe19e41f8a828645437aab,HYPE,17.144,686.67,11772.27,sell,18-04-2025 05:44,-1631.95,open short,0.0,0x849b63aab9314ec0e1e70421c0060d0202fe005154233f2d98c1110d99fd7463,87254521543,True,3.531681,473000000000000.0,1740000000000.0,,,,,
0x47add9a56df66b524d5e2c1993a43cde53b6ed85,GRIFFAIN,0.1404,1723.0,241.91,buy,06-02-2025 21:46,7725.0,open long,0.0,0xcc99c406e36a8e191a4a041d41e82401cb0054b3e1eae8c51dc083527e7a6090,70188177687,True,0.081281,999000000000000.0,1740000000000.0,2025-06-02 21:46:00,2025-06-02,,,21.0
0x72743ae2822edd658c0c50608fd7c5c501b2afbd,ETH,1454.9,0.688,1000.97,sell,09-04-2025 17:30,960.0931,close long,24.03184,0xb673188332d5924a15580421353e0702015e00de1ba5257cfcdd21ff6234cb6e,85278836101,False,0.100097,17200000000000.0,1740000000000.0,2025-09-04 17:30:00,2025-09-04,,,17.0
0xbee1707d6b44d4d52bfe19e41f8a828645437aab,@107,26.954,73.36,1977.35,sell,31-01-2025 19:13,991.3178879,sell,4.777937,0xee8f0b8f682ff0b05d70041cdf4a8d020144006f524a736976b6c5dece53a64b,67982682809,True,0.69207,766000000000000.0,1740000000000.0,,,,,
0xbee1707d6b44d4d52bfe19e41f8a828645437aab,@107,32.5,71.78,2332.85,buy,21-12-2024 15:10,16393.88436,buy,0.0,0x1d868513e48b8de990380419bd6b5201a5008f06e0668f8b64be66e293bbb054,57333552564,False,0.00358898,303000000000000.0,1730000000000.0,,,,,
0xbd5fead7180a9c139fa51a103cb6a2ce86ddb5c3,BTC,82220.0,0.28368,23324.17,sell,10-04-2025 07:33,37.98367,close long,852.231456,0xb058993fa8c20008ab8704213ee98902037400e30d970887491e090a5358b65a,85472845832,False,1.166208,734000000000000.0,1740000000000.0,2025-10-04 07:33:00,2025-10-04,,,7.0
0x23e7a7f8d14b550961925fbfdaa92f5d195ba5bd,@107,19.685,74.04,1457.48,buy,28-02-2025 02:02,1195.833716,buy,0.0,0x0ef403a187e222930180041e972a4802034e00b91254f3f6dbcdb7da0c15d9da,75596217293,True,0.02591399,545000000000000.0,1740000000000.0,,,,,
0x28736f43f1e871e6aa8b1148d38d4994275d72c4,PURR/USDC,0.2379,58.0,13.8,buy,22-01-2025 03:09,70234.92231,buy,0.0,0xb59f2c015cc834a7854e041c10801701a2002dc7af38fb8dcfa652a3381448c3,65433611495,True,0.02029,820000000000000.0,1740000000000.0,,,,,
0x8477e447846c758f5a675856001ea72298fd9cb5,WIF,3.3298,258.0,859.09,buy,27-05-2024 19:54,-496.0,close short,-2.329998,0xe931ddc9714187abf6da040a0bcad3016400515fb3c4dca1e9e91996874507a2,24031400109,True,0.30068,1060000000000000.0,1720000000000.0,,,,,
0xbaaaf6571ab7d571043ff1e313a9609a10637864,HYPE,20.107,720.49,14486.89,buy,25-02-2025 05:23,200725.69,open long,0.0,0x508ac261a95d79d66d73041e67d0370201de010559c66a084083578e898151b8,74597839875,True,4.867595,587000000000000.0,1740000000000.0,,,,,
0xbaaaf6571ab7d571043ff1e313a9609a10637864,HYPE,10.129,1191.06,12064.25,buy,07-04-2025 04:41,14761.69,open long,0.0,0x1b96b6ac70c3e827adc504210b62d102019100210a27074fade7c969916460b0,84264598541,False,0.603212,925000000000000.0,1740000000000.0,2025-07-04 04:41:00,2025-07-04,,,4.0
0x8477e447846c758f5a675856001ea72298fd9cb5,HYPE,21.249,5.0,106.24,buy,08-01-2025 17:53,144.02,open long,0.0,0x92235da9c4e4ea5d7aee041af5ad8e01e6005ad9342d6277581cf75dc410b5c7,61434288072,True,0.037185,1060000000000000.0,1740000000000.0,2025-08-01 17:53:00,2025-08-01,,,17.0
0xbee1707d6b44d4d52bfe19e41f8a828645437aab,HYPE,15.932,123.32,1964.73,sell,22-03-2025 05:40,-6492.21,open short,0.0,0xc659dd2178ee0339220b0420046ee102017300e7c0d6720c1b14bfc3febf9d4e,81187404019,True,0.58942,290000000000000.0,1740000000000.0,,,,,
0x92f17e8d81a944691c10e753af1b1baae1a2cd0d,FARTCOIN,0.98508,1146.0,1128.9,sell,29-01-2025 19:06,-84780.2,open short,0.0,0x3ad737d31049b784807f041cbef84401f3004944fff84783bfffc8eff152ed12,67471786587,True,0.395115,963000000000000.0,1740000000000.0,,,,,
0x39cef799f8b69da1995852eea189df24eb5cae3c,XRP,1.8706,310.0,579.89,buy,07-04-2025 20:44,-219773.0,close short,10.39306,0xb7280ea9de3ad65caa650421165e7d0205a40089f00396fa551b8b1b0c4d5e07,84702452294,False,0.057988,931000000000000.0,1740000000000.0,2025-07-04 20:44:00,2025-07-04,,,20.0
0xbd5fead7180a9c139fa51a103cb6a2ce86ddb5c3,ETH,2269.3,0.634,1438.74,buy,02-03-2025 21:10,-14.2614,close short,-59.60868,0xbee32d846374d56e3ade041ec571a00202da007167f3c9f84a91ca37631d363f,76335342247,True,0.503557,582000000000000.0,1740000000000.0,2025-02-03 21:10:00,2025-02-03,Fear,44.0,21.0
0xa0feb3725a9335f49874d7cd8eaad6be45b27416,TAO,457.41,3.193,1460.51,sell,21-02-2025 01:16,15.082,close long,4.243497,0xa5c8483802d0e8971063041e2436da02012d008919f3207255d0b7e04b596e81,73702221663,False,0.073025,716000000000000.0,1740000000000.0,,,,,
0xa0feb3725a9335f49874d7cd8eaad6be45b27416,VINE,0.14872,6111.0,908.83,buy,04-02-2025 07:20,20786.0,open long,0.0,0x9668a30ab2655416f672041d17dbd20201c800246c7582077fb3a9b1846de5aa,69247965190,False,0.090882,208000000000000.0,1740000000000.0,2025-04-02 07:20:00,2025-04-02,Fear,44.0,7.0
0xbee1707d6b44d4d52bfe19e41f8a828645437aab,@107,18.34,213.79,3920.91,sell,28-04-2025 13:07,1313.61575,sell,116.80325,0x3b38adb0a51a7e74ad40042266480001e800f528f05d8d7e81143af4cf553b22,89469823089,True,1.176272,451000000000000.0,1750000000000.0,,,,,
0xbee1707d6b44d4d52bfe19e41f8a828645437aab,@107,32.4,14.33,464.29,buy,21-12-2024 15:10,15595.13623,buy,0.0,0x0000000000000000000000000000000000000000000000000000000000000000,57333509146,False,0.00071648,768000000000000.0,1730000000000.0,,,,,
0x23e7a7f8d14b550961925fbfdaa92f5d195ba5bd,@107,16.96,4.9,83.1,buy,18-04-2025 03:37,1239.462772,buy,0.0,0xf80f262048e95437e9f70421be939701930094f8e834d7beb479bc1441874195,87242407930,True,0.00171497,793000000000000.0,1740000000000.0,,,,,
0x4acb90e786d897ecffb614dc822eb231b4ffb9f4,SOL,110.51,129.62,14324.31,buy,10-04-2025 21:04,13370.38,open long,0.0,0x827762b19206ae3fc7950421482aa00203c9009d1a6c4df5c94edba69a4f27f2,85613673023,True,4.297291,548000000000000.0,1740000000000.0,2025-10-04 21:04:00,2025-10-04,,,21.0
0xbaaaf6571ab7d571043ff1e313a9609a10637864,HYPE,13.25,35.0,463.75,sell,12-03-2025 15:07,186938.87,close long,6.3875,0x2ead067a462f0396c7a3041f65f3cb02011d00f2eddbc637ddba46e9c17e3037,79305129371,True,0.139125,369000000000000.0,1740000000000.0,2025-12-03 15:07:00,2025-12-03,,,15.0
0x23e7a7f8d14b550961925fbfdaa92f5d195ba5bd,@107,16.781,17.9,300.38,buy,19-04-2025 01:08,4616.071542,buy,0.0,0x769698ba0e78abbe34f80421cd143d0142006db76c5bd1b4f7156155686e5af9,87385178257,True,0.00626494,230000000000000.0,1750000000000.0,,,,,
0x39cef799f8b69da1995852eea189df24eb5cae3c,XRP,1.998,250.0,499.5,sell,07-04-2025 00:11,-62687.0,open short,0.0,0x7e3a01df084dcbb641d404210846270206ed009dedaa116a7d150c38a77eef1d,84307233542,False,0.04995,126000000000000.0,1740000000000.0,2025-07-04 00:11:00,2025-07-04,,,0.0
0xb899e522b5715391ae1d4f137653e7906c5e2115,BTC,82609.0,1.16004,95829.74,buy,09-04-2025 23:56,0.01013,open long,0.0,0xf69d15bbc45c939a5e1f042139a58302043400a0903eb9a660164c71345da19e,85392915739,True,28.748923,749000000000000.0,1740000000000.0,2025-09-04 23:56:00,2025-09-04,,,23.0
0xbaaaf6571ab7d571043ff1e313a9609a10637864,HYPE,17.643,56.67,999.83,sell,05-03-2025 04:20,224466.82,close long,58.262427,0x347d873ccb38532d2d0b041eeaeda302010d002eb0c29825f41fa7f840e92149,77211051521,True,0.299948,923000000000000.0,1740000000000.0,2025-05-03 04:20:00,2025-05-03,,,4.0
0xb1231a4a2dd02f2276fa3c5e2a2f3436e6bfed23,HYPE,23.917,207.77,4969.24,sell,19-02-2025 04:06,-2499.97,open short,0.0,0x93d2cceefeb9b4f0a6d8041e058f1202014100a7fd5424fe3484c6ec21e84048,73281517340,True,1.739232,354000000000000.0,1740000000000.0,,,,,
0x3998f134d6aaa2b6a5f723806d00fd2bbbbce891,MELANIA,0.50251,1650.0,829.14,buy,12-04-2025 08:21,-70728.9,close short,56.8755,0xaf9793d7fc76272415270421602a730206ed0015c00440455f6b27f3202cbc5f,85929818761,False,0.079597,907000000000000.0,1740000000000.0,2025-12-04 08:21:00,2025-12-04,,,8.0
0xbee1707d6b44d4d52bfe19e41f8a828645437aab,@107,25.42,10.47,266.15,sell,19-12-2024 13:18,11616.15021,sell,2.394288,0x0000000000000000000000000000000000000000000000000000000000000000,56546785124,False,0.013307,872000000000000.0,1730000000000.0,,,,,
0x23e7a7f8d14b550961925fbfdaa92f5d195ba5bd,WIF,1.0102,400.0,404.08,buy,02-02-2025 02:19,6340.0,open long,0.0,0x212c74e449d712c6e91a041cf4398f01a500318d9b4deb3756a263dba9810d73,68309289030,True,0.141428,1060000000000000.0,1740000000000.0,2025-02-02 02:19:00,2025-02-02,Greed,60.0,2.0
0xa0feb3725a9335f49874d7cd8eaad6be45b27416,HYPE,25.669,38.95,999.81,buy,18-02-2025 04:09,424.59,open long,0.0,0x807637973365743ce3ab041df53bf901c500a5250a92fee973aff4f709e463b3,73009241446,False,0.04999,381000000000000.0,1740000000000.0,,,,,
0x271b280974205ca63b716753467d5a371de622ab,PAXG,3080.0,0.324,997.92,sell,09-04-2025 17:28,-6.57,open short,0.0,0x58adaf85c250effcc70504213537b70201150029041b572d64c5a93a0830ceee,85278992574,False,0.0958,678000000000000.0,1740000000000.0,2025-09-04 17:28:00,2025-09-04,,,17.0
0x2c229d22b100a7beb69122eed721cee9b24011dd,ANIME,0.10064,1795.0,180.65,sell,23-01-2025 15:10,514121.0,close long,6.686375,0x2f62807558b89a8dad91041c39436202010200144e59c13483059fdbd0f37ca5,65844996379,False,0.018064,11200000000000.0,1740000000000.0,,,,,
0x47add9a56df66b524d5e2c1993a43cde53b6ed85,PURR,0.27823,638.0,177.51,buy,06-01-2025 02:02,-2661.0,close short,17.422504,0x7c343812ae8ccc22ae10041abe4ed001bb0080132173be82567126f9a2b452c5,60844212202,True,0.059642,1120000000000000.0,1740000000000.0,2025-06-01 02:02:00,2025-06-01,,,2.0
0x8477e447846c758f5a675856001ea72298fd9cb5,HYPE,20.16,2.98,60.08,sell,11-01-2025 16:25,370.21,close long,1.097534,0xc887f1f7d395b9764fd2041b32a6c201d200ee94664e70d2fb254b4f05d6420d,62267843070,True,0.021026,1000000000000000.0,1740000000000.0,2025-11-01 16:25:00,2025-11-01,,,16.0
0x8477e447846c758f5a675856001ea72298fd9cb5,BTC,94250.0,0.00545,513.66,buy,23-04-2025 14:25,-2.11297,close short,-14.70955,0x3a9f13e196c74581529204221616630206bf004ba1ff2508f4eb322e15e51133,88255618224,False,0.051366,572000000000000.0,1750000000000.0,,,,,
0xbaaaf6571ab7d571043ff1e313a9609a10637864,HYPE,11.657,51.66,602.2,sell,04-04-2025 19:24,2629.43,close long,24.920784,0xa2f1aa45928bf5526b120420e4765202043000293030ff4d2abb031b9428b410,83921650126,True,0.18066,987000000000000.0,1740000000000.0,2025-04-04 19:24:00,2025-04-04,Fear,28.0,19.0
0xbaaaf6571ab7d571043ff1e313a9609a10637864,HYPE,10.049,5.27,52.96,buy,07-04-2025 04:51,46031.26,open long,0.0,0x7f1fb7dbc44887137f4004210b817100007cf8b84164b7e5924083d295ef79f1,84264598515,False,0.002647,43600000000000.0,1740000000000.0,2025-07-04 04:51:00,2025-07-04,,,4.0
0xbd5fead7180a9c139fa51a103cb6a2ce86ddb5c3,BTC,84700.0,0.00018,15.25,buy,14-04-2025 00:27,20.27574,open long,0.0,0x93947131828715d1df0c04217b49e80201520011da3a1a8188e46c48a3ec7314,86282879463,False,0.000762,453000000000000.0,1740000000000.0,,,,,
0x23e7a7f8d14b550961925fbfdaa92f5d195ba5bd,@107,17.098,42.51,726.84,buy,18-04-2025 04:41,1093.322414,buy,0.0,0xe48c6118ae71ca24ce750421bf4d4f017200609dc69e195d809abf852e0b156f,87248319029,True,0.01487846,397000000000000.0,1740000000000.0,,,,,
0xbee1707d6b44d4d52bfe19e41f8a828645437aab,@107,25.28,415.94,10514.96,sell,18-12-2024 10:31,43398.14525,sell,30.754418,0xe736f7aeba6196b5b84c041982716f0202f900266330103b9ff10a64b1dfb7e7,56187780454,False,0.525748,43000000000000.0,1730000000000.0,,,,,
0xbee1707d6b44d4d52bfe19e41f8a828645437aab,@107,23.444,12.5,293.05,sell,24-02-2025 05:55,6307.076288,sell,1.62748,0x32c1915688a12cdc5551041e57b72101f100f3e9bea0a997439213743513618f,74331417607,True,0.102567,199000000000000.0,1740000000000.0,,,,,
0xbee1707d6b44d4d52bfe19e41f8a828645437aab,HYPE,16.876,45.23,763.3,buy,19-04-2025 05:57,-552.04,close short,12.623693,0x5118616926d4e2eab0fc0421d03c9e01670009da36e9ab0a60f86142cd3beecc,87409547493,True,0.22899,849000000000000.0,1750000000000.0,,,,,
0xb1231a4a2dd02f2276fa3c5e2a2f3436e6bfed23,ETH,2343.2,0.01,23.43,sell,06-02-2024 20:57,42.7346,close long,0.0433,0x89840ffdfa4c8f66506a04077f959d02017000f7aaae647d510c28aa44b1e540,8953422347,True,0.005858,63600000000000.0,1710000000000.0,2024-06-02 20:57:00,2024-06-02,Greed,73.0,20.0
0xbaaaf6571ab7d571043ff1e313a9609a10637864,HYPE,14.326,77.52,1110.55,sell,12-03-2025 01:34,30177.45,close long,80.845608,0x014b96aa4f4aa9980229041f5c8b9702014200f9f6f44ccb5bb7064267bc440a,79159283165,True,0.277637,1120000000000000.0,1740000000000.0,2025-12-03 01:34:00,2025-12-03,,,1.0
0x8477e447846c758f5a675856001ea72298fd9cb5,PENGU,0.00905,12240.0,110.77,sell,28-02-2025 21:43,-26698.0,open short,0.0,0x0c8baa83d7cc0b5dd038041ea4bfcc020162007307d059c00a7f6c955fc064bc,75902132900,True,0.03877,1080000000000000.0,1740000000000.0,,,,,
0xbaaaf6571ab7d571043ff1e313a9609a10637864,HYPE,13.636,317.49,4329.29,sell,12-03-2025 15:10,122960.18,close long,180.493065,0xfd761a82b5d5dab7103b041f65fd1101fb00dcf41edd74f9763f1565fe0ff2b8,79305638206,True,1.298788,197000000000000.0,1740000000000.0,2025-12-03 15:10:00,2025-12-03,,,15.0
0xbee1707d6b44d4d52bfe19e41f8a828645437aab,HYPE,15.913,57.21,910.38,sell,26-03-2025 12:11,14607.78,close long,10.915668,0xf326c05140a2586d31fa04204a770c0202f700a58ab98a3c95eb46a6f7ca1d7a,81861226298,True,0.273114,268000000000000.0,1740000000000.0,,,,,
0x8477e447846c758f5a675856001ea72298fd9cb5,BTC,98751.0,0.05064,5000.75,buy,02-02-2025 19:32,0.15272,open long,0.0,0x3565737cac90a576dffc041cffe1400204520023207010e9b82324d6cf6890cb,68518747159,True,1.750262,286000000000000.0,1740000000000.0,2025-02-02 19:32:00,2025-02-02,Greed,60.0,19.0
0xbaaaf6571ab7d571043ff1e313a9609a10637864,HYPE,12.876,10.0,128.76,sell,14-03-2025 09:53,28646.36,close long,1.009,0x07777391de2bdd374b7b041f83b8f8016d008bcb0c5dd6f845a7e0683c120d8b,79743319143,False,0.0,983000000000000.0,1740000000000.0,,,,,
0x083384f897ee0f19899168e3b1bec365f52a9012,ETH,2541.7,309.1061,785654.97,buy,25-02-2025 03:40,-1504.5823,close short,47883.62595,0x97d51ad99f2a1c25b084041e66a1da020241003aae4b4f352894ceb08192d891,74570997098,True,274.979241,91000000000000.0,1740000000000.0,,,,,
0x2c229d22b100a7beb69122eed721cee9b24011dd,NIL,0.77532,21091.0,16352.27,buy,25-03-2025 08:27,208663.0,open long,0.0,0x247befb2a30b8426313e0420375ffd02058b00d4390cda28e9df62bdb7bf251b,81645640007,True,5.723295,516000000000000.0,1740000000000.0,,,,,
0xbaaaf6571ab7d571043ff1e313a9609a10637864,HYPE,13.232,75.0,992.4,sell,12-03-2025 15:07,182584.18,close long,12.3375,0x2ead067a462f0396c7a3041f65f3cb02011d00f2eddbc637ddba46e9c17e3037,79305129371,True,0.29772,460000000000000.0,1740000000000.0,2025-12-03 15:07:00,2025-12-03,,,15.0
0x75f7eeb85dc639d5e99c78f95393aa9a5f1170d4,AIXBT,0.26146,2056.0,537.56,buy,03-02-2025 11:05,-62076.0,close short,16.1396,0xa8d4f3eba25252c3d012041d0a28430201f400551a8d351780a34dd12d28a150,68862756044,True,0.18062,1090000000000000.0,1740000000000.0,2025-03-02 11:05:00,2025-03-02,Fear,26.0,11.0
0xa0feb3725a9335f49874d7cd8eaad6be45b27416,HYPE,24.159,9.97,240.87,sell,20-02-2025 03:41,1202.83,close long,2.328992,0x9f953ad4699b8c635ae8041e15a20a019c009cf82f407d89496a54031ce9784f,73498604632,False,0.012043,861000000000000.0,1740000000000.0,,,,,
0x28736f43f1e871e6aa8b1148d38d4994275d72c4,BTC,98875.0,0.00011,10.88,buy,27-01-2025 16:09,0.40281,open long,0.0,0x4519e7b380eb6f77d5ff041c9c89430201d600f887d16dfd10e316458cf77d3a,66888229306,True,0.003806,570000000000000.0,1740000000000.0,,,,,
0x4acb90e786d897ecffb614dc822eb231b4ffb9f4,HYPE,17.745,109.99,1951.77,buy,04-03-2025 02:09,1116.69,open long,0.0,0xec6ee50570ba25646502041ed9763002040b001eb6e82824953415d330541911,76788135854,True,0.68312,580000000000000.0,1740000000000.0,2025-04-03 02:09:00,2025-04-03,Fear,25.0,2.0
0xb1231a4a2dd02f2276fa3c5e2a2f3436e6bfed23,@4,3.3863,32.0,108.36,sell,18-09-2024 04:18,2133.21926,sell,-6.813781,0x0938f7a9a32869c66a8d04121836ed02013300b1837c8804d49b1178e483f95c,38203274039,True,0.037926,370000000000000.0,1730000000000.0,,,,,
0xbaaaf6571ab7d571043ff1e313a9609a10637864,HYPE,11.45,94.02,1076.53,buy,06-04-2025 15:53,18871.69,open long,0.0,0x07c680a03f42757f61f7042102abe001c000016101e50f994285636305550e45,84227820216,False,0.053826,495000000000000.0,1740000000000.0,2025-06-04 15:53:00,2025-06-04,,,15.0
0x513b8629fe877bb581bf244e326a047b249c4ff1,BTC,84601.0,1.10352,93358.9,buy,14-04-2025 19:07,69.09341,open long,0.0,0x8f65d85adf8e5394701f042188095c01c2001bc4abf5408820daedfd248074d6,86492926883,True,23.339723,309000000000000.0,1740000000000.0,,,,,
0xb899e522b5715391ae1d4f137653e7906c5e2115,SOL,125.96,146.93,18507.3,sell,12-03-2025 06:54,-3190.42,open short,0.0,0xc50f6424bc5d951217e0041f603e240202f900c3f59724c753138a3162724b57,79208195590,True,4.626825,505000000000000.0,1740000000000.0,2025-12-03 06:54:00,2025-12-03,,,6.0
0xbaaaf6571ab7d571043ff1e313a9609a10637864,HYPE,20.192,14.92,301.26,buy,25-02-2025 04:59,163862.96,open long,0.0,0x82774ce5a8fba171ca24041e6788780201e1001345c2f76c67279275aea790f5,74591870283,True,0.101224,569000000000000.0,1740000000000.0,,,,,
0x8477e447846c758f5a675856001ea72298fd9cb5,kBONK,0.0146,5849.0,85.4,buy,23-04-2025 02:03,-8284678.0,close short,-2.368845,0xbbede3ca9a70c82df35f04220d9db401c60027d075e505abcef093f0e6d4f46d,88098033267,False,0.008539,344000000000000.0,1750000000000.0,,,,,
0x75f7eeb85dc639d5e99c78f95393aa9a5f1170d4,VINE,0.040728,4000.0,162.91,sell,29-03-2025 07:13,130616.0,close long,0.076,0x1622a4540bf71e57153f042078b91402010e004663897bc234467f6d9f358a9f,82414519095,True,0.054738,178000000000000.0,1740000000000.0,,,,,
0xbee1707d6b44d4d52bfe19e41f8a828645437aab,HYPE,18.31,6.72,123.04,buy,22-04-2025 16:44,-286.84,close short,0.017472,0x429e49802d0c257b711d042207428e019e00280311fa9ca45819019087d35f3a,87990196106,True,0.036912,1000000000000000.0,1750000000000.0,,,,,
0x8381e6d82f1affd39a336e143e081ef7620a3b7f,@107,24.574,20.36,500.33,buy,06-02-2025 20:30,827.0120904,buy,0.0,0x4521a6ebc587b56b1969041d410ded02029600b87cb95dfb83b5c385f16fddb3,70158371020,True,0.00610795,659000000000000.0,1740000000000.0,2025-06-02 20:30:00,2025-06-02,,,20.0
0x28736f43f1e871e6aa8b1148d38d4994275d72c4,VIRTUAL,3.9838,12.5,49.8,buy,05-01-2025 23:20,-353.3,close short,0.20425,0xd0b843d72f443f53a7ef041abbf416019f00a2e7a763fe378673fc64098bbdea,60825863254,True,0.017429,130000000000000.0,1740000000000.0,2025-05-01 23:20:00,2025-05-01,Neutral,53.0,23.0
0xbaaaf6571ab7d571043ff1e313a9609a10637864,HYPE,22.044,50.0,1102.2,sell,24-02-2025 18:53,105823.57,close long,7.48,0x4574ec7c828abd776867041e609b5f015500ab9c0f700d8435d7157ca18b7489,74460497694,True,0.370339,499000000000000.0,1740000000000.0,,,,,
0xbee1707d6b44d4d52bfe19e41f8a828645437aab,HYPE,16.725,89.68,1499.9,sell,17-04-2025 18:05,-13889.53,open short,0.0,0x60d2936df6c47f9236520421b812180201e5001fd507973eda6b788b4efe50c5,87152903408,True,0.524964,101000000000000.0,1740000000000.0,,,,,
0xb1231a4a2dd02f2276fa3c5e2a2f3436e6bfed23,LINK,15.056,613.7,9239.87,buy,01-01-2024 05:40,0.0,open long,0.0,0xdb0f6364c4e212a2d1b00406e91dcb014d00a968787e8768feb9f07ef9d67299,5891710460,True,2.309966,801000000000000.0,1700000000000.0,2024-01-01 05:40:00,2024-01-01,Greed,65.0,5.0
0xbee1707d6b44d4d52bfe19e41f8a828645437aab,@107,24.38,78.12,1904.57,buy,18-12-2024 10:17,41879.40622,buy,0.0,0x1bb63d0ceb6d78898adc0419823e2601b90094fbe59a09a2d8a37703e3611e51,56184841640,True,0.02343597,715000000000000.0,1730000000000.0,,,,,
0x8477e447846c758f5a675856001ea72298fd9cb5,SAND,0.31428,252.0,79.2,sell,27-03-2025 12:13,-4899.0,open short,0.0,0x90d3bd37a4268c0264ac04205b15a5017200da0650c9be46aa4b632700e19df6,82059134230,True,0.027719,605000000000000.0,1740000000000.0,,,,,
0xa0feb3725a9335f49874d7cd8eaad6be45b27416,HYPE,23.792,10.71,254.81,buy,20-02-2025 02:42,603.84,open long,0.0,0x2e292f14e49e0c995114041e14f76a01c500ceda334d7a472e3a3c27886953b7,73490332772,False,0.01274,507000000000000.0,1740000000000.0,,,,,
0xb1231a4a2dd02f2276fa3c5e2a2f3436e6bfed23,@4,6.572,41.0,269.45,sell,13-07-2024 04:28,1693.97037,sell,126.808826,0x62dd106fae438c17c731040d5e5b430130005d435800839657287552aeed6844,29619999603,True,0.094308,914000000000000.0,1720000000000.0,,,,,
0x8477e447846c758f5a675856001ea72298fd9cb5,SOL,100.5,28.58,2872.29,sell,07-04-2025 13:54,956.17,close long,-12.06076,0x823f181b49b5e64ccd44042111afdb020505001a52c2d60d7436e234e153dada,84542917887,False,0.287229,1100000000000000.0,1740000000000.0,2025-07-04 13:54:00,2025-07-04,,,13.0
0xbee1707d6b44d4d52bfe19e41f8a828645437aab,HYPE,14.31,205.24,2936.98,buy,10-03-2025 04:39,7437.67,open long,0.0,0x959b943c108882c09db4041f3d73b202034f008b231275cda62f0597ee6952ab,78512089464,True,0.881095,455000000000000.0,1740000000000.0,2025-10-03 04:39:00,2025-10-03,,,4.0
0xbee1707d6b44d4d52bfe19e41f8a828645437aab,HYPE,14.864,67.07,996.93,sell,28-03-2025 07:54,-680.04,open short,0.0,0x663c3b00e0b15e2310650420689cf3020143009274e5f36d976becb7f309f88f,82214860732,True,0.299078,949000000000000.0,1740000000000.0,,,,,
0x8477e447846c758f5a675856001ea72298fd9cb5,SAND,0.35493,1408.0,499.74,sell,03-03-2025 01:13,-2872.0,open short,0.0,0x02d1e318b38f26896ef1041ec831d302018900910420994fe6eb2bf606a4eae8,76425067553,True,0.174909,175000000000000.0,1740000000000.0,2025-03-03 01:13:00,2025-03-03,Fear,33.0,1.0
0xbaaaf6571ab7d571043ff1e313a9609a10637864,HYPE,13.211,74.67,986.47,sell,12-03-2025 15:07,172811.35,close long,10.715145,0x2ead067a462f0396c7a3041f65f3cb02011d00f2eddbc637ddba46e9c17e3037,79305129371,True,0.295939,1020000000000000.0,1740000000000.0,2025-12-03 15:07:00,2025-12-03,,,15.0
0x8170715b3b381dffb7062c0298972d4727a0a63b,TRUMP,13.037,19.1,249.01,sell,23-04-2025 22:30,-908.8,open short,0.0,0xed336f8e9add00ee51dc04221b99000205a8004d5f22ab68f09da996e209e967,88374893025,True,0.083665,361000000000000.0,1750000000000.0,,,,,
0x28736f43f1e871e6aa8b1148d38d4994275d72c4,FARTCOIN,0.86158,29.0,24.99,buy,17-04-2025 20:39,-389.7,close short,0.08091,0xaf97054b3126587ea5cf0421b9d49402030b00e6762e78e0ff38146e5a608c38,87178275308,True,0.008745,1030000000000000.0,1740000000000.0,,,,,
0x513b8629fe877bb581bf244e326a047b249c4ff1,BTC,91170.0,0.90131,82172.43,sell,22-04-2025 23:03,59.10106,close long,419.289412,0x36315be5779a8e346fab04220b98180202f200b1c0d190d4574344a88e1789e2,88074001681,True,18.899659,263000000000000.0,1750000000000.0,,,,,
0x75f7eeb85dc639d5e99c78f95393aa9a5f1170d4,kPEPE,0.016834,35627.0,599.74,sell,19-12-2024 23:54,2055976.0,close long,15.818388,0xc92e359b56c4485fd7f70419a26a6d0203c30101a6b0ce56664faa04f3e1667c,56705460992,False,0.057575,208000000000000.0,1730000000000.0,,,,,
0x28736f43f1e871e6aa8b1148d38d4994275d72c4,SOL,240.24,5.0,1201.2,sell,20-11-2024 20:29,45.0,close long,5.135,0xb99e0ca80649f2bd09c4041746919e01950057d8243e0c958dd29fc807bc0bc8,48756621889,True,0.42042,537000000000000.0,1730000000000.0,,,,,
0xb1231a4a2dd02f2276fa3c5e2a2f3436e6bfed23,@125,2.0017,170.86,342.01,sell,17-12-2024 01:45,170.8687881,sell,341.839603,0xf4f33e52dcc8d6bfd937041966646101970015786150472a12905af9868be114,55866178545,True,0.119703,37800000000000.0,1730000000000.0,,,,,
0x75f7eeb85dc639d5e99c78f95393aa9a5f1170d4,ZEREBRO,0.43635,629.0,274.46,buy,07-01-2025 21:14,-134101.0,close short,9.389712,0xf75572a8e5d2510721e3041ae3c8b202047c00461a996d07c8782c4a33e81373,61198675006,False,0.026348,1120000000000000.0,1740000000000.0,2025-07-01 21:14:00,2025-07-01,,,21.0
0xbee1707d6b44d4d52bfe19e41f8a828645437aab,@107,13.97,1.0,13.97,sell,10-12-2024 15:37,33341.39367,sell,0.532291,0x09de223d5e790626df640418e11beb02022600308e697317192133734edb16c2,54250766207,False,0.0,996000000000000.0,1730000000000.0,2024-10-12 15:37:00,2024-10-12,Neutral,49.0,15.0
0xbee1707d6b44d4d52bfe19e41f8a828645437aab,@107,26.888,12.5,336.1,sell,01-02-2025 20:39,603.8991369,sell,8.972119,0xa7d10163ae4b113d6ba2041cf0621901a3004fa9a2b87ef8df775cba4f9d4da4,68243402329,True,0.117635,154000000000000.0,1740000000000.0,2025-01-02 20:39:00,2025-01-02,Greed,70.0,20.0
0x28736f43f1e871e6aa8b1148d38d4994275d72c4,ETH,3520.0,0.142,499.84,sell,25-11-2024 16:07,1.7627,close long,24.30898,0x56c19038db48628ffe600417ab0ff30201ad009d83306c25c6b88713a78c2775,49021511322,False,0.049984,733000000000000.0,1730000000000.0,,,,,
0xbee1707d6b44d4d52bfe19e41f8a828645437aab,HYPE,15.684,6.0,94.1,buy,26-03-2025 09:52,16421.39,open long,0.0,0xe95dfacaade76eefca05042048e5b302025300635245c9d2b92c2817d310ad77,81847490722,True,0.028231,425000000000000.0,1740000000000.0,,,,,
0x7f4f299f74eec87806a830e3caa9afa5f2b9db8f,ETH,1570.4,0.32,502.53,buy,09-04-2025 22:59,2.9441,open long,0.0,0x02d1a1b4cd4251a1911e0421390115020429004a3acd3f578d4a94271b5b6de1,85367944895,False,0.050252,295000000000000.0,1740000000000.0,2025-09-04 22:59:00,2025-09-04,,,22.0
0x28736f43f1e871e6aa8b1148d38d4994275d72c4,SUI,3.984,13.8,54.98,buy,09-12-2024 18:37,-132.5,close short,0.78798,0xc40880f490f4249942540418cef2b601d4007a560a68f090d92c73b2a7e5bc66,53900872202,True,0.019242,725000000000000.0,1730000000000.0,2024-09-12 18:37:00,2024-09-12,Fear,31.0,18.0
0xa0feb3725a9335f49874d7cd8eaad6be45b27416,BERA,8.915,29.6,263.88,sell,21-02-2025 04:56,270.1,close long,2.748064,0x1329a9bfeeaddae40f2c041e26b40801a600f9ef511d739266960f444932e075,73733566639,False,0.013194,180000000000000.0,1740000000000.0,,,,,
0xae5eacaf9c6b9111fd53034a602c192a04e082ed,GMX,15.039,49.98,751.65,buy,24-04-2025 23:01,2463.08,open long,0.0,0x2dd610012782f34e6b8604222c45010201c1006db5405f762d1488be6cf54ae1,88642822002,True,0.252553,635000000000000.0,1750000000000.0,,,,,
0x75f7eeb85dc639d5e99c78f95393aa9a5f1170d4,RUNE,6.96,2.8,19.49,buy,08-03-2024 05:22,-211.3,close short,0.71372,0x17272671a4dda658771d0407f07b1701e20101f372ac15e18ec7bbaff895e1be,12594643831,False,-0.000389,378000000000000.0,1710000000000.0,2024-08-03 05:22:00,2024-08-03,Fear,37.0,5.0
0xbee1707d6b44d4d52bfe19e41f8a828645437aab,HYPE,26.97,134.25,3620.72,buy,30-01-2025 19:18,-663.02,close short,11.021925,0xd5a7206d9cc2b8d3f900041ccf3b1a01570078a4d524c05788afe95b716a43ae,67753314983,True,1.267252,92000000000000.0,1740000000000.0,,,,,
0x513b8629fe877bb581bf244e326a047b249c4ff1,BTC,85644.0,0.00018,15.42,sell,15-04-2025 15:04,-0.01513,open short,0.0,0xe0cec2d4c7767f9cccde04219595ef0201a700aaaf36fc6446357a6c67dc0e6a,86685611326,False,0.0,778000000000000.0,1740000000000.0,,,,,
0x8477e447846c758f5a675856001ea72298fd9cb5,WLD,3.1439,158.1,497.05,buy,17-07-2024 16:36,-35148.8,close short,0.516987,0xf2c925f1741de125cd4c040da0930502013b00b0d428c5a9f22e49c93523de98,30144849345,True,0.173967,21600000000000.0,1720000000000.0,,,,,
0xb1231a4a2dd02f2276fa3c5e2a2f3436e6bfed23,HYPE,24.13,20.73,500.21,buy,07-02-2025 20:47,-1108.85,close short,14.119203,0x307fdcda36bf89e96b00041d517c15020157006f96bf6ed2f0468811e53f36fa,70487275004,True,0.175075,204000000000000.0,1740000000000.0,2025-07-02 20:47:00,2025-07-02,,,20.0
0xa0feb3725a9335f49874d7cd8eaad6be45b27416,HYPE,24.04,124.77,2999.47,sell,19-02-2025 04:41,1588.37,close long,15.72102,0x45de47f7b3246ff37e82041e05f158016700b48fffc71b47c5ef53592eba1a5b,73285044132,False,0.149973,954000000000000.0,1740000000000.0,,,,,
0xbaaaf6571ab7d571043ff1e313a9609a10637864,HYPE,17.535,28.0,490.98,sell,05-03-2025 14:55,47588.29,close long,25.7628,0x16c116a0000d45985767041ef21cd201f700fd2fe41aa4a28ca1aa81bbe351eb,77326279701,True,0.122745,639000000000000.0,1740000000000.0,2025-05-03 14:55:00,2025-05-03,,,14.0
0x271b280974205ca63b716753467d5a371de622ab,PAXG,3085.5,0.575,1774.16,buy,09-04-2025 23:38,-92.305,close short,1.9504,0x9637bd5f23397a606b4e0421396f9c02034200bfa56e42c7afc8ec1d22711bdf,85379430895,False,0.170319,762000000000000.0,1740000000000.0,2025-09-04 23:38:00,2025-09-04,,,23.0
0x28736f43f1e871e6aa8b1148d38d4994275d72c4,PENDLE,3.2015,7.0,22.41,sell,10-02-2025 00:37,1730.0,close long,0.574238,0xa2221db306e17d1412ba041d74346002018200128c4df3642d5adb4b7644f2d7,71007505205,True,0.007843,441000000000000.0,1740000000000.0,2025-10-02 00:37:00,2025-10-02,,,0.0
0xbee1707d6b44d4d52bfe19e41f8a828645437aab,@107,13.264,149.15,1978.33,sell,12-03-2025 15:40,2811.784665,sell,32.669914,0x83fd913d871046f1f8ce041f66569d020308007c09718db0cf2dce874c871562,79310532345,True,0.593497,315000000000000.0,1740000000000.0,2025-12-03 15:40:00,2025-12-03,,,15.0
0xbaaaf6571ab7d571043ff1e313a9609a10637864,HYPE,14.476,41.46,600.17,sell,12-03-2025 01:12,144284.54,close long,49.457634,0xb3a9e6e4f5293d501bb3041f5c49ec02018b00ecdfb8798414bcd103222f2c30,79154664708,True,0.150043,864000000000000.0,1740000000000.0,2025-12-03 01:12:00,2025-12-03,,,1.0
0xa0feb3725a9335f49874d7cd8eaad6be45b27416,HYPE,28.526,59.16,1687.6,sell,17-12-2024 19:44,1737.19,close long,78.35742,0x4753fdec5cd084b3fa55041975d29e020274001cc2b4ec93ba13a3a5d6c6bd10,56018393301,False,0.084379,675000000000000.0,1730000000000.0,,,,,
0xbee1707d6b44d4d52bfe19e41f8a828645437aab,@107,21.8,18.05,393.49,buy,29-01-2025 04:04,1944.917515,buy,0.0,0x396a0bf6d285a04a091c041cb4e304020101004be94ed06f8b289020cc085f77,67327270478,False,0.001805,546000000000000.0,1740000000000.0,,,,,
0xa0feb3725a9335f49874d7cd8eaad6be45b27416,@142,94665.0,0.00989,936.24,sell,01-05-2025 02:03,1.477941083,sell,6.46203,0x0cf9faa0ae1bd99e4af504228fa3e601db006dbf51d62f5ff14d144617dd385c,90070886764,False,0.093623,392000000000000.0,1750000000000.0,2025-01-05 02:03:00,2025-01-05,Greed,72.0,2.0
0x8477e447846c758f5a675856001ea72298fd9cb5,VIRTUAL,2.3273,95.4,222.02,buy,13-01-2025 16:31,658.3,open long,0.0,0xbebf75c3b292f7a7f514041b5c3bcd0201cb0013661976901da0b70635c365a1,62646870799,True,0.077708,411000000000000.0,1740000000000.0,,,,,
0x75f7eeb85dc639d5e99c78f95393aa9a5f1170d4,OP,2.8705,74.2,212.99,sell,05-04-2024 15:06,5563.4,close long,2.18148,0xe411f735d23b9c8e040d0408585b0702017f00d672f41e1e8f3b4197122ff76a,16800596835,False,0.020447,1030000000000000.0,1710000000000.0,2024-05-04 15:06:00,2024-05-04,Greed,67.0,15.0
0x23e7a7f8d14b550961925fbfdaa92f5d195ba5bd,@107,18.2,79.25,1442.35,sell,26-04-2025 06:28,1030.195325,sell,-69.525863,0x5024c839b472989e98f404224178bb01f30098a94f40d538bc1d9cf09e5af900,88977551143,False,0.072117,161000000000000.0,1750000000000.0,,,,,
0xbee1707d6b44d4d52bfe19e41f8a828645437aab,HYPE,18.347,28.0,513.72,sell,28-04-2025 13:07,-2068.43,open short,0.0,0x4b6a89fd827b3711d60b042266472f0203f600be159f0ce582d6b1c2f549251a,89469762942,True,0.154114,373000000000000.0,1750000000000.0,,,,,
0x4f93fead39b70a1824f981a54d4e55b278e9f760,BTC,96273.0,0.03201,3081.7,sell,10-02-2025 01:54,-0.4356,open short,0.0,0x64cefba57d751119e8ad041d7512360191004b8e636ec83f0f9f94d4b5c16663,71018185098,True,0.924509,1010000000000000.0,1740000000000.0,2025-10-02 01:54:00,2025-10-02,,,1.0
0x8477e447846c758f5a675856001ea72298fd9cb5,kBONK,0.031926,7832.0,250.04,sell,02-01-2025 15:37,0.0,open short,0.0,0x7600ca7d743f21485b23041a76fe2801d0002cd7c707a0e1092acbcb6afc7fd4,60189803062,True,0.087515,548000000000000.0,1740000000000.0,2025-02-01 15:37:00,2025-02-01,Greed,68.0,15.0
0x23e7a7f8d14b550961925fbfdaa92f5d195ba5bd,@107,24.293,0.5,12.15,sell,30-01-2025 02:05,339.4276762,sell,1.096422,0x5ef997f51f347c2f9df8041cc3b34202011b00cf436907da732bd4a60aea2c2c,67578075964,True,0.004251,783000000000000.0,1740000000000.0,,,,,
0xbee1707d6b44d4d52bfe19e41f8a828645437aab,HYPE,27.036,40.0,1081.44,sell,14-02-2025 14:47,-1929.23,open short,0.0,0x881bbc1a8b79ce83f5f6041dbc33e50201e3003888bdf86518b669fea1618112,72216584998,True,0.378504,37400000000000.0,1740000000000.0,,,,,
0xbee1707d6b44d4d52bfe19e41f8a828645437aab,@107,28.326,10.0,283.26,buy,17-12-2024 12:31,24538.9698,buy,0.0,0xa96fe516d06c7ea47eb704196fa24302014d00e15f3c1fc1f4cc06856887724c,55952406959,True,0.00299996,910000000000000.0,1730000000000.0,,,,,
0x8477e447846c758f5a675856001ea72298fd9cb5,POPCAT,0.98188,565.0,554.76,sell,21-07-2024 01:55,-7384.0,open short,0.0,0x9728e393580828e32cd3040dd252df013400b4bf0482d608c8d1664cad988a34,30552474464,True,0.194166,564000000000000.0,1720000000000.0,,,,,
0x75f7eeb85dc639d5e99c78f95393aa9a5f1170d4,BIO,0.073098,3253.0,237.79,sell,27-04-2025 07:04,394160.0,close long,4.027214,0x51ca1901ded110051fef042252022d02046a00c849616bdcaff6a6ee70d51945,89206102163,False,0.023778,279000000000000.0,1750000000000.0,,,,,
0xbee1707d6b44d4d52bfe19e41f8a828645437aab,@107,21.4,50.9,1089.26,buy,29-01-2025 03:30,1361.759861,buy,0.0,0xc5e8937221d4eeab8d25041cb482c40203f000fd2a6a40643ca9052d366ba661,67069010624,False,0.00509,204000000000000.0,1740000000000.0,,,,,
0x28736f43f1e871e6aa8b1148d38d4994275d72c4,SOL,241.57,3.0,724.71,buy,29-11-2024 23:57,7.03,open long,0.0,0x9de19a7651e1bcac8d5a041803c0a402016c00efffcdd68f40f89fcfba4e661f,51334745312,True,0.253648,149000000000000.0,1730000000000.0,,,,,
0xbee1707d6b44d4d52bfe19e41f8a828645437aab,HYPE,12.69,15.76,199.99,sell,29-03-2025 17:53,18164.94,close long,1.254496,0x84d7bbe5937cdc8afcc20420800fdc01d1004cfb1df0f57645f36101958fcc79,82505679076,True,0.059998,902000000000000.0,1740000000000.0,,,,,
0x8170715b3b381dffb7062c0298972d4727a0a63b,MELANIA,0.64,2046.2,1309.57,buy,28-03-2025 13:10,-606253.2,close short,576.496388,0xaf5d07134fd3a3bd6db204206c3d7d02016d006c53563dcaef352df550e59742,82223281455,False,0.125717,1120000000000000.0,1740000000000.0,,,,,
0x8170715b3b381dffb7062c0298972d4727a0a63b,MELANIA,0.53,41.5,22.0,buy,23-04-2025 22:07,-1034785.6,close short,1.076095,0x67589ac5c169f323cf8404221b56890205ca00f71a32f75b67ad71f1dd01140c,88368703390,False,0.002111,535000000000000.0,1750000000000.0,,,,,
0xa0feb3725a9335f49874d7cd8eaad6be45b27416,HYPE,20.015,8.17,163.52,buy,03-03-2025 01:09,5756.41,open long,0.0,0x8a1ff92851fd92ea0871041ec8240c02022600218cdddcf1a380c8792c841d97,76419092120,False,0.008176,477000000000000.0,1740000000000.0,2025-03-03 01:09:00,2025-03-03,Fear,33.0,1.0
0xbee1707d6b44d4d52bfe19e41f8a828645437aab,@107,30.989,66.49,2060.46,sell,20-12-2024 21:50,21680.12067,sell,197.96115,0x146337e95b486dc5a29f0419b2d62b02018d00d8358c53bd859729defbf852f6,57123344611,True,0.618137,401000000000000.0,1730000000000.0,,,,,
0x4acb90e786d897ecffb614dc822eb231b4ffb9f4,SOL,105.46,5.0,527.3,buy,07-04-2025 04:33,16009.2,open long,0.0,0xa999f05c3b7b5205ea1c04210b4c8302099a003ee2721ba2388700765d144e9d,84345775040,False,0.026365,590000000000000.0,1740000000000.0,2025-07-04 04:33:00,2025-07-04,,,4.0
0x75f7eeb85dc639d5e99c78f95393aa9a5f1170d4,MELANIA,0.7284,681.5,496.4,sell,19-03-2025 21:43,26602.2,close long,2.9986,0xb310c7f474472ef549be041fddfd540202c30020c0806591501b390d0c2d203d,80768136453,False,0.047654,841000000000000.0,1740000000000.0,,,,,
0x92f17e8d81a944691c10e753af1b1baae1a2cd0d,@107,23.945,474.84,11370.04,buy,15-12-2024 10:38,95116.50785,buy,0.0,0xf76e0fdb3c2d96826cb7041944b7650186004d7a9c64c218fcff32b398aff4b2,55519957419,True,0.16619398,714000000000000.0,1730000000000.0,,,,,
0x4acb90e786d897ecffb614dc822eb231b4ffb9f4,TRUMP,26.546,136.9,3634.15,buy,19-01-2025 01:20,0.0,open long,0.0,0x6fc4fe2f69844a7b4805041bc92e80018e004229121115cb0bf3c5bd2d480603,64114538012,True,1.271951,28700000000000.0,1740000000000.0,,,,,
0xb1231a4a2dd02f2276fa3c5e2a2f3436e6bfed23,HYPE,13.15,40.01,526.13,buy,12-03-2025 14:49,5429.16,open long,0.0,0xe42ceaf80defd29bf248041f65be940201af0019b3dbc35906ab00429e3838f7,79181045026,False,0.052613,1110000000000000.0,1740000000000.0,2025-12-03 14:49:00,2025-12-03,,,14.0
0x4f93fead39b70a1824f981a54d4e55b278e9f760,ETH,3177.3,0.0292,92.78,buy,23-04-2024 12:37,-16.0887,close short,0.042048,0x34b31d6464a57c36ea57040898765c01220000ca2d8e33cdc149391746484faf,19813712241,True,0.032472,721000000000000.0,1710000000000.0,,,,,
0xb1231a4a2dd02f2276fa3c5e2a2f3436e6bfed23,BTC,43098.0,0.0927,3995.18,sell,06-02-2024 20:55,-2.73851,open short,0.0,0x5e2288ff0768cb91125604077f9456018500ace165dc49e68f28b1efdd29a841,8953290028,True,0.998796,657000000000000.0,1710000000000.0,2024-06-02 20:55:00,2024-06-02,Greed,73.0,20.0
0x7f4f299f74eec87806a830e3caa9afa5f2b9db8f,@107,27.703,1261.9,34958.42,buy,29-12-2024 10:20,124.9875,buy,0.0,0x5e6c49c66c423f574e5c041a2dc561014a0079a56d6d89c24e4dc40c5df92faf,59318562191,False,0.12618997,657000000000000.0,1740000000000.0,,,,,
0x92f17e8d81a944691c10e753af1b1baae1a2cd0d,HYPE,23.159,323.84,7499.81,buy,19-01-2025 18:26,25204.85,open long,0.0,0x158ce2342a5c2558618c041bd7c291015700397444d638d22e3cc5509f676cd8,64361699100,True,2.624933,383000000000000.0,1740000000000.0,,,,,
0xbee1707d6b44d4d52bfe19e41f8a828645437aab,HYPE,12.746,3.0,38.24,sell,13-03-2025 12:30,1385.25,close long,0.9411,0xb9dcd6654e3aad36bb37041f74e401020184008664f5a9f74727552a693cb571,79538804707,True,0.011471,1090000000000000.0,1740000000000.0,,,,,
0xbee1707d6b44d4d52bfe19e41f8a828645437aab,HYPE,20.6,194.41,4004.85,sell,25-02-2025 04:02,16291.92,close long,-184.378444,0x5d6e5bef0fa3dc6aad5f041e66e13e0201c300e660299821462e66dc86fe2ad3,74571662597,False,0.400484,644000000000000.0,1740000000000.0,,,,,
0xbee1707d6b44d4d52bfe19e41f8a828645437aab,@107,19.234,304.81,5862.72,buy,25-02-2025 08:44,688.5602816,buy,0.0,0xfa3b7a292975c2d25cdc041e6a15b901610074b0bbaaff9333023478a6944820,74655813165,True,0.10668347,61200000000000.0,1740000000000.0,,,,,
0xb899e522b5715391ae1d4f137653e7906c5e2115,SOL,145.18,15.24,2212.54,buy,02-03-2025 20:55,1892.76,open long,0.0,0xdda5efe6902bea4a1d1e041ec548f7020494001abfaa38940954174a0979ddb6,76327309137,True,0.743414,912000000000000.0,1740000000000.0,2025-02-03 20:55:00,2025-02-03,Fear,44.0,20.0
0x4f93fead39b70a1824f981a54d4e55b278e9f760,ETH,3565.8,0.8897,3172.49,sell,08-04-2024 13:49,-57.1892,open short,0.0,0xae400485351f04b29ee20408633dbf02036c00c0ddd4e582934ce2c3666f5d45,17109850453,True,1.110372,896000000000000.0,1710000000000.0,2024-08-04 13:49:00,2024-08-04,Fear,34.0,13.0
0x513b8629fe877bb581bf244e326a047b249c4ff1,BTC,93264.0,0.5,46632.0,buy,24-04-2025 01:11,30.90167,open long,0.0,0x859943722880c210701e04221d700c01b4006f995c6999fc7c25ebfd0c8175ac,88406741257,True,10.72536,4590000000000.0,1750000000000.0,,,,,
0x28736f43f1e871e6aa8b1148d38d4994275d72c4,PENDLE,2.8146,1065.0,2997.55,buy,03-02-2025 00:16,4335.0,open long,0.0,0xc0d3ed0552ea35ce59ef041d030db60202dc00134e69b09e7c9110e79958ad5a,68610020933,True,1.049142,775000000000000.0,1740000000000.0,2025-03-02 00:16:00,2025-03-02,Fear,26.0,0.0
0x72c6a4624e1dffa724e6d00d64ceae698af892a0,HYPE,18.48,2.0,36.96,buy,02-03-2025 19:40,-27018.59,close short,11.813,0xb7da25e6e5c06f78d50f041ec46b6002014c009aeb90ee83b0be7b773508a89a,75564000350,False,0.003548,816000000000000.0,1740000000000.0,2025-02-03 19:40:00,2025-02-03,Fear,44.0,19.0
0x3998f134d6aaa2b6a5f723806d00fd2bbbbce891,@153,0.9975,10.8,10.77,sell,21-04-2025 11:24,39639.72932,sell,0.000109,0x399c36024e47a76de5190421f386aa018300170fc70e2086e79beeb70329ce2b,87722525381,False,0.001033,540000000000000.0,1750000000000.0,,,,,
0x271b280974205ca63b716753467d5a371de622ab,SOL,138.12,338.48,46750.86,buy,19-04-2025 22:04,-6696.19,close short,422.998456,0x8918e81328fcffaff08c0421dae52901700066245a3de095fb57a404e7ca3990,87499916685,True,13.464246,717000000000000.0,1750000000000.0,,,,,
0xbee1707d6b44d4d52bfe19e41f8a828645437aab,HYPE,12.952,18.46,239.09,sell,18-03-2025 12:12,1900.27,close long,-0.688558,0x65bf3a78653cf1422520041fc6f16e01ce00745ef0ab6888c0bcc467b2ade3b0,80492735179,True,0.071728,864000000000000.0,1740000000000.0,,,,,
0xa0feb3725a9335f49874d7cd8eaad6be45b27416,@142,93884.0,0.00936,878.75,buy,28-04-2025 20:52,0.159935342,buy,0.0,0x1887b340019001356a1f04226b9bbf0201fe002ec5b07abf6689678bd7c88b17,89446887189,False,9.36e-07,36300000000000.0,1750000000000.0,,,,,
0x8170715b3b381dffb7062c0298972d4727a0a63b,MELANIA,0.585,34.0,19.89,sell,03-04-2025 06:33,-619296.0,open short,0.0,0x39a5b80c0f656d9086390420caf21f01eb0038f388d770695d0c8b84e0537bc9,83516717755,False,0.001909,715000000000000.0,1740000000000.0,2025-03-04 06:33:00,2025-03-04,Extreme Fear,15.0,6.0
0x8477e447846c758f5a675856001ea72298fd9cb5,WLD,2.3515,594.8,1398.67,sell,23-07-2024 16:04,-468.1,open short,0.0,0x7b6d18f49e620ada147d040df861de02010d0064770b17955be4ab44c5504f9b,30843573333,True,0.489535,124000000000000.0,1720000000000.0,,,,,
0xbee1707d6b44d4d52bfe19e41f8a828645437aab,@107,26.335,10.0,263.35,buy,19-12-2024 17:03,31671.40351,buy,0.0,0x405713f17276837e268204199c948c0201420048b1d13edc163bc51eaeae4464,56584632516,True,0.003,989000000000000.0,1730000000000.0,,,,,
0x28736f43f1e871e6aa8b1148d38d4994275d72c4,ETH,2053.5,0.25,513.38,buy,26-03-2025 19:09,9.75,open long,0.0,0x570b629b3396e71db7dd04204f48780201190046761836c1e9e58ecce3f8c96b,81915343823,True,0.179681,9490000000000.0,1740000000000.0,,,,,
0x47add9a56df66b524d5e2c1993a43cde53b6ed85,FTT,3.3,30.3,99.99,sell,25-12-2024 02:34,-1291.1,open short,0.0,0x0df684c7d9899b4371b30419ef3a3101ec00d953b2524b17385f84995dd80cd6,58402580559,False,0.009599,705000000000000.0,1740000000000.0,,,,,
0x75f7eeb85dc639d5e99c78f95393aa9a5f1170d4,GRIFFAIN,0.22411,7469.0,1673.88,sell,31-01-2025 05:01,110871.0,close long,48.62319,0x0d27a63483fc45ed87f2041cd5c5a401e900578cf33ea035546781d8bd179b76,67854991589,False,0.160691,1130000000000000.0,1740000000000.0,,,,,
0x8170715b3b381dffb7062c0298972d4727a0a63b,MELANIA,0.46929,10654.3,4999.96,buy,23-04-2025 21:55,-2206184.4,close short,923.088552,0x20e370552de6d849c14104221b3484020420004d6c0d003148e109374c926d49,88365036466,True,1.679984,112000000000000.0,1750000000000.0,,,,,
0x8477e447846c758f5a675856001ea72298fd9cb5,ZRO,5.24,26.1,136.76,buy,21-07-2024 15:33,-24868.1,close short,-7.119297,0xaea46f673a31f0154b12040ddaaa96013400f79bc3a4b1edf5b25ef1a3e28e01,30594762088,False,0.013676,249000000000000.0,1720000000000.0,,,,,
0x420ab45e0bd8863569a5efbb9c05d91f40624641,SOL,232.69,65.89,15331.94,buy,12-12-2024 22:45,-765.89,close short,406.80486,0xa6150a67f5237e9789a9041910c03502012800dd9c0087612087d6c65b893122,54982288054,True,5.151532,943000000000000.0,1730000000000.0,2024-12-12 22:45:00,2024-12-12,Extreme Greed,83.0,22.0
0x47add9a56df66b524d5e2c1993a43cde53b6ed85,FTT,3.17,4.1,13.0,buy,23-12-2024 19:13,-2230.3,close short,0.392657,0x0000000000000000000000000000000000000000000000000000000000000000,57976484630,False,0.001247,78100000000000.0,1730000000000.0,,,,,
0xbd5fead7180a9c139fa51a103cb6a2ce86ddb5c3,HYPE,24.48,17.87,437.46,buy,22-02-2025 23:14,4921.4,open long,0.0,0xca085ccbb952bf2b33ea041e432ca20201210063ed59d24b8d926306a8c00b36,74137299187,False,0.043745,199000000000000.0,1740000000000.0,,,,,
0xbaaaf6571ab7d571043ff1e313a9609a10637864,HYPE,19.42,2.0,38.84,buy,25-02-2025 06:04,221951.52,open long,0.0,0x0b75e50e8a325563d80c041e6844020202f500c9e712dd36734b3b91a44463f7,74607648943,False,0.001864,244000000000000.0,1740000000000.0,,,,,
0x92f17e8d81a944691c10e753af1b1baae1a2cd0d,HYPE,24.435,47.14,1151.87,sell,23-01-2025 05:54,44134.68,close long,69.333512,0x6b28b8b9ac4759bc0c19041c2ec31d02034100c5dff2f7170cf61fbe7999021f,65745875708,True,0.403153,1040000000000000.0,1740000000000.0,,,,,
0xa0feb3725a9335f49874d7cd8eaad6be45b27416,HYPE,24.823,18.79,466.42,sell,19-12-2024 06:02,1553.64,close long,3.211211,0xd6e6952397c7ff784495041993249102029d00db920adfb7228638da1a12bef0,56446169738,False,0.023321,1110000000000000.0,1730000000000.0,,,,,
0xbee1707d6b44d4d52bfe19e41f8a828645437aab,HYPE,20.848,96.67,2015.38,buy,27-02-2025 12:48,-2669.07,close short,-10.527363,0x04f0b81929c1b70cda48041e8de4630201bf002c56cf4a22d60b7e3aa442ed04,75446509566,True,0.604612,982000000000000.0,1740000000000.0,,,,,
0x8170715b3b381dffb7062c0298972d4727a0a63b,MELANIA,0.518,1807.7,936.39,buy,23-04-2025 22:21,-232347.8,close short,68.566061,0x23ea3786054b0cf9336404221b806a02029e001fa4fce96e783f4da4303aa643,88372711024,False,0.089892,256000000000000.0,1750000000000.0,,,,,
0xb1231a4a2dd02f2276fa3c5e2a2f3436e6bfed23,SEI,0.35571,22099.0,7860.84,buy,24-12-2023 00:46,24712.0,open long,0.0,0x6406a80d560679fb4f640406bff54f0104002ad8147d5d5d6ebf4ada957597fd,5276529418,True,1.965208,1020000000000000.0,1700000000000.0,,,,,
0x72c6a4624e1dffa724e6d00d64ceae698af892a0,HYPE,16.44,277.04,4554.54,buy,04-03-2025 11:30,-3338.06,close short,2201.49836,0x5d59161915c1218c371d041edfd95b0201a600f918765bdfb1f6e98735bfadfe,76941936794,False,0.437234,11700000000000.0,1740000000000.0,2025-04-03 11:30:00,2025-04-03,Fear,25.0,11.0
0xa0feb3725a9335f49874d7cd8eaad6be45b27416,HYPE,21.246,16.55,351.62,buy,25-02-2025 00:30,2497.22,open long,0.0,0xdcf1ce9c3f0f2878c8b6041e64740602018a001e833e561569b5a765370d974e,74502381392,False,0.017581,199000000000000.0,1740000000000.0,,,,,
0xa0feb3725a9335f49874d7cd8eaad6be45b27416,HYPE,25.145,357.92,8999.9,buy,19-12-2024 22:23,2020.12,open long,0.0,0xecc1e2d69d813dea51c40419a121ce02032f0022481e52ddea5035f128b2a40c,56668357017,False,0.449994,1090000000000000.0,1730000000000.0,,,,,
0xbee1707d6b44d4d52bfe19e41f8a828645437aab,@107,30.8,1.18,36.34,sell,20-12-2024 22:45,26342.57834,sell,2.156042,0x0000000000000000000000000000000000000000000000000000000000000000,57137210125,False,0.001817,396000000000000.0,1730000000000.0,,,,,
0x2c229d22b100a7beb69122eed721cee9b24011dd,PNUT,1.8458,160.6,296.44,buy,15-11-2024 21:29,2102.0,open long,0.0,0x10aceeb515c2c0fb39b50416df721901fd004994e5e6674863e301a20c6a1697,47564204942,True,0.103752,841000000000000.0,1730000000000.0,,,,,
0x8170715b3b381dffb7062c0298972d4727a0a63b,HYPE,14.2,89.56,1271.75,sell,19-03-2025 05:22,1850.95,close long,108.00936,0xa5e14d6fe37e90d2384f041fd2bc6701410042462189b416b5f0c1d8a3c42807,80632133396,False,0.122088,642000000000000.0,1740000000000.0,,,,,
0x513b8629fe877bb581bf244e326a047b249c4ff1,BTC,85047.0,1.2181,103595.75,sell,16-04-2025 21:42,43.96185,close long,653.02341,0x71d72a1d7ab8f7a961a60421aa5b980185009c0bd1efce4fd05a0f38d73d3e51,86974982935,True,23.827022,933000000000000.0,1740000000000.0,,,,,
0xbaaaf6571ab7d571043ff1e313a9609a10637864,HYPE,16.035,121.95,1955.47,buy,04-03-2025 13:38,178771.67,open long,0.0,0x06e8e099ee5838c8be9e041ee14fc90201ff00346ef970f61811dd794e68711d,76969615083,True,0.563174,591000000000000.0,1740000000000.0,2025-04-03 13:38:00,2025-04-03,Fear,25.0,13.0
0x39cef799f8b69da1995852eea189df24eb5cae3c,XRP,1.8602,90.0,167.42,buy,08-04-2025 06:31,-182386.0,close short,3.95334,0x72777e672b4dca01b85d04211d1f8b02030100a935a7c7c552edf1547e72ba7b,84813555709,False,0.00837,901000000000000.0,1740000000000.0,2025-08-04 06:31:00,2025-08-04,,,6.0
0x083384f897ee0f19899168e3b1bec365f52a9012,ETH,2365.6,5.0,11828.0,buy,03-03-2025 12:25,-686.8004,close short,1043.15,0x4f9d4419f29ba84e9804041ecff6e401dd0062a5b28a7b105fcba9a6cbf981be,76557824768,False,0.5914,996000000000000.0,1740000000000.0,2025-03-03 12:25:00,2025-03-03,Fear,33.0,12.0
0x513b8629fe877bb581bf244e326a047b249c4ff1,BTC,87368.0,0.22891,19999.41,buy,21-04-2025 17:51,-20.99324,close short,-146.937329,0xa51f91f3c5e6252256810421f7d1c801c60047ce3f3e9c9993f5bb2fed7388ad,87783068153,True,4.599864,731000000000000.0,1750000000000.0,,,,,
0xbd5fead7180a9c139fa51a103cb6a2ce86ddb5c3,XRP,2.6,203.0,527.8,buy,03-03-2025 23:27,-21211.0,close short,9.472386,0x9a3cbe54a48b9f41db69041ed79c3f0204230077cbe79dccb68539e88c877031,76721789271,False,0.02639,1040000000000000.0,1740000000000.0,2025-03-03 23:27:00,2025-03-03,Fear,33.0,23.0
0xa0feb3725a9335f49874d7cd8eaad6be45b27416,ONDO,1.38,15.0,20.7,buy,11-02-2025 17:12,207.0,open long,0.0,0xa4de4e5184c40de629ce041d8f7dcd02017800a5c9cbabc968f82d626969ebd4,71452711388,False,0.001035,165000000000000.0,1740000000000.0,2025-11-02 17:12:00,2025-11-02,,,17.0
0x8477e447846c758f5a675856001ea72298fd9cb5,kBONK,0.01518,36561.0,555.0,buy,23-04-2025 05:59,-5186890.0,close short,-15.684669,0x96b75825af69334e52ac04221049cb01fe00738f6cc1574145855fb2a8ca1bab,88143216316,False,0.055499,825000000000000.0,1750000000000.0,,,,,
0xbee1707d6b44d4d52bfe19e41f8a828645437aab,HYPE,15.946,627.1,9999.74,sell,26-03-2025 08:52,11606.51,close long,-59.95076,0x0d40073cf51f5782dec604204836cd019800e6a6770860ed8b5b99f927812ee8,81840321235,True,2.99992,550000000000000.0,1740000000000.0,,,,,
0xbee1707d6b44d4d52bfe19e41f8a828645437aab,HYPE,16.452,301.37,4958.14,buy,04-03-2025 12:22,12389.48,open long,0.0,0x103ad78e99363052ddc3041ee070f0020296006948b174c2dab7c4dad2f03e1c,76953530650,True,1.487441,464000000000000.0,1740000000000.0,2025-04-03 12:22:00,2025-04-03,Fear,25.0,12.0
0xa0feb3725a9335f49874d7cd8eaad6be45b27416,HYPE,27.224,11.44,311.44,buy,15-02-2025 00:57,73.21,open long,0.0,0x16079dd7dabd02543711041dc322350201340102c7410dc272a0f840989e22b3,72350298331,False,0.015572,357000000000000.0,1740000000000.0,,,,,
0xbee1707d6b44d4d52bfe19e41f8a828645437aab,HYPE,18.239,12.13,221.24,sell,19-04-2025 12:58,-23464.47,open short,0.0,0x7bae4cfcb42fa54ac6210421d4dbae02011a00b57a1d6af257d71ff5fdf87cad,87449449154,True,0.066371,537000000000000.0,1750000000000.0,,,,,
0x271b280974205ca63b716753467d5a371de622ab,HYPE,17.983,276.92,4979.85,sell,20-04-2025 02:00,-21836.1,open short,0.0,0x55226ca0ed7a5ac61ac90421dd7fec01600045d1c6d666ebaad87a208f512800,87523674511,True,1.434196,328000000000000.0,1750000000000.0,,,,,
0x28736f43f1e871e6aa8b1148d38d4994275d72c4,@107,9.9894,9.0,89.9,buy,07-04-2025 13:17,191.1910101,buy,0.0,0x782882592cfda9c0d15a042111452d02014d00a6a5780d43e76d407ab31db751,84544538762,True,0.00314993,702000000000000.0,1740000000000.0,2025-07-04 13:17:00,2025-07-04,,,13.0
0x513b8629fe877bb581bf244e326a047b249c4ff1,BTC,91042.0,1.64759,149999.89,sell,23-04-2025 01:12,24.92064,close long,68.704503,0xb42f70033bf4703003b004220d0c1e0201ef00913989b42d1df01a5978042e6b,88092168693,True,34.499974,1120000000000000.0,1750000000000.0,,,,,
0x4acb90e786d897ecffb614dc822eb231b4ffb9f4,HYPE,12.2,37.76,460.67,buy,13-03-2025 14:11,35567.85,open long,0.0,0x7809712bc0c172607b54041f760cdb0201a7000678f482b0c49d212ba2276157,79535318985,False,0.046067,936000000000000.0,1740000000000.0,,,,,
0x28736f43f1e871e6aa8b1148d38d4994275d72c4,BNB,544.35,1.552,844.83,buy,11-03-2025 18:44,13.448,open long,0.0,0x769ae07dfccdaf37e1a5041f57bfed020812001292258e991f3c34d3e886d2b1,79001333882,False,0.084483,194000000000000.0,1740000000000.0,2025-11-03 18:44:00,2025-11-03,,,18.0
0xbee1707d6b44d4d52bfe19e41f8a828645437aab,HYPE,15.339,3.0,46.02,sell,11-04-2025 15:25,-2419.32,open short,0.0,0xcacd46625c0177ac7d2b042154ae2902022000c803a75053facd19c199dc51c1,85794526499,True,0.016105,956000000000000.0,1740000000000.0,2025-11-04 15:25:00,2025-11-04,,,15.0
0xa0feb3725a9335f49874d7cd8eaad6be45b27416,BTC,98492.0,0.00795,783.01,buy,07-02-2025 20:42,0.33667,open long,0.0,0x37d05431bdae496cafe5041d516cee0205c70046b50e795a794a62e8dce6e9bd,70484305096,False,0.078301,508000000000000.0,1740000000000.0,2025-07-02 20:42:00,2025-07-02,,,20.0
0x430f09841d65beb3f27765503d0f850b8bce7713,LAYER,1.1253,500.0,562.65,buy,12-02-2025 06:02,139137.0,open long,0.0,0x55117344f36db571c16b041d980b1502039300c9bc2e530f978223e63d1afa33,71609366787,True,0.196927,713000000000000.0,1740000000000.0,2025-12-02 06:02:00,2025-12-02,,,6.0
0x8477e447846c758f5a675856001ea72298fd9cb5,JUP,0.90644,2758.0,2499.96,sell,03-02-2025 01:11,28619.0,close long,22.8914,0x61f9c3f2d22745550220041d03a7b30202a7006c7c304fa2714f2cc1ba6e918d,68634748533,True,0.874986,24400000000000.0,1740000000000.0,2025-03-02 01:11:00,2025-03-02,Fear,26.0,1.0
0xbaaaf6571ab7d571043ff1e313a9609a10637864,HYPE,19.298,518.13,9998.87,buy,25-02-2025 05:41,259572.37,open long,0.0,0x61d969db2ce264fd1db2041e6803380203c800eae505f9388c8d7fe6a014b200,74600463398,False,0.479945,879000000000000.0,1740000000000.0,,,,,
0x8477e447846c758f5a675856001ea72298fd9cb5,kPEPE,0.016296,30676.0,499.9,sell,27-05-2024 01:05,-215258.0,open short,0.0,0x4fcf48ecd80b3a4fe4670409fc3cad0139007752de0dff30bc5d814632394365,23953872569,True,0.174963,865000000000000.0,1720000000000.0,,,,,
0xbee1707d6b44d4d52bfe19e41f8a828645437aab,HYPE,18.787,26.63,500.3,buy,29-04-2025 16:21,-11901.65,close short,3.528475,0xbaf7484d8654a8c02654042278d0a502019b00e3d47c92f32731490b903a9f26,89740993822,True,0.150089,635000000000000.0,1750000000000.0,,,,,
0x28736f43f1e871e6aa8b1148d38d4994275d72c4,@107,12.51,27.97,349.9,buy,06-12-2024 14:59,2369.540924,buy,0.0,0x2c787f068ad413e1f16604188d57c101f40016153f11ae01bcb15cda09efdf71,53144226899,False,0.00279696,697000000000000.0,1730000000000.0,2024-06-12 14:59:00,2024-06-12,Greed,72.0,14.0
0xb1231a4a2dd02f2276fa3c5e2a2f3436e6bfed23,PURR/USDC,0.08759,2441.0,213.81,buy,25-02-2025 09:07,1303754.611,buy,0.0,0xd985f4c367b6b6c83d90041e6a55f002029900db4458692212cd681eee16b1ac,74661122789,True,0.85434,676000000000000.0,1740000000000.0,,,,,
0x4f93fead39b70a1824f981a54d4e55b278e9f760,ETH,2954.5,0.075,221.59,buy,16-05-2024 20:48,10.0573,open long,0.0,0x74acbe6bb0cb862b0a06040931bdde014500c3fd9be10573aa754bb1ffa50445,22768319480,True,0.077555,1040000000000000.0,1720000000000.0,,,,,
0xbee1707d6b44d4d52bfe19e41f8a828645437aab,@107,13.066,5.9,77.09,buy,12-03-2025 15:19,3496.478252,buy,0.0,0x2e9cff2f17c473c55489041f66184f0201210022b7d455ea5c6a97e282be329a,79307115482,True,0.00176993,789000000000000.0,1740000000000.0,2025-12-03 15:19:00,2025-12-03,,,15.0
0xbee1707d6b44d4d52bfe19e41f8a828645437aab,HYPE,15.919,7.7,122.58,sell,12-04-2025 13:37,-2735.77,open short,0.0,0x9f59cfee2647199d7d45042163af250203c400871d06cb25f668484050e51e6e,85981299633,True,0.042901,26800000000000.0,1740000000000.0,2025-12-04 13:37:00,2025-12-04,,,13.0
0xbee1707d6b44d4d52bfe19e41f8a828645437aab,@107,33.9,135.95,4608.7,sell,21-12-2024 12:13,22327.59296,sell,667.97853,0xfd68eecb68aac4f7dd880419bb987d01f500a2407cd836bba429d4e4071f7072,57294679682,False,0.230435,813000000000000.0,1730000000000.0,,,,,
0xb1231a4a2dd02f2276fa3c5e2a2f3436e6bfed23,@51,0.949,80.0,75.92,buy,24-02-2025 23:44,9716.308156,buy,0.0,0x6abfe130c45d9763299d041e63eef601f6002661255d6d412f77fda037359a14,74523770052,True,0.028,591000000000000.0,1740000000000.0,,,,,
0xb1231a4a2dd02f2276fa3c5e2a2f3436e6bfed23,@23,0.96042,100.0,96.04,buy,24-02-2025 23:46,2560.553499,buy,0.0,0xfb9f4ad7b53e08f5d447041e63f3c602031e000899fbc9ae4571b62daf60bc64,74524061579,True,0.03499927,435000000000000.0,1740000000000.0,,,,,
0x75f7eeb85dc639d5e99c78f95393aa9a5f1170d4,BIGTIME,0.5409,27.0,14.6,sell,11-03-2024 06:24,11541.0,close long,0.71739,0x58a7c4ddf779392f70fa0407fbc18b019e0035ec1e52a1c166a9f55282bebb92,13013445324,False,0.0007,920000000000000.0,1710000000000.0,2024-11-03 06:24:00,2024-11-03,Greed,74.0,6.0
0xa0feb3725a9335f49874d7cd8eaad6be45b27416,BERA,7.4299,712.3,5292.32,sell,20-02-2025 09:22,1690.3,close long,120.350208,0xfef707bf008a515d2f06041e1976b202025f00bb930ed312396c025e14b03df8,73549386282,True,1.587695,170000000000000.0,1740000000000.0,,,,,
0x271b280974205ca63b716753467d5a371de622ab,FARTCOIN,1.0516,1179.8,1240.68,sell,22-04-2025 21:21,-10066.1,open short,0.0,0xcfe223f69de33370239604220a6acd02019700c30b8d723cb69380acaded3076,88052867238,True,0.357314,140000000000000.0,1750000000000.0,,,,,
0x7f4f299f74eec87806a830e3caa9afa5f2b9db8f,ETH,1504.0,2.3275,3500.56,sell,10-04-2025 22:07,75.6076,close long,-24.787875,0x4d6095a920fee8bb513c042148e26e02029400ccbd3d2bac67311370bf95f57a,85631842617,False,0.350056,490000000000000.0,1740000000000.0,2025-10-04 22:07:00,2025-10-04,,,22.0
0xbee1707d6b44d4d52bfe19e41f8a828645437aab,HYPE,12.762,25.21,321.73,sell,29-03-2025 13:33,19003.99,close long,2.145371,0xbcfc6e25f6a7540f22d904207d0c3902021a00b579b304efd2eefb253fad69b5,82463333999,True,0.096519,1110000000000000.0,1740000000000.0,,,,,
0xbaaaf6571ab7d571043ff1e313a9609a10637864,HYPE,22.608,22.17,501.22,buy,19-02-2025 10:53,7501.13,open long,0.0,0x902e88b1788e25d2f848041e0a239e02011b002ee393b058d86fc190212b3f58,73281529004,False,0.048116,1030000000000000.0,1740000000000.0,,,,,
0xbee1707d6b44d4d52bfe19e41f8a828645437aab,HYPE,15.362,166.64,2559.92,buy,26-03-2025 19:07,16210.89,open long,0.0,0x86b71e1427562010ee2204204f421902021a007981fc4b6e84fa1960a1d3aaa5,81914766392,True,0.767977,892000000000000.0,1740000000000.0,,,,,
0x23e7a7f8d14b550961925fbfdaa92f5d195ba5bd,@107,15.051,136.1,2048.44,sell,16-04-2025 10:12,1892.876732,sell,-3.283209,0x7ccd1ac2f9ae22ddd06d0421a28a52017a00068824927d7d2d7e9d44b8bffb73,86864297068,True,0.716954,436000000000000.0,1740000000000.0,,,,,
0x28736f43f1e871e6aa8b1148d38d4994275d72c4,ADA,0.89601,55.0,49.28,buy,22-11-2024 18:52,-831.0,close short,-1.799655,0x890cd4cdc400a7dcd32b04176ee3aa01f80029afdb00251d267f526778eaeaa3,49269433964,True,0.017248,847000000000000.0,1730000000000.0,,,,,
0xbee1707d6b44d4d52bfe19e41f8a828645437aab,@107,28.536,10.0,285.36,sell,17-12-2024 12:11,37576.51822,sell,55.426437,0xeabddccea4a39b747cad04196f5a93018e00635e00ebc1e0b96ad3f3e4b13790,55950446722,True,0.085607,144000000000000.0,1730000000000.0,,,,,
0x47add9a56df66b524d5e2c1993a43cde53b6ed85,FTT,3.56,36.2,128.87,buy,27-12-2024 20:02,-4444.8,close short,0.974142,0x26de3102667f390901ad041a1658c102023e0050443b01232cb5cf4eb087b7a3,58916056116,False,0.012371,179000000000000.0,1740000000000.0,,,,,
0x75f7eeb85dc639d5e99c78f95393aa9a5f1170d4,TAO,390.1,2.517,981.88,buy,24-01-2025 01:50,-23.505,close short,14.19588,0x102b076a22d35c53d487041c4553f50203cf0057d3f91a18af33f954d06a8b32,66006581572,False,0.09426,479000000000000.0,1740000000000.0,,,,,
0x4f93fead39b70a1824f981a54d4e55b278e9f760,BTC,96680.0,0.01,966.8,sell,14-02-2025 03:03,-1.03668,open short,0.0,0x0df6bb91ca929cb908b5041db46718020241002706aed460af0c930df415788a,72112654407,True,0.29004,580000000000000.0,1740000000000.0,,,,,
0x4f93fead39b70a1824f981a54d4e55b278e9f760,BTC,104465.0,0.14361,15002.22,buy,30-01-2025 01:56,0.06702,open long,0.0,0xea4ad3ee19860efa5e51041cc39b4702023b00b814c676ffcae73cfd596355bf,67574495450,True,4.500665,422000000000000.0,1740000000000.0,,,,,
0x8477e447846c758f5a675856001ea72298fd9cb5,MEME,0.013262,28203.0,374.03,sell,11-11-2024 00:13,-750741.0,open short,0.0,0xe58427ac23dbab9ac4c90416795f8f02011200571fea355efae30885156d5cb6,45879577865,True,0.130909,359000000000000.0,1730000000000.0,2024-11-11 00:13:00,2024-11-11,Extreme Greed,76.0,0.0
0xbee1707d6b44d4d52bfe19e41f8a828645437aab,@107,26.781,1.0,26.78,buy,19-12-2024 17:18,33545.02126,buy,0.0,0x8257a0c5ade9d14133d204199ccd00019e004e5488571407bb0276d7b92853b1,56586754178,True,0.00029998,992000000000000.0,1730000000000.0,,,,,
0xbaaaf6571ab7d571043ff1e313a9609a10637864,HYPE,14.202,54.14,768.9,sell,12-03-2025 01:41,1392.62,close long,49.749246,0xd3ce5cd6f87448a89e34041f5ca241018300529fdf1300d076386a2cd2a54c7c,79160703571,True,0.192224,409000000000000.0,1740000000000.0,2025-12-03 01:41:00,2025-12-03,,,1.0
0x75f7eeb85dc639d5e99c78f95393aa9a5f1170d4,PURR,0.085539,10000.0,855.39,sell,03-03-2025 07:23,197924.0,close long,6.29,0xf79902cee76f8dbe8d0c041ecc79ff02017f00eb935514979602ffaf11cc7dc0,76503093591,False,0.082117,933000000000000.0,1740000000000.0,2025-03-03 07:23:00,2025-03-03,Fear,33.0,7.0
0x2c229d22b100a7beb69122eed721cee9b24011dd,TRUMP,32.386,155.6,5039.26,sell,19-01-2025 09:23,1006.3,close long,225.688464,0x22e4f24d88a6655f8798041bcffb7a02013000cede441e34675796d5a580b93d,64200957920,False,0.503926,546000000000000.0,1740000000000.0,,,,,
0xbee1707d6b44d4d52bfe19e41f8a828645437aab,HYPE,11.5,26.08,299.92,buy,08-04-2025 05:28,8189.19,open long,0.0,0xf4c86f72443bee85d81704211c682601cb00a07380d9350cd043fe5916d65172,84825652659,True,0.089975,526000000000000.0,1740000000000.0,2025-08-04 05:28:00,2025-08-04,,,5.0
0x28736f43f1e871e6aa8b1148d38d4994275d72c4,AI16Z,1.9746,5.3,10.47,buy,06-01-2025 19:47,-373.7,close short,0.260707,0xee085b86af41bfc1d714041acdbe7e02011500ed9e9c423449f43ba97e6e8124,60979745449,True,0.003662,152000000000000.0,1740000000000.0,2025-06-01 19:47:00,2025-06-01,,,19.0
0x8477e447846c758f5a675856001ea72298fd9cb5,ETH,3579.7,0.062,221.94,sell,03-01-2025 23:00,-0.2068,open short,0.0,0x777b463340c4e0bef2f4041a921be0014d0054159533b4659f6347b6cad4f06e,60475382615,True,0.077679,221000000000000.0,1740000000000.0,2025-03-01 23:00:00,2025-03-01,Extreme Fear,20.0,23.0
0x28736f43f1e871e6aa8b1148d38d4994275d72c4,DOGE,0.3192,9399.0,3000.16,buy,27-01-2025 18:32,6448.0,open long,0.0,0xc209bac2527ee393cb98041c9e2b63020407003713ea33e0718f7ae21493357f,66923160590,True,1.050056,915000000000000.0,1740000000000.0,,,,,
0x28736f43f1e871e6aa8b1148d38d4994275d72c4,ZK,0.23224,86.0,19.97,sell,13-12-2024 13:17,-822.0,open short,0.0,0xe46b9eb51cbd0631e1fc04191d67be0162001899122b4c706ddeef671e0af783,55135819896,True,0.00699,670000000000000.0,1730000000000.0,,,,,
0x8477e447846c758f5a675856001ea72298fd9cb5,HYPE,23.353,32.86,767.38,sell,09-01-2025 01:36,-676.4,open short,0.0,0x2fd72766de973fcfb07b041afc57f102018400b7476707c170e5596ea9430440,61570473663,True,0.268582,295000000000000.0,1740000000000.0,2025-09-01 01:36:00,2025-09-01,,,1.0
0xbaaaf6571ab7d571043ff1e313a9609a10637864,HYPE,22.063,6.07,133.92,sell,24-02-2025 18:52,111123.89,close long,1.023402,0x20098e87df15294d9ae9041e60980b020186001dfa0d7dcc04a4d335d7d7637e,74429390072,False,0.012856,4270000000000.0,1740000000000.0,,,,,
0xbee1707d6b44d4d52bfe19e41f8a828645437aab,@107,25.8,10.0,258.0,sell,23-12-2024 20:45,5047.419916,sell,1.073708,0x8d7123b108560213a2870419dd506602028200b25413419f010ad3b324e96997,58066988875,False,0.0129,227000000000000.0,1730000000000.0,,,,,
0x513b8629fe877bb581bf244e326a047b249c4ff1,BTC,84153.0,0.00015,12.62,buy,16-04-2025 00:29,32.06416,open long,0.0,0x7bbedc1b1887f40e92f604219c04ae014e0028788d38e7d6237b7417e9869345,86788839926,True,0.003155,1050000000000000.0,1740000000000.0,,,,,
0xbd5fead7180a9c139fa51a103cb6a2ce86ddb5c3,ETH,2787.6,12.2,34008.72,sell,22-02-2025 23:17,50.0,close long,1831.586,0x6e56ce55c02068d0e2ce041e43369602014200a06671a28c393326e1483a6628,74138249210,True,11.903052,390000000000000.0,1740000000000.0,,,,,
0x8477e447846c758f5a675856001ea72298fd9cb5,VIRTUAL,3.5632,62.3,221.99,sell,09-01-2025 03:16,0.0,open short,0.0,0x353cf44b8aaa6b662562041afdcbab018500d3068be96e164a14911a8ed9e66f,61591142506,True,0.077695,524000000000000.0,1740000000000.0,2025-09-01 03:16:00,2025-09-01,,,3.0
0xbee1707d6b44d4d52bfe19e41f8a828645437aab,HYPE,19.172,51.89,994.84,sell,23-04-2025 05:07,-13743.87,open short,0.0,0xed5ea665efcf549c0ee504220fb28602020a0062e954823803d47ed3f2b7c8de,88138191574,True,0.29845,76900000000000.0,1750000000000.0,,,,,
0xa0feb3725a9335f49874d7cd8eaad6be45b27416,HYPE,25.866,1.0,25.87,sell,18-12-2024 05:13,3865.85,close long,0.085,0x2a7354a43e032b39d54004197de7ee01960101e9f8f8f0a7431dc4f2ad267898,56125533086,True,0.007759,41400000000000.0,1730000000000.0,,,,,
0xbee1707d6b44d4d52bfe19e41f8a828645437aab,@107,26.299,15.0,394.49,sell,26-12-2024 11:41,5437.932124,sell,2.354158,0x0c03f27ecdca4665143b041a030a910191007fcde4d7f6a29da360cd579e3267,58700729787,True,0.118345,1050000000000000.0,1740000000000.0,,,,,
0x2c229d22b100a7beb69122eed721cee9b24011dd,TRUMP,16.242,64.0,1039.49,buy,13-02-2025 11:54,13930.7,open long,0.0,0x340887342ecb216d30d9041daa263f020374009db83989d960eb57ea5f3593e3,71939448387,True,0.36382,727000000000000.0,1740000000000.0,,,,,
0x2c229d22b100a7beb69122eed721cee9b24011dd,SOL,254.46,25.96,6605.78,sell,22-11-2024 03:37,324.85,close long,-12.626944,0xad6ff94db8c18c5c17fe041761a2470201d00046fd7efdd0e6d42ce8cec7adcc,49122644870,True,2.312023,554000000000000.0,1730000000000.0,,,,,
0xbaaaf6571ab7d571043ff1e313a9609a10637864,HYPE,14.4,3.49,50.26,sell,12-03-2025 01:12,100119.96,close long,3.897981,0x54b7423369d5bb13fc78041f5c49ed020110004eb7067f4dd952e7bcb7747eaf,79154664708,False,0.0,3910000000000.0,1740000000000.0,2025-12-03 01:12:00,2025-12-03,,,1.0
0x28736f43f1e871e6aa8b1148d38d4994275d72c4,@107,21.949,13.02,285.78,buy,24-02-2025 11:31,1001.783041,buy,0.0,0xb9ddf9d3b6eb4e1a0978041e5b8f81020215006f28bd902f23cad808b8efd2e8,74392941711,True,0.00455697,767000000000000.0,1740000000000.0,,,,,
0xa0feb3725a9335f49874d7cd8eaad6be45b27416,VINE,0.15112,3498.0,528.62,sell,06-02-2025 09:13,21542.0,close long,5.435892,0x49a6b10f3623381722b0041d3975a9000037be0466510816419ef949471a2286,70024142315,True,0.185016,32500000000000.0,1740000000000.0,2025-06-02 09:13:00,2025-06-02,,,9.0
0x513b8629fe877bb581bf244e326a047b249c4ff1,BTC,93260.0,0.5,46630.0,buy,25-04-2025 03:15,-9.76655,close short,21.1,0x8543ffeb4fdab50bfa0304222f29b702012700b5ee6b85c21ed9215e3bc8ba45,88683244072,True,10.7249,875000000000000.0,1750000000000.0,,,,,
0xa0feb3725a9335f49874d7cd8eaad6be45b27416,HYPE,26.276,55.61,1461.21,buy,15-02-2025 02:41,783.27,open long,0.0,0x4edff92420269a4a28f2041dc44d53016b009849bea44a336af78347dc9da034,72358281631,False,0.07306,184000000000000.0,1740000000000.0,,,,,
0x28736f43f1e871e6aa8b1148d38d4994275d72c4,PURR/USDC,0.41239,150.0,61.86,buy,22-12-2024 21:37,22769.16298,buy,0.0,0xc1646cfacfd17e14a0060419cf95f102015c00dfdc727deb7dbb329c0ce64d5a,57760982772,True,0.05249,707000000000000.0,1730000000000.0,,,,,
0xbd5fead7180a9c139fa51a103cb6a2ce86ddb5c3,BTC,82220.0,0.00392,322.3,sell,10-04-2025 07:33,37.39064,close long,11.776464,0x0000000000000000000000000000000000000000000000000000000000000000,85472845832,False,0.016115,983000000000000.0,1740000000000.0,2025-10-04 07:33:00,2025-10-04,,,7.0
0x92f17e8d81a944691c10e753af1b1baae1a2cd0d,HYPE,22.807,35.0,798.25,buy,19-01-2025 18:50,44023.31,open long,0.0,0x687cf77da07fd09e2cec041bd81afa01e800465f617b21c257620fff619b0f72,64368674279,True,0.279385,284000000000000.0,1740000000000.0,,,,,
0xbee1707d6b44d4d52bfe19e41f8a828645437aab,HYPE,18.831,20.18,380.01,buy,25-04-2025 07:51,-1492.3,close short,3.670742,0xd134326f52c7bee8a65b042232433b020131003c7b19fba0b73d45b97dd47ada,88725809661,True,0.114002,960000000000000.0,1750000000000.0,,,,,
0x8477e447846c758f5a675856001ea72298fd9cb5,kPEPE,0.00908,61123.0,555.0,buy,23-04-2025 15:37,-9187075.0,close short,-31.478345,0x8b93b964daf2fe2525aa042216e71102011800c615b99117d780132cc7522fcf,88254061128,False,0.055499,508000000000000.0,1750000000000.0,,,,,
0xbaaaf6571ab7d571043ff1e313a9609a10637864,HYPE,22.077,0.5,11.04,sell,24-02-2025 18:55,84516.98,close long,0.0913,0x2e3421eed0c57ef5f4f5041e609f1b02016a00cecf17de02dde371fe7a318030,74429390058,False,0.001058,64600000000000.0,1740000000000.0,,,,,
0xbd5fead7180a9c139fa51a103cb6a2ce86ddb5c3,BTC,82220.0,0.00018,14.8,sell,10-04-2025 07:33,36.26546,close long,0.540756,0xd198c499eea98214e1d004213eeb1a01ac00d468f971e754bdf2fd6fbeff5755,85472845832,False,0.000739,35100000000000.0,1740000000000.0,2025-10-04 07:33:00,2025-10-04,,,7.0
0x513b8629fe877bb581bf244e326a047b249c4ff1,BTC,92915.0,0.10762,9999.51,sell,24-04-2025 23:02,0.51356,close long,2.36764,0x5edcb07c73b385bdae9204222c48760201b90050797e5570b797af975afea5e2,88643113971,True,2.299887,295000000000000.0,1750000000000.0,,,,,
0xb1231a4a2dd02f2276fa3c5e2a2f3436e6bfed23,HYPE,26.41,8.97,236.9,sell,04-02-2025 18:58,-10695.42,open short,0.0,0x239816ccb557b2a750a6041d1fb92c02010f0025aaedd45ef16bec2753d2b267,69440869865,True,0.082914,427000000000000.0,1740000000000.0,2025-04-02 18:58:00,2025-04-02,Fear,44.0,18.0
0xbaaaf6571ab7d571043ff1e313a9609a10637864,HYPE,12.867,142.77,1837.02,sell,14-03-2025 09:51,37508.87,close long,13.120563,0x9edcd555f9d74595393f041f83b3cb01f800570f26733a11f42c85460fae640d,79743319139,False,0.0,574000000000000.0,1740000000000.0,,,,,
0x513b8629fe877bb581bf244e326a047b249c4ff1,BTC,85644.0,0.98989,84778.14,sell,15-04-2025 15:04,-29.02326,open short,0.0,0x68ecff0503954dfb39e4042195966502042d0087994fc696d56139abdfa6bec4,86685611326,False,0.0,654000000000000.0,1740000000000.0,,,,,
0x8477e447846c758f5a675856001ea72298fd9cb5,SUI,3.6583,12.9,47.19,sell,25-04-2025 14:24,-9658.7,open short,0.0,0x4da46363723bc2d2a0440422367f9c01920062cf3ed75c51f58e78018aebcd53,88789923289,True,0.016517,360000000000000.0,1750000000000.0,,,,,
0x8477e447846c758f5a675856001ea72298fd9cb5,ZRO,5.1507,29.8,153.49,sell,21-07-2024 00:54,-26705.5,open short,0.0,0x006195aabc1ae9e8f49c040dd1b3f7015500469c044f39aca00d884ebcf9e1bd,30549017786,True,0.053721,801000000000000.0,1720000000000.0,,,,,
0xbee1707d6b44d4d52bfe19e41f8a828645437aab,HYPE,15.756,30.76,484.65,sell,26-03-2025 10:10,14361.71,close long,-3.638908,0x9b56087022186435841c042049189f017e00879ca7664c74b5b7825c98a51c2f,81849244303,True,0.145396,576000000000000.0,1740000000000.0,,,,,
0xa0feb3725a9335f49874d7cd8eaad6be45b27416,HYPE,24.439,31.26,763.96,buy,15-12-2024 06:30,121.54,open long,0.0,0xb63d8704d40386f577a504194125af019800f84ac2586a2c2dae7869380e3f6f,55489275798,False,0.038198,822000000000000.0,1730000000000.0,,,,,
0x8477e447846c758f5a675856001ea72298fd9cb5,HYPE,23.278,5.84,135.94,sell,03-02-2025 14:49,60.93,close long,4.680176,0xf260b854504c52ee7d89041d0cb7da02021300648ffdce4f36aea5665bdd70e9,68938237917,True,0.04758,406000000000000.0,1740000000000.0,2025-03-02 14:49:00,2025-03-02,Fear,26.0,14.0
0x8381e6d82f1affd39a336e143e081ef7620a3b7f,XRP,1.9606,1022.0,2003.73,buy,07-04-2025 19:45,-25474.0,close short,-95.604012,0x61a8f634e2d03278d65e042115b6630202da0028c91a2597779053e05b4b1db8,84673169256,True,0.701306,547000000000000.0,1740000000000.0,2025-07-04 19:45:00,2025-07-04,,,19.0
0x4acb90e786d897ecffb614dc822eb231b4ffb9f4,HYPE,13.8,72.22,996.64,buy,26-03-2025 20:19,6178.32,open long,0.0,0x74dd1e22bc2b822ab8c10420501b4101410051b4cf188f9e8526c6c4dc7f28f8,81930482136,False,0.099663,836000000000000.0,1740000000000.0,,,,,
0x75f7eeb85dc639d5e99c78f95393aa9a5f1170d4,USUAL,0.41118,37.0,15.21,sell,31-01-2025 07:05,-17809.6,open short,0.0,0x157e1fc2d70d893ae0f1041cd72e0d012e0043f07f787b6afca359a8bf6c8c72,67874139871,False,0.00146,847000000000000.0,1740000000000.0,,,,,
0x8170715b3b381dffb7062c0298972d4727a0a63b,HYPE,27.226,7.26,197.66,sell,15-02-2025 01:32,1344.51,close long,1.643664,0x0000000000000000000000000000000000000000000000000000000000000000,72357808937,False,0.018975,588000000000000.0,1740000000000.0,,,,,
0xbaaaf6571ab7d571043ff1e313a9609a10637864,HYPE,12.561,15.92,199.97,sell,03-04-2025 08:08,43353.86,close long,0.969528,0xf6909ca34c7e0d8604270420cc0bb8016d00464c578ab384e0e904c76bff5d73,83555980003,True,0.059991,643000000000000.0,1740000000000.0,2025-03-04 08:08:00,2025-03-04,Extreme Fear,15.0,8.0
0xaf40fdc468c30116bd3307bcbf4a451a7ebf1deb,BTC,87300.0,0.00015,13.09,sell,24-03-2025 14:16,0.03764,close long,0.219,0xd8a67b7b3a1d9053e0b404202ad18f0202d400ee2b2d9d5c0de03a6c81e02eee,81506407230,False,0.001309,559000000000000.0,1740000000000.0,,,,,
0xa0feb3725a9335f49874d7cd8eaad6be45b27416,HYPE,25.053,7.3,182.89,buy,04-02-2025 10:01,485.24,open long,0.0,0x7f0fc5a1568bd8b21fe5041d19aaeb02035600697f2f8996f90ee31b449024f6,69280230695,False,0.018288,375000000000000.0,1740000000000.0,2025-04-02 10:01:00,2025-04-02,Fear,44.0,10.0
0x513b8629fe877bb581bf244e326a047b249c4ff1,BTC,94754.0,3.16949,300321.86,buy,29-04-2025 18:32,54.14045,open long,0.0,0x334c743390d6af56e13904227a4c540201880065902f6e0d965ef354497a010e,89760641570,True,69.074026,313000000000000.0,1750000000000.0,,,,,
0x8381e6d82f1affd39a336e143e081ef7620a3b7f,@107,23.827,18.06,430.32,buy,23-02-2025 19:41,0.01,buy,0.0,0xa4eae8e5338113698322041e50d7f7020125003fab45073e662b5e3434f38c8d,74269383015,True,0.00632098,630000000000000.0,1740000000000.0,,,,,
0xbee1707d6b44d4d52bfe19e41f8a828645437aab,@107,34.44,41.78,1438.9,sell,21-12-2024 12:22,16976.57296,sell,227.843606,0xfbccd4c4fcf41f5a73440419bbb0ae01eb005075eb68b4bafd06832cf78790f5,57302860134,False,0.071945,354000000000000.0,1730000000000.0,,,,,
0xbee1707d6b44d4d52bfe19e41f8a828645437aab,@107,25.19,0.46,11.59,sell,19-12-2024 11:00,38405.4541,sell,0.05026,0x0000000000000000000000000000000000000000000000000000000000000000,56527572973,False,0.000579,223000000000000.0,1730000000000.0,,,,,
0x4acb90e786d897ecffb614dc822eb231b4ffb9f4,HYPE,13.97,25.59,357.49,buy,21-03-2025 19:03,2765.02,open long,0.0,0x87cbad68d38ae07a0e30041ffd177e02010700b1b60ed7a86992be94c315e65f,81073906313,False,0.035749,595000000000000.0,1740000000000.0,,,,,
0xbee1707d6b44d4d52bfe19e41f8a828645437aab,HYPE,14.55,13.74,199.92,sell,10-03-2025 20:40,15409.0,close long,3.48996,0x53beb25ddc9620defb6c041f488c020202d400a51ac08ba008ab8f55baa85c02,78720353863,True,0.059975,587000000000000.0,1740000000000.0,2025-10-03 20:40:00,2025-10-03,,,20.0
0xb1231a4a2dd02f2276fa3c5e2a2f3436e6bfed23,ETH,2578.8,1.941,5005.45,buy,11-01-2024 08:12,-15.4223,close short,26.0094,0xc1d7e97a95e5513bfd12040718252c019900042ab01e635fc26c84d87fd1aa46,6776785292,True,1.251362,1000000000000000.0,1700000000000.0,2024-11-01 08:12:00,2024-11-01,Extreme Greed,75.0,8.0
0x4acb90e786d897ecffb614dc822eb231b4ffb9f4,SUI,2.9115,1696.8,4940.23,sell,26-02-2025 19:49,100738.0,close long,206.721144,0xbf7c48bfd49e3a0ab1ae041e82254a0201ee008336c580ea41ff6529e9f68d0a,75166999020,True,1.729081,222000000000000.0,1740000000000.0,,,,,
0x4f93fead39b70a1824f981a54d4e55b278e9f760,BTC,96314.0,0.23855,22975.7,buy,08-02-2025 01:44,0.68848,open long,0.0,0xfc82012eb544806988f5041d54dd5e02016c0086648d1b07cbe447368dd93bec,70563154906,True,6.892711,23000000000000.0,1740000000000.0,2025-08-02 01:44:00,2025-08-02,,,1.0
0xa0feb3725a9335f49874d7cd8eaad6be45b27416,HYPE,24.55,23.25,570.79,buy,15-12-2024 05:42,383.43,open long,0.0,0x1191f8109ad691b5bd41041940751801e1009d99c32ffde398734e470b4d5772,55483088670,False,0.028539,681000000000000.0,1730000000000.0,,,,,
0x28736f43f1e871e6aa8b1148d38d4994275d72c4,DOGE,0.33613,1151.0,386.89,buy,30-01-2025 20:58,14455.0,open long,0.0,0xbaa9e62450272fbe9fca041cd05fb302020f0091c8dc481bae7bdee65afe7b2a,67777731016,True,0.135409,761000000000000.0,1740000000000.0,,,,,
0xbee1707d6b44d4d52bfe19e41f8a828645437aab,@107,22.2,45.0,999.0,buy,03-02-2025 09:46,1572.999997,buy,0.0,0x13fcf030b7bbde46424d041d0941be020194006bdacec1539264094ff4f611cf,68812479243,False,0.0045,482000000000000.0,1740000000000.0,2025-03-02 09:46:00,2025-03-02,Fear,26.0,9.0
0x430f09841d65beb3f27765503d0f850b8bce7713,LAYER,1.208,450.0,543.6,sell,12-02-2025 06:15,50585.0,close long,51.4665,0x9ec3481c511375c8bc5f041d982f3f02029a0095ebc822ff2964066c31400fc3,71611999083,True,0.19026,857000000000000.0,1740000000000.0,2025-12-02 06:15:00,2025-12-02,,,6.0
0xb1231a4a2dd02f2276fa3c5e2a2f3436e6bfed23,SOL,98.818,93.82,9271.1,buy,17-01-2024 23:01,412.51,open long,0.0,0xd819279286d59dec348d040732680f01e500ea82428d02923ac7d453cc2d2c49,7367325599,True,2.317776,200000000000000.0,1710000000000.0,,,,,
0x92f17e8d81a944691c10e753af1b1baae1a2cd0d,FARTCOIN,0.65703,3888.6,2554.93,buy,02-02-2025 05:02,291325.5,open long,0.0,0x454cee17acb02752a5aa041cf61309020133009d7a6c8f2f9932b255e272d3bd,68341001184,True,0.894224,98900000000000.0,1740000000000.0,2025-02-02 05:02:00,2025-02-02,Greed,60.0,5.0
0xbee1707d6b44d4d52bfe19e41f8a828645437aab,@107,24.6,6.0,147.6,sell,16-12-2024 10:45,38627.4921,sell,33.267349,0xb99215c3fdb83014421b0419598d7e02016b00b0c678b2f5f18146bfce0b42f7,55710204201,False,0.00738,329000000000000.0,1730000000000.0,,,,,
0x47add9a56df66b524d5e2c1993a43cde53b6ed85,FTT,3.2,6.9,22.08,sell,17-12-2024 11:49,-4594.6,open short,0.0,0x0ea555d159925a98267704196f0ae302013e00932bd39b709a22070b044aa9ac,55942352210,False,0.002119,342000000000000.0,1730000000000.0,,,,,
0x513b8629fe877bb581bf244e326a047b249c4ff1,BTC,83500.0,0.00018,15.03,buy,14-04-2025 01:10,65.38851,open long,0.0,0xd999718550e1cb8a6b2b04217bc7590205b200cacda41c9cfb7b53d5ff018427,86277139108,False,0.0,134000000000000.0,1740000000000.0,,,,,
0x47add9a56df66b524d5e2c1993a43cde53b6ed85,COMP,120.6,3.59,432.95,buy,05-12-2024 08:22,-21.69,close short,-8.855453,0x32c10fdab56b13c8a497041872e685020325001328601ef9bba58394304e3c5e,52793737463,True,0.145471,345000000000000.0,1730000000000.0,2024-05-12 08:22:00,2024-05-12,Greed,56.0,8.0
0x2c229d22b100a7beb69122eed721cee9b24011dd,VIRTUAL,3.5033,437.0,1530.94,sell,17-01-2025 14:30,40273.2,close long,10.43993,0xda7c0b5043f58a1937c8041bab09cd02013700f0510fc938be40b4faba14b37a,63674266522,True,0.535829,355000000000000.0,1740000000000.0,,,,,
0xb899e522b5715391ae1d4f137653e7906c5e2115,BTC,74851.0,0.06679,4999.3,sell,09-04-2025 07:00,9.47287,close long,9.978426,0x4f5cb575426785ec92c504212dfbc90206fa0083f17c662c1e643c29e9957e9c,85138102165,True,1.499789,1080000000000000.0,1740000000000.0,2025-09-04 07:00:00,2025-09-04,,,7.0
0xbee1707d6b44d4d52bfe19e41f8a828645437aab,HYPE,14.562,137.12,1996.74,sell,10-03-2025 05:39,13722.34,close long,20.485728,0xef978e23ace0fcc077a4041f3e26a102016a002c6d546dad99d3ac2272090e81,78527121663,True,0.599022,252000000000000.0,1740000000000.0,2025-10-03 05:39:00,2025-10-03,,,5.0
0x75f7eeb85dc639d5e99c78f95393aa9a5f1170d4,RNDR,7.54,20.0,150.8,buy,26-02-2024 22:13,-863.9,close short,7.4678,0xdc47e8d8e078e53996ef0407cb0644012700abfa18821370743cb00bb5b1fa05,10989375811,False,-0.003016,442000000000000.0,1710000000000.0,,,,,
0x72743ae2822edd658c0c50608fd7c5c501b2afbd,FARTCOIN,1.154,455.8,525.99,buy,23-04-2025 15:29,2489.9,open long,0.0,0xeec73c69d9aac268c1b8042216cef602014400cd2c23306006c72ac03904384c,88264995359,False,0.052599,168000000000000.0,1750000000000.0,,,,,
0xbee1707d6b44d4d52bfe19e41f8a828645437aab,HYPE,11.845,67.05,794.21,buy,05-04-2025 09:26,10078.93,open long,0.0,0xc828ef5948de8edf3b160420ee1116014900d8d1aac112301c21d361d3502386,84067745570,True,0.238262,925000000000000.0,1740000000000.0,2025-05-04 09:26:00,2025-05-04,,,9.0
0x39cef799f8b69da1995852eea189df24eb5cae3c,@107,23.614,437.5,10331.12,buy,16-12-2024 03:21,1711.351549,buy,0.0,0xb13d206dbc1f94e4c55304195327d401bd00d3508fd702d7c0bd9c8990b566d0,55628610847,False,0.04374997,418000000000000.0,1730000000000.0,,,,,
0x513b8629fe877bb581bf244e326a047b249c4ff1,BTC,85195.0,0.002,170.39,buy,20-04-2025 05:49,2.84832,open long,0.0,0xcae2698b8b99cc38f0090421dffd7c0201d40064bffaa744520a7d3575b0b299,87541945403,True,0.039189,805000000000000.0,1750000000000.0,,,,,
0x39cef799f8b69da1995852eea189df24eb5cae3c,XRP,1.9928,265.0,528.09,buy,07-04-2025 19:48,-169423.0,close short,-25.41615,0xd159160f18b264b33160042115bd530205ec00f337bc7743be86d7de2c2d83c8,84674437644,False,0.052809,693000000000000.0,1740000000000.0,2025-07-04 19:48:00,2025-07-04,,,19.0
0x28736f43f1e871e6aa8b1148d38d4994275d72c4,@107,21.439,2.0,42.88,sell,14-12-2024 14:23,1596.527389,sell,31.97348,0x2e5db4f4c9a69a8d1da70419332f020189008c9ee1af5ef9d52276aca9e9e92f,55361131836,True,0.015007,42600000000000.0,1730000000000.0,,,,,
0xbee1707d6b44d4d52bfe19e41f8a828645437aab,HYPE,15.728,70.0,1100.96,buy,26-03-2025 10:13,16323.8,open long,0.0,0xc22f99caec483b37c57704204921f601e100ac6a83806f00d121d4a74bc0dcc8,81849584700,True,0.330288,159000000000000.0,1740000000000.0,,,,,
0xb899e522b5715391ae1d4f137653e7906c5e2115,SOL,126.15,652.86,82358.29,sell,10-03-2025 04:39,3515.9,close long,220.536108,0x04d20e5d9e4987875f22041f3d75320202cc0068e084ec76c12d9d9399d6a058,78512260878,True,20.589572,260000000000000.0,1740000000000.0,2025-10-03 04:39:00,2025-10-03,,,4.0
0xbee1707d6b44d4d52bfe19e41f8a828645437aab,ETH,3447.0,0.0059,20.34,sell,21-12-2024 17:08,-6.4685,open short,0.0,0x0000000000000000000000000000000000000000000000000000000000000000,57353259401,False,0.001016,73900000000000.0,1730000000000.0,,,,,
0xbee1707d6b44d4d52bfe19e41f8a828645437aab,@107,17.023,3.27,55.67,buy,06-03-2025 11:37,339.0896735,buy,0.0,0x79bc11e364d79e9e3a5f041f0061e2019700612db177bdd37283ceb15275358a,77577646911,True,0.00098096,392000000000000.0,1740000000000.0,2025-06-03 11:37:00,2025-06-03,,,11.0
0x28736f43f1e871e6aa8b1148d38d4994275d72c4,SOL,239.93,2.57,616.62,sell,20-11-2024 20:24,40.0,close long,2.555351,0x597b8d7cbe16f158a0b50417467cff02014d00eedc9f944d017b6e0763c016fa,48755342202,True,0.215817,890000000000000.0,1730000000000.0,,,,,
0xbee1707d6b44d4d52bfe19e41f8a828645437aab,@107,18.8,8.65,162.62,sell,25-02-2025 08:50,715.1794673,sell,-9.413242,0x564421ecae9156ce4693041e6a2768020234000b7c402421f411b36db6e1dcc9,74657177883,True,0.056917,732000000000000.0,1740000000000.0,,,,,
0xbee1707d6b44d4d52bfe19e41f8a828645437aab,@107,13.276,12.5,165.95,sell,12-03-2025 15:40,2824.284665,sell,2.888009,0x83fd913d871046f1f8ce041f66569d020308007c09718db0cf2dce874c871562,79310532345,True,0.049784,586000000000000.0,1740000000000.0,2025-12-03 15:40:00,2025-12-03,,,15.0
0x28736f43f1e871e6aa8b1148d38d4994275d72c4,SUI,4.9663,65.2,323.8,sell,04-01-2025 12:55,0.0,open short,0.0,0xce80d9c14b576a3071f9041a9e2262019900cc596b4f6d652ac3e734abffa502,60580024283,True,0.11333,1000000000000000.0,1740000000000.0,2025-04-01 12:55:00,2025-04-01,Fear,34.0,12.0
0x28736f43f1e871e6aa8b1148d38d4994275d72c4,PENDLE,3.6806,67.0,246.6,sell,25-01-2025 19:17,481.0,close long,1.195347,0x089743ed67de995a3dd1041c744201020117002c3b8e31db63ba30fc3a0195b6,66466859350,True,0.08631,315000000000000.0,1740000000000.0,,,,,
0xb899e522b5715391ae1d4f137653e7906c5e2115,SOL,128.01,20.0,2560.2,sell,12-03-2025 00:24,-6411.84,open short,0.0,0x40e737e7b1ec80b86d2b041f5bba9f02010600da76c1ff86f2cb57c23737708b,79142952698,True,0.64005,522000000000000.0,1740000000000.0,2025-12-03 00:24:00,2025-12-03,,,0.0
0xb899e522b5715391ae1d4f137653e7906c5e2115,BTC,84166.0,1.66337,139999.2,buy,11-04-2025 23:35,-7.40611,close short,-427.652427,0xc185a002b50e15979d9f04215a467202028500bc758b6affd3d6ca847fecf85f,85883232432,True,41.999759,119000000000000.0,1740000000000.0,2025-11-04 23:35:00,2025-11-04,,,23.0
0x92f17e8d81a944691c10e753af1b1baae1a2cd0d,HYPE,23.138,85.41,1976.22,buy,19-01-2025 18:26,16905.45,open long,0.0,0x04623d8642fe1a4f4b84041bd7c14c01de00a0adb05b65354f297ad4ec5d21c9,64361626697,True,0.691675,978000000000000.0,1740000000000.0,,,,,
0x8170715b3b381dffb7062c0298972d4727a0a63b,BTC,82566.0,0.00018,14.86,buy,29-03-2025 20:51,0.12444,open long,0.0,0x7b2fd27779941afb25810420821b200153000e97cd4e62c6af4662c42a399751,82526785086,False,0.001426,1070000000000000.0,1740000000000.0,,,,,
0xbaaaf6571ab7d571043ff1e313a9609a10637864,HYPE,13.601,45.0,612.05,buy,10-03-2025 23:07,32342.02,open long,0.0,0xdc3fc9ac7369ae4a1791041f4a42480205b000139a74e39f894d8b50aaf36f80,78285868827,False,0.0,438000000000000.0,1740000000000.0,2025-10-03 23:07:00,2025-10-03,,,23.0
0x39cef799f8b69da1995852eea189df24eb5cae3c,MELANIA,0.5338,235.9,125.92,buy,07-04-2025 11:24,-332392.2,close short,26.210849,0x9f0ce9fd48b4783d30f8042110008501db010118afbf13340393c4e7efb0596f,84498635929,False,0.012592,564000000000000.0,1740000000000.0,2025-07-04 11:24:00,2025-07-04,,,11.0
0xbee1707d6b44d4d52bfe19e41f8a828645437aab,HYPE,18.3,722.52,13222.12,buy,30-04-2025 03:21,-722.53,close short,463.713336,0x0000000000000000000000000000000000000000000000000000000000000000,89843939254,False,0.661105,491000000000000.0,1750000000000.0,,,,,
0xbee1707d6b44d4d52bfe19e41f8a828645437aab,HYPE,15.87,63.01,999.97,sell,26-03-2025 12:22,4448.69,close long,9.312878,0x541736fce618835556d804204a999802011c00a5b28d347cb6e9087d91b84246,81862529357,True,0.29999,696000000000000.0,1740000000000.0,,,,,
0xb1231a4a2dd02f2276fa3c5e2a2f3436e6bfed23,@23,1.9781,100.0,197.81,buy,03-02-2025 05:04,1532.743354,buy,0.0,0x46946a88bfd20b99e902041d064386020297000127d8d7d48c8e8923ebbf6ca0,68713601076,True,0.03499974,199000000000000.0,1740000000000.0,2025-03-02 05:04:00,2025-03-02,Fear,26.0,5.0
0xbee1707d6b44d4d52bfe19e41f8a828645437aab,@107,25.2,28.45,716.94,sell,19-12-2024 11:08,33006.3341,sell,3.392967,0x0000000000000000000000000000000000000000000000000000000000000000,56528797517,False,0.035847,1090000000000000.0,1730000000000.0,,,,,
0x4acb90e786d897ecffb614dc822eb231b4ffb9f4,HYPE,13.921,716.77,9978.16,sell,26-03-2025 20:47,11052.06,close long,433.502496,0x11ac3ab038ed10fb11c9042050703601ec00143327221531bc8f28e96e4954a9,81938131347,True,3.492354,1070000000000000.0,1740000000000.0,,,,,
0xbee1707d6b44d4d52bfe19e41f8a828645437aab,@107,25.254,200.74,5069.49,sell,13-02-2025 03:52,1834.089657,sell,425.367315,0xce3a3969e84e35e574dd041da50ef202022d0000c7c7f9b2f35037d39a948bad,71861616951,True,1.77432,426000000000000.0,1740000000000.0,,,,,
0xa0feb3725a9335f49874d7cd8eaad6be45b27416,TAO,436.86,0.145,63.34,buy,23-02-2025 01:16,69.53,open long,0.0,0xd978b2426f3aa61b4a6e041e44897b0201da008f2033183a1956026779cc1322,74145612469,False,0.003167,209000000000000.0,1740000000000.0,,,,,
0x513b8629fe877bb581bf244e326a047b249c4ff1,BTC,93746.0,0.04947,4637.61,buy,28-04-2025 20:59,38.83636,open long,0.0,0x4bd47834e8d317b1882204226bb0af02029a00abcc47302de3b7505d37828726,89563116284,True,1.066651,970000000000000.0,1750000000000.0,,,,,
0xbd5fead7180a9c139fa51a103cb6a2ce86ddb5c3,TIA,3.0827,157.0,483.98,buy,07-03-2025 06:15,-2009.9,close short,85.40172,0x143ab3e0d4e4013dfdc6041f0d22710205e10075dbbf38894988e980dfc061cf,77797898673,True,0.145195,857000000000000.0,1740000000000.0,2025-07-03 06:15:00,2025-07-03,,,6.0
0x28736f43f1e871e6aa8b1148d38d4994275d72c4,SUI,3.7119,10.2,37.86,buy,20-11-2024 19:59,-215.6,close short,0.146268,0x74f8d0b57084520386f2041746203c01d6004a24bf462e1aa18af89c48cfb18a,48747935881,True,0.013251,301000000000000.0,1730000000000.0,,,,,
0xbee1707d6b44d4d52bfe19e41f8a828645437aab,HYPE,26.337,4.22,111.14,sell,14-02-2025 11:27,-239.37,open short,0.0,0x9e7bc28a4652075fb4bf041db9ffbc02017e0079c2551fc0895db3376899f94c,72186281507,True,0.038899,905000000000000.0,1740000000000.0,,,,,
0x271b280974205ca63b716753467d5a371de622ab,HYPE,18.073,12.11,218.86,sell,19-04-2025 20:39,-6106.34,open short,0.0,0x179bbc1376625289768e0421d9f0c501a900d4f1adac96f5b7b148f8164fa977,87490085459,True,0.063032,1110000000000000.0,1750000000000.0,,,,,
0x28736f43f1e871e6aa8b1148d38d4994275d72c4,PENDLE,3.5022,56.0,196.12,sell,28-01-2025 02:19,1484.0,close long,4.531576,0x67b6ceeb439a8b3b991d041ca383450205c500090f65d9bb332fdef71ae33d50,67049786320,True,0.068643,418000000000000.0,1740000000000.0,,,,,
0x8477e447846c758f5a675856001ea72298fd9cb5,WIF,1.9186,174.0,333.84,buy,07-01-2025 20:47,-174.0,close short,23.652168,0x7191d584b13e3136486e041ae363f102028a0016f81827c12d4ff92e9abb78fc,61184901148,True,0.116842,81000000000000.0,1740000000000.0,2025-07-01 20:47:00,2025-07-01,,,20.0
0xbaaaf6571ab7d571043ff1e313a9609a10637864,HYPE,23.912,23.1,552.37,sell,20-02-2025 01:29,13188.5,close long,30.85467,0xe95d0633a19d8ecbe576041e1423420201e300c408cc278f05acc4a61c9f0d5c,73482924452,True,0.185594,1030000000000000.0,1740000000000.0,,,,,
0x513b8629fe877bb581bf244e326a047b249c4ff1,BTC,83076.0,0.03319,2757.29,sell,12-04-2025 09:15,12.28495,close long,6.555025,0x04142cf779dc722c14a2042160c2e70201900060892c1a0b1448bda3a619e60b,85949279872,True,0.689323,1060000000000000.0,1740000000000.0,2025-12-04 09:15:00,2025-12-04,,,9.0
0x23e7a7f8d14b550961925fbfdaa92f5d195ba5bd,@107,17.698,4.39,77.69,buy,20-04-2025 13:01,930.8449906,buy,0.0,0x5db9d84730bc83fe2a570421e4be8201ac000a38e598bf45b3ce096069a08cb0,87585932530,True,0.00153644,577000000000000.0,1750000000000.0,,,,,
0xbaaaf6571ab7d571043ff1e313a9609a10637864,HYPE,12.582,18.69,235.16,buy,29-03-2025 15:15,111296.38,open long,0.0,0x594f2fd9f142754f6d5c04207e381702024a003c76dddcd2f943bf39c7867c4e,82477618470,True,0.082305,1100000000000000.0,1740000000000.0,,,,,
0xb1231a4a2dd02f2276fa3c5e2a2f3436e6bfed23,@8,0.03044,281.0,8.55,buy,27-08-2024 05:24,891489.8447,buy,0.0,0xe99dafbeda9e733e2b57041050741001630001216bfdf4b6b779e8ab12f5326a,35663458665,True,0.09832,584000000000000.0,1720000000000.0,,,,,
0x28736f43f1e871e6aa8b1148d38d4994275d72c4,REQ,0.11104,1683.0,186.88,sell,16-03-2025 14:17,6266.0,close long,0.787644,0x5a62ece69c17e423530e041fa777ae01660098fde2d1e7878d8a299c21b58c93,80112698921,False,0.018688,134000000000000.0,1740000000000.0,,,,,
0xbee1707d6b44d4d52bfe19e41f8a828645437aab,HYPE,19.859,44.53,884.32,buy,25-02-2025 23:11,-2028.25,close short,-2.382355,0x3cd38a00e39b25cddb5e041e73ebd401e500540cebd79a313658ffec31f9a5c4,74919892179,True,0.309512,603000000000000.0,1740000000000.0,,,,,
0xbaaaf6571ab7d571043ff1e313a9609a10637864,HYPE,13.412,122.39,1641.49,sell,12-03-2025 15:09,167926.1,close long,42.163355,0x16ac4b69050f5f0ea972041f65fa880201e300df46dab2c41af6c72fa8d1e114,79305506568,True,0.492448,1070000000000000.0,1740000000000.0,2025-12-03 15:09:00,2025-12-03,,,15.0
0xbaaaf6571ab7d571043ff1e313a9609a10637864,HYPE,12.835,38.93,499.67,sell,14-03-2025 09:47,74076.02,close long,2.331907,0xbeacde5e0747ed0e809d041f83a65a01bb007203e20a97ab66f1355378cf7887,79743319123,False,0.0,533000000000000.0,1740000000000.0,,,,,
0x271b280974205ca63b716753467d5a371de622ab,SOL,103.42,79.24,8195.0,buy,09-04-2025 17:28,883.39,open long,0.0,0x8b59b40eac07cd3a0916042135365902012d00a2ad65a6ca2834510b007b8a0f,85278785438,False,0.78672,595000000000000.0,1740000000000.0,2025-09-04 17:28:00,2025-09-04,,,17.0
0x4f93fead39b70a1824f981a54d4e55b278e9f760,BTC,96402.0,0.20728,19982.21,buy,24-11-2024 21:07,1.41068,open long,0.0,0xfcf20294ec90f1af9a7104179a9efa020228005b527e7496484642f9379eefb4,49872125856,True,5.994661,733000000000000.0,1730000000000.0,,,,,
0xa0feb3725a9335f49874d7cd8eaad6be45b27416,HYPE,22.107,31.73,701.46,buy,02-02-2025 09:10,2267.83,open long,0.0,0xbe71863c221140abb38d041cf8e2b102011a0033ae82bbcb16b838fc7d94d3a9,68391412350,False,0.070145,515000000000000.0,1740000000000.0,2025-02-02 09:10:00,2025-02-02,Greed,60.0,9.0
0x8477e447846c758f5a675856001ea72298fd9cb5,W,0.7395,338.0,249.95,buy,07-06-2024 20:39,-22350.2,close short,0.7605,0x419fd3cfa08ab8e1bbaa040ae7d5a9014300e8b725f33d2e71dac261899506fc,25255991255,False,0.024995,613000000000000.0,1720000000000.0,2024-07-06 20:39:00,2024-07-06,Fear,26.0,20.0
0x8170715b3b381dffb7062c0298972d4727a0a63b,MELANIA,1.0,137.5,137.5,buy,25-02-2025 08:50,-316674.2,close short,45.3145,0xa13c17475073638dee91041e6a263702014f003f8b91b5511ccb3c05591df9b7,74656051627,False,0.0132,272000000000000.0,1740000000000.0,,,,,
0x28736f43f1e871e6aa8b1148d38d4994275d72c4,VIRTUAL,3.1297,63.9,199.99,buy,26-12-2024 03:04,-185.0,close short,-1.129113,0x38a920efd656aef386d60419fde36b014e008bb44629058986c5eb2e72d9c718,58625837575,True,0.069995,12600000000000.0,1740000000000.0,,,,,
0x271b280974205ca63b716753467d5a371de622ab,FARTCOIN,0.8265,1814.8,1499.93,buy,21-04-2025 22:32,-71368.0,close short,38.673388,0x83ff73a44dc0f1297a290421fb06c70204de00458edf758713bd1d164bd0f6c0,87835103424,True,0.431979,577000000000000.0,1750000000000.0,,,,,
0xbee1707d6b44d4d52bfe19e41f8a828645437aab,@107,21.756,54.0,1174.82,buy,14-01-2025 12:56,608.7475218,buy,0.0,0x4ed9ebc70875ed77f576041b6b5c3b012b00377868b571da98394d3565fd793c,62901823603,True,0.01889998,25200000000000.0,1740000000000.0,,,,,
0x513b8629fe877bb581bf244e326a047b249c4ff1,BTC,83079.0,3.47726,288887.28,sell,12-04-2025 09:15,19.74987,close long,697.19063,0x04142cf779dc722c14a2042160c2e70201900060892c1a0b1448bda3a619e60b,85949279872,True,72.22182,515000000000000.0,1740000000000.0,2025-12-04 09:15:00,2025-12-04,,,9.0
0x513b8629fe877bb581bf244e326a047b249c4ff1,BTC,83500.0,0.006,501.0,buy,14-04-2025 01:10,65.12483,open long,0.0,0x4b9ec22de65d4375faf204217bc746020439006be1bec6f381ff8dd1c884dad0,86277139108,False,0.0,354000000000000.0,1740000000000.0,,,,,
0x8477e447846c758f5a675856001ea72298fd9cb5,WLD,2.6158,150.0,392.37,buy,20-07-2024 17:20,-672.4,close short,70.467,0x5322fef21bbf549db7e3040dcd0f84012d00a419b0a47ea6dd2a52c3491608a9,30513482451,True,0.137329,960000000000000.0,1720000000000.0,,,,,
0xb1231a4a2dd02f2276fa3c5e2a2f3436e6bfed23,ARB,2.0192,2483.6,5014.89,buy,19-02-2024 03:09,0.0,open long,0.0,0x31a2cea18fc9390080a40407ae1e0e01a8001d14609768dedc71e6e4808991b0,10079344425,True,1.253721,36800000000000.0,1710000000000.0,,,,,
0xa0feb3725a9335f49874d7cd8eaad6be45b27416,HYPE,23.088,205.78,4751.05,sell,15-12-2024 01:02,2521.07,close long,98.87729,0x6ba5b941d6cad2ac944b04193c6854018901139543908c22572bf8dac78d6dea,55454126875,True,1.425314,381000000000000.0,1730000000000.0,,,,,
0x8477e447846c758f5a675856001ea72298fd9cb5,kBONK,0.037479,15552.0,582.87,sell,23-05-2024 17:27,-1016343.0,open short,0.0,0xd51b599572721d7fd36e0409ba1065016b000da21dfd0ed9abea4e37419e9fa9,23558682384,True,0.204005,72000000000000.0,1720000000000.0,,,,,
0xbee1707d6b44d4d52bfe19e41f8a828645437aab,HYPE,16.788,13.03,218.75,sell,13-04-2025 06:43,-5803.68,open short,0.0,0xabf68d421fe2ef668ec804216f49d40201b600ad187af4a64a27707104d89546,86132118910,True,0.076561,243000000000000.0,1740000000000.0,,,,,
0xbee1707d6b44d4d52bfe19e41f8a828645437aab,HYPE,14.056,48.61,683.26,sell,21-03-2025 19:24,8587.01,close long,2.911739,0xbd5610ad14816f040b97041ffd574d0201ba0094226b3f3cb01a9acf06223e17,81116055175,True,0.204978,1100000000000000.0,1740000000000.0,,,,,
0x083384f897ee0f19899168e3b1bec365f52a9012,ETH,2857.8,24.4,69730.32,sell,03-02-2025 04:15,419.3696,close long,693.936,0xc9b72befa5cbdf10c1b7041d05bdc90203aa00f98958a6f2b8e85c91970e3ae0,68692693236,False,3.486516,428000000000000.0,1740000000000.0,2025-03-02 04:15:00,2025-03-02,Fear,26.0,4.0
0xbee1707d6b44d4d52bfe19e41f8a828645437aab,HYPE,10.24,60.43,618.8,sell,07-04-2025 15:09,23416.24,close long,-51.945628,0x65b59f864202b463b52c0421128deb02032c00a888b2188fc72b7cab8ad7b90f,84581461595,True,0.18564,139000000000000.0,1740000000000.0,2025-07-04 15:09:00,2025-07-04,,,15.0
0xbee1707d6b44d4d52bfe19e41f8a828645437aab,HYPE,24.937,40.44,1008.45,sell,20-02-2025 10:16,-846.27,open short,0.0,0x842e69702d843fdf1fa6041e1a133002011900f39dd1dd08ac0bfebeef994c21,73563333497,True,0.352958,4210000000000.0,1740000000000.0,,,,,
0xbee1707d6b44d4d52bfe19e41f8a828645437aab,HYPE,14.38,1.37,19.7,sell,10-03-2025 20:41,8211.15,close long,0.11508,0xccc51a0c059399b8a07c041f48914b01ef008bd6e51022ad83989ee342fdb108,78720951509,True,0.00591,652000000000000.0,1740000000000.0,2025-10-03 20:41:00,2025-10-03,,,20.0
0xbee1707d6b44d4d52bfe19e41f8a828645437aab,HYPE,14.344,34.86,500.03,sell,10-03-2025 20:59,3924.85,close long,0.341628,0x52dd513606979a26c8d0041f48c4d10201bf008689f1b688f9281a9df6ce9294,78726466363,True,0.150009,421000000000000.0,1740000000000.0,2025-10-03 20:59:00,2025-10-03,,,20.0
0x28736f43f1e871e6aa8b1148d38d4994275d72c4,ADA,1.0626,333.0,353.85,sell,24-11-2024 10:26,-151.0,open short,0.0,0x660ecad5d0ccde37d0a9041791619401d9009cce5d29fa01cd725928ca741b72,49724359237,True,0.123846,640000000000000.0,1730000000000.0,,,,,
0xbee1707d6b44d4d52bfe19e41f8a828645437aab,@107,18.21,34.0,619.14,sell,12-12-2024 14:05,10836.94094,sell,44.581805,0xff36357284ce57f77c7604190944cd01f0003cdb31bc4f7306765b2d479758ca,54864934553,True,0.154785,589000000000000.0,1730000000000.0,2024-12-12 14:05:00,2024-12-12,Extreme Greed,83.0,14.0
0xa0feb3725a9335f49874d7cd8eaad6be45b27416,HYPE,24.512,36.54,895.67,buy,18-02-2025 14:49,-322.96,close short,102.173148,0xd2fdeef87eced68e6a33041dfc6f87020211008d200d2297670ce4a3dcb0e882,73043272156,False,0.044783,190000000000000.0,1740000000000.0,,,,,
0x47add9a56df66b524d5e2c1993a43cde53b6ed85,@107,25.658,8.43,216.3,sell,18-02-2025 07:29,2840.196997,sell,12.774812,0x00a3855f56cd13046c8f041df7793a013a00ca516eb38c2fd7d809ace03d6189,73036843313,True,0.072674,805000000000000.0,1740000000000.0,,,,,
0xbee1707d6b44d4d52bfe19e41f8a828645437aab,HYPE,27.647,3.72,102.85,sell,30-01-2025 19:06,-2139.43,open short,0.0,0x91d6a99b1447c34a9ecc041ccf18c302020400f5e23bf8a963f2e0f974d72cea,67750972996,True,0.035996,149000000000000.0,1740000000000.0,,,,,
0xbee1707d6b44d4d52bfe19e41f8a828645437aab,@107,30.105,27.2,818.86,sell,20-12-2024 21:33,31483.28814,sell,62.629807,0x383cd4c07472cf7a58dc0419b2aafb01c800a0e282b1963f67387ad2d5232ddc,57118220092,True,0.245656,907000000000000.0,1730000000000.0,,,,,
0xbaaaf6571ab7d571043ff1e313a9609a10637864,HYPE,13.555,7320.84,99233.99,sell,02-04-2025 18:22,78869.75,close long,6271.763628,0xdd08fbf6c4fa7af1dbbc0420c272e80201ac00d83b4d1bc6bd0768b54b32c196,83364331655,True,34.731895,843000000000000.0,1740000000000.0,2025-02-04 18:22:00,2025-02-04,Greed,72.0,18.0
0xbee1707d6b44d4d52bfe19e41f8a828645437aab,HYPE,24.945,2.06,51.39,sell,20-02-2025 10:16,-716.44,open short,0.0,0x842e69702d843fdf1fa6041e1a133002011900f39dd1dd08ac0bfebeef994c21,73563333497,True,0.017985,920000000000000.0,1740000000000.0,,,,,
0x23e7a7f8d14b550961925fbfdaa92f5d195ba5bd,@107,19.695,94.33,1857.83,buy,28-02-2025 02:02,360.956025,buy,0.0,0xbe3cf43678dff28d3b35041e9729b802015300103c20d45b66a8b6c0a70b6188,75596171929,True,0.03301548,514000000000000.0,1740000000000.0,,,,,
0xbee1707d6b44d4d52bfe19e41f8a828645437aab,@107,31.45,8.4,264.18,sell,20-12-2024 21:53,19159.63044,sell,26.759934,0xd0f9c41836b88afbc9e50419b2deab01b8002b22457dcd2a82cd9d900200491b,57124299848,False,0.013209,776000000000000.0,1730000000000.0,,,,,
0xbaaaf6571ab7d571043ff1e313a9609a10637864,HYPE,12.863,77.77,1000.36,sell,14-03-2025 09:51,42231.7,close long,6.835983,0x62edb7fd35145031ca3a041f83b28f01e10037a944e1ecb829e58a6ee17e87e1,79743319137,False,0.0,150000000000000.0,1740000000000.0,,,,,
0x92f17e8d81a944691c10e753af1b1baae1a2cd0d,FARTCOIN,0.65709,3897.2,2560.81,buy,02-02-2025 05:02,296053.1,open long,0.0,0x454cee17acb02752a5aa041cf61309020133009d7a6c8f2f9932b255e272d3bd,68341001184,True,0.896283,551000000000000.0,1740000000000.0,2025-02-02 05:02:00,2025-02-02,Greed,60.0,5.0
0x4f93fead39b70a1824f981a54d4e55b278e9f760,BTC,87278.0,0.04717,4116.9,sell,27-03-2025 02:22,1.36267,close long,46.066222,0x373ee0fd9a09947c7f040420545950019500d0854ced409d9dfa2c022714ba5e,81990935626,True,1.440916,331000000000000.0,1740000000000.0,,,,,
0xbee1707d6b44d4d52bfe19e41f8a828645437aab,@107,27.386,0.01,0.27,buy,23-12-2024 16:42,8265.764234,buy,0.0,0x1a231fdaa83d9024c16f0419dadf98017300fb7958151cc35f07bcb91055ff1b,58012013292,True,2.99e-06,69900000000000.0,1730000000000.0,,,,,
0x8170715b3b381dffb7062c0298972d4727a0a63b,MELANIA,0.53,94.3,49.98,buy,23-04-2025 22:07,-1035212.7,close short,2.445199,0xf594d81f9e94ba0c147404221b568502036b007e1a3ccb10ee410d8b31c5ed3a,88368703390,False,0.004797,413000000000000.0,1750000000000.0,,,,,
0x513b8629fe877bb581bf244e326a047b249c4ff1,SOL,136.23,29.36,3999.71,buy,22-04-2025 01:00,7983.95,open long,0.0,0x578a43176c078aaf9b7d0421fcb556020187009abd9b20a1dd97ca778489e12d,87862589289,True,0.919933,856000000000000.0,1750000000000.0,,,,,
0xb1231a4a2dd02f2276fa3c5e2a2f3436e6bfed23,HYPE,13.659,41.76,570.4,sell,14-03-2025 18:16,19468.24,close long,26.972784,0x511b30b558dbd9915233041f896c0d0201d400234f644a68191f3bee3be2a21a,79805655511,True,0.199639,387000000000000.0,1740000000000.0,,,,,
0xb899e522b5715391ae1d4f137653e7906c5e2115,SOL,116.03,5.0,580.15,sell,11-03-2025 00:26,5960.12,close long,-17.606,0x9733a3fb79bffecd83c7041f4b28c40201480054ab5237f75b1f150358a4fb1a,78789758764,False,0.0,298000000000000.0,1740000000000.0,2025-11-03 00:26:00,2025-11-03,,,0.0
0x513b8629fe877bb581bf244e326a047b249c4ff1,BTC,79103.0,0.05,3955.15,buy,08-04-2025 02:18,5.03329,open long,0.0,0x1021f5709105610ff5a404211a3e370201c300ee6911180c46c852b3feaa0dc0,84799682087,False,0.379694,300000000000000.0,1740000000000.0,2025-08-04 02:18:00,2025-08-04,,,2.0
0xa0feb3725a9335f49874d7cd8eaad6be45b27416,HYPE,19.318,18.67,360.67,buy,14-12-2024 05:52,1138.27,open long,0.0,0x0000000000000000000000000000000000000000000000000000000000000000,55299657013,False,0.018033,196000000000000.0,1730000000000.0,,,,,
0xbee1707d6b44d4d52bfe19e41f8a828645437aab,@107,12.4,703.54,8723.9,buy,26-03-2025 20:44,0.00427928,buy,0.0,0x36d97c377c3aef2d0d98042050682402011e001abd86cab1d5f8df397a605d3e,81937469554,False,0.03517693,75700000000000.0,1740000000000.0,,,,,
0xa0feb3725a9335f49874d7cd8eaad6be45b27416,ONDO,1.36,1237.0,1682.32,sell,10-02-2025 19:24,10161.0,close long,18.983002,0x01af0d659a95a45487fd041d80fef30201100102609dcef778fab427f1ba8579,71235620623,False,0.084116,155000000000000.0,1740000000000.0,2025-10-02 19:24:00,2025-10-02,,,19.0
0xbaaaf6571ab7d571043ff1e313a9609a10637864,HYPE,13.94,271.02,3778.02,sell,10-03-2025 22:46,79546.09,close long,1.138284,0x3f679b2ce978df8b58bf041f4a045c02028b00d075369b8e3b753617d8ce86c3,78756679218,False,0.0,198000000000000.0,1740000000000.0,2025-10-03 22:46:00,2025-10-03,,,22.0
0x75f7eeb85dc639d5e99c78f95393aa9a5f1170d4,MINA,1.5563,769.0,1196.79,buy,14-02-2024 18:13,-769.0,close short,39.3728,0x681437a5dcb3e879bc5d04079d9c9c02013800e6c8a685946ddbf388b7732e2a,9636011619,False,-0.023935,620000000000000.0,1710000000000.0,,,,,
0xbee1707d6b44d4d52bfe19e41f8a828645437aab,HYPE,26.831,76.47,2051.77,buy,18-02-2025 11:38,-573.59,close short,24.692163,0x8c9fa6da41c536081eb4041dfa3f1b0204a5003cbb9d59a1970166aa125061d4,73075948622,True,0.718118,193000000000000.0,1740000000000.0,,,,,
0xb1231a4a2dd02f2276fa3c5e2a2f3436e6bfed23,HPOS,0.037265,3755.0,139.93,buy,11-02-2024 21:07,61483.0,open long,0.0,0x91aeaf6bbb31cf09fb4f040792c44d013500c939f914ec23ce3618d4b2d8de8d,9379401430,True,0.034982,628000000000000.0,1710000000000.0,2024-11-02 21:07:00,2024-11-02,Greed,72.0,21.0
0x8477e447846c758f5a675856001ea72298fd9cb5,TNSR,1.425,389.4,554.89,sell,02-06-2024 21:29,-8315.7,open short,0.0,0xd328a69c7a4bece0dd52040a84b993014100786b04e2d147a4a00f5f57c5a559,24728547974,False,0.055489,549000000000000.0,1720000000000.0,2024-02-06 21:29:00,2024-02-06,Greed,64.0,21.0
0xbee1707d6b44d4d52bfe19e41f8a828645437aab,@107,16.714,18.54,309.88,sell,18-04-2025 18:42,716.3389845,sell,2.623449,0xf0362129d8a28724a5070421c8bf320203d200c8d3a210dbc06d7aa41964af4b,87343648311,True,0.092963,1100000000000000.0,1740000000000.0,,,,,
0x75f7eeb85dc639d5e99c78f95393aa9a5f1170d4,MELANIA,0.70274,528.0,371.05,sell,11-03-2025 07:20,135324.6,close long,40.65072,0x2531bbba2c681a25e23d041f4fe7a10202d3004fe528083d72e923c54e91baed,78909782394,True,0.124671,114000000000000.0,1740000000000.0,2025-11-03 07:20:00,2025-11-03,,,7.0
0x513b8629fe877bb581bf244e326a047b249c4ff1,BTC,94810.0,0.06102,5785.31,sell,29-04-2025 01:09,54.88625,close long,16.634052,0x385fb0a7c1277499370e04226e8f1401950098dcdb5f54efa1cb199b9c3bb142,89609661670,False,0.0,341000000000000.0,1750000000000.0,,,,,
0xbaaaf6571ab7d571043ff1e313a9609a10637864,HYPE,12.657,1126.0,14251.78,buy,29-03-2025 15:08,68708.13,open long,0.0,0xb2b136b71b3d56c60d3b04207e23fb0201e1002a4076c0f0d362071e9d78340b,82476212852,True,4.988123,454000000000000.0,1740000000000.0,,,,,
0x8170715b3b381dffb7062c0298972d4727a0a63b,MELANIA,0.518,607.4,314.63,buy,23-04-2025 22:21,-275689.5,close short,23.038682,0x3d55639d14f29b901b1e04221b7f510201ee0033f0ea4db5712206c1145765a0,88372711024,False,0.030204,809000000000000.0,1750000000000.0,,,,,
0xa0feb3725a9335f49874d7cd8eaad6be45b27416,HYPE,26.246,2.64,69.29,sell,17-02-2025 01:17,494.22,close long,0.225192,0x0000000000000000000000000000000000000000000000000000000000000000,72736151848,False,0.003464,948000000000000.0,1740000000000.0,,,,,
0xbaaaf6571ab7d571043ff1e313a9609a10637864,HYPE,21.626,0.68,14.71,buy,24-02-2025 12:42,60422.11,open long,0.0,0x0000000000000000000000000000000000000000000000000000000000000000,74400895645,False,0.001411,817000000000000.0,1740000000000.0,,,,,
0xa0feb3725a9335f49874d7cd8eaad6be45b27416,@107,18.078,17.86,322.87,buy,26-04-2025 06:36,6815.57335,buy,0.0,0xa4d6656cfd184fa9ab0c0422419104020139002a988d666e5b19e2babf97d6a9,88730843616,False,0.00178598,639000000000000.0,1750000000000.0,,,,,
0x23e7a7f8d14b550961925fbfdaa92f5d195ba5bd,@107,24.186,5.0,120.93,sell,02-02-2025 02:09,1412.470257,sell,0.420431,0x7454c815d6dc0af2c726041cf41b950201b9004af093b7d29e92cb49af457ea7,68306509730,True,0.042325,830000000000000.0,1740000000000.0,2025-02-02 02:09:00,2025-02-02,Greed,60.0,2.0
0xbee1707d6b44d4d52bfe19e41f8a828645437aab,@107,14.25,6.0,85.5,sell,08-12-2024 18:25,62437.0841,sell,5.928623,0x26b33cd9a3df7dda3fb50418b9fa9501c100fe87d468908055a0638dd0516854,53647346617,False,0.0,918000000000000.0,1730000000000.0,2024-08-12 18:25:00,2024-08-12,Fear,25.0,18.0
0x8477e447846c758f5a675856001ea72298fd9cb5,BTC,62964.0,0.00363,228.56,buy,01-08-2024 21:22,0.13659,open long,0.0,0xc4deab26526e080ec98c040e80b8ae017100e375283a07df19d15ecfbbeabc2d,31925711611,True,0.079995,162000000000000.0,1720000000000.0,2024-01-08 21:22:00,2024-01-08,Greed,71.0,21.0
0x2c229d22b100a7beb69122eed721cee9b24011dd,NIL,0.79615,175.0,139.33,buy,25-03-2025 08:27,273487.0,open long,0.0,0x247befb2a30b8426313e0420375ffd02058b00d4390cda28e9df62bdb7bf251b,81645640007,True,0.048764,1020000000000000.0,1740000000000.0,,,,,
0x39cef799f8b69da1995852eea189df24eb5cae3c,ADA,0.56213,696.0,391.24,sell,09-04-2025 10:16,-428185.0,open short,0.0,0x6885b7683f37bb16879a0421303afe02071b0043af56afa73f97a4d47dcce0db,85190039561,False,0.019562,351000000000000.0,1740000000000.0,2025-09-04 10:16:00,2025-09-04,,,10.0
0xbee1707d6b44d4d52bfe19e41f8a828645437aab,HYPE,20.68,8.58,177.43,sell,27-02-2025 11:01,-3275.33,open short,0.0,0x9301e25edc277b5352ed041e8ca4d1017f00b1e57f0da756538750ba12c4bb0e,75428742174,False,0.008871,661000000000000.0,1740000000000.0,,,,,
0x7f4f299f74eec87806a830e3caa9afa5f2b9db8f,ETH,1456.0,0.69,1004.64,buy,09-04-2025 18:55,-46.55,close short,3.1533,0x0b5f5cf77c4fcd1a9208042136373001a400e3e0f6c5eb4dd8f3f955d7fa6552,85291020204,False,0.100464,695000000000000.0,1740000000000.0,2025-09-04 18:55:00,2025-09-04,,,18.0
0x75f7eeb85dc639d5e99c78f95393aa9a5f1170d4,RUNE,1.5407,1305.0,2010.61,buy,01-02-2025 19:31,-4813.3,close short,27.927,0x3b8128327dd07878007b041cef9db301850069b7c8065c9a2f60c4d1555c5ce9,68231669843,False,0.193018,362000000000000.0,1740000000000.0,2025-01-02 19:31:00,2025-01-02,Greed,70.0,19.0
0xb1231a4a2dd02f2276fa3c5e2a2f3436e6bfed23,HYPE,23.826,80.15,1909.65,buy,06-02-2025 21:19,-3738.25,close short,200.815825,0x277ebc75f3588e5c775f041d419ac9020202006c524bdfa6cfc1f04ee484543f,70177940119,True,0.668378,763000000000000.0,1740000000000.0,2025-06-02 21:19:00,2025-06-02,,,21.0
0xb1231a4a2dd02f2276fa3c5e2a2f3436e6bfed23,HYPE,25.21,4.49,113.19,sell,13-02-2025 01:57,-14270.7,open short,0.0,0xd38906b7f73e64418d22041da3f0d5020151000c40e3c637e987dd1f658c95d0,71842769601,True,0.033957,1040000000000000.0,1740000000000.0,,,,,
0x72c6a4624e1dffa724e6d00d64ceae698af892a0,S,0.4282,3461.0,1482.0,sell,10-02-2025 23:35,-784.0,open short,0.0,0x96a0ce22fdf03a005bde041d83db8801d700c86a8c6a35bc44c236f2c8bd648e,70970956928,False,0.142272,743000000000000.0,1740000000000.0,2025-10-02 23:35:00,2025-10-02,,,23.0
0x28736f43f1e871e6aa8b1148d38d4994275d72c4,HYPE,20.204,25.0,505.1,buy,11-01-2025 19:54,150.0,open long,0.0,0xf67fad66524f1dc48cc5041b35a9a0019c005599295d3a41f12f279a65ec66bc,62292589249,True,0.176785,331000000000000.0,1740000000000.0,2025-11-01 19:54:00,2025-11-01,,,19.0
0xbee1707d6b44d4d52bfe19e41f8a828645437aab,HYPE,14.193,150.0,2128.95,buy,26-03-2025 21:35,0.01,open long,0.0,0x6135f2b3eafa619a008b04205101e802020e009926e7f0ebd7f22fe6ec7521a4,81946687997,True,0.638685,105000000000000.0,1740000000000.0,,,,,
0xbaaaf6571ab7d571043ff1e313a9609a10637864,HYPE,13.42,166.82,2238.72,buy,11-03-2025 05:54,62142.22,open long,0.0,0xf054c51991d99a5dcde4041f4ef6ff02023000550847238fabe0358a57663df8,78800474927,False,0.0,818000000000000.0,1740000000000.0,2025-11-03 05:54:00,2025-11-03,,,5.0
0xbee1707d6b44d4d52bfe19e41f8a828645437aab,HYPE,10.115,171.29,1732.6,sell,07-04-2025 14:35,26186.69,close long,-168.652134,0xda22d5afe1715757d17a04211227560201c700632234ee465fd3307f8a5fefdf,84571408413,True,0.519779,1080000000000000.0,1740000000000.0,2025-07-04 14:35:00,2025-07-04,,,14.0
0xa0feb3725a9335f49874d7cd8eaad6be45b27416,BERA,7.6474,66.0,504.73,buy,08-02-2025 03:24,89.6,open long,0.0,0xd7ab8360a6eec5b24900041d5603f001d100b8d82df1364c01e88b46b139b95d,70540589806,False,0.050472,1100000000000000.0,1740000000000.0,2025-08-02 03:24:00,2025-08-02,,,3.0
0x271b280974205ca63b716753467d5a371de622ab,SOL,102.97,50.0,5148.5,buy,09-04-2025 17:59,4235.38,open long,0.0,0x40469ee5a78d0c6af334042135926601c00086f6a244db1df5837c2d79ea7983,85285811717,True,1.729896,889000000000000.0,1740000000000.0,2025-09-04 17:59:00,2025-09-04,,,17.0
0xb1231a4a2dd02f2276fa3c5e2a2f3436e6bfed23,HYPE,26.576,19.93,529.66,sell,14-02-2025 06:03,-23335.87,open short,0.0,0xc0ab38f41c071edc4527041db6668d019b002beeec5a2ccc950c8d4d15fb1c4b,72137886381,True,0.158897,703000000000000.0,1740000000000.0,,,,,
0x8477e447846c758f5a675856001ea72298fd9cb5,SUI,3.572,201.1,718.33,sell,25-04-2025 13:37,-8217.2,open short,0.0,0x28c32646c11d13d2d9dd042235f4dd020243001365fc9c78a08efb02be61ac43,88781279206,True,0.251415,1030000000000000.0,1750000000000.0,,,,,
0x8477e447846c758f5a675856001ea72298fd9cb5,FARTCOIN,1.0971,202.6,222.27,sell,08-01-2025 23:30,-1140.9,open short,0.0,0xe6cf9d2b509d40ff6895041afa87710201790037799d6c2837d95e3cfbf0f741,61534576318,True,0.077795,677000000000000.0,1740000000000.0,2025-08-01 23:30:00,2025-08-01,,,23.0
0xbee1707d6b44d4d52bfe19e41f8a828645437aab,HYPE,12.875,38.84,500.07,sell,13-03-2025 12:29,202.61,close long,6.8941,0x7c74a3a4ffa10ca0000c041f74dec5017200323c7b8f5f1af71ab71c5d1f8ecb,79538521871,True,0.150019,352000000000000.0,1740000000000.0,,,,,
0x8170715b3b381dffb7062c0298972d4727a0a63b,MELANIA,0.515,266.4,137.2,buy,23-04-2025 22:17,-440094.1,close short,10.903752,0x8cd2432a021714dff12904221b742b02042c00223d5f7a28bb9ab44098776515,88371580465,False,0.01317,1090000000000000.0,1750000000000.0,,,,,
0x92f17e8d81a944691c10e753af1b1baae1a2cd0d,FARTCOIN,1.1789,6160.6,7262.73,buy,23-04-2025 03:30,1155911.2,open long,0.0,0x03a8b9ff0b84142fa1b104220e9715020b250036e19e6790c939e7621b393ed8,88114148455,True,2.541955,816000000000000.0,1750000000000.0,,,,,
0x47add9a56df66b524d5e2c1993a43cde53b6ed85,FTT,2.9903,9.5,28.41,sell,11-12-2024 04:38,-1792.7,open short,0.0,0x872b81856c6a7704fd810418ec61f601bf005cca209f7b89e9b82d270ff94367,54489869200,True,0.009544,163000000000000.0,1730000000000.0,2024-11-12 04:38:00,2024-11-12,Extreme Greed,80.0,4.0
0xbaaaf6571ab7d571043ff1e313a9609a10637864,HYPE,12.45,42.11,524.27,buy,12-03-2025 14:56,197509.0,open long,0.0,0xee1f7e9c43f8d6eb28d1041f65d2b602028900472628ad22da16ca9629cd4bf7,78855812443,False,0.026213,874000000000000.0,1740000000000.0,2025-12-03 14:56:00,2025-12-03,,,14.0
0xbaaaf6571ab7d571043ff1e313a9609a10637864,HYPE,13.301,37.62,500.38,buy,12-03-2025 14:48,59399.45,open long,0.0,0x362868ed8dfce496ae6e041f65bb9002017300a5eff719adc7c5fd9f1b4b6910,79163103788,False,0.025019,1090000000000000.0,1740000000000.0,2025-12-03 14:48:00,2025-12-03,,,14.0
0x72c6a4624e1dffa724e6d00d64ceae698af892a0,DOGE,0.35025,590.0,206.65,sell,26-01-2025 16:31,-28934.0,open short,0.0,0x93121c7cacca58846606041c8c430a018c00ce1799018f01c51f665674238480,66633668544,False,0.019837,561000000000000.0,1740000000000.0,,,,,
0xbd5fead7180a9c139fa51a103cb6a2ce86ddb5c3,BTC,82220.0,0.013,1068.86,sell,10-04-2025 07:33,36.2419,close long,39.0546,0xd534f937b22dac9d99de04213eeb1a01b700114b672dfe3d5582c4fb081055d9,85472845832,False,0.053443,1090000000000000.0,1740000000000.0,2025-10-04 07:33:00,2025-10-04,,,7.0
0xa0feb3725a9335f49874d7cd8eaad6be45b27416,HYPE,26.246,14.39,377.68,buy,17-02-2025 08:37,1341.4,open long,0.0,0x89d85457a6cf481e112a041de80029014a0010687757eab7cb188d856a8a9a5f,72782740209,False,0.018883,902000000000000.0,1740000000000.0,,,,,
0x513b8629fe877bb581bf244e326a047b249c4ff1,BTC,87850.0,0.56911,49996.31,buy,21-04-2025 21:52,26.28902,open long,0.0,0xa2099f93fb96ead914890421fa906f0201d7003bf95b50eaf36bcf0d01942f89,87818484403,False,0.0,639000000000000.0,1750000000000.0,,,,,
0x39cef799f8b69da1995852eea189df24eb5cae3c,XRP,1.8943,373.0,706.57,buy,07-04-2025 20:04,83282.0,open long,0.0,0xcb553eb82fa7665ba5bf042115eb5802064d00ed9fb7dc7fe76b761d6232d2de,84684357592,False,0.070657,363000000000000.0,1740000000000.0,2025-07-04 20:04:00,2025-07-04,,,20.0
0xa0feb3725a9335f49874d7cd8eaad6be45b27416,BTC,99698.0,0.00015,14.95,buy,04-02-2025 00:08,0.55954,open long,0.0,0xe70eac734f30fd93bf46041d12f16e020156002f86b809f168866b3a0f3d3f95,69131466028,False,0.001495,1090000000000000.0,1740000000000.0,2025-04-02 00:08:00,2025-04-02,Fear,44.0,0.0
0xbee1707d6b44d4d52bfe19e41f8a828645437aab,@107,15.396,13.33,205.23,buy,12-04-2025 06:41,585.6785187,buy,0.0,0x403e41727e57a17e776d04215f0dfa02055a00ee457583bced9b0dc2f8c1abf4,85933004293,True,0.00466549,931000000000000.0,1740000000000.0,2025-12-04 06:41:00,2025-12-04,,,6.0
0x23e7a7f8d14b550961925fbfdaa92f5d195ba5bd,@107,16.387,7.0,114.71,buy,04-03-2025 07:31,2133.16433,buy,0.0,0x8a62c1d091205dea791e041edd27cf020816005dafff225c08fe2b061bea28d6,76870120715,True,0.00244999,1040000000000000.0,1740000000000.0,2025-04-03 07:31:00,2025-04-03,Fear,25.0,7.0
0x513b8629fe877bb581bf244e326a047b249c4ff1,BTC,85644.0,0.17594,15068.21,sell,15-04-2025 15:04,-19.47887,open short,0.0,0x0678e691af43b6bd80e504219596550202df00108b2b05391a332ef77cc8e86a,86685611326,False,0.0,617000000000000.0,1740000000000.0,,,,,
0xb1231a4a2dd02f2276fa3c5e2a2f3436e6bfed23,HYPE,23.21,171.68,3984.69,buy,02-02-2025 04:51,-11449.69,close short,463.02096,0x0882dc6208261505b6f6041cf5f0c801b10092de5beb10994fb13e3f998c71c1,68338087946,True,1.394642,753000000000000.0,1740000000000.0,2025-02-02 04:51:00,2025-02-02,Greed,60.0,4.0
0x8477e447846c758f5a675856001ea72298fd9cb5,AIXBT,0.68649,127.0,87.18,buy,15-01-2025 11:56,-8480.0,close short,1.204214,0xb0fe06d59c7f7df0b900041b7f34eb015800d73d0affe15527c20567032f88c0,63130743917,True,0.030514,746000000000000.0,1740000000000.0,,,,,
0xbee1707d6b44d4d52bfe19e41f8a828645437aab,HYPE,16.087,186.48,2999.9,sell,04-03-2025 16:07,19873.22,close long,-12.419568,0x1929ead83efb3a1f5c24041ee2fcb40201c200479177a2aa74e4412e0213ffe6,77000105958,True,0.899971,605000000000000.0,1740000000000.0,2025-04-03 16:07:00,2025-04-03,Fear,25.0,16.0
0xbaaaf6571ab7d571043ff1e313a9609a10637864,HYPE,20.285,26.82,544.04,buy,25-02-2025 03:41,122023.53,open long,0.0,0x7ff343d4fac6057dd010041e66a5bb01f20073a4addd32b5828ae7e774291936,74479445871,False,0.052227,678000000000000.0,1740000000000.0,,,,,
0xbaaaf6571ab7d571043ff1e313a9609a10637864,HYPE,13.419,45.98,617.01,sell,12-03-2025 15:09,168894.29,close long,16.16197,0x16ac4b69050f5f0ea972041f65fa880201e300df46dab2c41af6c72fa8d1e114,79305506568,True,0.185101,922000000000000.0,1740000000000.0,2025-12-03 15:09:00,2025-12-03,,,15.0
0xa0feb3725a9335f49874d7cd8eaad6be45b27416,HYPE,22.735,28.36,644.76,buy,19-02-2025 10:27,1364.96,open long,0.0,0x58bad609a5c06ac768cf041e09d893018c003f42821c41c26aae578e5acb2cda,73320522588,False,0.032238,708000000000000.0,1740000000000.0,,,,,
0xbee1707d6b44d4d52bfe19e41f8a828645437aab,@107,13.7,35.28,483.34,buy,08-12-2024 07:07,60702.9241,buy,0.0,0x0000000000000000000000000000000000000000000000000000000000000000,53556728181,False,0.0,79600000000000.0,1730000000000.0,2024-08-12 07:07:00,2024-08-12,Fear,25.0,7.0
0x28736f43f1e871e6aa8b1148d38d4994275d72c4,ETH,1855.4,0.1874,347.7,buy,11-03-2025 00:51,11.4081,open long,0.0,0x9602b7a99db9ff9028b4041f4b72bc0202db009305f7dfb2252ae48b94e164ba,78800791869,True,0.121695,502000000000000.0,1740000000000.0,2025-11-03 00:51:00,2025-11-03,,,0.0
0x513b8629fe877bb581bf244e326a047b249c4ff1,HYPE,15.071,200.0,3014.2,sell,20-03-2025 02:08,2565.23,close long,98.64,0xd29fc06859a49b596da5041fe1172c020141006362a88f7423d10dd623c4bef5,80822037425,False,0.289363,639000000000000.0,1740000000000.0,,,,,
0xbaaaf6571ab7d571043ff1e313a9609a10637864,HYPE,21.47,39.91,856.87,buy,24-02-2025 13:36,103197.33,open long,0.0,0xa926e6e5011c0af627fd041e5cf8e5020165002203d55c1a4cf11dad5a2cd48d,74400900705,False,0.082258,1100000000000000.0,1740000000000.0,,,,,
0xbaaaf6571ab7d571043ff1e313a9609a10637864,HYPE,21.494,2.0,42.99,buy,24-02-2025 13:36,96737.83,open long,0.0,0x2d59c9005f7f55b67f43041e5cf75f01b600d53a7ed217e74d9c84a25c845159,74400900693,False,0.004126,618000000000000.0,1740000000000.0,,,,,
0xbee1707d6b44d4d52bfe19e41f8a828645437aab,HYPE,24.5,7.21,176.65,buy,21-02-2025 21:02,-4829.69,close short,4.160891,0xa56f07c229bcaa3f2169041e319419020302007e0a8ed969bf3790177cf9574f,73798170168,False,0.017664,372000000000000.0,1740000000000.0,,,,,
0xbee1707d6b44d4d52bfe19e41f8a828645437aab,@107,15.123,16.78,253.76,buy,09-03-2025 14:41,3447.12733,buy,0.0,0x46be52dd915ba36102a6041f33c1e1020b2600c2b7493e600612844513034309,78342203716,True,0.00503398,331000000000000.0,1740000000000.0,2025-09-03 14:41:00,2025-09-03,,,14.0
0xbee1707d6b44d4d52bfe19e41f8a828645437aab,@107,14.25,2.16,30.78,sell,08-12-2024 18:25,62138.0541,sell,2.134305,0x0000000000000000000000000000000000000000000000000000000000000000,53647346617,False,0.0,456000000000000.0,1730000000000.0,2024-08-12 18:25:00,2024-08-12,Fear,25.0,18.0
0xbee1707d6b44d4d52bfe19e41f8a828645437aab,HYPE,18.567,27.97,519.32,sell,28-04-2025 16:13,-8003.95,open short,0.0,0xb9513f8ad40bb64df74a042268658a01cf00715a642d17d933da5169127c4533,89502898103,True,0.155795,47700000000000.0,1750000000000.0,,,,,
0xa0feb3725a9335f49874d7cd8eaad6be45b27416,@107,18.783,6.59,123.78,buy,23-04-2025 06:50,2085.895764,buy,0.0,0xfe7c3900d4efef71c03a042210de0f02027800e7260b34395846dffa2dbbd74c,88162998363,False,0.00065894,754000000000000.0,1750000000000.0,,,,,
0xbee1707d6b44d4d52bfe19e41f8a828645437aab,HYPE,12.966,56.34,730.5,buy,18-03-2025 12:32,5104.92,open long,0.0,0x772c856034c2ece2cee8041fc72d3101f70082d311dc9bc7890a43585e3fc01b,80496067044,True,0.219151,567000000000000.0,1740000000000.0,,,,,
0x47add9a56df66b524d5e2c1993a43cde53b6ed85,PURR,0.36937,541.0,199.83,buy,24-12-2024 16:17,-4743.0,close short,19.33534,0xb4a398a477ac4e1ab2080419e911dd020111004189d2649afd4f25913282a62c,58292292051,True,0.067142,343000000000000.0,1740000000000.0,,,,,
0x28736f43f1e871e6aa8b1148d38d4994275d72c4,ARK,0.3507,43.0,15.08,sell,06-04-2025 14:27,2968.0,close long,0.056115,0xb8845066e19f69436144042101b663015c00614fe878eea9567ca8929c80e4e5,84220476482,False,0.001508,298000000000000.0,1740000000000.0,2025-06-04 14:27:00,2025-06-04,,,14.0
0x47add9a56df66b524d5e2c1993a43cde53b6ed85,SUI,2.4637,292.2,719.89,sell,20-03-2025 05:56,1217.8,close long,25.47984,0x475b7b1bfac9b04a104d041fe3b605017e0030612677864fc2f93f6d9a4388f2,80851294528,True,0.241883,1060000000000000.0,1740000000000.0,,,,,
0x6d6a4b953f202f8df5bed40692e7fd865318264a,@107,11.395,25.0,284.88,buy,04-04-2025 20:17,0.0,buy,0.0,0x7e3cafe65f43732c90990420e511a602070200391da414f318217fc78e054150,83939138881,True,0.00839991,799000000000000.0,1740000000000.0,2025-04-04 20:17:00,2025-04-04,Fear,28.0,20.0
0x6d6a4b953f202f8df5bed40692e7fd865318264a,@107,14.478,6.9,99.9,sell,27-03-2025 14:51,38.02684372,sell,2.241074,0xa4acd868b19e0d2b1e7e04205ce084020170007a6aa5206e08f00670250ef179,82077975743,True,0.033565,666000000000000.0,1740000000000.0,,,,,
0xbee1707d6b44d4d52bfe19e41f8a828645437aab,HYPE,15.692,442.19,6938.85,buy,26-03-2025 10:12,11722.59,open long,0.0,0x3f7c6e2d0c31023e1f1b042049211301ba008aee7a67f4fa65e69a6b3b7e1cb3,81849547644,True,2.081653,405000000000000.0,1740000000000.0,,,,,
0x47add9a56df66b524d5e2c1993a43cde53b6ed85,SUI,4.9047,405.6,1989.35,buy,07-01-2025 20:37,-3356.8,close short,15.076152,0x6f57b63dd24aec6cd8dd041ae33f0b00005ace01fe6f45839c21278e5f21df87,60687268055,True,0.66842,679000000000000.0,1740000000000.0,2025-07-01 20:37:00,2025-07-01,,,20.0
0x271b280974205ca63b716753467d5a371de622ab,FARTCOIN,1.1241,52.0,58.45,buy,23-04-2025 03:19,-132032.4,close short,-3.93848,0xc50d67e13061d73a7d6404220e7772012d00cd47dda197ae150fee068f81ace5,88110242922,True,0.016833,112000000000000.0,1750000000000.0,,,,,
0x8477e447846c758f5a675856001ea72298fd9cb5,kBONK,0.036802,29659.0,1091.51,buy,23-05-2024 17:41,-188841.0,close short,11.596669,0x2b0f5020455afbb0f4660409ba43b7019e0048317e6eead7e1456a723777c709,23560643654,False,0.109151,200000000000000.0,1720000000000.0,,,,,
0xbd5fead7180a9c139fa51a103cb6a2ce86ddb5c3,APT,6.14,3080.98,18917.22,sell,27-02-2025 10:09,-1919.02,open short,0.0,0xdc86f166cb9a777af2a2041e8c0a280201f80038cb1864278f660b9f76e30335,75420002673,False,1.891721,361000000000000.0,1740000000000.0,,,,,
0x8477e447846c758f5a675856001ea72298fd9cb5,ZRO,5.17,71.4,369.14,buy,21-07-2024 09:02,-21379.8,close short,-19.79565,0x2554f7ce8a945296aa66040dd6ac65012300a68d083b4829887af2decf49bdca,30564664033,False,0.036913,1000000000000000.0,1720000000000.0,,,,,
0x8477e447846c758f5a675856001ea72298fd9cb5,ZRO,4.7952,173.9,833.89,sell,20-07-2024 21:19,-5621.5,open short,0.0,0x5ddd27802429f21b92d5040dcf810f0193003b3e8ace3cebf00572ff7c1b1a8b,30531237516,True,0.291859,827000000000000.0,1720000000000.0,,,,,
0xbaaaf6571ab7d571043ff1e313a9609a10637864,HYPE,13.604,127.32,1732.06,sell,02-04-2025 18:22,123686.09,close long,115.313724,0xdd08fbf6c4fa7af1dbbc0420c272e80201ac00d83b4d1bc6bd0768b54b32c196,83364331655,True,0.606221,641000000000000.0,1740000000000.0,2025-02-04 18:22:00,2025-02-04,Greed,72.0,18.0
0x4f93fead39b70a1824f981a54d4e55b278e9f760,BTC,102030.0,0.03561,3633.29,buy,21-01-2025 05:59,0.0,open long,0.0,0xc1117d98103da378e481041bf8946902018600b9ff31ef500b02de7c6a6cfff4,65075478820,True,0.908322,36200000000000.0,1740000000000.0,,,,,
0x28736f43f1e871e6aa8b1148d38d4994275d72c4,BTC,104718.0,0.00066,69.11,sell,16-12-2024 16:50,0.00354,close long,3.086094,0x8e3a5c8e881465800a8204195ec53a01db0062fec09239ddbb67294d750ad00b,55768009963,True,0.024189,192000000000000.0,1730000000000.0,,,,,
0xbaaaf6571ab7d571043ff1e313a9609a10637864,HYPE,12.306,66.93,823.64,buy,30-03-2025 16:13,168520.8,open long,0.0,0x0000000000000000000000000000000000000000000000000000000000000000,82543956183,False,0.082364,1090000000000000.0,1740000000000.0,,,,,
0x513b8629fe877bb581bf244e326a047b249c4ff1,BTC,83861.0,0.00018,15.09,buy,11-04-2025 23:48,4.37364,open long,0.0,0x9960de2e785dfa195a8f04215a6c26020145000d47f1902067fd76d5df4a3c99,85885774868,False,0.000723,291000000000000.0,1740000000000.0,2025-11-04 23:48:00,2025-11-04,,,23.0
0x513b8629fe877bb581bf244e326a047b249c4ff1,BTC,91163.0,0.08537,7782.59,sell,22-04-2025 23:03,53.52775,close long,39.116534,0x36315be5779a8e346fab04220b98180202f200b1c0d190d4574344a88e1789e2,88074001681,True,1.789994,1100000000000000.0,1750000000000.0,,,,,
0xbee1707d6b44d4d52bfe19e41f8a828645437aab,HYPE,17.153,38.76,664.85,sell,18-04-2025 05:44,-1192.41,open short,0.0,0x849b63aab9314ec0e1e70421c0060d0202fe005154233f2d98c1110d99fd7463,87254521543,True,0.199455,487000000000000.0,1740000000000.0,,,,,
0x271b280974205ca63b716753467d5a371de622ab,HYPE,17.751,6.72,119.29,buy,20-04-2025 13:55,-24113.57,close short,2.232384,0xcc519d1c75b5778e0fd70421e55a0f0169000596c9114c9a7f4212e6b27739e0,87591851211,True,0.034354,996000000000000.0,1750000000000.0,,,,,
0x23e7a7f8d14b550961925fbfdaa92f5d195ba5bd,TAO,339.0,5.156,1747.88,buy,23-04-2025 10:34,-5.156,close short,7.074032,0xb3588b0c9622e05a02330422136ded01c3008c4125dd3037cb9ee6f6c38bc1a8,88210697820,False,0.174788,102000000000000.0,1750000000000.0,,,,,
0xbee1707d6b44d4d52bfe19e41f8a828645437aab,HYPE,15.837,99.6,1577.37,sell,07-03-2025 06:42,2084.79,close long,95.9646,0x2203493f69968d0c96d3041f0d72c20203f100519ceab628a7cd67dd958f12aa,77807592972,True,0.473209,148000000000000.0,1740000000000.0,2025-07-03 06:42:00,2025-07-03,,,6.0
0x75f7eeb85dc639d5e99c78f95393aa9a5f1170d4,ALT,0.4536,2750.0,1247.4,sell,18-02-2024 16:16,54394.0,close long,51.535,0x3cf97ac2ad6f8fd436990407ac60fd02018b00ae6fdc05e5c2dc57bbf03f4e5c,10038764443,False,-0.024948,355000000000000.0,1710000000000.0,,,,,
0xbd5fead7180a9c139fa51a103cb6a2ce86ddb5c3,ENA,1.21,30.0,36.3,sell,03-01-2025 23:02,-386794.0,open short,0.0,0x5a97395d9cbffc9decc1041a92216f01ee00f37e10192fffffbdac346a18fefc,60475119314,False,0.00363,863000000000000.0,1740000000000.0,2025-03-01 23:02:00,2025-03-01,Extreme Fear,20.0,23.0
0xa0feb3725a9335f49874d7cd8eaad6be45b27416,HYPE,26.686,81.98,2187.72,buy,18-12-2024 07:20,57.44,open long,0.0,0x28327dd22203d4dc78ee04197fb8210201de00b1d71e14694170965d405d5c15,56147619078,False,0.109385,805000000000000.0,1730000000000.0,,,,,
0xa0feb3725a9335f49874d7cd8eaad6be45b27416,HYPE,26.279,22.28,585.5,buy,15-02-2025 09:58,162.8,open long,0.0,0x569ba9699f108a639137041dc9256502010500d4ddaf5c6a17a518a4a571456b,72438601060,False,0.029274,619000000000000.0,1740000000000.0,,,,,
0xbee1707d6b44d4d52bfe19e41f8a828645437aab,@107,23.861,3.4,81.13,sell,02-02-2025 06:28,2771.462915,sell,-1.34692,0xcd65815d28f5d23d71cf041cf70e760201130033e8e5a4da649500f5693b57c3,68357971677,True,0.028394,539000000000000.0,1740000000000.0,2025-02-02 06:28:00,2025-02-02,Greed,60.0,6.0
0x23e7a7f8d14b550961925fbfdaa92f5d195ba5bd,@107,12.776,13.94,178.1,sell,29-03-2025 12:59,3925.311009,sell,-15.690373,0x8ab7bee7b36a71fb811704207cab6d01f400008f076eaef91acaff303fa39180,82458196999,True,0.062334,1060000000000000.0,1740000000000.0,,,,,
0xbee1707d6b44d4d52bfe19e41f8a828645437aab,HYPE,18.094,12.74,230.52,sell,19-04-2025 19:26,-2125.73,open short,0.0,0x283d1c62afeed15d55820421d91ff401e70031f5651a6853c56bedc7560016c0,87483557279,True,0.069155,290000000000000.0,1750000000000.0,,,,,
0x47add9a56df66b524d5e2c1993a43cde53b6ed85,SUI,2.0033,230.0,460.76,buy,11-03-2025 06:24,5972.3,open long,0.0,0xb2b0067659533dc08285041f4f4af102041400fbf735c7fae358f193082d83fc,78885175949,True,0.154814,306000000000000.0,1740000000000.0,2025-11-03 06:24:00,2025-11-03,,,6.0
0x083384f897ee0f19899168e3b1bec365f52a9012,ETH,2588.4,8.0105,20734.38,sell,25-02-2025 04:04,-1294.0229,open short,0.0,0xb4e35739aa42919afa40041e66e83f0201ee007b292b7010cc16d9e65ee1a4ee,74579387290,False,2.073437,504000000000000.0,1740000000000.0,,,,,
0x92f17e8d81a944691c10e753af1b1baae1a2cd0d,FARTCOIN,1.1801,500.0,590.05,buy,23-04-2025 03:30,595197.4,open long,0.0,0x6862aabd32992c0458e604220e969502010c007d2c0a8d7cacf2bfb8c8f5304a,88114061619,True,0.206517,746000000000000.0,1750000000000.0,,,,,
0x083384f897ee0f19899168e3b1bec365f52a9012,ETH,2261.8,1.326,2999.15,buy,01-03-2025 08:12,-1295.7513,close short,423.80286,0x48f7530788415475bfc3041eac02d702022c00ba17870eed48786914c73a2b22,76019886337,False,0.149957,499000000000000.0,1740000000000.0,2025-01-03 08:12:00,2025-01-03,Greed,74.0,8.0
0x39cef799f8b69da1995852eea189df24eb5cae3c,BTC,85320.0,0.00018,15.36,buy,13-04-2025 04:42,3.39305,open long,0.0,0x4b24c998acedaa77cd3004216def9a0202de0039d2242b507cbd579c562f3609,86108504727,False,0.000767,939000000000000.0,1740000000000.0,,,,,
0x28736f43f1e871e6aa8b1148d38d4994275d72c4,SOL,129.44,5.0,647.2,sell,28-02-2025 13:57,85.0,close long,1.3795,0xdd6a6f549d248b91fa3a041e9f617702014f0048916dc6a818556779a3f5589a,75782543306,True,0.22652,1110000000000000.0,1740000000000.0,,,,,
0xbaaaf6571ab7d571043ff1e313a9609a10637864,HYPE,11.715,206.0,2413.29,buy,03-04-2025 15:24,40622.3,open long,0.0,0x1cfe231f6ddb0a2869040420d10b630202e90050421e23fa4019cb060f642630,83555405447,False,0.120664,1000000000000000.0,1740000000000.0,2025-03-04 15:24:00,2025-03-04,Extreme Fear,15.0,15.0
0x271b280974205ca63b716753467d5a371de622ab,SOL,149.33,108.95,16269.5,buy,24-04-2025 00:54,-2208.97,close short,153.608605,0xd799c1f1d2a341a54cc004221d3f4d02028b00aef09b9b1c937774585fa85fb0,88403592738,True,4.067375,981000000000000.0,1750000000000.0,,,,,
0xbd5fead7180a9c139fa51a103cb6a2ce86ddb5c3,TIA,3.0835,308.9,952.49,buy,07-03-2025 06:15,-311.2,close short,167.782124,0x143ab3e0d4e4013dfdc6041f0d22710205e10075dbbf38894988e980dfc061cf,77797898673,True,0.285747,648000000000000.0,1740000000000.0,2025-07-03 06:15:00,2025-07-03,,,6.0
0x8477e447846c758f5a675856001ea72298fd9cb5,PENGU,0.045356,4896.0,222.06,sell,06-01-2025 17:05,-384221.0,open short,0.0,0xc2244e487954fac7cb9b041acb677d01f800ed3bbc0f47e1ab380b4e83f5f6df,60958761329,True,0.077722,812000000000000.0,1740000000000.0,2025-06-01 17:05:00,2025-06-01,,,17.0
0xbee1707d6b44d4d52bfe19e41f8a828645437aab,@107,26.75,0.68,18.19,sell,23-12-2024 19:43,15661.41684,sell,-0.109785,0x494f7b5fa199eac0e6400419dcb0a60203b200b0b9722ede9fe5a8c81cc60d4b,58047770887,True,0.005456,116000000000000.0,1730000000000.0,,,,,
0x47add9a56df66b524d5e2c1993a43cde53b6ed85,FTT,3.26,79.3,258.52,buy,24-12-2024 19:46,-1459.1,close short,-0.815997,0x30f4de7665e8b75181bd0419eb273a01c8006a791b5a5c04452afbe5edb9b8fa,58252774449,False,0.024816,581000000000000.0,1740000000000.0,,,,,
0xbaaaf6571ab7d571043ff1e313a9609a10637864,HYPE,13.05,10.0,130.5,buy,11-03-2025 06:19,205411.37,open long,0.0,0x0aa55af8f30d6f9dba66041f4f3d1102069900e8e392c8f71eac1a7381180b25,78766167752,False,0.0,634000000000000.0,1740000000000.0,2025-11-03 06:19:00,2025-11-03,,,6.0
0xbaaaf6571ab7d571043ff1e313a9609a10637864,HYPE,20.277,24.64,499.63,buy,25-02-2025 03:43,129980.5,open long,0.0,0x738c031f4767aedd6d57041e66aa54020b0800272ec7605f29a418f5e3020f67,74479445879,False,0.047963,709000000000000.0,1740000000000.0,,,,,
0x4acb90e786d897ecffb614dc822eb231b4ffb9f4,SUI,3.9736,1887.4,7499.77,buy,20-12-2024 01:22,94899.0,open long,0.0,0xb4b903ca83acf5a94a850419a3a9c9020173000c8ff6f978c6a07a84d542dd8d,56739917477,True,2.62492,280000000000000.0,1730000000000.0,,,,,
0xbaaaf6571ab7d571043ff1e313a9609a10637864,HYPE,12.166,37.95,461.7,buy,14-03-2025 01:22,159567.88,open long,0.0,0x6bd258e0b1e36203ffe9041f7ddf44013400b4cc6c7717a1f6ff7da639aab6b2,79684440926,True,0.115424,828000000000000.0,1740000000000.0,,,,,
0xb899e522b5715391ae1d4f137653e7906c5e2115,SOL,145.62,99.28,14457.15,sell,06-03-2025 20:08,3276.3,close long,38.9674,0x2220e801caa7e077761b041f063c840206e600591c171ade2b794c714205a01e,77669759525,False,0.693942,418000000000000.0,1740000000000.0,2025-06-03 20:08:00,2025-06-03,,,20.0
0xbee1707d6b44d4d52bfe19e41f8a828645437aab,@107,17.7,583.4,10326.18,buy,12-12-2024 13:09,7124.986026,buy,0.0,0xd7d85cfe8639aae0216104190876f401ab00c1944b2f087a0b7f25e0123e8d65,54857276239,False,0.0,1030000000000000.0,1730000000000.0,2024-12-12 13:09:00,2024-12-12,Extreme Greed,83.0,13.0
0xbaaaf6571ab7d571043ff1e313a9609a10637864,HYPE,13.05,10.0,130.5,buy,11-03-2025 06:18,198402.21,open long,0.0,0xbee4944253ca81e25065041f4f3b0c0205720037206cb6486ce3f78bcf453556,78766167752,False,0.0,1080000000000000.0,1740000000000.0,2025-11-03 06:18:00,2025-11-03,,,6.0
0xaf40fdc468c30116bd3307bcbf4a451a7ebf1deb,BTC,83500.0,0.012,1002.0,sell,16-03-2025 22:58,3.45384,close long,7.188,0x389be5292729061f3075041fad771b019200b30845a2c732a5a1605c1bb00d83,80197832156,False,0.1002,1120000000000000.0,1740000000000.0,,,,,
0x4f93fead39b70a1824f981a54d4e55b278e9f760,BTC,82786.0,0.24148,19991.16,buy,16-03-2025 16:50,0.0,open long,0.0,0xf7c15cafba60bca57d9c041fa93c29020374005bb91ce8dd3bfc28b1c159ae02,80133393627,True,5.997348,226000000000000.0,1740000000000.0,,,,,
0xb1231a4a2dd02f2276fa3c5e2a2f3436e6bfed23,ETH,2337.9,0.0054,12.62,buy,09-01-2024 00:42,0.0,open long,0.0,0x19ff2b1736d83e04a73f04070ee640011200fd91b9800f561a41858fbf2e9a9a,6544719309,True,0.003156,383000000000000.0,1700000000000.0,2024-09-01 00:42:00,2024-09-01,Fear,26.0,0.0
0xa0feb3725a9335f49874d7cd8eaad6be45b27416,HYPE,23.868,36.03,859.96,buy,18-02-2025 20:20,2161.41,open long,0.0,0x44c4953a650a020751dc041e002e0e02023e00b365d71ee5e79d15e30e0ca86b,73163377637,False,0.042998,629000000000000.0,1740000000000.0,,,,,
0xb1231a4a2dd02f2276fa3c5e2a2f3436e6bfed23,ETH,2308.1,4.147,9571.69,buy,30-12-2023 02:33,-21.0903,close short,-8.294,0xffa8b6c033ace18b36860406de3855010200eb267a9772eec86b268e394f6386,5764733388,True,2.392922,519000000000000.0,1700000000000.0,,,,,
0x72c6a4624e1dffa724e6d00d64ceae698af892a0,HYPE,18.03,75.0,1352.25,sell,13-12-2024 01:38,-2710.4,open short,0.0,0xed02e4537e62ae3f85af041913406902022800b9a1628d2678318cfc86f3ae2a,55018321743,False,0.129816,213000000000000.0,1730000000000.0,,,,,
0xbaaaf6571ab7d571043ff1e313a9609a10637864,HYPE,13.711,363.94,4989.98,sell,02-04-2025 17:27,171476.1,close long,368.562038,0xe5ab597da9f059f1b16e0420c1ce5902012600d32b3664d7d3976ff7ec86efdb,83355015162,True,1.746493,544000000000000.0,1740000000000.0,2025-02-04 17:27:00,2025-02-04,Greed,72.0,17.0
0xbee1707d6b44d4d52bfe19e41f8a828645437aab,HYPE,18.4,15.65,287.96,buy,29-04-2025 08:22,-11303.15,close short,6.30382,0xb9638090bc8645e85fdd0422736d6802010200db59b07488e934a188d1a62e5f,89646927986,False,0.014398,364000000000000.0,1750000000000.0,,,,,
0xbaaaf6571ab7d571043ff1e313a9609a10637864,HYPE,14.191,37.0,525.07,buy,10-03-2025 20:34,10417.48,open long,0.0,0x5907b571d9ea18930202041f487b7502030700482274989174de703603e4ebc9,78718157667,True,0.131266,675000000000000.0,1740000000000.0,2025-10-03 20:34:00,2025-10-03,,,20.0
0xbee1707d6b44d4d52bfe19e41f8a828645437aab,@107,25.41,10.0,254.1,sell,19-12-2024 13:17,17710.02021,sell,2.186808,0x9b8962c5d84a22f31d6b0419995b8701bb00ab96649c9bb6f5b442ba6e9dcc3e,56547318600,False,0.012705,287000000000000.0,1730000000000.0,,,,,
0x47add9a56df66b524d5e2c1993a43cde53b6ed85,FTT,3.05,29.4,89.67,sell,17-12-2024 09:08,-2840.0,open short,0.0,0x64c13b16d643b807cc5304196cbbff01240017d3289fa65542b369f73cf6d311,55923719558,False,0.008608,441000000000000.0,1730000000000.0,,,,,
0x271b280974205ca63b716753467d5a371de622ab,PAXG,3363.0,0.107,359.84,sell,21-04-2025 03:55,-121.562,open short,0.0,0xc55cd1332ecc5d3e64b50421ee8a12018d00498bd2a9009f573b1cad537e87ad,87676495432,False,0.017272,1050000000000000.0,1750000000000.0,,,,,
0x47add9a56df66b524d5e2c1993a43cde53b6ed85,FTT,3.02,32.5,98.15,buy,17-12-2024 14:40,-3526.9,close short,1.523925,0x0000000000000000000000000000000000000000000000000000000000000000,55931885874,False,0.009422,195000000000000.0,1730000000000.0,,,,,
0x72743ae2822edd658c0c50608fd7c5c501b2afbd,KAITO,0.82488,591.0,487.5,sell,23-04-2025 00:12,-8733.0,open short,0.0,0xb07fb9b21b67cbc4601104220c606c02012f00e0f7c51c4ba5415f26e6bcf83d,88083975922,False,0.04875,992000000000000.0,1750000000000.0,,,,,
0x083384f897ee0f19899168e3b1bec365f52a9012,ETH,2535.0,0.395,1001.33,sell,03-02-2025 08:48,1483.2991,close long,-50.05045,0x1a5913ec6269766675c7041d0899df0201db0029ced973d54515d74d318907d2,68791113611,False,0.050066,840000000000000.0,1740000000000.0,2025-03-02 08:48:00,2025-03-02,Fear,26.0,8.0
0x271b280974205ca63b716753467d5a371de622ab,HYPE,17.801,106.06,1887.97,buy,20-04-2025 14:41,-5033.94,close short,29.930132,0x8d75f20026ea1369d0230421e5dedf017d00f222d11bdaec24d574348e6b7b4a,87597204600,True,0.543736,23300000000000.0,1750000000000.0,,,,,
0xa0feb3725a9335f49874d7cd8eaad6be45b27416,HYPE,20.463,9.28,189.9,buy,14-12-2024 15:28,1399.61,open long,0.0,0xd809b4a9926f1a7cb7ca0419341f960192003a3f3f2322c23f569ded55b9b142,55331454772,False,0.009494,122000000000000.0,1730000000000.0,,,,,
0x8477e447846c758f5a675856001ea72298fd9cb5,kPEPE,0.00877,135446.0,1187.86,buy,27-04-2025 22:40,-2131485.0,close short,0.67723,0xc07bfd4705490dde443404225c86ca0202c700cbfc6bdef6d0bb634987f5fc7f,89338790244,True,0.415751,1040000000000000.0,1750000000000.0,,,,,
0x513b8629fe877bb581bf244e326a047b249c4ff1,BTC,84975.0,0.39589,33640.75,buy,12-04-2025 23:55,14.31797,open long,0.0,0xc9f9e5f0987fa33deb8104216ab7e90183003dd53e46a48fd2bcf758552ad213,86079800296,True,8.410188,405000000000000.0,1740000000000.0,2025-12-04 23:55:00,2025-12-04,,,23.0
0x513b8629fe877bb581bf244e326a047b249c4ff1,BTC,83173.0,0.03316,2758.02,sell,12-04-2025 04:58,-3.29621,open short,0.0,0x6b313e029807198fba0f04215de94801ac001092edd85e7c214059795735b0c6,85920946401,True,0.827405,898000000000000.0,1740000000000.0,2025-12-04 04:58:00,2025-12-04,,,4.0
0xbee1707d6b44d4d52bfe19e41f8a828645437aab,@107,23.685,20.0,473.7,buy,26-01-2025 14:14,1287.708219,buy,0.0,0xf21cf269de5c61cc978f041c89af440138002642dc309bf39aaae5520aa64915,66616879457,True,0.007,648000000000000.0,1740000000000.0,,,,,
0x6d6a4b953f202f8df5bed40692e7fd865318264a,@142,83090.0,0.01524,1266.29,buy,06-04-2025 00:53,0.005568129,buy,0.0,0x05ff5dee00774ba6191b0420f88c7401860093aaebda0ca19aa073397dd87055,84153726894,True,5.12e-06,602000000000000.0,1740000000000.0,2025-06-04 00:53:00,2025-06-04,,,0.0
0x513b8629fe877bb581bf244e326a047b249c4ff1,BTC,87850.0,0.14845,13041.33,buy,21-04-2025 21:51,22.8996,open long,0.0,0xbbc975ff45390c95c4fc0421fa8eb902011b00cf6a31dff26679b522148c526d,87818484403,False,0.0,272000000000000.0,1750000000000.0,,,,,
0xbee1707d6b44d4d52bfe19e41f8a828645437aab,@107,13.93,1.36,18.94,sell,10-12-2024 14:29,57067.52205,sell,0.741752,0x0000000000000000000000000000000000000000000000000000000000000000,54234609831,False,0.0,866000000000000.0,1730000000000.0,2024-10-12 14:29:00,2024-10-12,Neutral,49.0,14.0
0xbee1707d6b44d4d52bfe19e41f8a828645437aab,HYPE,15.118,175.84,2658.35,buy,14-04-2025 03:25,5035.61,open long,0.0,0x7354e16317574030521004217d4cc00201b3004680a876961520216222174383,86323445588,True,0.930422,323000000000000.0,1740000000000.0,,,,,
0xb1231a4a2dd02f2276fa3c5e2a2f3436e6bfed23,HYPE,23.154,32.52,752.97,buy,12-02-2025 00:20,-8072.54,close short,35.521596,0x7832ed4132a8d453e16a041d94433f01aa00cceb426e3785fd91a91f8173e09e,71548442999,True,0.263538,365000000000000.0,1740000000000.0,2025-12-02 00:20:00,2025-12-02,,,0.0
0x8477e447846c758f5a675856001ea72298fd9cb5,AAVE,139.42,3.9,543.74,buy,21-08-2024 13:15,-259.41,close short,1.96404,0xc14924d22530b113f939040fe8e8b60172002aa0b72e43ba1018cf688edeaf55,34939570833,True,0.190308,1070000000000000.0,1720000000000.0,,,,,
0xbee1707d6b44d4d52bfe19e41f8a828645437aab,@107,18.396,10.0,183.96,sell,25-02-2025 13:16,2400.60943,sell,2.978229,0xf3fa2f458f77c3ec1bd0041e6d262602073300ffc034fd96f8c01fa7750152f6,74734931803,True,0.064386,707000000000000.0,1740000000000.0,,,,,
0x75f7eeb85dc639d5e99c78f95393aa9a5f1170d4,ZETA,2.486,375.9,934.49,buy,23-02-2024 01:22,-1130.8,close short,17.313954,0xb0265d177a5299366c9e0407bcac0f0201060030ca941ce97875dadaff63d81c,10547765229,False,-0.018689,1030000000000000.0,1710000000000.0,,,,,
0xa0feb3725a9335f49874d7cd8eaad6be45b27416,ONDO,1.3576,80.0,108.61,buy,11-02-2025 19:14,4167.0,open long,0.0,0x956e7b71ab84f9d01ec0041d90d68501fc00cac9bb11a01209b93b4c4bdb4b0a,71452711401,False,0.00543,763000000000000.0,1740000000000.0,2025-11-02 19:14:00,2025-11-02,,,19.0
0x23e7a7f8d14b550961925fbfdaa92f5d195ba5bd,@107,18.171,8.3,150.82,sell,26-04-2025 06:35,137.2353247,sell,-7.522273,0xc2002ed25df19ea256800422418d720201ee00e326bdcfe5e21f64d06f5164c1,88978719166,True,0.045245,454000000000000.0,1750000000000.0,,,,,
0x39cef799f8b69da1995852eea189df24eb5cae3c,MELANIA,0.53276,392.0,208.84,buy,09-04-2025 23:52,-55831.3,close short,43.9628,0x174e0b180896cc1d125a04213998f002019f0102548d3c5a3835929c0c41472d,85390678370,False,0.010442,935000000000000.0,1740000000000.0,2025-09-04 23:52:00,2025-09-04,,,23.0
0xbee1707d6b44d4d52bfe19e41f8a828645437aab,@107,26.97,105.8,2853.43,sell,20-12-2024 20:42,34118.01113,sell,128.77448,0x53f74812fa62749fb8710419b225f002035000b20177f4398005332b01603932,57098040543,False,0.142671,770000000000000.0,1730000000000.0,,,,,
0xb1231a4a2dd02f2276fa3c5e2a2f3436e6bfed23,HYPE,15.934,596.62,9506.54,sell,08-03-2025 20:16,12181.54,close long,136.983952,0xa5dd301269eada275461041f273dbe013900f697d7a7758f42ac8392fa8f0393,78216280650,True,3.32729,766000000000000.0,1740000000000.0,2025-08-03 20:16:00,2025-08-03,,,20.0
0xb1231a4a2dd02f2276fa3c5e2a2f3436e6bfed23,HYPE,14.253,144.97,2066.26,sell,11-03-2025 21:40,9686.41,close long,-5.900279,0x9dacb9245a84879353da041f59c8f10201890013edff89c3dfe13113194732be,79098831385,True,0.72319,1050000000000000.0,1740000000000.0,2025-11-03 21:40:00,2025-11-03,,,21.0
0xbaaaf6571ab7d571043ff1e313a9609a10637864,HYPE,16.7,89.63,1496.82,buy,05-03-2025 21:58,17722.68,open long,0.0,0x0c8ae4e98e1ffbf03b2e041ef6fefb01fc005cfbbfbb9140a351515da6ec3e73,77425337802,False,0.0,123000000000000.0,1740000000000.0,2025-05-03 21:58:00,2025-05-03,,,21.0
0xa0feb3725a9335f49874d7cd8eaad6be45b27416,BTC,98175.0,0.01157,1135.88,buy,07-02-2025 21:54,0.00223,open long,0.0,0x96a1b2cdec58f6326498041d523b8a0202b90040af6cfaf5d3fcb37053aad5d1,70510595238,False,0.113588,899000000000000.0,1740000000000.0,2025-07-02 21:54:00,2025-07-02,,,21.0
0xb1231a4a2dd02f2276fa3c5e2a2f3436e6bfed23,@107,15.169,3.77,57.19,sell,11-12-2024 20:13,91372.15,sell,57.187093,0x0000000000000000000000000000000000000000000000000000000000000000,54678012859,False,0.005718,108000000000000.0,1730000000000.0,2024-11-12 20:13:00,2024-11-12,Extreme Greed,80.0,20.0
0x28736f43f1e871e6aa8b1148d38d4994275d72c4,@107,26.93,2.39,64.36,sell,31-01-2025 01:14,252.6208831,sell,11.814134,0x699793e54fb744f82227041cd344aa01cc00d84404e7234f0c48e26150a9415e,67824808462,True,0.022526,609000000000000.0,1740000000000.0,,,,,
0x28736f43f1e871e6aa8b1148d38d4994275d72c4,PURR/USDC,0.076211,250.0,19.05,buy,09-04-2025 19:32,14999.25154,buy,0.0,0x3e9b305afe9f03e883ce042136a00b020a3300a87a8d8a959127192fbf7fdf58,85314255013,True,0.08749,531000000000000.0,1740000000000.0,2025-09-04 19:32:00,2025-09-04,,,19.0
0xa0feb3725a9335f49874d7cd8eaad6be45b27416,BERA,7.7759,49.2,382.57,buy,21-02-2025 21:08,2742.7,open long,0.0,0xe1e97ed66cc755c9c9ac041e31a572020315008335b8f274208ef4815f5298ed,73769448526,False,0.019128,169000000000000.0,1740000000000.0,,,,,
0x4f93fead39b70a1824f981a54d4e55b278e9f760,BTC,96849.0,0.20879,20221.1,sell,15-01-2025 00:11,1.56249,close long,138.887108,0xffd2e84fe6c73ab6e478041b7512e902018c0002a0d306c31aaa271b15360cda,63029805534,True,6.06633,710000000000000.0,1740000000000.0,,,,,
0xbee1707d6b44d4d52bfe19e41f8a828645437aab,HYPE,13.3,74.55,991.51,buy,16-03-2025 20:47,7217.5,open long,0.0,0x81429f4d87adc08d4ed2041fabf2c702013900d6e43d1479223d9b7d9455fb56,80170921401,False,0.049575,256000000000000.0,1740000000000.0,,,,,
0x8477e447846c758f5a675856001ea72298fd9cb5,PENGU,0.046,4826.0,222.0,sell,06-01-2025 18:04,-466840.0,open short,0.0,0x6b5e5d31cdb31ace8fdf041acc42f60170005142ec79960716c627b992fbfc81,60959974507,False,0.022199,937000000000000.0,1740000000000.0,2025-06-01 18:04:00,2025-06-01,,,18.0
0xbee1707d6b44d4d52bfe19e41f8a828645437aab,@107,25.22,186.53,4704.29,sell,19-12-2024 11:12,26659.0541,sell,25.976293,0x9ed7f2b564092c65a5be04199790d202010600b42d6da9e5b1ea8f43c639ed09,56529304763,False,0.235214,567000000000000.0,1730000000000.0,,,,,
0x513b8629fe877bb581bf244e326a047b249c4ff1,SOL,140.46,28.75,4038.23,sell,22-04-2025 17:55,1039.58,close long,47.877375,0x11142bd4c52f2f96a8ff0422080d5c02011c00502923146778d9deecac4c5077,87999512482,True,0.928791,606000000000000.0,1750000000000.0,,,,,
0xb1231a4a2dd02f2276fa3c5e2a2f3436e6bfed23,HYPE,25.205,81.63,2057.48,sell,13-02-2025 01:57,-14340.0,open short,0.0,0xd38906b7f73e64418d22041da3f0d5020151000c40e3c637e987dd1f658c95d0,71842769601,True,0.617245,674000000000000.0,1740000000000.0,,,,,
0xb1231a4a2dd02f2276fa3c5e2a2f3436e6bfed23,ETH,2321.1,0.0054,12.53,sell,06-02-2024 08:26,39.875,close long,-0.009828,0xdc4e88de74ba1608209904077d8fed0134003744407c167f3a93d3225b61e301,8915190380,False,-0.00025,547000000000000.0,1710000000000.0,2024-06-02 08:26:00,2024-06-02,Greed,73.0,8.0
0xbee1707d6b44d4d52bfe19e41f8a828645437aab,@107,18.14,100.0,1814.0,sell,12-12-2024 13:01,7556.297731,sell,337.62266,0xcd0a9861185f51c662b704190857c202016a00657c364cf523835077f9633c12,54855862699,False,0.0,307000000000000.0,1730000000000.0,2024-12-12 13:01:00,2024-12-12,Extreme Greed,83.0,13.0
0x72743ae2822edd658c0c50608fd7c5c501b2afbd,ETH,4024.0,0.131,527.14,sell,17-12-2024 20:21,-378.5666,open short,0.0,0x42f144288a7045d0ac48041976579b0202c000a8cf23886e5429a02dfa167064,56022870409,False,0.052714,734000000000000.0,1730000000000.0,,,,,
0x4acb90e786d897ecffb614dc822eb231b4ffb9f4,SUI,4.0923,4242.0,17359.54,sell,20-12-2024 19:22,105465.6,close long,971.29074,0x9eddc3b7bc731f58275a0419b1561a020226008fe303018a23bfd42370976e11,57075011887,True,6.075837,530000000000000.0,1730000000000.0,,,,,
0x6d6a4b953f202f8df5bed40692e7fd865318264a,POPCAT,0.22989,1464.0,336.56,buy,16-04-2025 04:23,-8165.0,close short,12.157056,0xff2249d5956b6ed0e5ef04219ea0a5020148002d1871f96f17ab9deca4a565ad,86817500312,True,0.113083,119000000000000.0,1740000000000.0,,,,,
0xbaaaf6571ab7d571043ff1e313a9609a10637864,HYPE,22.106,100.0,2210.6,sell,24-02-2025 19:01,26017.32,close long,21.16,0x54478c4f49b40559c2e3041e60b31001e500a88ad7c1f6b83d40c2066c8ef7d0,74429385602,False,0.212217,629000000000000.0,1740000000000.0,,,,,
0x28736f43f1e871e6aa8b1148d38d4994275d72c4,FARTCOIN,1.7591,10.7,18.82,buy,21-01-2025 05:57,-637.9,close short,0.270389,0x81c0dc52dc5bdec41e9d041bf889d70201e200cf32914aa00e0316b751ef7cae,65042457488,False,0.001882,1060000000000000.0,1740000000000.0,,,,,
0xbee1707d6b44d4d52bfe19e41f8a828645437aab,@107,18.14,0.85,15.42,sell,12-12-2024 13:01,6561.457731,sell,2.869793,0x0000000000000000000000000000000000000000000000000000000000000000,54855862699,False,0.0,789000000000000.0,1730000000000.0,2024-12-12 13:01:00,2024-12-12,Extreme Greed,83.0,13.0
0x75f7eeb85dc639d5e99c78f95393aa9a5f1170d4,STG,0.65944,4137.0,2728.1,sell,20-02-2024 20:11,4137.0,close long,96.59895,0xa7084dd4386ac11604cf0407b4921c02015c00f56f03de37b6f755c9331281dc,10269652292,False,-0.054562,474000000000000.0,1710000000000.0,,,,,
0xbee1707d6b44d4d52bfe19e41f8a828645437aab,HYPE,13.591,36.47,495.66,buy,28-03-2025 15:00,1986.88,open long,0.0,0x55b528a39c79ae4d023704206d82f101e50079ad7440dafea22d524eda453a0f,82282162592,True,0.148699,23400000000000.0,1740000000000.0,,,,,
0xb1231a4a2dd02f2276fa3c5e2a2f3436e6bfed23,HYPE,24.626,32.21,793.2,sell,11-02-2025 10:45,-7781.46,open short,0.0,0x1289af65eaec104b9ee8041d8b3d9801680092b3cc68a356072c1fb1824d9c24,71396960097,True,0.277621,813000000000000.0,1740000000000.0,2025-11-02 10:45:00,2025-11-02,,,10.0
0x7f4f299f74eec87806a830e3caa9afa5f2b9db8f,ETH,1456.0,0.69,1004.64,buy,09-04-2025 18:55,-38.62,close short,3.1533,0x34c2053d3f0734a30b5b042136373102057b00471c02a9fd77b075a2f4e3e786,85291020204,False,0.100464,1090000000000000.0,1740000000000.0,2025-09-04 18:55:00,2025-09-04,,,18.0
0x4f93fead39b70a1824f981a54d4e55b278e9f760,BTC,99389.0,0.4375,43482.69,sell,16-01-2025 22:46,11.66771,close long,172.15625,0xefa24533c792fb0f0f72041b9d694601d500883b02562d951f30e4bb1e47768c,63531154556,True,13.044806,542000000000000.0,1740000000000.0,,,,,
0xb1231a4a2dd02f2276fa3c5e2a2f3436e6bfed23,HYPE,24.67,48.96,1207.84,sell,03-02-2025 23:30,-288.46,open short,0.0,0x3c4ddccc33cfa75aa020041d1283310203cb0027144792362f988f4a60e74aef,69118735790,True,0.422745,455000000000000.0,1740000000000.0,2025-03-02 23:30:00,2025-03-02,Fear,26.0,23.0
0xb899e522b5715391ae1d4f137653e7906c5e2115,SOL,119.86,187.71,22498.92,buy,10-03-2025 22:33,710.42,open long,0.0,0xaf07f0f2218a29f66a8d041f49df560203e300a5fd171b11ae7eb0c0483c528a,78752944582,True,5.62473,730000000000000.0,1740000000000.0,2025-10-03 22:33:00,2025-10-03,,,22.0
0xbee1707d6b44d4d52bfe19e41f8a828645437aab,HYPE,12.637,203.16,2567.33,buy,13-03-2025 12:34,1101.15,open long,0.0,0x322536e14b1cafa0e256041f74ed24019900fff54d621dff412a0e1f55c74be8,79539253878,True,0.770199,892000000000000.0,1740000000000.0,,,,,
0x92f17e8d81a944691c10e753af1b1baae1a2cd0d,HYPE,23.079,170.81,3942.12,buy,19-01-2025 18:40,38501.8,open long,0.0,0xbf40139b10da6a86d58e041bd7f66b0201a400556f7c78d2f8f9f001933878e6,64365737144,True,1.379743,672000000000000.0,1740000000000.0,,,,,
0xb1231a4a2dd02f2276fa3c5e2a2f3436e6bfed23,BTC,43512.0,0.00026,11.31,buy,31-01-2024 03:36,-1.08996,close short,0.002288,0xaa0b81954d9286faee670407656c5301b7007473363c7d5bb7f779be86e7880f,8480934427,True,0.002828,1040000000000000.0,1710000000000.0,,,,,
0x4acb90e786d897ecffb614dc822eb231b4ffb9f4,SOL,106.77,275.8,29447.17,buy,07-04-2025 00:39,11815.28,open long,0.0,0x78d8ee89ebd688f0601c04210895e90203be00c121e76168283f9e3695a8e4fd,83700278486,False,1.472358,229000000000000.0,1740000000000.0,2025-07-04 00:39:00,2025-07-04,,,0.0
0x8170715b3b381dffb7062c0298972d4727a0a63b,MELANIA,0.515,97.1,50.01,buy,23-04-2025 22:17,-466219.3,close short,3.974303,0x27faee5531d1ac60c2bd04221b741101e500bbe0a8cac194b404b58d7106f706,88371580465,False,0.0048,1060000000000000.0,1750000000000.0,,,,,
0x72743ae2822edd658c0c50608fd7c5c501b2afbd,HYPE,18.736,26.68,499.88,sell,28-02-2025 09:29,-533.74,open short,0.0,0xcd442ee30e9e72092a11041e9c4aa402012200e2628745ffff517d09f655037a,75700126437,True,0.174956,452000000000000.0,1740000000000.0,,,,,
0xae5eacaf9c6b9111fd53034a602c192a04e082ed,GMX,14.993,11.26,168.82,buy,24-04-2025 23:01,987.81,open long,0.0,0x2dd610012782f34e6b8604222c45010201c1006db5405f762d1488be6cf54ae1,88642822002,True,0.056723,593000000000000.0,1750000000000.0,,,,,
0x28736f43f1e871e6aa8b1148d38d4994275d72c4,PURR/USDC,0.63269,16.0,10.12,sell,16-12-2024 20:37,20664.64964,sell,4.838895,0x4e28e295dda92e659bc2041961fcd802012a00c0728f79fea19bbe32fc0bc841,55807052256,True,0.003543,1080000000000000.0,1730000000000.0,,,,,
0x8477e447846c758f5a675856001ea72298fd9cb5,FARTCOIN,0.5898,469.0,276.62,sell,08-04-2025 18:04,-28582.5,open short,0.0,0x17988b2aacb0c3fd373e042125110601830020f2befa87b45bc10d40430d7fe3,84950850524,True,0.096815,1020000000000000.0,1740000000000.0,2025-08-04 18:04:00,2025-08-04,,,18.0
0xbee1707d6b44d4d52bfe19e41f8a828645437aab,@107,26.105,9.57,249.82,sell,16-02-2025 04:11,725.8964916,sell,0.890549,0x22eb56a0bef5056c80b3041dd530ae017700815dcb39b99f245b3f4cb1b6fe1b,72583188572,True,0.087438,727000000000000.0,1740000000000.0,,,,,
0x23e7a7f8d14b550961925fbfdaa92f5d195ba5bd,HYPE,17.045,100.0,1704.5,sell,18-04-2025 04:05,-400.0,open short,0.0,0x27b3fba59eb3e14990110421bee4ea016200e467101cfcbcd2528a8f9a53c0e5,87245114992,True,0.596575,748000000000000.0,1740000000000.0,,,,,
0xbaaaf6571ab7d571043ff1e313a9609a10637864,HYPE,20.106,96.01,1930.38,buy,25-02-2025 05:23,199779.18,open long,0.0,0x6790f2cfaab79a9e40c2041e67d0370201de0103c8405e8c8c0c5229a72d2dee,74597839873,True,0.648605,617000000000000.0,1740000000000.0,,,,,
0x75f7eeb85dc639d5e99c78f95393aa9a5f1170d4,kPEPE,0.009439,13523.0,127.64,buy,09-03-2024 02:09,-13523.0,close short,4.665435,0x57042d1b519033a1cafe0407f3a7240201b800c4e2cdc3d9aeca5d96a0c7913b,12727640629,False,-0.002552,873000000000000.0,1710000000000.0,2024-09-03 02:09:00,2024-09-03,Fear,26.0,2.0
0x47add9a56df66b524d5e2c1993a43cde53b6ed85,FTT,3.05,8.1,24.7,sell,17-12-2024 05:44,-1764.1,open short,0.0,0x6b64dfef26a9882e1922041969cfa80201af0058ee943cf4469fb6dde0b17d97,55878998244,False,0.002371,992000000000000.0,1730000000000.0,,,,,
0x8477e447846c758f5a675856001ea72298fd9cb5,kBONK,0.049957,80787.0,4035.88,buy,18-11-2024 03:20,-96226.0,close short,162.705018,0xc16cf2e3c1ee0947d98704170e484901b70051fca0fa6b88ee245684c1d57a4b,48114036323,True,1.412556,640000000000000.0,1730000000000.0,,,,,
0x47add9a56df66b524d5e2c1993a43cde53b6ed85,BTC,95332.0,0.00786,749.31,buy,18-02-2025 14:07,0.02134,open long,0.0,0xe8d1fe4f2c1a550d1b72041dfbf5a902025600f70cd4d65255030bae6e8e7291,73109977760,True,0.251767,262000000000000.0,1740000000000.0,,,,,
0x4f93fead39b70a1824f981a54d4e55b278e9f760,BTC,97430.0,0.00094,91.58,sell,10-12-2024 04:04,0.20924,close long,1.507854,0x1feb3a5084a69050d8930418d71ee102019600b44b063bc10606fc4c7321e642,54060130599,True,0.027475,455000000000000.0,1730000000000.0,2024-10-12 04:04:00,2024-10-12,Neutral,49.0,4.0
0xbee1707d6b44d4d52bfe19e41f8a828645437aab,@107,25.44,100.0,2544.0,sell,19-12-2024 13:21,1219.100211,sell,24.868071,0xf48eea1252c8ff04d18604199968ac01e5003c8f9391fe2178f851c2e9889e38,56547743673,False,0.1272,947000000000000.0,1730000000000.0,,,,,
0xbee1707d6b44d4d52bfe19e41f8a828645437aab,@107,17.56,153.82,2701.08,sell,12-12-2024 12:15,17482.60773,sell,430.115576,0xf568c3e7757338fa90bd041907b06501c300bc8ec5ff01a2b49d4fd1475d65c1,54849806422,False,0.0,24300000000000.0,1730000000000.0,2024-12-12 12:15:00,2024-12-12,Extreme Greed,83.0,12.0
0xbaaaf6571ab7d571043ff1e313a9609a10637864,HYPE,19.377,27.7,536.74,buy,25-02-2025 07:23,234620.14,open long,0.0,0x2607cf1ba60f0b2ca7c1041e692a2402024d00ff1a7628c06298e4fab8c4425e,74607648922,False,0.025763,743000000000000.0,1740000000000.0,,,,,
0x72743ae2822edd658c0c50608fd7c5c501b2afbd,FARTCOIN,1.06,422.7,448.06,buy,22-04-2025 16:11,31388.7,open long,0.0,0xa5e8fd99b5d56be071fc042206e44502014d00ea71cba6d212edce88e6fe0430,87986115219,False,0.044806,493000000000000.0,1750000000000.0,,,,,
0x28736f43f1e871e6aa8b1148d38d4994275d72c4,DOGE,0.40115,2492.0,999.67,sell,22-11-2024 21:58,6394.0,close long,-5.081188,0x21599f4fc2d0e5d51eb5041771991d01ca0043bc4b2b8871021fc525a28be4d2,49317759737,True,0.349883,330000000000000.0,1730000000000.0,,,,,
0x271b280974205ca63b716753467d5a371de622ab,BTC,82032.0,0.01347,1104.97,buy,10-04-2025 00:27,-4.58038,close short,7.357314,0xeb2414a1d4166bc2638d04213a003902023700bf225cdbfa7c54fe29fc5853d1,85402451670,True,0.371269,492000000000000.0,1740000000000.0,2025-10-04 00:27:00,2025-10-04,,,0.0
0xb1231a4a2dd02f2276fa3c5e2a2f3436e6bfed23,BTC,42420.0,0.00521,221.01,sell,06-02-2024 02:41,-1.19991,open short,0.0,0xa6c313afd244268784a704077ca46f02012100d9312ee36b544f5d405e65048c,8900492126,False,-0.00442,163000000000000.0,1710000000000.0,2024-06-02 02:41:00,2024-06-02,Greed,73.0,2.0
0x8477e447846c758f5a675856001ea72298fd9cb5,TIA,11.426,163.1,1863.58,buy,29-05-2024 14:48,-163.1,close short,22.820952,0xf74d43be077eae847249040a2f74580155004256e014199184d7aa0f313606d3,24273831921,True,0.652253,96700000000000.0,1720000000000.0,,,,,
0xb899e522b5715391ae1d4f137653e7906c5e2115,SOL,129.12,8.0,1032.96,sell,09-03-2025 22:09,3025.29,close long,2.3672,0x63bd63f4d8c8b5d034fe041f38ed0b0201d3001e7ea892908474dfb962b5a1cd,78420217149,True,0.25824,781000000000000.0,1740000000000.0,2025-09-03 22:09:00,2025-09-03,,,22.0
0x2c229d22b100a7beb69122eed721cee9b24011dd,PNUT,1.2269,352.6,432.6,sell,13-12-2024 14:31,15306.0,close long,5.05981,0xf8431517b3e205f9201b04191e7bba01b000f9ae391091488986876ef99b4dc4,55146973105,True,0.151411,237000000000000.0,1730000000000.0,,,,,
0x23e7a7f8d14b550961925fbfdaa92f5d195ba5bd,@107,22.222,235.0,5222.17,buy,02-02-2025 09:16,499.8341783,buy,0.0,0x9e90c282d9ab7a0d9b49041cf8f52e0203ca009becd4591cd9aadd5c096eeb6a,68393753852,True,0.08224997,526000000000000.0,1740000000000.0,2025-02-02 09:16:00,2025-02-02,Greed,60.0,9.0
0x23e7a7f8d14b550961925fbfdaa92f5d195ba5bd,ETH,2596.6,6.8,17656.88,buy,12-02-2025 05:51,50.0,open long,0.0,0x503439916305d815ecd7041d97ec19017700f433e22c578a4ea74f79dfc85b53,71607343512,True,6.179908,897000000000000.0,1740000000000.0,2025-12-02 05:51:00,2025-12-02,,,5.0
0xbee1707d6b44d4d52bfe19e41f8a828645437aab,HYPE,27.036,18.5,500.17,sell,14-02-2025 14:47,-1910.73,open short,0.0,0x881bbc1a8b79ce83f5f6041dbc33e50201e3003888bdf86518b669fea1618112,72216584998,True,0.175058,962000000000000.0,1740000000000.0,,,,,
0xa0feb3725a9335f49874d7cd8eaad6be45b27416,TAO,357.35,0.788,281.59,buy,26-02-2025 00:50,93.283,open long,0.0,0x99521b4b87a388efc994041e750e5a020210002bdbf1a6d3f7f981d81573fffb,74945054545,False,0.014079,794000000000000.0,1740000000000.0,,,,,
0x8170715b3b381dffb7062c0298972d4727a0a63b,BTC,79386.0,0.30363,24103.97,sell,11-04-2025 00:25,4.42405,close long,-250.585839,0x1d1a84ee7b58ad2f677e04214a7afd019a008639751bc05a56336eb9d7cf0c98,85666950321,False,2.313981,900000000000000.0,1740000000000.0,2025-11-04 00:25:00,2025-11-04,,,0.0
0xbee1707d6b44d4d52bfe19e41f8a828645437aab,@107,14.35,3.54,50.8,sell,11-12-2024 19:01,37035.01423,sell,2.904216,0x0000000000000000000000000000000000000000000000000000000000000000,54638850966,False,0.0,414000000000000.0,1730000000000.0,2024-11-12 19:01:00,2024-11-12,Extreme Greed,80.0,19.0
0xbee1707d6b44d4d52bfe19e41f8a828645437aab,HYPE,16.032,50.0,801.6,buy,04-03-2025 10:22,10997.8,open long,0.0,0x03e65b4b78d065618b4b041edf1709018500a15e2bd6fb5633e747c57c8d99e3,76923081560,True,0.240479,431000000000000.0,1740000000000.0,2025-04-03 10:22:00,2025-04-03,Fear,25.0,10.0
0xa0feb3725a9335f49874d7cd8eaad6be45b27416,HYPE,19.4,30.37,589.18,buy,14-12-2024 05:47,887.08,open long,0.0,0xa705491a09829597378c04192bb71f0195007ef6436a2a8158a9bc3411122116,55299705606,False,0.029458,446000000000000.0,1730000000000.0,,,,,
0x2c229d22b100a7beb69122eed721cee9b24011dd,POPCAT,0.25097,15792.0,3963.32,sell,07-02-2025 19:06,225027.0,close long,239.88048,0x0b6ebb62d50b6295bf23041d5055c10203c30101d67b48e6686d92c639b29bf4,70450390189,False,0.396331,491000000000000.0,1740000000000.0,2025-07-02 19:06:00,2025-07-02,,,19.0
0x2c229d22b100a7beb69122eed721cee9b24011dd,VIRTUAL,0.51375,685.8,352.33,sell,11-04-2025 15:41,32630.5,close long,16.246602,0x918c5d8167f5774e223e042154dbaa01b30080f45b721992178229c801b7eeef,85796966994,False,0.035232,936000000000000.0,1740000000000.0,2025-11-04 15:41:00,2025-11-04,,,15.0
0xbee1707d6b44d4d52bfe19e41f8a828645437aab,HYPE,13.578,19.07,258.93,buy,28-03-2025 16:39,4476.89,open long,0.0,0xd69a2f5d46dee4c2bc0904206ea68d02019d00681288483b9ef8caf273418467,82294007014,True,0.077679,20800000000000.0,1740000000000.0,,,,,
0x8477e447846c758f5a675856001ea72298fd9cb5,JUP,0.88086,2522.0,2221.53,buy,03-02-2025 00:57,24040.0,open long,0.0,0x2bdbdfafbf377479a7d3041d0381a501dc009286caa60d36a8a7213052bc38ac,68629153799,True,0.777535,862000000000000.0,1740000000000.0,2025-03-02 00:57:00,2025-03-02,Fear,26.0,0.0
0xa0feb3725a9335f49874d7cd8eaad6be45b27416,BTC,97305.0,0.01499,1458.6,buy,14-02-2025 22:43,0.02609,open long,0.0,0x0c906ceac68c9afabb54041dc1976c0202dc004fadf95dc90b52af84c398ded8,72314024530,False,0.07293,534000000000000.0,1740000000000.0,,,,,
0xb899e522b5715391ae1d4f137653e7906c5e2115,KAITO,1.4478,13805.0,19986.88,buy,16-03-2025 01:40,-99913.0,close short,-561.849695,0xa3c5906a9c883f50ce5d041f9ef56401b400388410f1748721b4f13568ab601c,80040096256,True,4.996719,850000000000000.0,1740000000000.0,,,,,
0x75f7eeb85dc639d5e99c78f95393aa9a5f1170d4,OGN,0.058653,245.0,14.37,buy,22-04-2025 08:58,-25841.0,close short,0.87024,0x94192efd89669da85f6b0422020828020121009dd10afeaa5f44aed7f6a0e2a7,87927636887,True,0.004827,443000000000000.0,1750000000000.0,,,,,
0xbee1707d6b44d4d52bfe19e41f8a828645437aab,@107,18.29,474.32,8675.31,sell,12-12-2024 19:02,2746.207971,sell,510.151452,0xb3f114572abd58d6503e04190d8c6c020231004bf7acd62f940dad76f203a0d1,54917055105,False,0.0,721000000000000.0,1730000000000.0,2024-12-12 19:02:00,2024-12-12,Extreme Greed,83.0,19.0
0x8170715b3b381dffb7062c0298972d4727a0a63b,MELANIA,0.52,3886.0,2020.72,buy,23-04-2025 22:04,-1181758.1,close short,139.62398,0x5854599ed2ae77852cd504221b4d6c020414000585367da916ca79a6842ac6ac,88367757544,False,0.193989,437000000000000.0,1750000000000.0,,,,,
0xa0feb3725a9335f49874d7cd8eaad6be45b27416,HYPE,24.53,55.55,1362.64,buy,15-12-2024 05:47,87.37,open long,0.0,0xc29b0f1572be5d5a57d8041940882b0192000853951d328c141c47fc5df270e5,55483408148,False,0.068132,514000000000000.0,1730000000000.0,,,,,
0xa0feb3725a9335f49874d7cd8eaad6be45b27416,HYPE,25.137,15.03,377.81,buy,04-02-2025 08:29,78.18,open long,0.0,0x22bc48ddbf3e95fedf14041d18a2a7020162008179c7b9f83ccd3466d11c3ffb,69258612330,False,0.03778,842000000000000.0,1740000000000.0,2025-04-02 08:29:00,2025-04-02,Fear,44.0,8.0
0x75f7eeb85dc639d5e99c78f95393aa9a5f1170d4,GRIFFAIN,0.45974,725.0,333.31,buy,07-01-2025 20:35,-59316.0,close short,12.47,0xf573af37a33857126d5e041ae335780202440090d7c1ac81e466a54fa6af4bdf,61177108169,False,0.031997,1100000000000000.0,1740000000000.0,2025-07-01 20:35:00,2025-07-01,,,20.0
0xbee1707d6b44d4d52bfe19e41f8a828645437aab,HYPE,12.81,139.59,1788.15,sell,29-03-2025 14:45,14385.97,close long,17.644176,0x8c433a824fbfb6db7a5704207dde5401a600457426e58defeff83b12562ca35d,82473079766,True,0.536444,88900000000000.0,1740000000000.0,,,,,
0x4f93fead39b70a1824f981a54d4e55b278e9f760,BTC,96184.0,0.15595,14999.89,sell,14-02-2025 01:50,0.0,open short,0.0,0x0602f3a7a2dcf64fa830041db395c101df001ace28c53dc3909aa22c0e9dc229,72102449118,True,4.499968,513000000000000.0,1740000000000.0,,,,,
0x28736f43f1e871e6aa8b1148d38d4994275d72c4,PURR/USDC,0.29628,254.0,75.26,buy,31-12-2024 13:06,36040.69416,buy,0.0,0x30d1c69f14781547a1cf041a4cfbb9018a00b792db7c1eb8e5ee7d5b6e274da1,59761694880,True,0.08889,58900000000000.0,1740000000000.0,,,,,
0xbee1707d6b44d4d52bfe19e41f8a828645437aab,HYPE,19.202,15.63,300.13,sell,23-04-2025 05:17,-16140.75,open short,0.0,0xc1de68c3ab85d05de5cf04220fcf9302011c000b99be3c6e4f87b183406456ee,88140281464,True,0.090038,576000000000000.0,1750000000000.0,,,,,
0x28736f43f1e871e6aa8b1148d38d4994275d72c4,HYPE,12.661,19.74,249.93,buy,05-12-2024 22:30,-82.41,close short,6.683964,0x8622226d07946f647c7504187f1a6102017200008ae5d55ffc9f242ef3b1eb96,52982266750,True,0.087474,368000000000000.0,1730000000000.0,2024-05-12 22:30:00,2024-05-12,Greed,56.0,22.0
0x28736f43f1e871e6aa8b1148d38d4994275d72c4,ENA,0.35762,111.0,39.7,sell,23-03-2025 01:28,6458.0,close long,0.096015,0xebe65c2e8b34979f888f042011c3c9018700a12c9c017a6efa816bcf6f4ea85c,81291244923,True,0.013893,338000000000000.0,1740000000000.0,,,,,
0x47add9a56df66b524d5e2c1993a43cde53b6ed85,XRP,3.2,234.0,748.8,sell,16-01-2025 17:03,-6541.0,open short,0.0,0x9dce51c121dcbcdaeefe041b9878310201ec006271c2070d5d3e315947aa8fe0,63338560038,False,0.071884,447000000000000.0,1740000000000.0,,,,,
0x513b8629fe877bb581bf244e326a047b249c4ff1,SOL,146.89,271.27,39846.85,buy,29-04-2025 02:16,26353.4,open long,0.0,0xcfdf6c777e75f4665b5104226f51fd017a00b285f2f6312fd7b094de09b3b795,89618961145,True,9.164775,1060000000000000.0,1750000000000.0,,,,,
0xa0feb3725a9335f49874d7cd8eaad6be45b27416,HYPE,28.01,81.81,2291.5,sell,17-12-2024 20:16,590.0,close long,17.924571,0x26c0242bfe319f7489ba04197646b80203d7007c8c4084a6ad967ecfc247fea6,56026937571,False,0.114574,765000000000000.0,1730000000000.0,,,,,
0xbee1707d6b44d4d52bfe19e41f8a828645437aab,HYPE,18.793,11.18,210.11,buy,29-04-2025 16:21,-11816.34,close short,1.41427,0xbaf7484d8654a8c02654042278d0a502019b00e3d47c92f32731490b903a9f26,89740993822,True,0.063031,452000000000000.0,1750000000000.0,,,,,
0xbee1707d6b44d4d52bfe19e41f8a828645437aab,HYPE,21.226,30.0,636.78,buy,24-02-2025 13:49,10114.54,open long,0.0,0xb4bbeb2ad84e83f4d404041e5d1f1601bb00310591d51dc28867efb1408580c5,74410316739,True,0.222873,847000000000000.0,1740000000000.0,,,,,
0x47add9a56df66b524d5e2c1993a43cde53b6ed85,@107,12.56,0.61,7.66,buy,10-12-2024 01:34,4714.970284,buy,0.0,0x47137028a91025025d3d0418d4f6d501910090365f08b27a48635f3b74d4d087,53994113810,True,0.00020485,624000000000000.0,1730000000000.0,2024-10-12 01:34:00,2024-10-12,Neutral,49.0,1.0
0x513b8629fe877bb581bf244e326a047b249c4ff1,BTC,84900.0,0.03535,3001.22,buy,19-04-2025 22:17,56.70302,open long,0.0,0x098b7e2cf75461bf7f140421db08c90203e400b81a42233f798c8b07e715f083,87496676650,False,0.0,121000000000000.0,1750000000000.0,,,,,
0x513b8629fe877bb581bf244e326a047b249c4ff1,HYPE,12.895,387.74,4999.91,buy,17-03-2025 04:27,2951.79,open long,0.0,0x17de713e595445fb5928041fb13a2201e900119f501dfba4939a745acac51a69,80239763359,True,1.679968,625000000000000.0,1740000000000.0,,,,,
0x271b280974205ca63b716753467d5a371de622ab,HYPE,17.817,16.8,299.33,buy,20-04-2025 14:41,-390.29,close short,4.47216,0x8d75f20026ea1369d0230421e5dedf017d00f222d11bdaec24d574348e6b7b4a,87597204600,True,0.086205,476000000000000.0,1750000000000.0,,,,,
0x8477e447846c758f5a675856001ea72298fd9cb5,GMX,45.329,12.25,555.28,sell,06-06-2024 20:51,-24.53,open short,0.0,0x2e87904e76f8c5cd9089040ad40bc001030017e0f48a20d362051b2c4f89c493,25161086129,True,0.194348,1010000000000000.0,1720000000000.0,2024-06-06 20:51:00,2024-06-06,Extreme Greed,78.0,20.0
0x513b8629fe877bb581bf244e326a047b249c4ff1,BTC,92944.0,0.00015,13.94,sell,24-04-2025 23:02,43.06416,close long,0.00765,0x5edcb07c73b385bdae9204222c48760201b90050797e5570b797af975afea5e2,88643113971,True,0.003206,900000000000000.0,1750000000000.0,,,,,
0xbaaaf6571ab7d571043ff1e313a9609a10637864,HYPE,11.281,449.3,5068.55,buy,03-04-2025 19:22,70559.3,open long,0.0,0xb0cf0d286e6a454ae6d00420d3d1a902032f00062ad1219a5e30c8cbe2029847,83668871170,True,1.520565,977000000000000.0,1740000000000.0,2025-03-04 19:22:00,2025-03-04,Extreme Fear,15.0,19.0
0x513b8629fe877bb581bf244e326a047b249c4ff1,BTC,79048.0,0.5,39524.0,buy,10-04-2025 22:36,-0.77447,close short,166.6,0x2a304504f582536d70e304214937f302024a000cf4e9eeaa18008fca8d268d4f,85641949320,False,3.794304,914000000000000.0,1740000000000.0,2025-10-04 22:36:00,2025-10-04,,,22.0
0xbee1707d6b44d4d52bfe19e41f8a828645437aab,@107,25.42,0.45,11.44,sell,19-12-2024 13:19,9127.030211,sell,0.102907,0x0000000000000000000000000000000000000000000000000000000000000000,56547574604,False,0.000571,406000000000000.0,1730000000000.0,,,,,
0xbee1707d6b44d4d52bfe19e41f8a828645437aab,HYPE,15.871,100.81,1599.96,sell,26-03-2025 12:18,6415.63,close long,15.000528,0x33d6aa155c4e41a9e94b04204a8e120167006b7717dc60a3be15015214ab8106,81862067252,True,0.479986,613000000000000.0,1740000000000.0,,,,,
0xb1231a4a2dd02f2276fa3c5e2a2f3436e6bfed23,BTC,43448.0,0.00026,11.3,buy,31-01-2024 04:00,-2.26963,close short,0.00793,0x6ebdf9ca458fddd0e7a50407657dc102013800eb30c733858f40026e383feb27,8481867795,True,0.002824,266000000000000.0,1710000000000.0,,,,,
0x6d6a4b953f202f8df5bed40692e7fd865318264a,PNUT,0.16038,1593.8,255.61,buy,24-04-2025 00:42,-1593.8,close short,5.17985,0x802b502f4ef4710d864a04221d1c400202690021f7415cd9c802b402372c58ed,88401104033,True,0.085885,183000000000000.0,1750000000000.0,,,,,
0x8477e447846c758f5a675856001ea72298fd9cb5,ANIME,0.11567,278.0,32.16,sell,21-01-2025 22:23,-10961.0,open short,0.0,0xeb311f2f3a6fac8163b8041c0b1ac6017100a731cb6c85557cad1ec2233d2373,65368482139,True,0.011254,1080000000000000.0,1740000000000.0,,,,,
0x28736f43f1e871e6aa8b1148d38d4994275d72c4,PURR/USDC,0.35186,339.0,119.28,buy,13-12-2024 00:54,51842.86306,buy,0.0,0x7b5292d5ded21e06070a0419129f700163002cf9a287585f24d338a75eca4589,55002699546,True,0.11864,607000000000000.0,1730000000000.0,,,,,
0xa0feb3725a9335f49874d7cd8eaad6be45b27416,HYPE,28.518,61.65,1758.13,sell,17-12-2024 19:44,1980.06,close long,81.162225,0x9cf033515e3d0735076b041975d26101c500be8f1dcfa2c58bf7b289ff3c9169,56018393297,False,0.087906,56600000000000.0,1730000000000.0,,,,,
0xbaaaf6571ab7d571043ff1e313a9609a10637864,HYPE,13.05,296.52,3869.59,buy,11-03-2025 06:17,193865.15,open long,0.0,0x0000000000000000000000000000000000000000000000000000000000000000,78766167752,False,0.0,648000000000000.0,1740000000000.0,2025-11-03 06:17:00,2025-11-03,,,6.0
0x8477e447846c758f5a675856001ea72298fd9cb5,WLD,2.35,2198.4,5166.24,buy,23-01-2025 02:20,-14200.6,close short,-3.473472,0x0fec6edd3791de45f636041c2abe5e01a900b8612c99b2ea23410139a3d11e1c,65704737107,False,0.516624,458000000000000.0,1740000000000.0,,,,,
0x47add9a56df66b524d5e2c1993a43cde53b6ed85,@107,27.684,20.27,561.15,buy,26-12-2024 03:26,1896.345938,buy,0.0,0xc8491d93e317983b59bd0419fe19eb017c00610cc4b039ac8a3a205c18c6120d,58628545486,True,0.00681068,729000000000000.0,1740000000000.0,,,,,
0x23e7a7f8d14b550961925fbfdaa92f5d195ba5bd,@107,17.818,1.56,27.8,sell,20-04-2025 01:45,4695.508792,sell,0.070535,0x4c38c26fc47d18b3cc990421dd56f0014100f876465b41eb4d2e22e8c94ed7b8,87522468264,True,0.009728,1000000000000000.0,1750000000000.0,,,,,
0x8477e447846c758f5a675856001ea72298fd9cb5,BTC,98164.0,0.00452,443.7,buy,07-01-2025 21:06,0.06754,open long,0.0,0x3524f97d8f7fa1d35b7a041ae3a8e40203b000536211d6b5c9da3ba9b698d54b,61194082553,True,0.155295,829000000000000.0,1740000000000.0,2025-07-01 21:06:00,2025-07-01,,,21.0
0x75f7eeb85dc639d5e99c78f95393aa9a5f1170d4,@107,24.263,46.99,1140.12,sell,19-12-2024 04:14,804.0929763,sell,-47.948736,0xccff6e7f01bb02053e9b0419919ae90172007cefd3eebc59ad20f406fe235210,56418374333,True,0.383079,465000000000000.0,1730000000000.0,,,,,
0x8170715b3b381dffb7062c0298972d4727a0a63b,MELANIA,1.601,2530.0,4050.53,sell,02-02-2025 09:30,-35079.8,open short,0.0,0xa602450fa90412b7720e041cf91c940201b9009ad0c7badefded66ca4ba456be,68396847336,False,0.38885,45500000000000.0,1740000000000.0,2025-02-02 09:30:00,2025-02-02,Greed,60.0,9.0
0x513b8629fe877bb581bf244e326a047b249c4ff1,BTC,93747.0,0.59642,55912.59,buy,28-04-2025 20:59,38.88849,open long,0.0,0x4bd47834e8d317b1882204226bb0af02029a00abcc47302de3b7505d37828726,89563116284,True,12.859894,616000000000000.0,1750000000000.0,,,,,
0xa0feb3725a9335f49874d7cd8eaad6be45b27416,HYPE,28.177,158.56,4467.75,sell,31-01-2025 21:30,4304.04,close long,245.181328,0x393b37d1def80eb954a0041ce0dd6e020141005225dbc6be5d12810de71fd325,68007414426,False,0.446774,736000000000000.0,1740000000000.0,,,,,
0xbaaaf6571ab7d571043ff1e313a9609a10637864,HYPE,12.29,848.6,10429.29,buy,03-04-2025 04:04,51904.23,open long,0.0,0x329ecdfb926bfb65887a0420c9336a02019d00d76e7a5d35e533fe6938c956db,83309672305,False,1.042929,864000000000000.0,1740000000000.0,2025-03-04 04:04:00,2025-03-04,Extreme Fear,15.0,4.0
0x75f7eeb85dc639d5e99c78f95393aa9a5f1170d4,NTRN,1.3759,15000.0,20638.5,buy,14-02-2024 08:22,0.0,open long,0.0,0x018093a2f0a6d351c23d04079c0f8d01460068169ddd549447a84aba5340abd2,9603483566,False,-0.41277,542000000000000.0,1710000000000.0,,,,,
0x4acb90e786d897ecffb614dc822eb231b4ffb9f4,SUI,1.87,173.2,323.88,buy,09-04-2025 06:51,47692.2,open long,0.0,0xfa835b08ebbcaa054e6404212de35a0205d3005fb18ef4574d64da3000c7d536,85117808917,False,0.016194,270000000000000.0,1740000000000.0,2025-09-04 06:51:00,2025-09-04,,,6.0
0xbd5fead7180a9c139fa51a103cb6a2ce86ddb5c3,XRP,2.6,193.0,501.8,buy,03-03-2025 23:27,-20226.0,close short,9.005766,0x6bba49c56d4b7b645480041ed79c4202017800f04053ac5c0a44d2a2f201569a,76721789271,False,0.02509,435000000000000.0,1740000000000.0,2025-03-03 23:27:00,2025-03-03,Fear,33.0,23.0
0x6d6a4b953f202f8df5bed40692e7fd865318264a,@107,34.413,2.19,75.36,sell,21-12-2024 12:21,6260.0,sell,62.994716,0xa58405ea797e4f24648e0419bbae54020145007d8d6b980bd87042a8c46711d3,57302662945,True,0.026377,573000000000000.0,1730000000000.0,,,,,
0x39cef799f8b69da1995852eea189df24eb5cae3c,MELANIA,0.73264,104.6,76.63,sell,20-03-2025 23:14,-559193.6,open short,0.0,0x5deb96ec72d0d431b094041fef996f02018a00180a46b154a5547f4cfe288063,80963185708,False,0.007663,94000000000000.0,1740000000000.0,,,,,
0x4f93fead39b70a1824f981a54d4e55b278e9f760,BTC,103790.0,0.00018,18.68,buy,20-01-2025 23:42,0.0,open long,0.0,0x03f3c922b9515d80ac96041bf1775b01b0006a51909a2f8220171e407886921f,64966476893,True,0.00467,894000000000000.0,1740000000000.0,,,,,
0xbaaaf6571ab7d571043ff1e313a9609a10637864,HYPE,15.11,684.35,10340.53,buy,07-03-2025 02:17,114258.38,open long,0.0,0xbf61c2471ed07edf364d041f0a73e9020165003208bd53180ef6a9436294b889,77741352358,False,0.0,845000000000000.0,1740000000000.0,2025-07-03 02:17:00,2025-07-03,,,2.0
0xbee1707d6b44d4d52bfe19e41f8a828645437aab,HYPE,14.338,341.24,4892.7,buy,26-03-2025 20:50,-470.09,close short,-108.480196,0x224cec331f2940e480ea0420507b2c01c700836b8ec011c056e9848c6761e637,81938821077,True,1.467809,135000000000000.0,1740000000000.0,,,,,
0xbd5fead7180a9c139fa51a103cb6a2ce86ddb5c3,BTC,82980.0,0.007,580.86,buy,12-03-2025 17:55,5.29555,open long,0.0,0xb4e4f3851da5787521a5041f67e7e00201df00e024297414739ea93c5d333707,79331963142,False,0.029043,1060000000000000.0,1740000000000.0,2025-12-03 17:55:00,2025-12-03,,,17.0
0xb1231a4a2dd02f2276fa3c5e2a2f3436e6bfed23,HYPE,15.573,122.86,1913.3,buy,07-03-2025 00:00,4760.79,open long,0.0,0x10a4cf0273b5e00e29c9041f08e73f01d600e640f8104ae5084e22a881aed8fc,77726746772,True,0.669654,799000000000000.0,1740000000000.0,2025-07-03 00:00:00,2025-07-03,,,0.0
0x8477e447846c758f5a675856001ea72298fd9cb5,ZRO,5.1509,18.7,96.32,sell,21-07-2024 00:54,-26686.8,open short,0.0,0x006195aabc1ae9e8f49c040dd1b3f7015500469c044f39aca00d884ebcf9e1bd,30549017786,True,0.033712,454000000000000.0,1720000000000.0,,,,,
0xbaaaf6571ab7d571043ff1e313a9609a10637864,HYPE,11.13,20.86,232.17,buy,06-04-2025 19:21,60112.85,open long,0.0,0x33525a9b88e80ee6c4cb04210506300202fc00e75e5ffee354b3c3959d9ad1d1,84248596190,False,0.011608,797000000000000.0,1740000000000.0,2025-06-04 19:21:00,2025-06-04,,,19.0
